,customer_id,customer_name,review_head,review_body,review_date,ratings
0,customer_review-RXW9VRLHE569R,Piyush,"Good speaker for 2000 rs , but don't expect too much bass",paotronics drum speaker pros 1 amazing sound 2 looks feels good hand 3 water proof 4 usb port aux 5 fm also cons 1 bass good 10 watt speaker 2 clip jack put cable handle easily like speakers 3 battery backup arounbd 5 hrs 80 volume also anker sound core mini easily last 10 12 hrs 80,2018-07-30,4.0
1,customer_review-R2NK8JD9LJH2R1,Neeraj joshi,READ THIS review For some TIPS,bought much research knew would loud still surprised sound sound clear loud expectations must buy product every one better every speaker 2500 reason best 1 use pendrive speaker 2 play music 35 mm cable 3 ofc play music bluetooth 4 sd card supporteduse card reader plug enjoy sd card songs 5 use powerbank plus usb cable thn use speaker powerbank 6 supports fm radio 7 superb bass 8 loud expectation imagination 9 long battery life 10 solid build quality 11 soundrum heavy feels like premium product hand 12 clear crisp sound 13 u use ur earphones listen fm radio night idont fm galaxy note 5 listen fm earphone night 14 powerfull 10 watt speaker compact size speaker booooom 15 water resistant splash proof certified dust proof 16 value money bang buck 17clear sound even fm radio cons usb port hard feels like usb stuck port unplugging usb cable pendrive go blindly,2018-09-02,5.0
2,customer_review-R2TS4QJYBKLZJQ,SK Dwivedi,Best in the price class,pros 1 premium look feel 2 10 watt loud fits even large room 3 aggressive pricing 4 360 sound coverage 5 beautifully integrated buttons concealed ports 6 splash proof 7 sound doesnt distort full volume 8 usb aux cons 1 battery life,2018-11-22,5.0
3,customer_review-RU84KKQBGSF3,Nishant,"Really LOUD stereo volume and big BASS,splash proof, it has FM, 8 HOURS battery BACKUP and has mic.",fm good turn fm keep window capture fm channels save memory next time switch channels buttons speaker splash proof 10 watt speaker 5w right side speaker 5w left complete charging speaker take 2 hours battery backup seen 10 hours moderately high volume connect phone use bluetooth talk mic pressing triangle twice u invoke google assistant con buttons misconfigured press change fm channel fm mode bluetooth mode wont anything turn volume keep pressing similarly lowering volume thats annoying like press volume increases one unit press hold,2018-11-21,5.0
4,customer_review-R28R7M1HLIN8H8,Arif,Awesome Bluetooth speaker at such an affordable price.,start awesome portronics sounddrum bluetooth speaker produce loud clear sound im damn impressed sound solid build quality top bottom metal black matte finish rubberised grill around body gives good grip protects speaker well compact fits palm easily bluetooth pairing instant inbuilt voice feedback notifying onoff bluetooth pairing etc front theres onoff button also used select modesbouetooth fm etc volume updown buttons playpause key back covered rubber flap usb port pen drive aux port microusb port charging led indicator charging battery life also superb got 5 hours playback charging sometime first time also fm built mic fm recption upto mark ignore fm feature playback usb good also connected phone aux cable found volume slightly low compared bluetooth mode ive made call voice loud clear sides also claims water dust resistant thats tested time rs2000 must appreciate portronics packaging good box usb microusb cable warranty card user manual included speaker got rs1749 sale amazon also received rs49 cashback amazonpay would say worth would recommend hope review helps,2018-11-07,5.0
5,customer_review-RWRBVCF79F1FP,KALPANA Kashyap,COMPLETELY WASTED MY MONEY,giving review 2 months usage thing heigher volumes quality sound gets much distorted unpleasant hear u r person buy listen song heigher vol u replaced speaker one also problem little less distortion still would suggest one go speaker,2018-10-27,1.0
6,customer_review-R2H0TINK80ZMCC,Saurabh Sharma,Phenomenal,initial impressions 1 day great built quality good form factor good sound quality best still good distortion even highest volume theres crackling sound songs 100 doable battery life solid 10 hours 80 volume loud expected still pretty satisfactory easily fill medium sized room google assistant also works charge phone well take decline calls kudos amazon delivering within 2 days edit 14th november also purchased boat stone 600 using feel sound quality bass better stone 600 features louder,2018-11-06,5.0
7,customer_review-R284I9ORVFY86G,Atul D. Pitroda,very decent product and very good performance against its size!!!,amazing product size fits looking fir reviews around sony xb21 jbl flip4 minnd hiwecer lisened one shop incidently liked price loint beats others spend 7k still buy jbl product good audio quality good 15 10 room bass little compromised mid high high quality battery something drawned cud use 2 hiurs high volumes also fm flawless douvt whether b crystal clear also usb conn aux charging point mini usb issue flap see thus connections flap keepz hanging whatever u plug overall good product price point,2018-11-18,4.0
8,customer_review-R3PT8IGZSEQCXL,anuj,Value For Money,best speaker price range treble good battery good bass boom loved range average good loudness awesome best speaker 3500 buy bought around 1900 value money,2018-07-28,5.0
9,customer_review-R19U4B4GD3E2P3,Sachin Dahiya,"Go for it.. supports Bluetooth, FM, Aux USB..",bluetooth speaker really good sturdy little bit heavy makes sturdy stable listening full volume battery life pretty good promised protronics look feel good sound quality also good fm also good songs played usb also warranty card included box register product online get 2 months extended warranty without extra fees thus total warranty 122 14 months good product protronics go,2018-10-13,5.0
10,customer_review-RNPURZCS20BSO,Sidhartha93,Stops working in 20 days,bad product stopped charging 20 days mode replacement better buy go jbl go atleast get market service,2018-09-27,1.0
11,customer_review-R23ZO3M58Q0CTL,Saravana D Kira,Great product and it producing very good sound quality,great product producing good sound quality important thing got product good seller widgets india thanks alot,2018-04-05,5.0
12,customer_review-R529M02P6EPC0,christy prasad,Satisfied,sound level good didnt expect much though sound quality 810but overall much satisfied issue see volume max sound distorts remedy lower volume bit quality wil back normal,2019-04-07,4.0
13,customer_review-RRFXV69TBN4DN,Mahendra Deshmukh,Poor sound quality...Music lover beware.,want pleasent sound dont go product loud initially however consistent loudness mean sound low period time sound clear one hear clear dialogue high volume egamazon prime hype product seems low grade chinese product pertaining sound quality battery life pretty decent,2018-11-07,2.0
14,customer_review-R3RXMSIPPFKU9T,Manohar Kumar,Sound Quality was very poor,used earlier protronics sound pot 3w amazing sound quality time bought 10 w sound drum sound quality missing low bass higher note volume distracting replacing product might quality issue purchase 3w itslef post return gets completed,2019-01-07,3.0
15,customer_review-R1DC5FXK78WTHH,Manjunath L.,Good Quality Build and Decent Sound,pros design great looks feels much premium build quality superb mean unbelievable price everything put together well sound clarity sound loud clear till 80 volume decent bass unfair compare 10k speakers size price appreciable bass compact fits tiny spaces true stereo 360degree speaker 5w5w decent battery backup 6 hours mixed use diff volume levels fm radio builtin antenna water resistance cons like many speakers volume control longpress really annoying want rotary volume control distortion 80 volume expected like speakers provision attach external antenna enhance fm reception battery indicator option hang speaker placed flat surface available black color price range less 2k speaker great value money dont expect bass 10k speakers compare speakers price range find great buy voice clarity excellent think perfect balance features quality price,2018-12-31,4.0
16,customer_review-RRB5BZNYFJ7KQ,Shubham Singh,After sales service of portronics is bad,sound quality awesome purchased sound like used gave service center send repair still working like earlierservice center portronics given worst experience,2018-09-26,2.0
17,customer_review-R1QLOMOU8HPPWH,Harshal,Faulty product get,delivery milne ke bad product check karo battery pury khatam hone bad charge kar ke dekho product working,2018-10-12,1.0
18,customer_review-R16ETBM9RBA64Y,smeet,Disappointment nothing else,stopped working within one month purchase raised ticket customer care refund policy mumbai service center closed weekends go weekdays totally lost confidence product bought reading good reviews abt item fact bug review raised amazon rating expected unless u rate 5 star product surprising thats true called amazon customer care fixed,2018-11-11,2.0
19,customer_review-R3KAWWGDMH3B5B,Ravi,Beast in small pack,loud speaker bit low enough bass beast small pack betty backup excellent confused boat rugby finally go design compact splash free fm radio mic good option usb option betty life 7 8 hr compact size good design,2018-08-24,5.0
20,customer_review-R3Q581GC0T2YUW,Phalgun Erra,Good clarity and enjoyable sound,pretty good sound clarity size clear detailed highs mids decent bass size surprising placing corner little closer walls works better center room,2018-09-03,5.0
21,customer_review-R3GDOY4V6TR78Y,Omkar Gaonkar,"Best speakers, worth for money........",great sound nice base 1 thing like premium look sound much portable also offers good quality sound us also delivery faster expected seller appario retail private ltd bangalore pros 1 portable carry anywhere 2 good sound also good base 3 premium look feel like jblbut please compare sound jbl 4 360 surround sound 5 definitely better speakers price range 6 best battery backup upto 7 hours 8090 volume 1518 hours backup 6070 volume 7 much louder expected cons 1 aux cable provided like brands 2 slight distortion occurs 100 volume specially songs heavy bass keep volume 8090 also much loud average large size rooms 3 slightly dust magnet dust get attached rubber surface overall worth money product tip better sound experience use corners wall put sound drum nearat corners wall enhances sound doesnt required extra power trick work rooms either small medium sized way save energy also enjoy songs tiny power house,2019-03-28,5.0
22,customer_review-R3GCJWGG6IZWV0,Padmanabh D.,Empty Box,idea speaker like didnt get one got 1850 empty box,2019-04-19,1.0
23,customer_review-R61NEUAFNJBZL,Avadhoot Y Vichare,Product build Quality is good. Sound Quality is above average. FM Does Not Work,product build quality good sound quality average 1900 speaker battery lasted approx 5 hrs easy connectivity bluetooth aux pen drive issue fm tried many locations get fm didnt read reviews prior purchasesame issue noted many buyers fm concern hence purchased product,2018-09-14,4.0
24,customer_review-R2L4L9CF9K6NN,Dipak,Great speaker in the price range,first product received seemingly used one box open seal bother use returned instantly next day separate package delivered seller got new well packaged item pros 1 great build looked premium quality hands 2 great battery life 3 sound good enough fill large rooms 5 sound quality great price point loudest level obvious distortions 6 great fm receiver used metro city 7 usb direct play play cons 1 aux cable package mentioned product description 2 none found till date,2018-10-27,5.0
25,customer_review-R2AC3UUZPZQ7S6,Himank,Ahead of it's class,pros 1 great bass theres lot bass speaker handle top radiator vibrates lot filled water see water dance music 2 360 sound sound similarly heard directions though two speakers facing left right block one sound changes 3 supports lot inputs bluetooth fm aux even usb port put pen drive nice tried using finding tracks pain pen drive lot songs 3 gives control music play pause power mode switcher volume next previous track 4 water resistant works well shower dont think submerge water 5 get dirty covering kind mesh like jbl speakers cleaned water 6 battery good good works quite time full charge enough notice long lasts phones status bar shows speakers battery level might different different phones showing mi oneplus cons 1 bass rich theres lot passive radiator small bass little shallow would notice youve heard lot high end speakers shouldnt matter much price bass quality better portonics dome bigger radiator speakers build overall better 2 speakers jumps little bass full volume track lot bass 3 volume buttons shaped signs click work next previous track buttons changing volume need hold buttons feel little stupid people often change track trying change volume 3 hanging options 4 small grills bottom used build something hang put keyring tied hairband keyring make easier carry,2019-01-10,5.0
26,customer_review-R2C8OXEB6CXEJH,Dinto Louis Edayady,Stand out bluetooth speaker in terms of design and sound output !!!,seller devineindia amazon fulfilled pros speaker design portronics sound drum stands rest bluetooth speakers promised delivers 360 surround sound speakers placed accordingly sound get surprisingly loud small speaker size design makes apt travellers carry around sound output audiophile take pinch salt vocals clear lows bass punchy enough power frequencies full volume mids guess weak point speaker get bit muddy reduce volume around 80 output balanced set volume 80 biggest drawback device detailed cons comes biggest drawback device reduce increase volume long press difficult adjust volume specific percentage say 80 plus visual indication making even difficult focusing much quality bass mids high look else fm tuner tuner auto tune fm frequency easily far fm station took travelled saved channels brought home worked lack visual indication making difficult adjust frequency sound drum received damaged raised replacement request duly replaced item amazon fulfilled nutshell fun little speaker turn heads,2019-02-16,4.0
27,customer_review-R2ME3K6RGJXWI9,Amit,The Boom Boom speaker!! Go for it.,received product days back product great vfm fill room quiet loudness cannot believe loud good clarity talking bass base quite awesome panchi built fm radio option usb connectivity build quality also goog feels premium complete steal deal 1800 rupees also would like mention bluetooth connectivity great havent faced issue regarding bluetooth connectivity single timei recommend product looking portable bluetooth speaker used outdoors well indoors quiet loud basically good value money also worth mentioning speaker 360 degree sound signature means ever hear quality quantity sound loudness person directional speaker thats major quality prose,2019-04-25,5.0
28,customer_review-R1TNXZ7CPP6LC7,devender,Perfect - great design and sound!!,happy design quality sound giving sound drum top adding great effect already using portronics ear phones years based experience thought get decision good,2018-09-13,5.0
29,customer_review-R1OJPLW4MI4NHP,Amazon Customer,Detailed Review - Excellent product,pros 1 excellent clarity sound amazing sound quality small device friend bose soundlink color ii 7521950100 bluetooth speakers rs 9200 amazon though unfair compare portronics bose speakers surprised note portronics sound quality less bose high pitch sound clarity voice clarity excellent 2 disconnect bluetooth mobile go sleep time sounddrum automatocally switches device kept away physically move 3 start audio voice indicator power power bluetooth mode etc good led indicator get feedback press hold main power button 4 connection device mobile extremely simple quick unlike bose speaker require installation app password verification etc put bluetooth device scan bluetooth device around shall find sound drum pair may multiple bluetooth devices paired mobile press paired sound drum shall connect voice feedback sound drum next time onwards need pair simply click paired sound drum mobile 5 size small cylindrical dia 75 cm x height 10 cm around hence occupies small area place somewhere easy carry one place another cons 1 power button little bit hard many times kept pressing 10 sec start realized pressed little bit greater force 2 battery though current battery power good concerned long term sustainibility product case rechargeable battery gets exhausted time wrote customer support informed availability spare battery depends whether product would available point time cannot guaranted 3 bass great,2019-01-12,5.0
30,customer_review-R3AR3TE6QGPNUT,K,"Loud and great bass, poor sound",pros loud great bass makes perfect party speaker probably wont find thumpy bass like price point anywhere else cons sound quality isnt good listen complex music need listen multiple instruments together want hear vocals loud clear poor choice mids pretty weak vocals sound muted things like guitar distortion lack colour need something loud lots bass get need something good sound quality clarity stay away need bass get jbl go need bass still want sacrifice sound quality spend get tagg sonic angle 1,2019-02-03,4.0
31,customer_review-ROSYXP93KELYU,Abhineet G.,best table top speaker,product awesome sound quality best within price range shape suitable tabletop speaker option fm bluetooth speaker used listen fm radio internet radio beneficial fm radio working,2018-08-22,5.0
32,customer_review-R3AHAM4VYU1XAU,harsh gupta,Got defective product.,power button stops functioning speaker cant switch cant switch time im unable switch fm mode lower volume zero switching,2018-11-08,1.0
33,customer_review-R1S43IOE7RTDQB,P.Raju,Everthing is good except for one Big caveat,sound drum good terms sound quality durability battery backup however caveat repeated voice infomessage played sound drum powered connected bluetooth turned messages irritating one power voice message plays automatically turns 30 mins usage totally unexpecteduntimely times would slept stopping music playback loud power voice message wakes,2019-02-20,4.0
34,customer_review-R2GTLPPDKUMMSD,Jyothis J J,Excellent speaker,really excellent product price good looking great sound bass,2018-06-24,5.0
35,customer_review-RE8SHTTYQPW31,K Selvam,Not satisfied with this product.,sound drum 871 markpor 567 better rel ated sound bass fm fm worst bass,2018-10-30,1.0
36,customer_review-R2QDU72IOF4AV3,Amazon Customer,Worst connection issues.,showing battery backup 6 hours playing full volume automatically volume goes low minutes playing full volumeand also automatically leave voice like going bufferfirst thought phones bluetooth connect another phone also thingtired return product againg ordered flipkart issue continuedso dont buy waste money,2019-05-28,1.0
37,customer_review-RHJUSZ2BENZ52,udaya g.,No charging adapter in box ever for this price,got product 2 hours ago sound quality good produce 10 w sound feel 5 w sound major drawback charging adapter produced boxwhile maintain brand company produce authorized charger even buy china product worth rupees 300 give sound quality liked buy company product disappoinment,2019-02-27,3.0
38,customer_review-R1XLI4HK8CGA3M,akshay,Exceptional sound output!!!,really blown away sound loud zero distortion even higher volume dont know drivers portronics used base rich crisp 360 degree sound experience awesome complaining less bass speaker designed 360 degree rich sound experience bass perfect want bass go buy passive radiator 2 months im love beautiful speaker battery life also good get around 8 hours 70 volume,2019-08-17,5.0
39,customer_review-R714JF549SM2I,Aviroop D.,was skeptic about a few things - like the product's quality,bought watching reviews youtube skeptic things like products quality vibration physically fears gone amazing product doesnt vibrate much anyone looking buy without hesitation,2018-04-01,5.0
40,customer_review-R25JLZVQR3BCGI,Vikash,FM connectivity poor - no service - worst attitude,sound quality okay fm connectivity poor catch popular radio fm channels r within defined range speaker addition response amazon portronics even feedback complained portronics asked send speaker mumbai cost said product faulty shall arrange pickup representative said send want service talk seller cant anything waiting resolution amazon unprofessional brand service use throw product waste time money,2019-05-19,2.0
41,customer_review-R2K2LNTWNMKZTQ,pravin Chaurasia,Thunder sound but battery lyf poor,amazing sound effect 5 star sound output n bass,2018-09-15,5.0
42,customer_review-R3SS1MA9MT48FM,Sunil Kumar Nayak,OVERALL: A PERFECT BUY. SATISFIED,waterdust resistance havent tested water quite resistant dust due threaded synthetic protection sound quality voices treblehigh notes clear distortion audible maximum volume bass quite noticeable play within 15 10 room room closed wont notice bass outside room yeah sound clear loud think bass fine products segment better speakers bass overall usability better one battery playback time around 4 hours 8090 volume 6 hours 6070 volume takes little 2 hours charge completely connectivity besides wireless bluetooth connectivity auxin havent used yet range fine home hall use inbuilt fm redundant also tried auto tuning channel search hostel room 1st floor could listen distantly distorted bad quality sounds popular frequencies fm channels unusable anyway never thought listen fm speaker nowadays durability synthetic cushioned protection fine thing falls edges floor middle part upper bottom covers brittle hard plastics easily break crack falling dropped bottom plastic piece came fevicol staples inside wasnt properly dried affixed cracked edges 2 sides still could reattached clips much damage isnt visible expected better smooth quality plastic textured ones arent durable,2019-02-19,4.0
43,customer_review-R2QLBO2B404RDT,Alexander,Not worthy for voice calling,purchased connect phone call throug device checking reviews much noise voice clear connect phone calls advantage various inputs like aux bluetooth fm usb sound quality also good already using alexa reviews exaggerated sound quality case already ht go need portable speaker listen music dance p,2019-01-30,3.0
44,customer_review-R3QLSUKQZYQSL8,Rahul PK,Best bluetooth speaker under 2000,ive tried many bluetooth speakers rs 2000 trust best price sound output really great used indoors outdoors battery output superb mid volumes significantly comfort levels goes 8 10 hrs sometimes even fm reception also good tune ready go easy take calls discontent far best bluetooth speaker rs 2000 go,2018-12-24,5.0
45,customer_review-R2O1WILCZT3HY9,MANI MT,poor performance,poor performance compared sublime 2its 10 w sound loudness voice sound clarity bass disappointed pros battery backupand usb cover belt item keeping holding safe flat sound available sublime far better product,2018-10-18,2.0
46,customer_review-R3FDQH5BWKJK2W,Abhishek Vaid,Buy it period,get pay definely hits spot highs great lows mellow perfect genres music pop rock jazz rege gazzals opera classical mozart even american country plays without stinch imperfect perfect bass exactly coded song perfect timing swing music depth sound sound clear crisp amazing quality material water resistance take mountain hike basically weather music carnival hand,2019-05-28,5.0
47,customer_review-R13MI7ABUJXURC,Samuel L.,"First 24 hour Review, its Great.",device bit heavy others although big deal theres usb cable included box accessories like aux cable carrying pouchetc device connected easily stays connected without interruption first 24 hours sound experience great much highs mids lows could use little bit balancing fine tuning highs mids bit overwhelming certain songs overall considering price hard complain bass nice feel pronounced dont compare bass subwooferseven cheap ones popular expensive brands like jbl sony anker remember price terms jbl go easily blows away even fare compare hand feels nice hold seems like expensive actually havent tested much water resist dont plan shouldnt theres sound crackling muffled audio even high volume 1800 bucks great buy easy use tons features wouldnt regret,2019-01-06,4.0
48,customer_review-RKFGM0LDDOUJY,NAVDEEP SINGH,Less pronounced bass at lower volumes. Could've been better.,desugn flawless price point mesh quality supreme solid mass feels quite package hand battery backup share use sound quality think could way pronounced bass lower volumes one doesnt also boat stone 200 insane lower freq response even lowest volumes using sound drum since past hour came tweaking dynamics sound viper4android bass becomes bit mess dubstep trap tracks would request makers sound drum please learn lower freq response competitors dont compromise part spectrum indians solely dependent upon bass audiophiles perspective think imaging quie good decent staging thanks stereo setup 2x 5w speakers overall dynamics preserved throughout volume spectrum overall ratings portronics sd 8510 stone200 810 lost 05 design,2018-12-13,5.0
49,customer_review-RZGEORRGJGIXD,NEWNSTORE,A good Bluetooth speaker,small big either sound considering coming small form factor impressive bass good clarity great problem bluetooth connectivity good music playback using telephonic function mark bothered telephonic functions price surely value money product,2019-07-24,5.0
50,customer_review-R4DTNYFWGKIM6,Prakash,Small Package Big Dhamaka,confused boat speaker one size small easy carry play music bass mids high really well balanced output clear like bass music full volume blow mind 3 months issues,2018-11-04,5.0
