,customer_id,customer_name,review_head,review_body,review_date,ratings
535,customer_review-R1V3YH05OOXR1P,adithya,Bass could have been better,small speaker output amazingly loud totally misses good bass completely charged speaker played 7hrs handy occupies less space backpack,2018-12-26,4.0
536,customer_review-RJDLU0HG8A7V5,krishnan vs,Good one,performs well portability sound quality deparrment,2019-09-04,5.0
537,customer_review-R3L5S27RYUM1PO,Thejas,Value for money,good quality product nice bass radio working properly sound instruments great,2019-01-25,4.0
538,customer_review-R2KEYKWUF1UDAF,James,Great sound,crisp loud sound punchy beats good bluetooth connectivity,2019-10-11,5.0
539,customer_review-R2J16YD085C5S0,Linse David,Amazing experience..! Value for money..10 stars..!!!,best rangeplease go blindlyits another quality product portronics dont go sony jbl,2019-07-01,5.0
540,customer_review-R7PUMITKIBV1P,Aditya,Best stylissh Bluetooth speakers for the price.,good product bells whistles sound quality descents dept much mids lows less average descent,2019-03-21,4.0
541,customer_review-R2G7OS0TXELM40,murali,best for the price,using 2 months working good bass good lacks bit trbble good songs movies overall best bt speaker piece,2019-05-19,5.0
542,customer_review-RKUC57EK8GXWA,subodh Mangalwedhekar,Nice product - Meets requirement,nice product price range 1700fm reception quality good compact loud sound quality sound could better higher sound overall meet requirement expectationsso 4 5 star,2018-11-17,4.0
543,customer_review-R3CQTSEQAW80L,Vikram Singh Meena,Best Ever Speaker,amazing pumping bass better sony jbl speakers price range everone buy,2018-11-14,5.0
544,customer_review-RZ18K0M7GDDL1,Amazon Customer,Disappointing ouput!!!,disappointedvoice clearbass n treble didnt felt depth feel like get ouput loud speaker wonder people giving 45 stars one gud build quality,2019-07-01,3.0
545,customer_review-R2SPA7JIH9LIOI,Shruti,Good,good productmust appreciate seller tooall accessory presenteven filled warranty card box,2018-05-18,4.0
546,customer_review-R3K6MEE335RHCU,Ganapathy Subramaniam R S,Perfect Speaker with loud sound and long life,good speaker deep bass good sound quality long battery life light weight durable,2019-01-08,5.0
547,customer_review-R1E41OX4UWTX6I,krishnendu mukherjee,Value for money,satisfied quality product,2019-09-25,5.0
548,customer_review-R30DQHGA3AU6NF,Sanjeet Kumar sah,Bettry backup Kam detha hai or sound bhi Kam ho gaya or bas bhi Kam gaya hai..,sir good morning sanjeetkumarsah sir jo protronic sound drum liya tha uska better backup kam deta hai jab phul charge karta hu 1se2 ghante hi khatm ho gata hai sir usme sound bass kam ho gaya hai,2019-07-09,5.0
549,customer_review-R2ZL51OLS4RM6M,Kishore,Value for money,excellent product enjoying past 5 months issues far strongly recommend,2018-09-05,5.0
550,customer_review-R25WLNJ6SH1BQ3,Aditya Viswanathan,Poor Durability,even month use speaker working kind glitch started sounding n alll distributing sound quality please help resolve issue,2019-02-02,1.0
551,customer_review-RE78NQRYK4HOJ,ayush gupta,Cons I faced,bluetooth connectivity good sometimes increase volume mobile increase speaker volume control button speaker good,2019-08-12,4.0
552,customer_review-R1C3BLPTJ5GHMQ,Amit M.,Lacks Bass,lacks punchy bass otherwise loud enough fill entire room,2019-09-29,3.0
553,customer_review-RPDH5ZFHX26N7,Atul Lahane,Awesome,awesome product portronics timely delivered good packing built sound quality best,2019-06-26,5.0
554,customer_review-R3AQBE6V754JWM,sumit biswas,Portronics POR-871 SoundDrum 2018 best Bluetooth speaker this price range.Great sound,portronics sound drum price range powerful bluetooth speakerthe sound quality awesome base strongthe bluetooth speaker meant listen sound think anyone cheat take thankyou,2018-11-27,5.0
555,customer_review-R39I4WQ33IOR2G,Anup,Well built speak,excellent experience product buy without doubt budget till 7k product beats jbl bluetooth speakers,2018-12-08,5.0
556,customer_review-R2X6C2ZMXX8JU0,Archit,Awesome product,think best product price great sound bass playback time loved,2019-09-02,5.0
557,customer_review-R3LXVF37GCNGTG,KR,Bass could be better.,apart bass features sound good,2019-06-21,4.0
558,customer_review-R20OWYV411EIUX,Parveen hooda,Perfect for travelling,perfect travelling even beach like areas sound quality perfect small group party,2019-07-20,5.0
559,customer_review-R3CWM7Y58STU1R,Rajesh maurya,Malfunction very soon.,fm radio changing week use irritating use fm radio cannot change stations,2019-10-24,2.0
560,customer_review-RRGWU3XOZIZJJ,Kiran,Its a mini power house❤️,power house though battery 1800mah works long hours loud sound mine havent drained power till using 46 months,2019-08-12,5.0
561,customer_review-R2A944GQTYICOY,Gaurav Lamba,Awesome!!!!!,best speaker budget guys really nice build quality even water resistant say splash proof really amazing bass loud sound good experience speaker,2019-04-23,5.0
562,customer_review-R37NI3MAQNMHVJ,arjoshi,Dynamite in a small package,size little monster packs powerful punch bass great clarity sound distortion even high volume,2018-10-23,5.0
563,customer_review-R4PFO0T578W80,Prabhat Arora,Excellent Product,impressive one best sound quality value money surely impressed like,2018-11-01,5.0
564,customer_review-RPG2CUZKGVBBB,Ashwin Joseph,best Bluetooth under 2000,worth buying im totally satisfied plus also increased warranty period sounds great small issue bass much described kiddos amazon timely delivery,2019-06-19,5.0
565,customer_review-R4A8EOZTG704D,Amazon Customer,Very good & worth,good satisfied would good volume increase decrease function made bit smooth hence 1 less,2018-11-28,5.0
566,customer_review-RW134DLGU078Z,Amazon Customer,It's worth good product,good product loud sound connect pen drive aux,2019-04-07,5.0
567,customer_review-R3HIAZWAEEW33K,Sahil Singla,Amazing speaker with superb sound quality and battery life,u looking bluetooth speaker 2000 rs dont think get better amazing sound quality bass amazing battery life highly recommended need think buying product,2019-01-29,5.0
568,customer_review-R35ZCE9LAGY246,Amazon Customer,SoundDrum is true Drum!!,sound pretty good easy connect fm works button outer cover comes quickly overall good product 2k,2018-11-01,5.0
569,customer_review-R1DSK660LNIDDY,Narugopal das,Full sound quality samthing chang.,like produckbattery charging 2hoursbattery vare stongmidiam sound track 5to6hourssound quality care good full sound samthing quality chang lo price bast productsound drum proteomics,2018-10-30,4.0
570,customer_review-RRHVSL1QDF45K,Rahul Athankar,Great,awesome product crystal clear sound tiny power plant sound best design easy carry,2019-02-06,4.0
571,customer_review-R5WP612WOSCGQ,USAM ASHRAF P A,Good but not bad,thing better portable speakers get amazon price range using one month problem sound quality nice battery backup,2019-08-21,5.0
572,customer_review-R1Q27L873FYN6Q,Amazon Customer,Poor sound quality,fake youtube reviews posted people product totally worth,2018-10-30,1.0
573,customer_review-RP5M5P6QF539C,Mei,Sound is very good and in built mic is not audible,connectivity stable built mic audible,2019-08-10,3.0
574,customer_review-R3J07I65Q794EK,GBR,Good,sound quality ok overall product good price,2019-03-24,4.0
575,customer_review-R299QKNDEK4HQG,Ramesh,Happy music from Portronics,sound drum compact nice look sound quality clarity really fabulous right choice product music lovers,2019-02-25,5.0
576,customer_review-R4LG492JTYKPD,Vikhyat,sober but not durable,touch ne product compared portronics posh 606 rough use avoid buying sound treble missing cracked voice 100 vol battery good 255,2018-12-20,2.0
577,customer_review-R1LNR3R3K0MBXF,lalit,Good sound,good quality good jbl go good bass,2019-10-27,5.0
578,customer_review-R2JJBMUVRS3SYP,Amazon Customer,Quite expensive but really volume and good sound quality..!,give 5 stars portable small size good volume sound quality course classy look,2018-11-27,5.0
579,customer_review-R30HHF0EYPDZT,Ahwan panigrahi,it is value for money product..,product good clear audio output bass good product value money product controls poor cheap plastic overall product ok,2019-11-24,4.0
580,customer_review-R1CS1238MVAV9E,Ankit Girotra,Poor built quality,sound quality everything fine base speaker fell customer service really bad even though guarantee period neither co amazon willing help,2019-07-19,2.0
581,customer_review-R20692KTJNIG6B,Amazon Customer,Blue Tooth,addressee recipient product complained blue tooth connectivity pl call help fix issue connect blue tooth,2019-05-07,1.0
582,customer_review-R6PJP58ZIFYWA,Aryan Raj,Definitely go for it,best bluetooth speaker 2000inr bass awesome loudness awesome clarity awesome overall awesome,2019-06-19,5.0
583,customer_review-RMHTY0R84FKRO,Amazon Customer,Go ahead nice product,wonderful sound drum full battery back fm also working nice go ahead,2019-06-17,5.0
584,customer_review-R39BPIOWTZYQE3,Mayank Verma,Meets all your expectations...,price doubt best speaker 4th bluetooth speaker range one impressed much even water dance u play songs,2019-07-01,5.0
585,customer_review-RMX9RL72JKEAG,Vaidik tiwari,Phenomenal product.,im surprised listened first time power generates,2019-05-22,5.0
586,customer_review-R10XISXRYMICA9,Mohit,Full volume sound is distortion I am not happy for quality,proteomics sound drum better sound quality full volume distortion bass okk price range advice go boat jbl,2018-11-28,2.0
587,customer_review-RS2OM5XYG0LCM,Amazon Customer,Best Sound Drum,superb sound amazing product guys buying bought boat stone spin x speaker really disappointed later sound drum much satisfied,2019-01-27,5.0
588,customer_review-RHQ9BRQP6APFS,Lokesh Shetty,Great product..!,really good speaker low price keep proteomics,2019-03-25,5.0
589,customer_review-R128PJCU3KDQ45,karthikeyan,Nice product.,radio receiver better,2019-10-24,4.0
590,customer_review-RP0HUAF0MTV0H,Sagar Dandekar,Only one word.... superb...,buy speaker without doubti think speaker without portronics price range using product last 4 weeks superb experience,2018-07-04,5.0
591,customer_review-R29Q66BHOP21KW,Harjinder Singh,Paisa vasool,great product fm works fine faridabad also equipment fails catch proper fm sound quality better expecting full product loved,2018-10-28,5.0
592,customer_review-R3UXR0AK0ISLN2,Roby,Bass quality is low,sound high bass quality low usb playing highlight boat sound quality 100 portronics 70,2019-04-02,3.0
593,customer_review-R3N1I66WZYQ03Q,naveen Pratap singh,Cheap and best,good product everyone also cost low best quaility good like high volume songs,2019-05-31,4.0
594,customer_review-RWOPEJRL47BFQ,Puneet Kumar Sharma,very good,good sound quality battery also long time,2019-09-25,5.0
595,customer_review-RQK53X0KNIIQ8,swarndeep singh batth,Best BT speaker,super productsound quality 1blue tooth connectivity awesome,2019-07-07,5.0
596,customer_review-RTJ4TB462AHVT,M.Mukherjee,Awesome sound,awesome speaker gives superb sound loved,2019-10-22,5.0
597,customer_review-R3R7KHCBN5N3NO,Krishna,Full featured stero speaker for a decent price,speaker sound quality features definitely worth money,2018-11-30,5.0
598,customer_review-R2RLURLU2AP17B,Deb,Nice,beautiful small portable bluetooth speaker fm fm reception good note card included box used extend warranty 2 months extra,2019-05-17,5.0
599,customer_review-R13AGL6ZW76LTK,Praveen Joshi,Fm stopped working,using 4 months fm stopped working raised online complaint service center grant road mumbai waiting problem resolved,2019-07-26,2.0
600,customer_review-R1X495F6I62ZMD,Umesh Nair,Nice Bluetooth speaker,really liked product one best available market price segment good battery back 7 hrs continuous music,2019-08-24,5.0
601,customer_review-ROE3WQCN9R1O2,Amit,Worst buy for the money,sound quality connecting fm bluetooth worst starts making crack sound seconds start poor buy worth money,2019-08-04,1.0
602,customer_review-R3I61M6LZE3XGQ,praveen,bluetooth speaker,bass good sound quality moderate portable carry battery backup good fm radio,2019-02-07,4.0
603,customer_review-R8IGXGB12KDFB,Balvant Rathod,Good Product,good sound quality hath pakadte hi bass fil hota hai loud,2018-12-21,5.0
604,customer_review-R1GM2INUO4UAUL,RAGHUVENDRA SINGH CHAUHAN,Sound ka Baap,awesome sound quality battery life havent tested yet seems durable aux cable missing along speaker promised package amazon guys sending new cable issues end,2018-10-13,4.0
605,customer_review-R3OLGJKMDZG1MH,VK SINGH,Valued product,value money good sound quality volume control using fm,2019-10-26,4.0
606,customer_review-R3V9RMU1P3BU4R,amit kumar,Awesome sound,sound awesome balanced beat proper bass boost like mid range subwoofer chhota packet bada dhamaka dont think go,2018-11-14,5.0
607,customer_review-R3RX0HRMYBDUXI,ANOOP MOHAN,A very good product,product would surprise us loudness clarity compact design even bass effect good enough though gonna give wow feel good product,2018-10-29,5.0
608,customer_review-R18MMED44RMM3J,Ramanadham,Five Stars,excellent bass clarity battery back good,2018-06-28,5.0
609,customer_review-R1CRTSB7HCJBYA,md abdulllah al mamun,Very good product,wonderful music lovers im getting fm,2019-08-05,5.0
610,customer_review-R13V4F9GX5U00N,Chatt..,Overall performance is very good,good sound good battery good fm reception overall performance good,2018-11-30,5.0
611,customer_review-R211TSAZOPTZ6X,Amazon Customer,Value for money,though expected little louder sound everything else great feels premium hand nice built quality secure bluetooth connection clear sound,2019-08-12,4.0
612,customer_review-R1ZX7FA2KJDPOU,Amazon Customer,Super loud & clear,nice speaker good sound qualityfm reception poor able use fm radio,2018-08-07,3.0
613,customer_review-R2Z49PAQUOSIEC,Vasanth,about product,mujhe abhi sube 7 baje mila hi abhi maine jitna use kiya hi awesome sound quality base also price per jada sound voice clear ni aata per awesome product hi ye personally like,2019-02-22,4.0
614,customer_review-R2X8ZP14VYRYVK,Rohit Kumar,Fabulous product,nice music system soo many features like auto use long range connectivity battery backup sound like home theater etc advise u must buy,2019-10-21,5.0
615,customer_review-R2J1WEBNVC38SV,Satyarth Prakash,Best in this price range.. Bass superb..,best deal price range even 2500 u cant get type bluetooth using 2 months yet problem sound 5 look 5 battery 45 portable anywhere,2019-03-13,5.0
616,customer_review-R3H7VVSZLJFKUW,Prashant,Sound drum rocks!,sound drum sound quality awesome bass par highs n mids lively one listens mid volume clarity way way amazing b rock jazz ghazals etc,2018-11-14,5.0
617,customer_review-R3TM9EIWGM92H6,ajay t.,Five Stars,super amazing speaker great sound bass nice patronic speaker thanks amazon product,2018-05-17,5.0
618,customer_review-R2OEAV5BPBVHPG,HASMUDDIN ANSARI,Awesome,awesome aound build qualitybattery backup also good,2019-03-13,5.0
619,customer_review-R236GQ9BE8KLCQ,Yogi,Poor sound but good build,sound quality quite poor overall build quality finish however quite good looking food looking speaker average sound go,2018-10-26,3.0
620,customer_review-RGBS06FTH938J,Abhishek Bhardwaj,Awesome Product,using last 1 month voice quality awesome,2019-02-19,5.0
621,customer_review-R7TX6J6CNGZBR,sagar,Awesome,easy use easy carry issue fm,2019-07-04,5.0
622,customer_review-RMGM6338ZW4OC,Indranil,Nice speaker. Worth the price,good base sound blue tooth also effective lag build quality good sturdy battery good last 56 hours,2019-08-18,5.0
623,customer_review-R31SXGC4BXO6Y7,akash baghel,Must Buy,sound quality amazing battery life good amazing specs,2019-02-05,5.0
624,customer_review-RJV5I8SHTD0L3,gunjan bhatia,Worst speaker ever.,volume button loosened seems like fall week since started using worst product buy money worthy fm stopped working,2019-02-10,1.0
625,customer_review-R2QIQABX9F0QN4,Saloni,Awesome,chota packet badha dhamaka takes little longer get connected via bluetooth easily ignored plays,2019-06-25,5.0
626,customer_review-RQYIPX1BR661X,Jayesh Kumar Bongale,A short review,beast small package best way describe sound drum sound amazing ofcourse depends kind track playing device chic looks sturdy overall good buy,2019-01-25,5.0
627,customer_review-R3I3FYAKE7JXGN,parsam sai bharath,Ok not bad,plastic quality poor bass poor sounds good clear crystal clear,2018-12-31,5.0
628,customer_review-R1EVNMKGEN7OYC,Amazon Customer,Just Awesome,clear sound descent base premium design worth buying,2019-11-12,5.0
629,customer_review-R2ASFHOTUOPSGC,Twinkle,Best speaker under 2k,overall good speaker excellent built quality full volume high u cant bear low volumes sound seems dull low pitch bass punch awesome,2019-02-05,4.0
630,customer_review-R1ODLIEP2F1G3P,V.KASIVISWANATHAN,Review on Portranics,two days delivery product function returned manfacturer,2019-10-12,5.0
631,customer_review-R1RLR8Y1XRJCSN,Sudipta Karmakar,Very good product.,good product long battery backup sound quality also good,2019-09-24,5.0
632,customer_review-R5Y1MQK2J99AK,Aashutosh,Quite good for this price,power packed beast small size really loud good base sound clear build quality also good stylish,2019-10-10,5.0
633,customer_review-R115QNH8FD4104,Vinai Saxena,Below expectation,expectation,2018-08-28,2.0
634,customer_review-R1Q6ALWIWELB2S,SOURABH,"BEWARE,GOOD SOUND QUALITY BUT A QUESTION MARK ON DURABILITY,???",good experience thing concerned durability aspect volume button sticker came second day purchase decided reture,2018-11-27,5.0
635,customer_review-R26FQYUXXHMQ2F,Viraj,Powerful capsule,size small quality sound loud n good,2019-10-27,5.0
636,customer_review-RQ1W3BLFXVJTC,jitendra n.,Good product,like sound loud much,2019-08-05,5.0
637,customer_review-R266ASKMMGA2VT,Amit S,Excellent Product,good product means price 25 higher,2019-07-31,5.0
638,customer_review-R2FDYJQRLGVBED,Chitra,Worth the money,sound quality good battery charge remains many days love,2018-11-08,5.0
639,customer_review-R24W9R85OFGVG0,Etii,It has got the Bass.,nice sound quality great bass effect,2019-07-20,5.0
640,customer_review-R2C1RUY3U5L2Q,Sajjad Manal,It's a must buy.,loving way three months back purchased sound quality amazing nothing degrades time,2018-11-30,5.0
641,customer_review-R31O9DSTJIUEAH,Digvijay,Charging Issues,product greatthe bluetooth connection fast sounds great considering pricebut 2months using unable charge speakeri contacted response,2019-04-13,2.0
642,customer_review-RR5DSX9ACKV6Z,Jobin Jose,Bhoom !,absolutely great product reason reduce rating,2019-10-21,5.0
643,customer_review-R1TH1G58ANIE4R,sharath gururaj,Best for the price !!,discounted price cant ask better product awesome sound quality ease connectivity go,2019-10-13,5.0
644,customer_review-R3L2BBIEFOC6KW,DD,Nice product,good bt speaker fits expectations,2019-12-06,5.0
645,customer_review-R1M74U1GPUV0FE,Mathew T.,Extremely happy with the product,extremely happy product ask friends shocked turned loudness high must looking speaker 2k,2019-06-02,5.0
646,customer_review-R1G8M0M8MSSGZV,balakrisna,Great device,using 4 years initially sublime sound drum cost wise affordable great sound,2019-09-09,5.0
647,customer_review-R2HYM30A23CSSG,Amal,Iam impressed at the build quality!!!!,nice product price range 1699 sound quality good overall quality sound get little bit poor high volume build quality product grate,2019-01-23,4.0
648,customer_review-R23GZUK8HVR6H4,Enoch K.,Good to satisfy your music urge!!!,really good dont think twice use good equalizer mine used samsung eq sounds surreal personal experience though worth spending hard earned money,2018-12-27,5.0
649,customer_review-RCS64Q3TQXHRO,Amazon Customer,Perfect one,looks premiumsound quality good highly recommend,2019-02-09,5.0
650,customer_review-R1RSJO0GMSYL01,soumyadipbarmanroy,Everything's upto the marks but the bassn thats big time,bass priority musicthe thrill misses though qualities claimed well preserved wont recommend though,2019-02-12,2.0
651,customer_review-R280S0HZDXPL3J,Nipun Rangwala,Very good sound quality product,good product along usb charging cord company give electrical charging socket,2019-02-27,5.0
652,customer_review-R2TDKF92NE2VEC,Siddharth Narang,Small Packet Big Sound The best portable speaker i ever had Just FM sounds cracks ...,small packet big sound best portable speaker ever fm sounds cracks sometimes isnt antenna,2018-05-17,4.0
653,customer_review-R3D41UO0AXHZ4Q,Gulab Mahto,Beast for the price range.,price range best bluetooth speaker damn loud clearnot clearest used jbl go 2 mi bluetooth speaker 2,2018-11-17,5.0
654,customer_review-RDD4OI2DCBZV7,Amazon Customer,Worth for money..,received yesterday really worth cost fantastic product within range good quality sound output even higher volume,2019-06-10,4.0
655,customer_review-RTAJ9RGWOT1S7,Piyush Jindal,"Average battery, amazing sound quality.",battery performance great plays music 150 mins slightly less full volume 75 volume 200 mins,2019-03-23,4.0
656,customer_review-RZ4QPYOUPNN3M,mehroz,"Sound quality, battery, durability,bass?",sound quality excellent battery life good give around 78 hours battery backup durability good quality superb bass safication value money go,2019-01-02,5.0
657,customer_review-R2DPV3DY1SN2C3,Laksh,Review for portronics sound drum,sound quality portronics sound drum good waterproof also speaker sound loud one problem full volume use 2 hours,2019-08-12,5.0
658,customer_review-R15AAHRJV4VP94,Priyesh N,Recommended,great sound quality good packaging prompt delivery,2019-10-26,5.0
659,customer_review-R1B573OPBN0OXX,Cinju,Portronics POR-871 SoundDrum 4.2 Stereo Speaker (Black),good product much recommended,2019-08-26,5.0
660,customer_review-R3OJ7W45NX61SW,Muzamil Bashir,Best speaker with FM,1 month purchase quality sound bass normal best product range brought product place jbl mainly becoz got fm battery backup fantastic,2019-10-08,5.0
661,customer_review-R1D1NPPH6KAF8V,Arijit D.,Value for money,got around 1800 money immense value disdvantage show channel frequency fm radio mode else priceless,2019-03-21,5.0
662,customer_review-R1S94ZMBRIC429,Amazon Customer,Awesome Product,360 sound experience good built awesome sound,2019-01-27,5.0
663,customer_review-R17BCVBF4Z2YWH,G.Venkatram,Top class,absolutely top class bluetooth speaker everything excellent wonder using regularly around 23 hours enjoying thanks,2019-08-20,5.0
664,customer_review-R1ZOAQ2BFSIUN7,Akash Sen,Best value for money product,hade day rain riding 600km best value money product every one try high volume clatters reduce point everything fine,2018-11-23,5.0
665,customer_review-R3IWUQ89ZQAP9V,Shivali Singh,i love it,best cud price range,2019-03-20,4.0
666,customer_review-R2SU8UYWSCJR99,Amazon Customer,Thankyou Amazon for the wonderful product,excellent speaker bhai good sound quality good battery backup awesome product good quality price deversable thanks,2019-09-18,5.0
667,customer_review-RISWQ5LD38YII,Harsh,Best speaker,best speaker potronicssound quality awesome better expwected bass enough 10w speaker expcect bass speaker awesomre go,2019-06-21,4.0
668,customer_review-RIRC3GVYSXAE1,amit,ExcellentProduct go for it...,excellent product much satiesfied good quality soundbluetooth connectivity battery backup also value money,2019-07-04,5.0
669,customer_review-R1N3T61TZSHW9L,Vishal,good but ok,great u cannot gift anyone outside delhiits service centre r delhi battery might get damage u charge continuously,2019-07-06,4.0
670,customer_review-R3IHW56EX3U4W9,Gaurav,Worth the buy,happy decision buying speaker sound quality good loudness also good second thoughts needed,2019-02-21,5.0
671,customer_review-R2IL9WALR0CUGE,Amazon Customer,Worth for money,handy product powerful sound built fm performance excellent worked well moderate signal availability distortion product worth money,2019-07-05,5.0
672,customer_review-R392W38614N4A8,aDi,Travelling juke box,five stars less speaker,2019-08-21,5.0
673,customer_review-R1F8RPJWB00D9I,Kodanda,Not as expected,sound balanced,2019-12-11,1.0
674,customer_review-R3XA1RE1YUZI0,Madhav s.,Nice product with best sound quality n battery life,pros sound quality awesome battery life awesome u play 50 volume 1012 hrs cons bass good bt low volume u increase volume upto 6070 u feel ample bass,2019-01-02,4.0
675,customer_review-R3DTVM3K0XNDYX,Cherian & Rani,ok,interface issues times,2019-08-31,3.0
676,customer_review-R34Y0GALMFTEGI,Cathy Deepak Boro,Nice and sturdy on,nice children dropped several times good new,2019-04-28,5.0
677,customer_review-R1JFWU6VOE9C5U,Asha t.,Awsm,b screen see fm frequency available cant set frequency fm radio mode,2019-06-27,4.0
678,customer_review-RHD71J3JWRQJ5,ROHIT SHARMA,Very good,product awesome price range sound would meet expectations battery life also good handy carried anywhere easily overall good,2019-11-24,5.0
679,customer_review-R1EFT0BSEC3GW1,Gajraj singh kachhawa,Best product in its price range,using product almost 2 months would say product outstanding price tried many bluetooth waste money best product,2019-07-18,5.0
680,customer_review-RU9T7NNWRLXJP,Badita kumari,Monster of bass and crisp sound,couple things like didnt include aux cable box usb cable short charging,2019-04-17,5.0
681,customer_review-R2RQ9A1RAC9NKM,Amazon Customer,Go for it,value money purchased reviewing many speakers cool one,2019-05-29,5.0
682,customer_review-R9W9EKA5MZYD4,Amazon Customer,Went faulty,product went faulty automatically gets switched every 2mins warranty period proceed,2019-08-28,1.0
683,customer_review-RYU2JP1GMRI4X,B S R Murthy,Excellent product.,excellent productthe sound quality superb battery lasts 5 6 hoursno problems faced till bought second piece gifted relative one best bt speakers price,2019-03-04,5.0
684,customer_review-R1OGYWEVNQCRFD,George,Valuable sound drum,good sound drum,2019-10-31,2.0
