,customer_id,customer_name,review_head,review_body,review_date,ratings
1639,customer_review-R2CO97JU7RXU33,Sanjay Kumar,Bahut hi ghatiya product hai mat lena,sound quality poor,2019-11-17,1.0
1640,customer_review-R1VS7VW0QCM4RM,rka,Awful,extremely useless item bought 20 days ago already charger pin working,2019-10-22,1.0
1641,customer_review-R2A27GA2XWIQJD,Rajiv Singh,Really Awesome Sound,like built quality sound dislike battery life full sound max 2 hours,2018-11-01,4.0
1642,customer_review-R3G3U03CAQFKM2,SANJIB K.,A must Buy Product,dont hesitate buy go blindly awesome product,2019-03-01,5.0
1644,customer_review-R3C0GERH6VJMMW,Amazon Customer,Excellent product at smart price,excellent product meeting expectations,2019-01-02,5.0
1645,customer_review-R2Y8RCYHACFJMD,janak patel,Good product,sound loud clear battery runs many hours,2019-07-04,5.0
1646,customer_review-R2BC052YSP9BTP,P S Chakraborty,Superb,nice product price range volume lower paired mi handset,2019-10-02,5.0
1647,customer_review-R3GGW0T2VEFPPL,Samadrito Bhattacharjee,Best one for this price range,best bluetooth speaker range till sound clarity bass totally world,2018-10-29,5.0
1648,customer_review-R231B2GQKKWHJO,Rakesh,Sound booster,nice product like,2018-10-31,4.0
1649,customer_review-R25Q6V1IF4LKLJ,anand pal kolamuri,One of the best,best speaker range body build strong robust audio quality nice lil low bass,2019-01-03,5.0
1651,customer_review-R1EBUFI20R00KO,Amazon Customer,Aaj hi mila meko!!!,sound loud bass also effective good pretty much satisfied,2019-08-31,5.0
1652,customer_review-RA4BF1ZONVIPL,Neelam,value for money,value money,2019-07-09,5.0
1653,customer_review-RFOPQDF0J9IWV,Amazon Customer,Good Sound Quality,sound quality good beyond thinking,2019-02-24,5.0
1654,customer_review-R1X1SITQS981K3,Pushpendra Singh Rathore,excellent,excellent,2019-03-15,5.0
1655,customer_review-R1MJVJ388TKM2W,Girish Manson,Worth the money,good budget around 2000do expect deep bassoverall sound quaility good enough,2018-11-14,5.0
1656,customer_review-R20X4AYENB0J1P,shashikant chikale,Power full Device,powerful portable speaker good bass loudness,2019-01-30,5.0
1657,customer_review-RTIELR1JRGQI9,Amazon Customer,Product quality,fantasic item loved great bass advanced quality thanks portronics,2019-10-02,5.0
1658,customer_review-R1SE1198EHAYKD,Varun Yadav,Bakvas,bahoot bakwas sound quality high bass clearity sound poor dont buy,2019-01-31,1.0
1659,customer_review-R3I0W2K40MES3P,Surbhi Sharma,5 star,amazing speaker,2019-05-21,5.0
1660,customer_review-R1D4YH7E4JWEM9,AmazonZ,Good enough,good indoorslacks low end outdoors,2018-11-27,4.0
1661,customer_review-R1DOEPQQE3GW3Z,Amazon Customer,awesome product,simply love productit good good quality,2019-09-02,5.0
1662,customer_review-RV85NRNSFTVHI,Shiv S.,Best Music Bluetooth speaker device,good sound feel heel,2019-09-09,5.0
1663,customer_review-R1JMRIXD9U44ZY,mnsh1403,Dazzling quality at affordable price,amazing sound price,2019-06-19,5.0
1664,customer_review-R1B52224KEVXMM,RAGHU Kumar,Anything is very good,good,2018-09-20,4.0
1665,customer_review-R3QC93S4ZVNOLG,Mark Anthony Concessio,Awesome sound :),best blue tooth portable speaker price range,2019-08-12,5.0
1666,customer_review-R11V76LURJNDIZ,Dilip D.,Poratability,excellent product adjusting volume bit tricky satisfied product,2019-03-11,4.0
1667,customer_review-R3DBHBLI7029DH,Amazon Customer,Awesome!!,nice sound quality specially treble price cool,2019-09-05,5.0
1668,customer_review-RUJU7B3S31UT1,Ishu,Vfm,good sound quality volume average battery backup better jbl go,2018-11-22,4.0
1669,customer_review-R2T0P8P59EZLQP,Abdulsalamcv,Nice,nice,2019-02-26,5.0
1670,customer_review-R3UA961QPPAVER,Ram soni,Thanks Amazon,superb saund best song,2019-04-01,5.0
1671,customer_review-R2N8HYZI7IWBGR,bimal kumar saha,Very nice product,total functions good handling device also easy waterproof,2019-06-28,5.0
1672,customer_review-R37IY08B5ERP1U,Shiwani,Happy with this product. Nice sound quality,great sound quality,2019-08-13,5.0
1673,customer_review-R2DT2AVFYWJGAF,Ankur jaswal,Value for money,best speaker good sound quality,2019-06-07,5.0
1674,customer_review-R1ALMD6XCR8D8E,Mrinal,Awesome speaker,fantastic sound size durable product best price range,2018-12-10,5.0
1675,customer_review-R3VY8U2J1TJKJD,Shankar,Sound quality,speaker sound quality good sound volume low connected easily bluetooth,2019-10-07,5.0
1676,customer_review-RWNAVOXN0IMZ4,Shoban Kumar,Awesome,loud n clear got 1600,2019-12-05,5.0
1677,customer_review-R2HITSLUPPDETB,Sanjay Verma,Meaningful product for a small place like bathrooms and kitchen.,nice sound easy carry anywhere product satisfying needs,2019-10-05,4.0
1678,customer_review-RFIJAR8FDI63Q,KUNWAR DEVENDRA SINGH,Five Stars,simply awsome,2018-03-23,5.0
1679,customer_review-R783Z76XVOJBV,Md M Rahaman,super,sound effects super qualitybass number,2019-11-26,5.0
1680,customer_review-R3A522CRZ672H6,Sahil anwar,Better than expectations.,better expectations sound volume,2019-10-09,5.0
1681,customer_review-R3J2BE0HJITMX3,Arun K,Best product under 2k,awesome battery backup loved,2019-06-03,5.0
1682,customer_review-R2XJWM1IBFOD07,Fathe singh,I think other name of portronic is bass,speaker amazing sound quality superb bass price point let buy fall love,2019-02-01,5.0
1683,customer_review-RBMKPJERM18VG,Amazon Customer,Ok in this price,sound clearity high volume another ok price,2019-08-17,3.0
1684,customer_review-RZ0BOL4XAWJVO,Abinash,Awesome Product,good one great sound terms battery capacity,2019-08-18,4.0
1685,customer_review-RQTPX8H9UIKKD,Rakesh Kumar Jena,Very good product.....,sound amazing,2019-07-31,5.0
1686,customer_review-R2J3EIUE0J8MZV,Amazon Customer,Great deal,best speaker ever bought,2019-06-16,5.0
1687,customer_review-REX1DVFR890L0,Chethan,Awesome product,sound output excellent bass bit less overall awesome product,2019-11-04,5.0
1688,customer_review-R3HMAD8U23XUFD,Anup Wanjari,Good Product,sound quality good requires bass,2019-11-11,4.0
1689,customer_review-RS49RXHOIGB6Y,Amazon Customer,Excellent product,excellent sound clarity connects much faster,2019-08-02,4.0
1690,customer_review-R293Y77KQESU1G,Sathish.s,Best quality.worth to spend money,best product purchase,2019-06-08,5.0
1691,customer_review-R1Q632Y3N3GDQA,king,Worth it,awesome,2019-11-19,5.0
1692,customer_review-R3VZFZCEN6XYDA,Anand,Good,love,2019-09-28,5.0
1693,customer_review-R1HPP6NFXFUGV3,Ashutosh Soni,Perfect wirless speaker in this budget,overall perfect budgeti viewed lots reviewfinally got thisit awesomen delivery fast,2018-07-10,5.0
1694,customer_review-RWVMUHS128UCQ,Amazon Customer,I like Paul product,worth money good loud sound,2019-10-17,5.0
1695,customer_review-R2UF0WK280JZUQ,aarav,good sound quality,good productat reasonable price,2019-06-17,5.0
1696,customer_review-R34CBKBEB94NN9,varun,Best speakers in its price range..,awesome speakers highly recomended,2019-10-30,5.0
1697,customer_review-RVNZTCOTOSCFU,Rajheshkumar,Value for Money!,liked sound worth buying portable play music usb,2019-05-01,4.0
1698,customer_review-RQN50F7SDSZZV,Harsh,Amazing,amazing speaker range,2019-05-26,5.0
1699,customer_review-R2P25M9Q5UWPPU,Dr.bikash,Great sound,sound quality excellentbass goodoverall nice speaker price,2018-07-11,5.0
1700,customer_review-R3O7M1PRXUH005,Kaushik,Best thumping bass at this price segment,awesome product,2019-04-02,5.0
1701,customer_review-R32YP8HYSPQQEY,Surajit Acharyya,Amazing product,superb quality crisp sound bass really good,2018-11-11,5.0
1702,customer_review-R2W1TOPW1RDO1T,tunikipati ravi,Average,mamulugane unnadi,2019-06-04,1.0
1703,customer_review-R13GSF879T3YJP,Pradeep *****,Amazing Amazon delivered,overall nice products durability also good,2019-11-05,5.0
1704,customer_review-R77SUZ0C3XB4B,Priya singh,"Best and cheap ,,nice sound quality..",nice sound handy happy products better alexa got rs1699,2019-01-23,5.0
1705,customer_review-R2H0GRUXQ8UJG5,Shadab,AMAZING POWER PACK WITH CRISTAL CLEAR SOUND,speaker durable sound output loud clear music lovers definitely love product,2018-08-18,5.0
1706,customer_review-RUAFW6RBE7VLJ,Elanthendral,Worth it,price hard hitting sound drum competes almost bluetooth speakers,2019-10-10,5.0
1707,customer_review-RB9R7AED7TEE0,manish,Not good,purchased six months time sounds good right sound good,2019-08-23,1.0
1708,customer_review-R17JH8PW8524AG,Ravinder Kumar,Awesome,awesome,2019-01-28,5.0
1709,customer_review-RJJ2WLROWUCHO,Leo,Battery sucks....!!! Don't go for it if your a regular user..,sound quality decent battery life short last 3hrs continuous use,2019-02-25,1.0
1710,customer_review-R17Y4U8A7NNNV4,SHIVAM DIXIT,Value for money,everything awesome good sound quality bass good one best speaker price range,2018-11-14,5.0
1711,customer_review-RM0VSFC9G2WMM,pawan kumar,Bad products,bad sound quality much price,2019-06-21,2.0
1712,customer_review-R20H9PHG9DKXRU,Baljeet singh,Excellent,good product loud clear sound,2018-10-31,5.0
1713,customer_review-R2SDNDGJMWHEU7,NILESH,Best Bluetooth speaker with compact size.,go,2018-08-13,5.0
1714,customer_review-R38SFDOA0F17PB,Fred Hauzel,Quite a speaker,didnt expect muchbut truth told 1799its way awesome,2019-08-12,4.0
1715,customer_review-R2JMF533WW1EXF,Amazon Customer,Perfect thing at the perfect price,perfect thing awesome sound quality user friendly,2019-07-02,5.0
1716,customer_review-R37V39PD5Q7IL0,Sohail khan,It doesn't charge,doesnt charge purchased yesterday usage 2 hrs doesnt charging,2019-05-08,1.0
1717,customer_review-R1PMIGXUEGYM78,Raj,Value for money,robust functioning good sound quality value money pack,2019-07-22,4.0
1718,customer_review-R340RZ7O4OUZX2,KALLOL CHOWDHURY,Good product,value money sound quality good scope improvement area,2019-03-10,4.0
1719,customer_review-R34HQGI3UQYB9V,PRAVINCHANDRA VASANTLAL RAJ,Sound Very clear.,awesome per price tagssound listen every corner,2019-11-03,5.0
1720,customer_review-R19G2G7GXL8BJ3,Mohit416,Great!! Must buy,love sound power tiny bombshell,2019-06-01,5.0
1721,customer_review-R84MCULH84PYV,abhishek,Must have,simply amazing sound quality superb battery spectacular chota packet bada dhamaka,2018-11-16,5.0
1722,customer_review-R2VRSG1MSP8R6J,Suraj sharma,Awesome,awesome sound price thank amazon,2019-01-29,5.0
1723,customer_review-R1R7B9YBXTGYLY,SHUBHAM ANAND,Totally waste,original productfirst copy portronicsdont buywaste money,2018-11-10,1.0
1724,customer_review-R13QL7V7WY6I4G,Shekhar pareek,Sound drum,best sound quality best bluetooth connectivity n range poor fm radio frequency,2019-10-15,5.0
1725,customer_review-R3SHUVT40LPUNO,Sumant,Great One...,price grt quality,2019-11-24,5.0
1726,customer_review-RMV95CH0DKM33,Pradeep Majumdar,Not Satisfied,sound loud pleasant clear,2019-10-07,1.0
1727,customer_review-R1IIJSN9TDCG2J,harpal singh raskeerat,Veey gud product,value money,2019-07-12,5.0
1728,customer_review-RK3QVRALLFQMT,Manoj Kumar,Nice product,nice product,2019-05-13,5.0
1729,customer_review-R3LJWF6N6G5S4Y,Amazon Customer,Value4Money,gud price point,2018-11-01,4.0
1730,customer_review-RN3N8Y7TQ60E0,rohan kumar,Love it,battery life awesome good quality sound bass amazing value money,2018-10-31,5.0
1731,customer_review-R2GFURISI8H3GV,Vivek Rao,Compact companion,good sound base,2018-10-29,4.0
1732,customer_review-R1FH31G1NVFH9W,shyam sundra,Amezing product like j b l .,amezing like j b l nice product go,2019-01-02,5.0
1733,customer_review-RCL2EU05DKOBB,Subrat,Bluetooth range is very less...,bluetooth range less wise speaker beast,2019-07-01,4.0
1734,customer_review-R2VUSQCV4WYK1G,Amit,Superb,dad price rangego iti giving review using 6 months,2018-11-13,5.0
1735,customer_review-RQ8BYEW5366FP,Vinod Patyal,Nice portable sound drum,nice portable speaker fm bluetooth functionality exactly looking,2019-09-27,5.0
1736,customer_review-R2FLUNRN3DX3UR,Renil Rajeev,Clear winner in this price range,perfectly full filledheavy bass sound clarity,2018-07-24,5.0
1737,customer_review-R16GNWB5DMXZ6O,Amazon Customer,Good Product👍,sound bass quality fantastic,2019-07-14,5.0
1738,customer_review-R2ZBWG2NCXV5YS,Saugat,Great Buy,value money,2018-11-23,5.0
1739,customer_review-RAH43Q0F5RUY1,Resin T. Ravi,Value for money,easy use good sound quality must product music lovers,2019-05-01,4.0
1740,customer_review-R2OO42TGEU5A8E,Akshay,Go for it,best price range,2018-11-02,4.0
1741,customer_review-RR607T5AVGFCG,Amazon Customer,Good sound,good sound drum fm radio,2019-11-07,5.0
1742,customer_review-R11XIHJ8MINTS0,Ajit singh shekhawat,Good,great,2019-11-01,5.0
1744,customer_review-R1UPLB0JY79RNJ,Arun patil,After 15 day use my view about product,best sound quality loud enough lack bass precpctive great deal,2019-02-13,5.0
1745,customer_review-R5E8MQXHYQL9P,Amazon Customer,Love u portronics,osm dude sound n bass clear best bt speaker low budget,2019-06-20,5.0
1746,customer_review-RWLG0SSW33E0N,sourav,Undoubtedly one of the bests in this range.,speaker awesome range speaker gives one best class sound loud clear well balanced base looks cute,2018-10-21,5.0
1747,customer_review-R3L95SGRAN2KXX,Jitender Kandari,Five Stars,best speaker price range go really looking good sound,2018-03-18,5.0
1748,customer_review-R1X4XHIXGZ626B,Saurabh Jalutharia,Without any doubt.. Just buy it,best best best best price beast real one go sure gono love kt trust,2018-05-17,5.0
1749,customer_review-R2KX7Z4EQVZOMX,Electronics engineer,Perfect Bluetooth speaker,great speaker good bass sound,2018-11-01,5.0
1750,customer_review-R2TS3V19ZI9GEF,Ambalavanan Kanagasapapathy,Unique,good,2019-01-03,5.0
1751,customer_review-R15EL7K57JFZ28,surendra kumar,Good value,good,2019-03-31,5.0
1752,customer_review-RXC3UXPJDE14H,Mansi Dighe Kadam,Good sound quality,nice product price sound quality battery life good,2019-10-07,5.0
1753,customer_review-R2OO6I2FOQ6F1X,lakshmi ranga,Portable yet good quality sound,portable yet good quality sound,2019-03-27,5.0
1754,customer_review-R2L5SRFISGBSO3,Srikanta Adhikari,Srikanta,good,2019-11-11,5.0
1755,customer_review-R31YZ4S090YLOT,Dhandeep soni,Best Bluetooth speaker,sound quality good noise level low,2019-03-30,5.0
1756,customer_review-R3EJHP8O5VL2N,RAO,Very good speaker,good product range sound quality nice battery backup good,2019-08-15,4.0
1757,customer_review-R1CEU3Z8CA18JG,satyanarayana.g,very good product,good,2019-11-02,4.0
1758,customer_review-R22QNTDBLAW5R2,Vikram Mishra,Good product but pendrive is not working,sounds good pendrive working even replacement,2018-11-01,2.0
1759,customer_review-RMTLYG47M0XZD,Naresh P,Good value for money,bluetooth connectivity battery life good overall features good considering price range sound quality mediocre,2018-11-11,4.0
1761,customer_review-R3H67XBMZIKXIV,Amazon Customer,NYC product,awesome product,2019-07-27,5.0
1762,customer_review-RZMZ6X2WU77UL,Ranjeetyadav,Good product,nice,2019-09-04,5.0
1763,customer_review-R1O2K3IFMTEV7A,Jaiprakash,Good product,good sound quality fm connecting apple products,2019-09-02,3.0
1764,customer_review-R1ZKWM8NJDKT7O,Amazon Customer,Portronics does it again,worth money good sound,2019-07-18,5.0
1765,customer_review-R1EILXYFGW0UNI,ashwin Mantoor,Good,good,2018-12-21,5.0
1766,customer_review-R32H9I9AF7A1UI,Amazon Customer,Mind Blowing !,best sound output tiny thing really happy purchase,2019-06-28,5.0
1767,customer_review-R1VM98B3ADSHMK,P,Good,nice,2019-02-26,5.0
1768,customer_review-R2OV7YF5BE9OCB,Amazon Customer,Best n clear sound,amazing sound,2018-06-14,5.0
1769,customer_review-R2XZHQZLCQXUDR,Arjun MV,Worth of money,excellent sound,2018-11-13,5.0
1770,customer_review-R2RR9OAJM94MLH,pratik,Good product,sound good price reasonable going sony must buy,2019-01-01,5.0
1771,customer_review-R1Z6FHAHM61N91,Hassaan,Just go for this speaker,got 1800 sound quality amazing price range beats jbl go built quality superb,2018-08-25,4.0
1772,customer_review-R1U88CTSB1O5WH,Dr Alok bansal,Sound is breaking,sound good breaks sound calling,2019-12-08,1.0
1773,customer_review-R1FH7DZI3WU6QZ,venkatsai,Awesome,great bt speaker price range bass little low acoustic sounds superb,2018-11-17,5.0
1774,customer_review-R33B30M93O8MS6,rithic,Good sound,good sound quality connectivity ok cant carried pockets,2019-10-10,5.0
1775,customer_review-R6LV6K0A4J32Z,rajendiran.,It's a fine product with super sound quality,like product bluetooth connectivity superb sound quality nice,2019-10-10,3.0
1776,customer_review-R2FZ5U86B1XXAV,Punit786,Superb,excellent battery back awesome sound quality overall best price,2019-06-27,4.0
1777,customer_review-RG37FSATN70AR,Harsh Vardhan,Very high bass,nice speaker powerful bass radiator,2018-12-31,5.0
1778,customer_review-R2G2DL0065CVKW,VIVEK,Good product,satisfied,2019-07-01,5.0
1779,customer_review-RITQSR2GJTSS6,Sanjeev Rouhan,Sound is not good,sound good bass,2019-10-08,1.0
1780,customer_review-RBGUE4J34KBGZ,Amazon Customer,Nice,good product price,2019-05-12,4.0
1781,customer_review-R2W3DF3PKRWSD0,Amazon Customer,Best portable speaker in this price range,sound quality superb battery life also good delivery expected date good condition,2018-11-13,5.0
1782,customer_review-R2WPY9BB1YH1YK,Madhav,How I can change it,speaker charging jack damaged,2018-08-29,1.0
1783,customer_review-RRJM1KGHMD9BO,Amazon Customer,Good one,good sound quality,2019-08-14,5.0
1784,customer_review-R290HD7FMUHRHC,Aditya Choudhary,Really Awesome product,awesome product price range bass far far better jbl go,2019-04-08,5.0
1785,customer_review-R1HLAE6HH1E5A3,Anindya C.,It is good... Really good,nice lookingsound loud clear got wanted,2019-08-21,5.0
1786,customer_review-R1URXVZFD88AE6,Deepak Sharma,Good quality,super quality soundand perfect connectivity bluetooth,2019-11-21,5.0
1787,customer_review-R3S58M27VWCKRN,Muthuvel,Great product,good quality music battery 8 hours battery life,2019-08-24,5.0
1788,customer_review-R1DMASAYA30U4U,Amazon Customer,Good product,overall product audio built quality good worth buying,2019-08-07,4.0
1789,customer_review-R2GTTA7C7D9CCU,Gagan Yadav,Sound and bass,good product,2019-03-25,5.0
1790,customer_review-R3BP499UZ99LU0,saubhik sarkar,No. 1 blutooth speaker under 2K,great build equally great sound better blutooth connectivity boat,2019-07-30,4.0
1791,customer_review-RZJPAC756LHNL,Ramakrishnan,Super product,sound quality,2019-11-09,5.0
1792,customer_review-R1FUKBR4KLEDZ,Rohit,Poor battery,battery backup good,2019-10-06,4.0
1793,customer_review-REQNXUPZEO5LV,Anii,Very much satisfactory....,good productno regrets,2019-04-15,5.0
1794,customer_review-RJ6FKQNCTX66O,BHANU SHARMA,Best In This Price,awesome sound awesome quality awesome product,2019-01-21,5.0
1795,customer_review-R1YGN55WEBNG06,Sumit S.,Awesome product..!!!,powerful clean sound good battery fm added advantage,2018-11-03,5.0
1796,customer_review-R263KHYOSVBPA6,Sanjay Kumar dutta,Too much,love product,2019-06-21,5.0
1797,customer_review-ROSL4JV7CFSVM,Bhupesh,Grt sound,ultimate quality super sound quality,2019-08-31,5.0
1798,customer_review-R2HY3X1UFVNALV,Poonam p.,5 star,best ever speaker seen dont buy breezejbl goposhetc buy,2019-01-04,5.0
1799,customer_review-R6SJEZ8KY4PJE,Subhadipta,Sound is of High qulity,sound excellent pairing good volume good working good product,2019-02-28,5.0
1800,customer_review-RSGN7OGTE519Y,Raju Bhupati,Good product,nice product easy use sound quality good price,2019-08-01,4.0
1801,customer_review-R2X83EAS1AHCA9,shashikant42u,Sound is very loud but sounds quality not so good as I aspected. no digital Dolby,sound loud sounds quality good aspect,2019-07-06,4.0
1802,customer_review-R2BPB43ZMR35AL,Kindle Customer,Nice,nice,2019-08-03,4.0
1803,customer_review-R1W6KPZP26KI8Z,Chirag,Value for money...!!!,top product small party room good sound qualoty super bass,2018-12-25,5.0
1804,customer_review-R12N791TMYNX9Q,Raj shaw,asome product in this price👍👍👍👍🤘🤘🤘👌👌,fantastic mindblowing product cheap best,2019-06-06,5.0
1805,customer_review-REDU7TR3P5OSZ,SANDEEP BANSWAL,Boom Boom,voice clear good bass loud sound fm good battery backup upto mark,2019-05-23,5.0
1806,customer_review-R2EYXGP4YT6TOE,Rajendra Taksali,Drum Beats,may like incorporate led display remote control make perfect companion,2018-12-24,3.0
1807,customer_review-R2Q1XS9ZQ29NTF,Deepanshu,Good sound ...,good sound drum,2019-02-09,5.0
1808,customer_review-RCXS67Z7IQ0E2,nadeem saifi,Portronics is amazing,best speaker,2019-09-10,5.0
1809,customer_review-R1UWE1JCWWKPXR,Sundar S A,Best & Beast of sound,sounds like speaker used public meetings excellent,2019-07-09,5.0
1810,customer_review-R20XUPO1XCF0HZ,Farha,Super product,super fast delivery product worth cost really great product,2018-12-08,5.0
1811,customer_review-R2YP9OW6PZ6F6U,chandan mishra,Good,good product,2019-10-18,5.0
1812,customer_review-R1BUDB7RO5X0JG,Lavesh jadhav,Buy this product,good sound quality,2019-10-11,5.0
1813,customer_review-R102DG5JDB47UM,Tushar J.,very nice,still going sturdy,2019-09-05,5.0
1814,customer_review-R3BEEWWRUAM2O3,CHANDRA KANT CHANDRA,Review of sound drum,like much good sound quality,2018-10-17,5.0
1815,customer_review-R2PO7QG6UJWJJ0,Amazon Customer,Overall good product,vocals clear good battery backup nice product,2019-06-24,4.0
1816,customer_review-RB4V1GV1O9Y9M,Arpit,Superb speaker.. Worth to buy it,working fantastic,2019-06-17,5.0
1817,customer_review-R26ML7IBX6ABW2,Subodha Patra,Outstanding,seems durable sound outstanding great product,2018-09-28,5.0
1818,customer_review-R39L31ZOTCLLGA,Harshit,Satisfactory,good quality speakers best,2019-06-29,4.0
1819,customer_review-R35G92471MSP6Q,Jyothish Kumar. A.S,Suuuuuper Speaker,awesome sound quality fm battery backup good totally item super quality,2019-01-27,5.0
1820,customer_review-R1VO67ZV5NL841,HEMANTA MIDYA,Mind Blowing product.,sound quality good bluetooth connectivity good protability perfect,2019-10-08,5.0
1821,customer_review-R1JNVNB902RULG,vicky anand,Good one,1750rs r worth ur money battery backup awesome 5080 volume,2019-08-22,5.0
1822,customer_review-R3BL13CNEGQ3ST,Ganesh,Good bass,sound quality good,2019-08-24,5.0
1823,customer_review-R3IUX6WD1G8SK3,Amazon Customer,Value for money product,gifted brother loved muchthis product totally value money,2018-11-12,4.0
1824,customer_review-R3A8O5ZS9WJVHN,akashdeep vimal,Good speaker,good,2018-11-10,4.0
1825,customer_review-RH2BT0LDPDKQ3,Anupam Thakur,"Very nice products, built quality is excellent👍",sound drum really drum sound,2019-08-27,5.0
1826,customer_review-R30NH77W9RWCZ9,ranjeet kumar,If your need loud sounds that is not for loud.It is only sufficient for a room or pack place.,good product according price 1850,2019-09-01,4.0
1827,customer_review-RN998WH7O9X8A,Sanveer k.,Durability,everything good except durability charging port micro usb charging perfectly,2019-02-06,4.0
1828,customer_review-R1TL03497EOPRC,Santosh,Amazing,amazing product portronics nice happy quality product price thanks,2019-02-26,5.0
1829,customer_review-R2JSDE5OWZGXR2,Somu,Perfect winner under 2k,bang buck price range,2019-08-01,5.0
1830,customer_review-R3KQJWVZXY7GRF,RAVI,Bluetooth connection is not instant,bluetooth connectivity instant,2019-07-30,4.0
1831,customer_review-R3A7Q2UPBW1DYL,Biswa B.,Best bass speaker,best bass speaker,2019-08-12,5.0
1832,customer_review-R2E65BJV65HNCX,Deepender Kaushik,Awesome item,best quality sound user friendly device price range quite good,2019-04-22,5.0
1833,customer_review-R2EK3BO11B8N23,Amazon Customer,Very good product,im totally impressed product nothing dislike,2019-09-09,5.0
1834,customer_review-R45EP2ZKUBES9,Amazon Customer,Best speaker nice product portronics pro 871,best sounds good battery life,2019-01-25,5.0
1835,customer_review-R37F1LADL95JUR,sumedh,About radio stations,sound ossm radio stations play,2019-09-02,3.0
1836,customer_review-R237CJM9JUF98R,Pradeep,Fantastic,top notch producttotally satisfied performance aspects,2019-09-17,5.0
1837,customer_review-R2WDV7RI9C37PD,Kurian varghese,Very good,good product,2018-11-06,5.0
1838,customer_review-R3H5GJ2PLT1481,ASHU,Good decent travel companion...,loud sound less bass protronics,2018-10-28,4.0
1839,customer_review-R284MI2852L0S1,Dip Narayan Kar DK,Good product in this Price. But FM don't work,good product price,2018-08-17,3.0
1840,customer_review-R3S3TKNIQVJVEF,Amazon Customer,Super sound,dont think buy amazing speaker powerful sound,2019-01-09,5.0
1841,customer_review-R1OFMO0KOMCBLP,sachin rathod,Good product,best built quality well sound price must buy speaker,2019-07-29,5.0
1842,customer_review-R296GMYS7WNUZI,sobish,Nice,nice,2019-11-04,5.0
1843,customer_review-RVCCGHHK3KJ9A,Jagath,Very nice,happy,2019-06-05,4.0
1844,customer_review-R1YKYPKI1LHG28,thaseesh,Portable,portable high sound output,2019-10-18,4.0
1845,customer_review-RQOVK3GHRIL6I,Sujeet,Chhota packet bada dhamaka,awesome bass like bomb,2018-11-18,5.0
1846,customer_review-R34K73ZE6DTPQC,Amazon Customer,Worth the money spent,charging port could fast charging port like type c,2019-07-07,4.0
1847,customer_review-RAXQHL9J7QUBP,Tsewang Norbu,It's has a perfect sound quality for your outdoor picnics and house party.,excellent product description actual love sound built quality,2018-07-24,5.0
1848,customer_review-R2TJ950NZRS1U0,Shyam s.,Superb!!!!,aux cablebut mentioned boxits awesome bluetooth speakers 2000,2019-02-24,4.0
1849,customer_review-ROYYMCAP2KCPU,Shajan johny,Sooooper,fantastic product go,2018-09-17,5.0
1850,customer_review-RZE7T2TUBJPLN,Amazon Customer,Top notch Bluetooth speaker,best range good audio ouptut awsome bass gifted parents happy,2018-11-09,5.0
1851,customer_review-R2GPF2K78OPLZJ,virendra raut,Good product,nice product highly satisfied,2019-10-27,5.0
1852,customer_review-RHFUCFGWQFGC4,6thdevil,Great product,wonderful buy product sound lovers,2018-11-20,5.0
1853,customer_review-R2KFQSW3RTIU4P,SANJIB,Mobile sound booster,complete personal music system one good mobile,2019-06-24,5.0
1854,customer_review-R3M5GOIGR9HSQA,Dhavan,Very good,good,2019-04-02,4.0
