,customer_id,customer_name,review_head,review_body,review_date,ratings
1281,customer_review-R3LRZ5R8KRQKAF,Vino,Brilliant,really appreciate amazon product nicely wrappedover product outstanding pls go without hesitation,2014-05-13,5.0
1282,customer_review-RRW0LCLS51073,Gautam Mani,Five Stars,love,2015-09-04,5.0
1283,customer_review-R1O3L6DIQZLJWB,Kiran Kumar B K,Five Stars,perfect advertised,2017-02-21,5.0
1284,customer_review-R2U083W0RON14W,Amazon Customer,Five Stars,worth money prices reduced brands,2016-01-09,5.0
1286,customer_review-R1MJPC00CWGNGB,SWARNADEEP BISWAS,Four Stars,working nice,2016-09-12,4.0
1287,customer_review-R1CLJKKC88527J,RAHUL R,One Star,poor delivery service disappointed,2015-05-27,1.0
1288,customer_review-RM7RI2CDZMU26,debayan,Five Stars,vary good,2017-02-26,5.0
1289,customer_review-R2K1I3KY47QB98,Rajeev Patel,Four Stars,good product,2016-03-17,4.0
1290,customer_review-R2H9IBJVOUV4NB,bijay,Five Stars,good productdata transfer speed avg 1718kbpslooks gr8 works f999 transcendworth buying,2015-12-19,5.0
1291,customer_review-RNCMA4ZYU3AK7,Amazon Customer,Satisfied and worth the money .,working fine,2016-09-28,5.0
1292,customer_review-R1H11MW68EEFRX,Saurabh Kale,Works fantastic...,gives upto 130mbps sumtyms works perfectly using 6 months nw go,2015-12-17,5.0
1293,customer_review-R2PHHX01794NM5,Vineet Tiwari,Good solid body,good solid body faced heating problem populating 1 tb data never faced hdds amazon service good,2015-03-15,3.0
1294,customer_review-R2DPSPO8HU2U14,Vipin Arora,Five Stars,sold,2016-03-24,5.0
1296,customer_review-R29BHTTQOURRXS,Vivek Gautam,Fully satisfied,nice product transcend,2016-03-14,5.0
1297,customer_review-R124B8YI5P9PTR,Ritabrata Das,Bad product,defective product dont buy stored many data erased,2015-04-22,1.0
1298,customer_review-R1TY23HKHDZL9O,Amazon Customer,Awesome...Transcend Product.,three layersqualitylow costeasy handlingfast data transfer everyone buy transcend harddisk,2015-11-23,5.0
1299,customer_review-R1RGRW8RWL111R,Sumeeth,Four Stars,nice product,2015-01-22,4.0
1300,customer_review-RB1W6AIU3CQ3W,Gowtham Balu,Five Stars,beautiful looklove outer rubber cover good transfer speed less wightsupreb one,2016-06-19,5.0
1301,customer_review-RQGCRO7P5ETD4,Anu,Good,good,2015-10-16,5.0
1302,customer_review-R260HWKQS2JHOM,Happy customer,Five Stars,great product got great price delivery per schedule,2014-11-10,5.0
1303,customer_review-RIVK2K8WDVKLE,Amazon Customer,Awesome,best hard drive sagment superb build quality high speed transfer perfect photographer tech geek,2016-01-27,5.0
1304,customer_review-R229TSG63MET6K,Divanshu,good portable hard disk and the price is reasonable and ...,good portable hard disk price reasonable good thing plug play overall satisfied product,2015-12-23,4.0
1305,customer_review-R37KBFCSK4AUJ0,Prithvi,Its good could be better.,good working nicely quality plastic near around button provided upto mark makes breaking sound tapped,2015-02-11,4.0
1306,customer_review-RCCDH68N6P07D,Jeet,Nice portable HDD,hardisk awesome performance great,2016-04-17,3.0
1307,customer_review-R3QC5XUUBB6EHA,Indian Optics Pvt. Ltd,Five Stars,amazing best hard disk ever used,2016-03-07,5.0
1308,customer_review-R2HM8QLKC54R11,Neha,Loved it.,superb pricing loved,2015-09-26,5.0
1309,customer_review-R32LHODVVDSHPH,Abhivrat,Good one,good one military grade protection,2015-05-23,4.0
1310,customer_review-R3SNKUZJ6DADYN,Bhavesh patel,Five Stars,excellent product useful age,2014-11-25,5.0
1311,customer_review-R16SEBJNCR2QDU,Amazon Customer,Five Stars,good product super fast delivery within 20 hrs,2015-11-12,5.0
1312,customer_review-R2EZHD7LIMNQV5,hemant sharma,Five Stars,nice hard drive good price,2015-11-18,5.0
1313,customer_review-R2NNUEF232VNI1,Amazon Customer,Five Stars,awesome product received expected date,2016-09-25,5.0
1314,customer_review-R16GIEQV0NLUBD,Abhishek,"Good product,",good product,2016-02-25,4.0
1315,customer_review-R3B1MZN7TZ1OR1,rohit kumar singh,Four Stars,works great feel sturdy,2016-01-04,4.0
1316,customer_review-RBRGETEULUDRS,Pema Namgyal,I m happy with it,giving problem happy,2017-12-12,5.0
1317,customer_review-R1NQQKK6SXE71L,Rames,Five Stars,good one,2015-02-04,5.0
1318,customer_review-R3BABSA0S9ZE7H,Ravi M.A.,Five Stars,met expectations,2015-09-18,5.0
1319,customer_review-R10VKIF1U3UCMB,Amazon Customer,Four Stars,gud product,2017-07-02,4.0
1320,customer_review-R2BBKVJZ7XD25U,Akash,Awesome: -) Good product at decent price,awesome good product decent price handy 30 usb speed data transfer really great,2015-10-06,5.0
1321,customer_review-RRVVVD4QDDSKM,Dr.Debasish Sahoo,Five Stars,excellent product found better words describe,2016-07-14,5.0
1322,customer_review-RIBIFQOTEHHH5,ramsingh,Five Stars,nice,2018-02-11,5.0
1323,customer_review-RQ6A7IZL0ZY7F,Arabinda,Product Really good.,product really good recommend others,2016-03-18,5.0
1324,customer_review-R25RF8TVGOXP7P,Sanjay Madhavan,Four Stars,quick dispatch buy,2015-12-15,4.0
1325,customer_review-R2JF8TI1ENX8Y7,Amazon Customer,"Good, and was on time delivered",good time delivered,2017-07-26,5.0
1326,customer_review-RFZGGKVJ39V4N,Navneet,Five Stars,good product transcend,2015-12-18,5.0
1327,customer_review-R1BSS6YH1QDE4O,sunil kumar sahoo,Five Stars,excellent product reasonable price,2015-11-04,5.0
1328,customer_review-R13SIA0N2LXWYN,sstabrej,Five Stars,go itu wont regreat,2015-05-12,5.0
1329,customer_review-R1RCJH6BI0O1GT,yatin,Five Stars,good product,2017-01-27,5.0
1330,customer_review-RR0SV0KUXFEUL,Ashok Gupta,"Very Good, Useful product",gooduseful product,2015-04-08,5.0
1331,customer_review-R368CL4QE2RJG1,Bibek,"After a week of use, it just stoped working ...",week use stoped working laptop reads memory shown data lost dont know please help,2014-07-30,2.0
1332,customer_review-R32Q2WSQFC11EF,NAME_NOT_RETURNED,Worst,worst,2018-10-30,1.0
1333,customer_review-R20MSVJNCIBM3X,Isaac Lng,Five Stars,love product thank swift delivery,2014-11-12,5.0
1334,customer_review-RTB70AOXIT4WX,Sudhir,Five Stars,veryyyyyyyy nice product,2017-12-10,5.0
1335,customer_review-R2W8RK6D2BH0W9,Umang Ramaiya,5 stars.,satisfied purchase good design build quality speed delivered 2 days early,2016-09-13,5.0
1336,customer_review-R257AKA90D5MNW,vina,Nice,good product works expected,2016-06-28,5.0
1337,customer_review-R1C40NK972DEAL,J Vich,Go for it.,good product,2016-09-22,4.0
1339,customer_review-RJ1NF098IZUOA,THOMAS VARGHESE,Five Stars,good deal worth money amazons delivery exceeds expectations,2014-11-20,5.0
1340,customer_review-R3BVM6P7S73CEW,Dileep,Five Stars,good product,2016-03-05,5.0
1341,customer_review-R1DYIQNUATZBPM,Amazon Customer,Good product with USB 3.0 compatible.,2nd hard disk first one still works 3 years good one handy,2015-11-11,4.0
1342,customer_review-R278LS7TSRTF4N,sukhveer,Rest of things look fine.,doesnt support single file transfer 1gb rest things look fine,2014-10-17,3.0
1343,customer_review-RY1PTC7GFCEXV,pavan,Five Stars,nice product,2016-10-18,5.0
1344,customer_review-R2AR1YXOLJXLJ6,cibi,Good product.,prompt delivery good product,2015-10-23,5.0
1345,customer_review-RCOR7Q0I38FQW,Amazon Customer,Four Stars,good value money good transfer speed suggest go,2016-04-22,4.0
1346,customer_review-R3RK9AFG081NMJ,K.SAMPATHKUMAR,Five Stars,excellent item,2017-10-09,5.0
1347,customer_review-R3RFRDHK28G3AZ,Amazon Customer,Five Stars,good product,2017-10-16,5.0
1348,customer_review-R27GZL8XDUJ175,Subhro,Four Stars,good product,2016-01-06,4.0
1349,customer_review-RIFDZZH71AWTU,Kalirajan.N,Four Stars,good one liked shock proof rubber cover,2015-09-08,4.0
1350,customer_review-R2SM6O5RWLGD6W,Harshad Patil,Happy with the product,hdd delivered time usb data cable robust happy product,2015-08-24,4.0
1351,customer_review-RJEHB9B0QNCF3,Amazon Customer,Good deal with less price.. Super customer service by Amazon,good looking low cost device protective cover delivered within 2 working days,2016-01-10,4.0
1352,customer_review-REDPHE2WX3P6W,Amazon Customer,Five Stars,product good reached excellent condition 3 years warranty,2015-12-11,5.0
1353,customer_review-R3FLNBVEC3N0WT,Jitesh Mahajan,Excellent look,speed good usb 20 look excellent,2015-11-18,4.0
1354,customer_review-R3PYHTMCKYL0BK,karishma pursnani,works absolutely fine!,months works absolutely fine,2016-07-30,5.0
1355,customer_review-R85G16R9YI0LU,Rushikesh Kokate,Five Stars,quality product transcend,2016-06-06,5.0
1356,customer_review-R1PH2MYT7IFS0R,satish,Four Stars,good product,2015-12-07,4.0
1357,customer_review-R1BI6XW1NMDBMD,Nishanth Raja,Five Stars,super,2018-02-08,5.0
1358,customer_review-RJ909388ZDW7X,nwinfra.ram,Very rigid and sturdy design. Select this if you need a hard ...,used past 3 months rigid sturdy design select need hard design,2015-06-08,4.0
1359,customer_review-R3LQUGAW194MN8,Bishwajit Saikia,Five Stars,best producttransfer rate fast waysbetter last buffalo hdd,2015-04-29,5.0
1360,customer_review-R280PH6R5WTSDG,Manish patel,Poor quality items,buy anyone maha bakwash products diya hai amazon ne 2 months 3 bar kharab ho chuka hai,2016-10-30,1.0
1361,customer_review-R28643IC6FJXFM,Raj,Excellete product,excellent product happy ontime delivery,2014-09-30,5.0
1362,customer_review-R4Q6XTAQ1T58B,Praveen,Five Stars,excellent product,2015-09-26,5.0
1363,customer_review-R1BATZEV6YC20F,Manju KN,Very good product,absolutely awsome product amazing speed best deal got delivered 24hrs thanks amazon,2015-12-08,5.0
1364,customer_review-R8ZP3NV72N30Y,Deepak,Good quality product meets the requirement the best part it ...,good quality product meets requirement best part inbuilt software back n faster transfer rate,2015-10-23,4.0
1365,customer_review-R3FNFV94C99W5W,p k prabhakar,Actual memory is less,luke,2018-10-08,2.0
1366,customer_review-R1WT3WYJYECFOH,Amazon Customer,Four Stars,nice product easy data use bt data transfer speed good enough bt overall good product,2015-12-12,4.0
1367,customer_review-R3I5DKTDMEUO4P,Kanu,Very Happy...!!!!,great product nice deal,2017-02-03,5.0
1368,customer_review-RN7XFWNZCB6YO,Abhilash,Liked it,always satisfied transcend products one also good sturdy compact,2015-03-23,4.0
1369,customer_review-R30L8B12AP2RGB,Teni,Sturdy product,easy carry,2015-10-30,5.0
1370,customer_review-R3GQGD7BQ64HOB,Bhaskar M.,Fast and reliable.,fast reliable,2016-08-12,5.0
1371,customer_review-R3DNUN9L7N815U,Giri,Four Stars,good yet use completely,2016-04-07,4.0
1372,customer_review-R2I7SSAWSI7U1F,kannabiran R,Four Stars,gooooooood features nice style safe use thanks amazon amazing price products,2015-08-16,4.0
1373,customer_review-R3NWRWQPNHORLX,varun thammaiah,Five Stars,worth price,2017-11-25,5.0
1374,customer_review-RVCN3AAX64ZKW,Shayne,Worth a buy for a good price.,handy hard disk lightweight,2016-10-03,5.0
1375,customer_review-RK6M6GRPAVPFT,Amazon Customer,Two Stars,faulty piece received return,2017-08-02,2.0
1376,customer_review-RYP2QAE31FYTU,AMAR JEET SINGH,Four Stars,nice product easy use,2016-09-28,4.0
1377,customer_review-RBSAT0GLP4FP3,Amazon Customer,Three Stars,okay,2016-03-10,3.0
1378,customer_review-R3HVGG73E3RIHY,Sameer Desai,Five Stars,thanks amazon perfect choice,2015-10-13,5.0
1379,customer_review-R37DDB7ZXWHKYK,Munish Chaudhary,"Compact, rigid and Shockproof",gud product worthy nice rubbery shockproof body sturdy design quick delivery simply loved,2015-06-15,5.0
1380,customer_review-R3JNBQBI13GOBR,Rohit,TRANSCEND,hard disk goodgood rubber finishwell packed available space 931gb overall good purchase,2015-12-30,5.0
1381,customer_review-R1UO1COSEVSWQ7,Sudip J.,Not small but a medium size hard drive,thought would look small,2015-10-16,4.0
1382,customer_review-R1E7OVPMGAL2WH,ND,4 Stars,looks good speed average durability time tell note purchased friends feedback,2016-01-14,4.0
1383,customer_review-R23XRW94JVQ03R,subham goswami,fine product and it body is very sticky for that ...,fine product body sticky doesnt sleep surface everyone buy,2015-04-28,5.0
1384,customer_review-R6C6EF80OF4FZ,Anil J Jangid,Nice,worth moneynice product,2015-11-29,4.0
1385,customer_review-R34XOO53DFTO8F,Abhishek C.,Five Stars,works fine timely delivery,2016-01-02,5.0
1386,customer_review-R3TBMICSINHCAT,Gaurav Yadav,Good Device but Slow data movements,used device backing mac quite well 9 hours assuming takes time first time overall quality quite good prompt delivery,2014-04-28,4.0
1387,customer_review-R1BGZ4GO2OZR6T,Sree Ram,Good with Budget,bought 3780rs till working fine bought 1yr,2017-04-27,5.0
1388,customer_review-R3MJBK3ZOON39E,youmash,Four Stars,nice onedelivered earlier n workin well present,2016-04-05,4.0
1389,customer_review-R3BEV4N417LH54,Anil Tambe,I am Happy with the purchase,real quality item useful work lots data wish keep pc harddrive free collection data program soft wares,2014-06-20,5.0
1390,customer_review-R3MRDKD89QAR7E,AMJ,Four Stars,good product,2016-02-08,4.0
1391,customer_review-ROQ0GS2ST7543,Abhijeet Nagawade,Perfect for external storage/backup,rugged build quality good read right speed,2014-11-14,5.0
1392,customer_review-R3N72ALAUCTUHD,K.SENTHILKUMAR,Five Stars,useful product store datas,2017-10-10,5.0
1393,customer_review-R362ZJL5Z2Y9E0,Saravanan G,Eject also worked fine. speed is little less than what I was ...,recognised vista smoothly eject also worked fine speed little less expecting,2015-01-05,4.0
1394,customer_review-RQFDNPA4N4N2W,Nakul S.,The Hard is not detected by PC. I have ...,hard detected pc tried different cable also detected,2015-08-07,1.0
1395,customer_review-R37FSQ7EGEHD9Y,Ramesh V S,Fantastic.,got day ordered fantastic,2015-12-29,5.0
1396,customer_review-R31ZSGTM1FROVL,sanjay kumar,Four Stars,beat durable long lasting transcend good,2017-09-13,4.0
1397,customer_review-RF1HHIRDYJWJQ,Amazon Cjustomer jaya jayswal,Five Stars,excellent,2016-05-11,5.0
1398,customer_review-R3Q64YLZXN9MU5,Amazon Customer,Four Stars,good one,2018-04-02,4.0
1399,customer_review-R22FMZ17JVEODE,Namrat kumar patnaik,Five Stars,simply fantasticgo,2017-02-03,5.0
1400,customer_review-R3BRZ2TB0FC1PQ,Amazon Customer,Four Stars,nice product recommended tonbuy,2016-01-12,4.0
1401,customer_review-R3IZRD1VW521NR,Jatin Kumar,Five Stars,amazing product good price,2016-02-08,5.0
1402,customer_review-RLY3O1TE7AIU2,Amazon Customer,Not worth for this price,price high product better buy manufacturers,2016-03-17,2.0
1403,customer_review-R1J4GFSS02Y3BN,Ajit Singh,Five Stars,good product,2014-11-16,5.0
1404,customer_review-R1HOVNDBKK55YT,Rvind Kavuru,Connector is loose,connector loose sheer waste money,2016-04-10,1.0
1405,customer_review-R1R0TJZH9EJNAO,swaraj s,Good Product to buy,excellent product really met expectations gud product buy gud storage amount worth buying,2015-11-19,5.0
1406,customer_review-RY9P4V85FF8K2,GURU,High speed and durability,ultra speed better seagate 90mbs,2017-12-27,5.0
1407,customer_review-R20JGCNX5J1YVV,Dr. Archan Chatterjee,satisfied with service,time delivery far working fine satisfied,2015-05-29,4.0
1408,customer_review-R330FWX12H037Y,Ranu R.,Five Stars,good storage n rugged,2016-07-23,5.0
1409,customer_review-R1NJQWEVOKTY3W,Balasubramanian S.,Five Stars,good satisfied product,2017-08-14,5.0
1410,customer_review-R4H8X6V0VCRNL,Arpit Khunteta,Five Stars,awesome delivery process amazon hard drive worth price good build quality good transfer speed,2015-09-09,5.0
1411,customer_review-R2U207HXK90J8A,BALA MURUGAN T M,Five Stars,good,2015-08-09,5.0
1412,customer_review-R13I30O14NCP4T,Sutanu Ghosh,Five Stars,good drive,2015-11-29,5.0
1413,customer_review-R23U2AJDDM7N70,praveen k v,Four Stars,good product,2016-03-22,4.0
1414,customer_review-RIP8P6MOQ58SK,Nilesh,Five Stars,meet expectation arrived time light weight still durable,2015-11-04,5.0
1415,customer_review-R3J4X88MEUEAGA,rohit kumar,One Star,worst product dont working properly data transfer speed 1byte kb transferring multiple file together,2015-12-17,1.0
1416,customer_review-R3VDYNKRIJMCSO,ASingh,Five Stars,good one,2015-09-22,5.0
1417,customer_review-R3K750V15AESMO,SACHEEN NAIK,Cost effective,great product,2017-08-13,5.0
1418,customer_review-R2EAMUNGSGTBHX,Madhu,works good.. has not failed so far.,works good failed far,2016-06-12,4.0
1419,customer_review-R2FKV3QPWUFE48,Sanjay Kumar M. Nayak,One Star,problem driver installations device recognized error comming,2014-11-30,1.0
1420,customer_review-R1410JUQF9ZF0D,Murali,Five Stars,wonderful piece fulfilled storage needs,2016-01-01,5.0
1421,customer_review-R2G9TCUSXH291N,Neeraj,Three Stars,product working fine till bulky,2015-05-21,3.0
1422,customer_review-R2O3QJ92FS3LDW,Sahil Kshetrapal,Good value for money,great value money excellent matt finish well delivered amazon,2016-01-21,5.0
1423,customer_review-R2C9L432F5Q12K,Amazon Customer,Four Stars,good,2017-07-21,4.0
1424,customer_review-R1I5SDT7FI8QI9,Nithin,Three Stars,good,2015-05-17,3.0
1425,customer_review-RWYUT21CRMNET,Amazon Customer,Five Stars,great,2017-04-13,5.0
1426,customer_review-R2A540EDMV1VUH,Amazon Customer,Four Stars,good product price,2016-08-20,4.0
1427,customer_review-R1JW7SPQ4FP4QI,Raghurama Hegde,Four Stars,good,2017-01-02,4.0
1428,customer_review-R25LKE5QA2ETR8,rohitashwa bhadani,it worked for sometime and after that... ...,worked sometime came know defect wire sometimes works sometimes doesnt,2015-01-22,1.0
1429,customer_review-R3UOYEB2YV3FMB,Ataullah,very good,good product price,2015-12-31,4.0
1430,customer_review-R2VUOFQB32EJB8,devershi,Four Stars,nice one,2018-01-06,4.0
1431,customer_review-R3CQUZ0EQAHOXE,sudip,Four Stars,good product,2015-04-19,4.0
1432,customer_review-R9TXFSEIEWR0R,kishor,High speed,nice high speed copy files folders etc product,2015-11-29,5.0
1433,customer_review-R34L2H3NQ6GVZX,sadhish,cute n Nice..,sleekcute n nice,2018-02-10,4.0
1434,customer_review-RO1KHZCE7O74K,Amazon Customer,Transcend Storejet !TB Portable,good product,2017-10-08,5.0
1435,customer_review-ROX0PIJUPC62T,SHISIR KUMAR PRADHAN,Transcend Store Jet 25M3 2.5-inch 1TB with USB,bought transcend store jet 25m3 25inch 1tb usb 30 cable good transfer speed 814 mbps,2015-06-01,3.0
1436,customer_review-R1353NRQZWYUV8,Amazon Customer,Five Stars,excellent hard coating cover speed data transfers great,2015-10-24,5.0
1437,customer_review-R1PZ1J26244LR8,Gajendra Metawala,Excellent product at good price and excellent service.,excellent product delivered well time thanks,2016-01-30,5.0
1438,customer_review-R1DVFC1PQ876D7,Chetan Jajoria,Five Stars,good buy,2015-11-20,5.0
1439,customer_review-R3ARI0RL0UVD3F,Prem,Five Stars,great product transcend product shown website great delivery amazonin,2015-08-24,5.0
1440,customer_review-RTI0FDILR9QO,Abdul Rehman,Four Stars,nice product cost,2016-12-12,4.0
1441,customer_review-R1K52MORRXUKM1,Palash Dahale,The delivery and product quality is all good. Everything works fine,delivery product quality good everything works fine speed good claimed tested 20 30,2015-04-21,4.0
1442,customer_review-R2LFVKSDXDPRI0,Imran Ali,Four Stars,product really good iam satisfied product worth money u spend,2015-09-19,4.0
1443,customer_review-R2R9JQG6JGOH1O,Earnest,"Good product military grade ,drop protection",product amazing courier good toothe product arrived designated date thumbs,2015-05-17,3.0
1444,customer_review-RTUIX9SBVBD9W,Anish kumar C K,Four Stars,good,2015-11-18,4.0
1445,customer_review-R4AN4STL1TMSE,Rony,Five Stars,amazing product,2017-02-26,5.0
1446,customer_review-RSO5OQPIEE7LG,Santibrata Chatterjee,Four Stars,truly worth,2015-10-28,4.0
1447,customer_review-R2W62PEA9V3T2Z,Amazon Customer,Five Stars,per expect overall good,2016-02-06,5.0
1448,customer_review-R2XIY0A8H411PP,ABDUL RAHEEM,Quality of the product is very good. very Happy with the product,received product expected quality product goodvery happy productthanks amazon,2015-09-08,4.0
1449,customer_review-R1MH0T0GSLJF6K,Debasish Das,Transcend is always good,good one,2017-10-25,4.0
1450,customer_review-RHJFL0P9TDR1R,Anand,Four Stars,really good,2015-10-19,4.0
1451,customer_review-RIL3EJYO6NIM0,Amazon Customer,Four Stars,good value money thing didnt like look,2016-10-14,4.0
1452,customer_review-R2WYCXTQU15V4Z,Anonymous213,Five Stars,good product prompt delivery,2017-11-05,5.0
1453,customer_review-RKOESMOCM880J,ritzz,Five Stars,excellent per specs sturdy,2016-02-03,5.0
1454,customer_review-RGP3MO6ZACFDZ,yusuf,Five Stars,good prodect,2016-01-23,5.0
1455,customer_review-RGQ4ESUXAJ3D7,SATYAM,Five Stars,good productfast shippingthanks,2016-01-20,5.0
1456,customer_review-RAUE2CXQZNZ38,S Tamil,Five Stars,good product,2016-12-22,5.0
1457,customer_review-R3BBE5PHB9VX4W,Amazon Customer,Good to use.,good use,2016-10-29,4.0
1458,customer_review-RUBO8BV9SKYDY,Indian,This is absolutely fantastic.,fast rug using hard disk past 3 years absolutely fantastic,2015-03-18,4.0
1459,customer_review-ROLK8EHYQIZYQ,Kamal K.,Good product.,using 2 years since bought problem till,2017-01-12,3.0
1460,customer_review-R3KUAMTQAH3KIO,seshadri,Four Stars,good,2017-03-22,4.0
1461,customer_review-R2MH0BTQM09U7D,Arka Bhattacharjee,Best in class of Design & Quality.,really met expectations starting designperformance quality would also complement amazon excellent price service offered,2014-08-11,4.0
1462,customer_review-R15MYLEJFGR0O6,Makarandh Prasada,Stopped working in just 2 months after purchase even after ...,stopped working 2 months purchase even using carefully see customer service responds,2015-05-07,1.0
1463,customer_review-R2ND53XQV8QBN3,SURAJ,besttt,best 1tb hard drive marketdefinitely buy,2015-03-14,5.0
1464,customer_review-R2QPQVKMPSR5JL,Praveen,Four Stars,product really gud moreover amazon service really fast,2015-11-17,4.0
1465,customer_review-R1QQ405OUKPUPJ,Rajender kumar,Amazing data storage bank...,lovely data traveler,2016-04-01,5.0
1466,customer_review-RTB74B9UO4VOO,Amazon Customer,Five Stars,value money product,2016-03-24,5.0
1467,customer_review-RWDPH129PUOFV,Venkata Subramanian,Five Stars,excellent product sleek finish good performance,2014-12-08,5.0
1468,customer_review-RINXRBI61Q3I0,Amazon Customer,Five Stars,excellent piece problems using since last 1 year,2016-12-10,5.0
1469,customer_review-R2YAV3LZ78FO18,SOUNAV SIKDAR,Five Stars,helpful everuy time formatting use backup datas,2015-07-24,5.0
1470,customer_review-R4OOS8X16L6O1,Kuldeep S.,Fast speed & easy to use no need to install any software,value money fast speed easy use need install software,2016-06-29,5.0
1471,customer_review-R3QHTE8J5CAO9,Andy,Three Stars,product good takes little time get detected else speed looks meets expectations,2014-11-10,3.0
1472,customer_review-R2E6ABLK4C8GGF,Ankur Jain,Nice,loved price got 3800,2014-10-27,5.0
1473,customer_review-R3HR8DT94OWZXA,Amazon Customer,Five Stars,successful product trust,2016-05-25,5.0
1474,customer_review-RDOXKSS6C9VO3,Krishnadas G,Good product. No harm in purchasing it,item delivered time good product harm purchasing probably slower rate data transfer claim oem specifications,2014-08-02,4.0
1475,customer_review-R2RIWLV2WZ6X6,Amazon Customer,Five Stars,good product compare cost,2015-11-16,5.0
1476,customer_review-R13OAJ092JH4BZ,Nathan,Three Stars,good product faster delivery amazon,2015-10-04,3.0
1477,customer_review-R2SFP855Y17IHF,Alpha 100,Hdd is 5 star but i can not believe that ...,hdd 5 star believe one guy posted photo rather photo hdd,2015-12-15,5.0
1478,customer_review-R35COO86DRGZ0M,padmaj,Five Stars,good productworth buying,2015-10-16,5.0
1479,customer_review-R1U242MD48TX9,Amazon Customer,Good,bought 3year working fine,2017-03-02,4.0
1480,customer_review-R28LNVO4928N0X,Sankara Shanmuga Sudhakar Ramalingam,Value for money,good product personal use,2016-06-26,5.0
1481,customer_review-R3KM9K60L093CY,Avinash,still good.. got dropped once,1 month still good got dropped oncestill working,2015-11-25,4.0
1482,customer_review-R34O5NRGWKN3Q9,Amazon Customer,Everything fine. Could have given a better data cable,everything fine could given better data cable,2016-12-13,4.0
1483,customer_review-R17UPERBYDLMUO,Prasad,Four Stars,good,2016-07-15,4.0
1484,customer_review-RON1NY535NE5H,Amazon Customer,Five Stars,good product less price,2017-02-21,5.0
1485,customer_review-R365ZJT5G0FDC4,swati,Four Stars,loved product amazon service got next day order happy,2015-10-28,4.0
1486,customer_review-R1G9DP8Z9TJ3B2,Manjusha Savant,Four Stars,purchased backup photos far works well serves purpose,2016-01-29,4.0
1487,customer_review-R3T77QFUW0EA40,Ranjeet Singh,perfect,perfect im lookin little bit costly worth,2014-09-23,4.0
1488,customer_review-R2L6IHXB5S07RV,Amazon Customer,Five Stars,nice product,2018-01-07,5.0
1489,customer_review-R1ND4RMG2N03GU,Din't get,good product,good product fast transfer satisfied,2016-07-09,5.0
1490,customer_review-R1I6CY6CYHF0PI,Hariharan Krishnan,Five Stars,great product,2016-05-28,5.0
1491,customer_review-R5OS3TFT61THL,Rajesh K,great but at 3800,great buy 3800,2015-08-22,4.0
1492,customer_review-R3TWB90LZ1G0CV,Sethabish,Five Stars,excellent product go hesitation nice product transcend,2016-01-24,5.0
1493,customer_review-R2J9AMYFO14X37,Rohan,Bit slow in data transfer,nice handy slow data transfer,2016-03-26,3.0
1494,customer_review-R22Z38I9WB20QD,pranav shenoy,Nice .......No complaints,vry gud producti recomend buy closing ur eyesonly u r buying amazon,2015-12-06,5.0
1495,customer_review-R2SPF791CUM9S3,Prathamesh Muley,Five Stars,best product,2017-11-25,5.0
1496,customer_review-R1TH1MTNES4TBK,Anubhav Anand,Five Stars,good product great finish good writing speed,2015-12-27,5.0
1497,customer_review-R3HCXPUMSC4GTB,DInesh Dhamecha,Five Stars,good,2017-02-18,5.0
1498,customer_review-RW9AD47IZHOHM,Wonder789,Rs 4000 on amazon !,bought product rs 4000 yesterday amazon lol got good deal hope,2016-09-12,5.0
1499,customer_review-R37MTOHX0AGS4A,Dev,Excellent Product,awesome speed,2016-03-25,5.0
1500,customer_review-RXRWYQS4TUEEQ,Amazon Customer,Five Stars,excellent ontime delivery amazongood product warranty given activated minute login portal,2016-02-08,5.0
