,customer_id,customer_name,review_head,review_body,review_date,ratings
253,customer_review-R2E624DUSBLG3Z,ABDULMAJEED K.,MAJEED parannur.,like copy speed super using simple using oneplus 6t smart phone,2019-02-22,5.0
254,customer_review-RB60UHIMBTCI4,Chaithanya Gudivada,Great to use,wonderful product,2019-11-03,5.0
255,customer_review-RX7QQPOJAOB2A,Syed Nabeel,Decent,speeds fine stuttered sometimes,2019-08-31,4.0
256,customer_review-R2SPK3G29LOOV7,Mubarak,Excellent product,overall excellent product,2019-11-14,5.0
257,customer_review-R250TZ5HVYI2TH,R. K. Jha,Great Type C Dual Pen Drive,small efficient 32 gb dual otg flash drive must accessory type c otg mobiles,2019-09-21,5.0
258,customer_review-R2SPYEAN6X2E9Q,DNB,Good product! â‚¹â‚¹ðŸ‘,justifies cost good brand,2019-05-11,4.0
259,customer_review-R1KTGAV99SLHPI,SRINATH B T,Very Small,small compared image displayed nice product,2019-10-11,5.0
260,customer_review-R3CQYWN4XWTW22,Govind Godara,Brand,name says sandisk best storage devices good class,2019-11-03,5.0
261,customer_review-R17I59BEFN8HIY,Amazon Customer,Waste,waste product copying 100 mb taking 3 minutes slow copying please dont go check best available options,2019-09-03,1.0
262,customer_review-R2K3EHTT5L6NDO,Subhankar Bhadra,One of the best!,cant go wrong maintains constant speed built superbly great buy,2019-07-17,5.0
263,customer_review-R2RIYALUQS8A8C,Munish Jindal,Reliable and fast,nice pendrive super fast speed much utility reasonable price complaints,2019-07-14,5.0
264,customer_review-R1RSC3XMCU2KZV,23RitzP,useful,far good review weeks write speed lower side,2019-06-09,4.0
265,customer_review-R2FH4EBG2WH4LN,jimil jose,Good,easy carry slow file transfer,2019-10-02,4.0
266,customer_review-R2IJJDOT2GBMB8,AMAZON IS AT PRESENT NOT GOOD AS THEY ARE SUPPLYING DIFFERENT ITEM RATHER THAN THE ORDERED ONE.,Not bad.,slow speed,2019-08-12,3.0
267,customer_review-R1W84H3ER4BV8A,F.K. Lawyer,SanDisk Dual Drive Type-C 128GB Flash Drive,overall good,2019-11-20,5.0
268,customer_review-RAJJAPKBWNW3I,Ashutosh Sadana,Good pen drive,sometimes data transfer rate slowbut good product unless lose,2019-08-13,5.0
269,customer_review-R3C0PN5FIYJMY7,Kshitiz Sinha,Review,high speed transfer highly portable quality mark complains,2018-05-08,5.0
270,customer_review-R39KYSV7VC3CSF,Tolomkhomba Karam,Small and sexy,loved transfer media mobile upload social media easily without using convertor,2018-08-27,5.0
271,customer_review-R22LU9H78AJUBM,Shaunak,Necessary product,good use easy use,2019-08-21,5.0
272,customer_review-R2VIUFY0259XPR,kailash chandra meher,Worst product waste of money,worst product low quality product high cost totally waste money never order product ever,2019-09-24,1.0
273,customer_review-R204433YVS2UG1,Akshay B.,A good OTG pendrive.,data transfer rate per expectations ports easy connect disconnect,2019-06-07,4.0
274,customer_review-R25ZJKKD33VLY2,Sudhir N Kamath,Average build quality!,build quality average worth price,2019-07-14,3.0
275,customer_review-R35PNM7ZVS199V,Harshit Mishra,usb 2.0 pendrive with c type,small size easy keep use c type port mobile transfer speed usb 20 pendrives best pendrive range 32gb space,2019-06-02,5.0
276,customer_review-R3M2062HF7AW26,Deepak Razdan,Nice product,whenever transfer file mobile usb sometimes get error msg file couldnt transferred,2019-10-10,4.0
277,customer_review-R10FH9SQCDDASE,VigneshKV,not detected by Oneplus 5t,waste money detected oneplus 5t,2018-10-31,1.0
278,customer_review-R1ABZVDD1SRNIJ,Aravinda,Good option with c pin,simpler look,2019-10-02,5.0
279,customer_review-R486I3ULFL1KE,Arka Mandal,SanDisk 3.1,working first data transfer working normal pd,2019-04-17,2.0
280,customer_review-R3JRYH30LQ62MZ,Ravi Kumar,Ok product,great ok,2019-05-27,3.0
281,customer_review-R33NGLTXXZDD7G,Bidhan,USB,liking daily usable,2019-06-29,4.0
282,customer_review-RMMI3UB068SUK,Amazon Customer,good product,storage good gets heated flimsy construction,2019-04-16,4.0
283,customer_review-R2WUGEISSIUR7S,Swapnil Gaikwad,Good USB C OTG dual drive.,good must product phone moving micro usb usbc port,2018-08-22,4.0
284,customer_review-R3UTGGFSCBY1M6,Joseph Francis,Good,slow copy transfer big files,2019-06-29,4.0
285,customer_review-R3POIG9XVOEJ4T,DEEPAK VERMA,Compact and easy to use.,handy pen drive uses compact sizewe easily plug mobile use facilityi think best innovation type cmobilr users,2019-07-30,5.0
286,customer_review-RLGD4XF83WPN0,Ramesh,Good purchase,small size need take special care,2019-10-17,4.0
287,customer_review-R2R0SYFPH9MVRL,Amrit Mamgain,Good product,using product transfer data fro c type mobile works like charm,2019-07-28,4.0
288,customer_review-R1CPZBEJ0B003I,Amazon Customer,Quality product at a affordable price.,good,2019-05-29,5.0
289,customer_review-R14CAUSRZTKRSM,Chineel,Loved it,expected works well,2019-10-24,5.0
290,customer_review-R3NUSWZLVK99GR,Raghavendran,"Plastic low quality, Memory very good",plastic low quality memory good,2019-10-06,4.0
291,customer_review-R2T61G5CGSL8MD,Amazon Customer,Taking too much time to copy files less than 2gb,useless pen drive like 1st gen pen drive,2019-11-10,1.0
292,customer_review-R4FRN8VWX6X1,Amazon Customer,Not recommend for rough users,good product wish could 30too delicate rough users dont purchase itmight purchase week,2018-12-09,5.0
293,customer_review-RT475E19X38G1,Ramesh K S,Value for money,easy use,2019-06-23,5.0
294,customer_review-R16ZNFM56Z1761,kmkandan,Good,works described without issues fast data transfer,2018-09-20,5.0
295,customer_review-R1OF7VXOM9ACJX,K.vinodhkumar,Very slow micro USB port dual pendrive better like this one,low quality material,2019-05-13,1.0
296,customer_review-R3L8Q27TWG1QR1,LEO,very good,small size sturdy,2019-08-06,5.0
297,customer_review-R18S44YDBDPMPI,DRK,Good and handy,got good offer price,2019-06-29,5.0
298,customer_review-R2WSKGRSSS9M0,Roohani Mahajan,good but could be more durable,already breaking 3 months use otherwise yur small portable useful,2019-05-14,4.0
299,customer_review-RKGRU0HR5JYIH,Laishram Karnajit Singh,Poor build quality,build quality poor need handle carefully,2019-10-02,2.0
300,customer_review-R36XMZB3EAVS9V,Siva K,"Good quality, durable, value for money.",pen drive build quality strong like others flimsy durability good value money,2018-09-04,5.0
301,customer_review-R2LVCDI9ZDGYBP,Eldo E V.,Nice,good,2019-10-21,5.0
302,customer_review-R3D79XGFXZ0H0W,Subhash S.,Very slow,slow speed usb 31,2019-05-02,2.0
303,customer_review-R300N46T28H822,GANESH,64GB SANDISK DUAL DRIVE BLACK SIMPLE OUTLOOK,purchased one colleague told bad,2019-12-14,3.0
304,customer_review-R1ZV6YV440OE7W,Kavish,Good Product,plastic indeed cheap quality careful otherwise good product,2019-02-05,5.0
305,customer_review-R1XPEPVD16DT6N,pavankumar,Useful,useful,2019-10-11,5.0
306,customer_review-RCAW7CL1L2X3S,dinesh,Good,good,2019-09-09,5.0
307,customer_review-R2UXPH9W5ILTLT,Amazon Customer,Just ok,plastic material worst build quality,2019-05-20,5.0
308,customer_review-RVFADRG6VYK0X,Muthumalla,C Type dual flash drive,fit mac book c port usb drive okay memory ok bought macdrive could use,2019-12-13,2.0
309,customer_review-R87611E7PR5B2,Ashok Goenka,Nice,nice,2019-10-31,5.0
310,customer_review-R3P3VLGG8DB9KU,Amazon Customer,Very cheap quality plastic used,plastic used side normal usb cheap use unusable,2019-12-08,1.0
311,customer_review-R3TQUNC4ESTK33,Doc 123,OK ok,didnt find quality material good looks fragile transfer rate less still buy getting good deal,2018-10-17,5.0
312,customer_review-R1I0HBESFO84RB,SHIV,Perfect,perfect,2019-06-19,5.0
313,customer_review-RTNZ1G0IQ6HSF,Monika,Satisfied,easy use pc laptoptook reading use phone,2019-08-28,5.0
314,customer_review-RJ4DY4725UU84,Amazon Customer,Very nice,best pendrive ctype phone ctype also support laptop,2019-01-28,5.0
315,customer_review-R1QOW1HBGCZC9Z,Mubashir Shafi,Device not working on my phone,unfortunately otg working xiaomi mi a1 although works pc doesnt get detected phone disappointed product,2019-03-15,1.0
316,customer_review-R87EO8W0JPH61,alam,Value for money,value money material sturdy,2019-01-27,4.0
317,customer_review-RRQ23VHYV059B,a quality product,Value for money,read write speed fast however quality plastic doesnt seem last long overall serves purpose well,2019-07-16,5.0
318,customer_review-R1M7YI5TWIKFLK,K Divya,Ok,nice upper plastic coming careful buying product rest fine,2019-10-21,3.0
319,customer_review-R3QK00WM5E9A4,Sebastian,2 Peas in a Pod,pretty cool product also doubles phone charger simple easy use,2019-11-13,5.0
320,customer_review-R32HRIX5N344AO,smeet,Awesome,wonderful need use adaptors,2018-11-11,5.0
321,customer_review-RKXOV4DVF13VH,samraj,Go for it,good product bought hesitation,2019-10-28,4.0
322,customer_review-R3DCGIL211X75J,Bhagwan,Thanks ðŸ˜Š ðŸ˜Š,awesome product,2019-08-21,5.0
323,customer_review-RMNMTLC8EHT2I,PRAVIN RAJAN,Good,good however could option cap unused ends,2019-02-03,4.0
324,customer_review-R16DYAJ53EWWHG,Arjun,"Tiny, works fine.",really tiny hand worth good phone pc durability question feels plasticy lets see,2018-10-13,4.0
325,customer_review-R3HRSC0WQHGMVO,Ashish Shukla,It must have some protection to both side,must protection side,2019-03-18,3.0
326,customer_review-R3ALW9PBXG8NVG,Amazon Customer,Must buy,must buy drive,2019-08-23,5.0
327,customer_review-R3PMDT5AIZW938,THAKUR SUDHEER SINGH,Sandusky dual drive Type C,using last two months reviewed year rest good product cheap compare market price,2019-02-23,5.0
328,customer_review-R33JXH87KT6W2T,Suman,Five Stars,loved op 5t xps 13,2018-05-18,5.0
329,customer_review-R4U4USH8A1E4O,Vijaydeep,Ok .Good,nice product small size quality good,2019-04-28,4.0
330,customer_review-R2D7SXBYN52T5P,P.S.RAJAN,SanDisk Dual Drive Type C,easy use worth price,2019-04-28,5.0
331,customer_review-R1J2RX06ZPFGV,Umesh Taying,Good for price,fast enough,2019-12-06,1.0
332,customer_review-R1GLJJNKFAZXPL,shyam babu H,Difficult to use,difficult use mobile sometimes files transferred drive deleted automatically beware try copy drive instead moving files,2019-07-25,4.0
333,customer_review-ROIQP7254ZQQJ,Srikanth Yamana,Value for money..,im using device s9 easy connect phone value money guess quality also nice,2019-01-18,5.0
334,customer_review-R2WHFZ19HWYP2G,Zach,Best buy,wat fits ur mobile type c port ur laptop otg cables reqd,2019-02-24,5.0
335,customer_review-R3RWNOD5IH10SW,Amazon Customer,Perfect,great product works perfectly one plus 6,2019-04-03,5.0
336,customer_review-RUUNOFYUH1507,Amazon Customer,Five Stars,perfect pendrive huge storage better connectivity quite light sturdy,2018-03-03,5.0
337,customer_review-R3BCOAWZTMAPVT,Nitin,8/10 product -2 for slow performance.,everything good productbut single might regret buying oneis speedtht perfoming fast expected,2019-10-28,5.0
338,customer_review-RBKX7C84CXL7Y,DIBYENDU DOLAI,Awesome product,undoubtedly good product sandisk respect awesome,2019-09-02,5.0
339,customer_review-R1OFOMTMZKZ58L,Lalit batra,Average product,product low material quality,2019-09-08,3.0
340,customer_review-R20DZJ40FTO6ER,Learnchase,Nice product,nice product taking time configure enable otg storage advanced setting able connect typec mobile,2018-08-28,5.0
341,customer_review-ROQ54ZHTC8V2,Lijo Aprem,High speed,multiple purpose easy way transfer datas,2019-03-05,5.0
342,customer_review-R9B64MOKB72KR,Rappa,Excellent,great product,2019-07-04,5.0
343,customer_review-R2MWJTWJMZ040H,John Poulose,Storage with Value for Money,value money,2019-11-02,5.0
344,customer_review-R2OL1VULANLUJQ,Sujay HN,Good and compact but data transfer not so great,design good easy handle data copy speed great takes lot time 10gb data transfer,2019-05-12,4.0
345,customer_review-RJKODUNDNM4K9,Yashwanth,Stupid option,dont go worthy speeds utterly disappointing 2mbps returned next moment got delivered,2019-01-17,1.0
346,customer_review-R37CB7SPHQ7B3J,Rishi Gupta,Little genius,light small super fast,2018-12-31,5.0
347,customer_review-R2GOGXEN8TFT9P,RATHNA PRADEEP S,Good,good,2019-08-22,4.0
348,customer_review-R3E24R6NRNP5YZ,bijoy,Nice,good job,2019-08-21,5.0
349,customer_review-RBCCIACVOO3LN,prasad,Go for it without any fear.,good productyou go,2019-10-29,5.0
350,customer_review-R1C5PEE3TYIWLB,Hardik Pandya,Great,goo product compaq unique,2019-03-16,5.0
351,customer_review-R26SESW9QXET1L,Mohammed Basil,Worth every penny,really good product must buy people prefer usb sd card yes small light make cool holders,2018-12-14,5.0
352,customer_review-R1FS354LC7NWFJ,Thamizh,I loved it,loved,2019-07-02,5.0
353,customer_review-RQITATPGE0GBH,suresh chawla,Fragile,made plastic careful,2019-09-23,3.0
354,customer_review-R17Q83KSG2BQY2,Briaton Gonsalves,Speed,love data copy speed 50mbps normal copying speed pendrives,2019-07-30,5.0
355,customer_review-R1QZEAE1AXGVSQ,Bills,Cheap & fragile plastic used . Not worth the money spent.,delicate itemcheap plastic used fear plastic body damage used without care good product terms build,2019-11-11,2.0
356,customer_review-R3SNDWDBVKYUEJ,Syed Rafiuddin Hashmi,Excellent,excellent,2019-08-20,5.0
357,customer_review-R1VCXIFAXQ7ZTQ,sion kumar,Best,good product,2019-11-17,5.0
358,customer_review-RZUXTIRRXS0MK,Rajkumar.Pe,Worth for money.,nothing dislike superb product love,2018-10-31,5.0
359,customer_review-R3W04KZBKCN5VX,Yash,"Very Tiny Otg pendrive I have came across, but it's value for money..",slow u connect mobile works fine computers,2019-08-01,1.0
360,customer_review-R3KVPQA8C351UW,Manish,Very good,good one delicate go strong one,2019-08-09,4.0
361,customer_review-R11KPZJ59GP1Z1,Ajay,Good,good,2019-10-30,3.0
362,customer_review-R1D0OCUH2PSHAP,Naresh Salgaonkar,Value for money,protection connectors though overall satisfied drive,2019-07-23,4.0
363,customer_review-RW2VLPD5GRVC9,Joel D.,Not so easy to use ðŸ˜‰,gave three start easy use part cause typec side usb isint really easy pull phone insertedrest great,2019-11-06,5.0
364,customer_review-R2UMD4JEAYOFJX,srinivass,Excellent,excellent,2019-07-21,5.0
365,customer_review-R1I3NWLFWOSFWQ,Dr sainath,Good product,nice product works perfectly fine,2019-07-20,5.0
366,customer_review-RK3GP50MC5WWX,Manav Akela,Ok,ok,2019-11-08,5.0
367,customer_review-R27HP5NYWPST91,Amazon Customer,Not worth,though everything good lags transferring reading data satisfied reading writing speed,2019-10-10,5.0
368,customer_review-R2K4TNAHD7HS1X,Medico95,It's not 32GB!!,19gb device 13 gb used kind software left 19 gb,2019-07-18,2.0
369,customer_review-RTTHAKX20FDWV,Pooja R,Best,best,2019-03-27,5.0
370,customer_review-R2EMITL2VSHHVJ,Jit Kapse,Good,good,2019-08-12,5.0
371,customer_review-RPTZ1UGEZIS9F,aditya singh,Waste of money slowest drive speed upto 2mb/s,slowest trasfer like 2mbs one plus 6 drive waste money,2019-05-28,1.0
372,customer_review-R2OLTTWRATBX6T,jigar vaidya,32gb pendrive received instead of 128gb..,ordered 128gb pendrive received 32gb paid fir 128 gb bad experience kindly helpful nd replace pen drive,2019-07-02,1.0
373,customer_review-RFY67R41WU45S,jeevan kumar,Speed and comfortable...,size small convenient carry good speed,2018-07-11,5.0
374,customer_review-RYTH18MX04CTJ,Amazon Customer,Good but bad read write speed.,great product read write speed isnt best,2019-08-03,4.0
375,customer_review-R1Q8F4U5J0W8SQ,Siva Kumar Challa,Good product,good,2019-07-26,5.0
376,customer_review-R1NDVUJDEDUFCW,harish,Awesome product,compact nice use,2019-11-02,5.0
377,customer_review-RQOWHM554VICB,Shailendra S.,Value for money product,good product average build quality issue noticed,2018-10-18,4.0
378,customer_review-R3AU8EKR7Y9VJB,john kennedy,Good,easy use,2019-10-19,4.0
379,customer_review-R3BQP50H12T7G3,Amazon Customer,Its a product of day ðŸ˜Š,easy use nd worth money durability still going check along reliability still needs check usages,2019-06-02,5.0
380,customer_review-RESE1Y31LBXCT,Sanjeev Chakravarty,Excellent Product,value money,2019-10-30,5.0
381,customer_review-R1EW90EI2U8F84,aseef,Good,ok,2019-08-21,4.0
382,customer_review-R2VCY2CDIDOLIV,Amazon Customer,Disappointing,slow worth,2019-10-12,1.0
383,customer_review-R2BEOMETKVE181,M.Kiran,Performance 100,performed exceedingly well small keep safe,2019-05-21,5.0
384,customer_review-R3T88Y5QZO77V7,kishor,Space,actual space available 117gb 128 gb,2019-06-22,3.0
385,customer_review-RSP7XXI6TVJVV,Rock,Must have,useful productwith im built software good backup,2018-10-01,5.0
386,customer_review-R2TCYYJE3A8FJ,B.Sundaramoorthy,Pen Drive,good branded item,2019-03-23,4.0
387,customer_review-R1N69YN2H6P3AB,Bhanu prakash,Good product wrt size,holder strong enough seems may break limited use size pretty small placed wallet easily,2019-06-24,5.0
388,customer_review-R18WXH9O0F8CJB,KIRAN,Helpful,really helpful thanks amazon,2019-10-05,5.0
389,customer_review-RSF4JLJF30QKV,B,Dual drive - Usb Type C and usb 2.0,havent used product usb 20 end given cover could given product description,2018-08-21,3.0
390,customer_review-R34Z5DDTDR7UOU,jaydeepsinh dodiya,Very poor build quality,material vwry cheap cant long last even year using pendrives every time u worry breaking pendrive,2019-03-15,3.0
391,customer_review-RWSHEKVLKW1LW,Harsh Ramawat,"Best affordable 128gb Type-C for any Type-C OTG supporting phone, even Google Pixel 2 XL",best product highly recommend totally satisfied speed data transfer performance one,2018-09-14,5.0
392,customer_review-RVZWKX1L80ZCU,Siva,value for money,really working well sandisk app,2018-10-06,5.0
393,customer_review-R29VPZDLJK37XA,Sibi,Faster data,low quality thin plastic faster data transfer,2019-10-15,3.0
394,customer_review-R1L742V64400TE,Nikhanj K Martin,4.75/5,value money,2019-09-29,5.0
395,customer_review-R1MJY4Y8K5G3VT,shanmukh,Worth for money,data transfer speed nice 60mbps,2019-03-19,5.0
396,customer_review-R1F3QHZX8R17DK,G S R RAJU,Excellent value for money ðŸ’°,excellent quality pan drive c type useful c type mobile,2019-01-24,5.0
397,customer_review-R1R8VNR9NXKCSJ,Singh Amar,Ok Product .,good build quality felt ease use area needs focused,2018-11-08,3.0
398,customer_review-RXZHUVR99H759,Dany,Wrong product,got wrong pendrive usb type b,2018-10-04,1.0
399,customer_review-R3GQTGJBJSH1PK,SSS,Good to have,handy,2019-07-10,5.0
400,customer_review-RMJ0JQT40GDCQ,Vivek Sinha,Good Dual USB Drive,good product works well macbook pro windows pc heat data transfer fast,2019-10-28,5.0
401,customer_review-R3FSK1PTEX4N2R,JIJO KURIAKOSE,Good,good,2019-06-28,5.0
402,customer_review-R3EKXQVPWT7TOP,Amazon Customer,Five Stars,received today working well samsung note 8 cute small,2018-05-14,5.0
403,customer_review-R1PE4PW80RXGEW,Viren Chhachhia,Slim and best,u go worth money,2018-11-03,5.0
404,customer_review-R3MKUXH1JO9M6H,Harshet,Overpriced,overpriced,2019-08-18,5.0
405,customer_review-R2UBZO5Y3FH903,Guesswho,Good product. Can be better!,built quality could better found little flimsy,2019-05-24,4.0
406,customer_review-RQ9N94W4YM72V,MAHENDRA SINGH,Good,easy use,2019-06-12,5.0
407,customer_review-R1RCXWSL67EN00,D Muthu Prakash,Nice product.,small one working perfectly,2018-10-08,5.0
408,customer_review-R3K9Y4RYHSLUSC,Ragini,Nice,nice,2019-11-12,4.0
409,customer_review-RT4KN8PYJ0CYB,anil kumar,Good,good,2019-11-05,4.0
410,customer_review-RDIJWY1DQQPLX,Deepak rana,Good,working fine,2019-08-15,4.0
411,customer_review-R1EWZJYKE7HNM8,Ayushman,Pen drive end is too small,normal pen drive fit store stuff connects phone properly small pen drive,2019-11-02,1.0
412,customer_review-R4V7FPCPLQGLS,Akshay Tayawade,"Good product but not durable, USB side is plastic which looses shape.",good product durable kind flash drive usb side plastic looses shape got pressed pockets wallet,2019-03-23,3.0
413,customer_review-R1NLOOFC07S2H0,Shaswat,Great Product,convinient easy use,2019-07-10,5.0
414,customer_review-R1RY5M6TX5O9G,Amazon Customer,Build quality,using month issue handled carefully made thin plastic,2019-11-16,4.0
415,customer_review-R1WNKBIP1NONFV,Ashish Vaid,Good product high price,good product pricing could cheaper,2018-06-02,3.0
416,customer_review-R7269WDX7150P,Santosh,good,good,2019-10-08,3.0
417,customer_review-RQK9YQGFVCOI,Ravi,But small to handle,good,2019-10-07,5.0
418,customer_review-R1Z9UGNCCPLW5D,prakash kumar,Fast and furious,easy use easy back,2019-05-08,5.0
419,customer_review-R15782AZOFM94D,Apramey,Only usb 2.0,wish usb 30 least,2018-09-09,4.0
420,customer_review-R237MQUGG3MZHY,Max,Good Product!!,pen drive slim handy easy use,2019-10-18,5.0
421,customer_review-R1TDFHOIS605L0,Jagdish Johal,must buy,superb quality good speed,2018-10-16,5.0
422,customer_review-RVBW8MB3P52YB,Amazon Customer,Good,good,2019-08-25,5.0
423,customer_review-R102G858ZI9RG2,Andrew,Easy to Use,great product design,2019-02-19,5.0
424,customer_review-R22EJNO22HENGN,shrey,A great pendrive,product way small easier carry store things need take extra care loosing,2019-11-03,5.0
425,customer_review-R217TWJLRUKWSL,Amazon Customer,Sandisk Otg drive,durability badthere plastic parts break soonthe product easy use,2019-01-30,3.0
426,customer_review-R39ARH5DXXU6PI,hapavana,Sandisk,value money,2019-01-25,4.0
427,customer_review-R29WSQGM5P8A3K,Dr. Akash Upadhyay,"Good product, material is okay",good product material quality isnt good seems easily breakable,2019-06-12,4.0
428,customer_review-R29KIO5E9E58ZL,Pradosh Mohanty,Product quality.,product stops working recommended purchase product,2019-09-19,1.0
429,customer_review-RP8ENJNCHUNZ,MAHESH KALWANI,Small peice of wonder!,small compact handy prone losing itbut beautiful fast operation anybody could ever ask,2019-07-13,5.0
430,customer_review-R1OPU0Y3N4YTID,SYED ARIF,Super fast,super cool pendrive recommend world purchase,2019-09-06,5.0
431,customer_review-R2MQS67DDNVGYO,purushottam bhat,Good,nill,2019-10-23,5.0
432,customer_review-RUAUT5N6ET543,Prakash,Good,good pc writing speed mobile slow,2018-11-07,5.0
433,customer_review-R3GH96YGN5F4N2,venkatesh,Plastic body,product overall good long durable plastic body,2019-08-13,4.0
434,customer_review-RM5ICZ5PIXD61,ashish mittal,c type port doesnâ€™t fit,c type port fit laptop quality also poor,2019-10-06,1.0
435,customer_review-RB1B7KX5LO1R5,ROHIT SHARMA,Easy,easy small,2019-07-05,5.0
436,customer_review-R1XUEG4OB20IVG,Anubhav,Good for mobile use,goodsometimes doesnt support pcs took transfer data phone purpose good,2019-10-01,4.0
437,customer_review-R23GG61FZGF2YK,Anurag ameriya,Poor service,waste im able return product get money back option money return showing doest support one plus 6t,2019-10-06,1.0
438,customer_review-RD2GIH9G4669P,Anjaneya Alapati,Total Paisa Vasool,total paisa vasool although plastic feeling slightly delicate worth,2019-07-01,5.0
439,customer_review-R5IVQ9OAMPUUY,A P Singh,"Good product very useful would traveling, and on a daily basis",good product useful would traveling,2019-02-16,5.0
440,customer_review-R2Z5OT3ZYEHOKL,Prasad Rangavajhula,The best product,excellent product,2019-09-17,5.0
441,customer_review-RA1V12R584O3H,Gml Simte,Excellent!!,tiny works well one plus 6t hope last long,2018-11-07,5.0
442,customer_review-R2Q7VE29OKU62Q,Brahman,Guess it's reading little slow.,serves purpose recommended,2018-10-08,5.0
443,customer_review-R34TE93IF3X2JZ,Gopal Budhia,Great product,good fast usb 30 support also usb connector made plastic lest durable long run,2018-10-20,4.0
444,customer_review-R4BI77BPHKT1A,rajarasool mohamed,Correct product,correct product easy use,2019-11-08,5.0
445,customer_review-R352H6PV5F9XJ5,vvvijayyy13,Good,good,2019-03-03,5.0
446,customer_review-R3HGZZCBSIPJBJ,Rahul sagar,Great product,good quality hell lot space,2018-12-03,5.0
447,customer_review-R2LYBHB2Y9N37G,Venu,Highly recommended,high class product,2018-12-24,5.0
448,customer_review-R34HSZFHEWTQ79,Shaileshkumar Patel,Awesome Product,best product easy use mobile laptop bothvalue money data teansfer fast recommend,2019-09-27,5.0
449,customer_review-R2PEG6R4NJ7U7W,Amazon Customer,Good but not the best.,nice small,2019-11-16,5.0
450,customer_review-R1N02KRC15E45T,vicky,Ok,ok,2019-08-12,3.0
451,customer_review-R1BOJVTD65MIJF,Biswadip D.,Meh!,works smoothly slow max 10mbps rate usb c mode,2019-08-28,4.0
452,customer_review-R3EFQXVO1WL2J,suraj thapa,Thumbs up,really liked product easy plug play,2019-02-14,5.0
453,customer_review-RCCQ82XEDI2WK,Lakshya,Small and portable,sure use tab small lost easily excellent product,2019-02-28,5.0
454,customer_review-R3KIQ4H2GFD77M,PARTH,Good,good,2018-11-30,4.0
455,customer_review-RR3APS6A8WY5S,ranjit,Its good.,pendrive good connects well transfer speed little bit slow disappointing,2018-06-01,5.0
456,customer_review-R38ZLRLNREAKK1,Amazon Customer,Good,little smaller expected,2019-07-30,5.0
457,customer_review-RWJLNVRYYFC85,Sampath Kumar Desikachary,Good,good,2019-07-05,5.0
458,customer_review-R2YWTZ6CM3HADN,akashdua,Superb but too small.,superb performance tiny easy loose,2019-09-10,4.0
459,customer_review-R5FJ8UKQ1G4CY,simon joseph,Value for money,good performance,2019-10-15,4.0
460,customer_review-R22ZH8G7M5A2EK,Arulanantham,Compact and powerful,compact fast enough usual issues far,2019-06-11,5.0
461,customer_review-RENPCL9WCI1WX,vikram r.,One Star,product slow durable,2018-06-05,1.0
462,customer_review-R2FPULI3KHWBUD,KillerAshu007,Awesome,really awesome support every type c phones small take hand easy carryout,2019-08-20,5.0
463,customer_review-R28X5E0FLCH2DB,Abishek Ramlingam,Be aware of the plastic built,pendrive looks fine little amount flex body product great,2019-10-02,4.0
464,customer_review-R10KFBFX7U24VB,Paul,Good deal,nice good deal,2019-04-06,5.0
465,customer_review-RO61V2E2CET9K,Dr Ishwar P. Goel,Excelle6,good,2019-08-24,5.0
466,customer_review-R131OQ6WDF5RLC,Dr.Gireesh,Superb,superb,2019-06-18,5.0
467,customer_review-R1ZF6N3CQN3F8N,Mr V,Good!,good quality product working fine,2018-12-20,5.0
468,customer_review-R3GXTZFPEZVHXW,Sajid khan,Easy to use,easy use nice product,2019-09-23,4.0
