,customer_id,customer_name,review_head,review_body,review_date,ratings
0,customer_review-R1VGE9TYEDLV7F,Snigdha,Three Stars,good product wid price,2018-07-15,3.0
1,customer_review-R15JK6E8ZJD165,Sandeep,Good quality pictures,used recent trip rajasthan quality really good lacks less clarity night like manual function u use ur photography skills accessories good,2019-02-09,4.0
2,customer_review-R1643I5YCU2Z36,सुशांत इनामदार,Good Camera for Rs.13990/-,get accessories described advertise even possible authorized sony center got camera lens cover camera bag 4 nimh rechargeable batteries charger remember dslr dont expect results dslr camera overall photo quality good rs13990,2018-05-10,5.0
3,customer_review-R22MQEG36IB9F5,Dinesh K.,Picture quality,picture quality easy use beginners awesome camera perfect shot sony camera sony,2019-02-26,5.0
4,customer_review-RFNPGPGT45VW7,Kence Georgey,Worth for its price !!,sony camera worth low price picture quality excellent problem aa battery charge inserted camera charge via charger,2018-12-13,4.0
5,customer_review-R1RML76M4J1VBO,Richard K.,The product is good. But would like to know where the camera ...,product good would like know camera case isas advertised camera case sent,2018-05-15,4.0
6,customer_review-R3G2HGBG6H6XSG,Anand,Bad display.,worst product connectivityonly connect laptop usb poor displaypoor display means everything looks poor trying take photo touch screen motion photos means stable things captured old poor photos quality mobiles better dont come lence lence means everything photography fun cant return cant afford buy range understand value lence photo avoid see display believing look good laptop go,2018-11-04,1.0
7,customer_review-R31B310857C0O6,Satyam,Picture quality is very nice,got 4 rechargeable battery sony charger lens cap camera strap 16gb memory card,2018-11-09,5.0
8,customer_review-R6LXQZVTJWUNR,Amazon Customer,Awsome product. Satisfied with seller,awsome got 12990 offer picture qiality good needs precision expect dslr quality though thats quite impossible price range useful beginners must go coming seller satisfied seller required accessories included package starting 16 gb memory card rechargeable batteries charger really nice product,2018-10-29,5.0
9,customer_review-R1G8EMJ4IUW2I4,Prasad Koduri,not worth the money,better quality camera mobiles price range,2018-10-02,1.0
10,customer_review-R1EF4OV2CPRWOH,bhushan durge,Bad image quality. Very bad low light and portrait mode.,didnt find much useful automatic mode doesnt set proper iso poor performance low light even mobile cams portrait mode worst one even increasing pixel size pixels appear image remember u cant return product replacement available careful,2018-11-21,1.0
11,customer_review-R3ITREGKTCF7FO,Amazon Customer,Please go for DSLR camera.,old model go dslr series useful camera get better features mobiles u r looking beginners camera go basic dslr sonycanonnikon user canon 1300d dslr camera,2018-10-07,1.0
12,customer_review-RWYXAEU9O8GKQ,Adiboy,Don’t buy misleading description and questions answer,totally misleading works 4 aa batteries 2as mentioned description comes 4 normal alkaline aa non chargeable batteries 8 chargeble batteries charges mentioned questions reviews totally completely misleading finally managed return refund,2019-06-21,3.0
13,customer_review-R1H7SRWT9PGJ72,Ayush Verma,VALUE OF MONEY,received sony camera sony bag sony battery sony charger sony rechargeable battery 16 gb sony memory card overall everything best thanks amazon,2018-11-20,5.0
14,customer_review-R3OTEQC4KFP0UE,Shamita Bhattacharjee,Battery woes.,camera alright received 4 perfectly sealed drained batteries ran pillar post find camera getting switched never could imagine batteries useless buy 4 chargeable batteries alongwith charger worth rs 900 cheap tricks avoided company,2019-08-20,3.0
15,customer_review-R1OP5K1K00C542,Shakeel,It's features,cyber shot easy us didnt like lack latest features like wifi nfc,2018-08-12,4.0
16,customer_review-R1UIIJT7UXRJNY,COMPUTER HOME,USE LESS amazon,given rechargeable batteries charger mentioned advertisement,2019-05-02,1.0
17,customer_review-R38RR1Y1QL59LW,Dr M Murali Krishna Kumar,good camera,good product dont try take picture moon,2018-08-24,5.0
18,customer_review-R1KZ1DZBHSVFEM,Jayanta,Average Camera. With great day light capture,first camera made low lightbut capture good photos day lightwell upset seller given rechargeable battaries charger decent job looks like dslr uploaded photos,2019-11-14,4.0
19,customer_review-R376E3OPL3UFU,Ramasamy,Camera not starting,bought sony dsch300 set language time date entering info pressing ok says go sonynet info press ok camera switches camera working fine changing sony rechargable batteries,2019-08-18,4.0
20,customer_review-R3JVEY04TA3RCR,Disappointed Buyer,"Medium quality camera, a budget smartphone can beat the picture quality",pros 1 affordable cons 1 medium quality camera budget smartphone beat picture quality 2 body lightweight fibre body metallic sturdy like older make2015 happy camera build quality suggestion go shop feel body like make purchase verdict gone cameras higher quality features body quality,2019-06-25,3.0
21,customer_review-RDXFPHQ5V6SVQ,dinesh MK,Worst picture quality i replace one time but in that also same problems,picture quality worst dont buy camera go another model replace also problem countinus went sony service center also treating worst pls go canon better,2018-10-13,1.0
22,customer_review-R1Q5HHZLMKSY1,shabeeb uk,Overall bad experience in why of out put,zooming image low quality normal day light full grance manual function complicated worth money product,2019-07-24,2.0
23,customer_review-R1C1ACMAMLJ8WN,Amazon Customer,very very bad experiance with defective peace. display and lend are not working well suddenly failed,picture quality average due defective product received bad experiance product,2019-02-23,1.0
24,customer_review-R33ED0FB74AH0R,Srinivas Goske,It's not worth it,hi purchased sony dsc h 300 camera quality good batterys need changed frequently camera settings also varied hope tried explain issues,2019-05-30,1.0
25,customer_review-R3LKXAZ0C8F5V3,Panicker,Waste product,old style product handy uses old style pencil cells wanted replace product sony one seller agreed,2019-10-21,1.0
26,customer_review-R3JWATYSPJC4CM,Amazon Customer,Excellent but complicated,excellent pictures create magic photography main problem settings complicated beginners auto mode ok ok time learn setting pro camera sony always rocks,2018-05-22,5.0
27,customer_review-R3IS9S8PNTOAU1,Vikash Kumar,Not happy,good better good mobile spend money buy big one,2018-10-02,3.0
28,customer_review-R1ZOFBSQL4CDCM,Leandex,Good but focusing,picture quality video quality good problem focus fast accurate zoom takes time focus objects get price range,2018-10-21,3.0
29,customer_review-RU3Y8C7EHXEOT,Milan Pratap Singh,Don't buy.. .,awesome camera sony bt please dont buy gud days cameras available jus increase ur budget little bit nd go another device like dslr,2018-10-12,2.0
30,customer_review-R3VZ753AFVO48Z,sandeep sane,Four Stars,nice camera,2018-07-02,4.0
31,customer_review-R2ATBQN46ZR4LW,Santhosh Kumar,Like it,good,2017-09-08,5.0
32,customer_review-R1DTEU3V9XF7EA,Sreedhar,Please Don't waste your money on this camera.,bought friend beginner quality pictures poor mobile camera shaky images coming everytime even take photos shaking camera,2019-02-06,1.0
33,customer_review-R3T5IH8JSSB9DG,manikandan p p,Poor Camera,poor quality camera taking pictures camera goes offautomatically switching offif possible please take back,2019-04-19,1.0
34,customer_review-R211SQYR5L5WAZ,V.vijaianand,Five Stars,excellent camera,2017-12-07,5.0
35,customer_review-R208P6NE5103FI,Mr. Chandan Dey,overall this is better in this price.,easy access zooming good clicking photo take much time process good experience first time,2018-10-25,4.0
36,customer_review-R3ULTN4E06O4GD,Vishamjay Badal,Not working,received product havent work still facing problem sony service centre already visited need retrun cyber shot much fed,2019-06-17,1.0
37,customer_review-R35Q48LKQBTSE4,Amazon Customer,Happy shuttering,overall good product limited aperture values manual modeneeds refinement battery compartment cover nice picture quality good resolution lenseamust non professional photographer,2018-09-22,5.0
38,customer_review-R2NXKJLZGQIUG3,Rohit Kumar Mishra,Totaly wast of money,photo quality bad mobile tak better photo f11 pro fully wast money,2019-09-22,1.0
39,customer_review-R1CXT5VP6WSMZE,Mahesh Sharma,Payment process on emi is not worth at all . This is not expected from the respected MNC like you .,camera quality good payment process paying emi worth cost emi charged item discount price profit buying thing discounted price,2019-05-30,4.0
40,customer_review-R3IYXDV1XBKI5F,Johnny,Sony camera solue my problem please Amazon customer care,camera good quality pictures missing sume accessories reachable batterys charger memory card,2019-09-15,4.0
41,customer_review-R29B7115EXLY4O,Alok Trivedi,The best you can get in this budget.,best get bidget also offering additional accessories like bag power charger rechargeable batteries dslr look like model,2018-07-06,5.0
42,customer_review-R2V98Q6FAG71G0,Pranshu masaniya,It's good but.....,photo quality excellent video quality good give 4 stars,2018-06-29,4.0
43,customer_review-RFVIH91PSUVA1,Amazon Customer,Excellent,thanks sony wonderful thing easy beginners easy use n important price really happy thank amazon,2018-10-13,5.0
44,customer_review-R3VQNJN2RNZURV,Pravesh,For this product,review amazon camera best beginners purchase site accessories received executive responding understand problem go site,2019-08-29,3.0
45,customer_review-R3TG9W0MBDXVSU,CP,Sony digital camera,good decent product price,2018-05-05,4.0
46,customer_review-RY3YLD5AD4M9Z,M janahan,Repair product,product repair button working,2019-04-23,5.0
47,customer_review-RS4FUY45HS9XA,Arup kumar saha,Good camera,picture quality good mentioned description chargeable batteries charger normal batteries atleast one item give,2019-07-08,3.0
48,customer_review-R3NUW9MQE571ZK,sandeep yadav,while zooming image it will blur,useless product dont waste money,2018-10-23,1.0
49,customer_review-R3KS7PZXRDQAM8,Mahendra,Very nice .easy to handle and little bit heavy,nice one,2019-01-21,5.0
50,customer_review-R16SH5KD9R2QQZ,Priyank,no comparison to other.. it's best..,best best best class,2018-12-23,5.0
51,customer_review-R30AXNCB6KLAPH,Chuks Onyekachi,Five Stars,item delivered promptly described,2018-09-02,5.0
52,customer_review-R2D8CHT9QY7AZK,Bansil Tadha,Night mode is good,nice camera,2018-06-14,4.0
53,customer_review-RW7KXMDGYDVO,Saikat Pal,Thank your Amazon,awesom product,2018-11-04,5.0
54,customer_review-R3OIA1UJJCCTXW,Amazon Customer,Don't go for Sony H300,placed go cyber shot camera lot issues sony h300,2019-01-01,1.0
55,customer_review-R2PEKBST7U1RCU,RUDRA NARAYAN DAS,Picture quality very poor,picture quality poor mobile camera se kharab hai sony canara,2019-01-27,1.0
56,customer_review-R36YHC36JT0653,Mohinder,Camera is good but Batteries and recharger are worst quality,camera okbut rechargeable batteries recharger worsti spent rs2500 extra buy new ones due extra expenditure give 2 star,2018-04-07,2.0
57,customer_review-R6OSJ2SQP7BWG,HYD Customer,Very good,still getting aquainted important know got bag 16 gb sd card box dont order separately,2019-04-22,5.0
58,customer_review-R3D5CCW03K9G1H,Jayesh,Best at Price,price range think wonderful product initial userzooming quality superb auto focus better worth money,2019-08-27,5.0
59,customer_review-R3GELMWOESSA80,victor m.,Advertisement doesn't match,picture quality good budget product didnt send charger camera case advertised,2019-05-21,4.0
60,customer_review-R2BQB4IGR3RN80,Chaitanya kiran kulkarni,Great camera but on full zoom there are no stabliet ...,great camera full zoom stabliet good buget feel like dslr good beginners,2018-02-04,4.0
61,customer_review-R17Y2WPYJOXZA4,Ravi Ram,It's Sony,sony words describe,2019-10-07,5.0
62,customer_review-R2FBHSJXV1OSXA,Rajesh,Almost dead batteries provided in box,camera good batteries provided box dont charge purchased another set batteries check whether camera working,2019-08-21,5.0
63,customer_review-R2JURGPQFR2YQV,Chenna Rao Gollamandala,Great product from Sony,excellent product sonysony sony sony,2018-11-20,5.0
64,customer_review-R1V48F0F08TK17,abin,Gave a non- working product,product bad got non working camera face lot problems returning kindly please see happen anyone,2019-11-04,1.0
65,customer_review-R3JCH3Z61PH1UQ,Indranil Nath,Good Product.,good product begin manual mode good intelligent auto mode though ive tried many auto mode value money,2019-08-21,5.0
66,customer_review-R3SPM4RRWR15WV,JOGENDRA SINGH,"Product good, but no charger provided",product good didnt get charger spite replacement get 4 alkaline batteries,2019-11-13,5.0
67,customer_review-R3BKFM9UC1ZWNH,sibasish kar,Good product with affordable price,product good batteris pencil satisfied product pencil batteries price camera ok except batteries,2019-09-14,3.0
68,customer_review-RU62IAIE5GBPU,Amazon Customer,Don't buy,picture quality less 16 mp sony ordinary digital camera dont buy,2018-12-03,1.0
69,customer_review-R10JXV6G4YDAAN,Dr.Manuprasad k.s,Nice camera very easy to use,since 1 year using camera good performance recommend camera beginners,2018-10-06,4.0
70,customer_review-R38468X4E9X261,manjunath d.,Duplicate Power Batteries,technically issue much problems coming auto setting changing,2019-06-03,1.0
71,customer_review-R9JGUWHJ80DSJ,Suman Mondal,Five Stars,happy use,2018-06-30,5.0
72,customer_review-R226Y3A5APMJ3B,Alward engleng,Settings is the first step before you start taking photos.,good product start become photograph easy use run smoothly making vedio give better good osome night,2019-03-29,4.0
73,customer_review-R2PVVES973KRFZ,RNB,Good product,good product,2019-05-26,4.0
74,customer_review-R32PCU5JQ4FTFD,SANDEEP KUMAR KASHYAP,Good,good,2019-10-14,5.0
75,customer_review-R26KUOUZJH4SPO,Chitro,Good Camera,good features accessories received,2019-03-28,5.0
76,customer_review-R3HK93JW8ETLDL,Yash Barot,Superb,amazing camera least beginners try make alot videos youtube clients loved,2018-10-26,5.0
77,customer_review-R16WQFBZAXSRBD,amit ranjan,Average,average picture qualities,2018-11-20,3.0
78,customer_review-R2E44IQ7QXF9M,Sony,Good,good quality product lower price easy handle options,2018-09-22,5.0
79,customer_review-R2WH64G0BEQ5KH,Sonu Sharma,Asi service life m kabhi mat Dena kisi ko,default product receive hua h disappointed service ap clint k sath asa kaise kar sakte h bad sevice u r frod,2019-06-30,1.0
80,customer_review-R183SXK0FBFY91,Sunel T,5*,good quality product,2019-08-01,5.0
81,customer_review-R1RMMRLL6DM6IA,Amazon Customer,Good product.,good casual use,2018-11-17,4.0
82,customer_review-RM3CXQRCVJ95H,AJEET KUMAR SINGH,Supb,supb,2019-09-02,5.0
83,customer_review-RIUHGJEJ0SL1T,Sivasankar,Go for it.....,simply superb fast delivery amazon,2019-07-28,4.0
84,customer_review-R1SLBJ5JMQ6RQT,Parameswar,Very poor quality,poor quality,2018-07-21,1.0
85,customer_review-REEBNUMRORWMX,Ronak rathod,Totally waste of money,reviews dekh kar ye camera purchase kiya tha totally waste money isse achha phone ki clearity hei plz dont buy camera,2019-10-21,1.0
86,customer_review-R31T94OYL7OLWL,Siddhant singh,Good camera for the price,good camera provide rechargeable battery camera,2019-10-05,4.0
87,customer_review-R2XSC3SFL4YN0E,Gazhal Bhalla,Not working,camera stopped working despite changing batteries also return exchange repaired,2019-07-14,1.0
88,customer_review-RMO5D5SWI8D8A,Sndeep,Five Stars,excellent picture quality price,2018-08-16,5.0
89,customer_review-R1TIZY9C3HPIUI,Amazon Customer,Very Happy,wonderful,2019-10-01,5.0
90,customer_review-R2LKNMNFZYV4KQ,VIBHUTI VIJAY,Impressed,nothing better price range,2018-07-13,5.0
91,customer_review-R13QOJJB462OFF,Prithwiraj,Five Stars,fantastic product affordable price amazon best delivery,2018-03-22,5.0
92,customer_review-RLI0SPCR3JONO,KODAM NAGARAJU,Not bad.. pictures quality ok,easy use expect dslr quality bad good picture quality,2019-01-01,4.0
93,customer_review-R3M4ABCMQPGFLB,senthilkumar k,User frendly,really best prodect begener use buy dslr,2018-12-27,5.0
94,customer_review-RDCO8XST5KCS8,Amazon Customer,I am maximum products purchase Amazon.in easy operating systems very nice,sony camera like performance easy use thanks amazon best price safe transactions safe delivery,2018-10-06,5.0
95,customer_review-RKSB1Z9BD9K8F,Sarathkumar i,worst,worst product response amazon,2019-06-10,1.0
96,customer_review-R2660AYK9NJDDY,pratik Kumar Agasti,They are not providing charger and chargeble battery.,didnt receive chargebl battery charger,2019-10-09,4.0
97,customer_review-R3SP3DDLBXYBF7,RAGHU Kumar,Nice,beater,2019-06-09,4.0
98,customer_review-R1J04LEKA2VSFW,mani,Bad experience purchase for this product,camera ok u cheeted battery charger included box,2019-06-13,5.0
99,customer_review-R2WXF0IEEAILGR,Mayur,Very good,good camera battery damage two days otherwise camera zoom picture quality better,2019-11-27,5.0
100,customer_review-R3CNJ8TAUQPGM0,Amazon Customer,Mobile camera is much better then this.,bed products full zoom continus blur comes every 2 3 seconds dosent give continus clear video full zoom,2019-11-23,1.0
101,customer_review-R25PQOPO7ISEKC,Muraleedharan Nair,Three Stars,okay,2018-11-21,3.0
102,customer_review-R3GQN8P5MNICRI,SDITYA,Ok,ok,2019-04-30,4.0
103,customer_review-R3AYF1ABY86DS8,NEVIN,Reachargable batterty m,giving four star didint get rechargable battery,2019-10-22,4.0
104,customer_review-R3NB09YG4SHGIA,Kaustubh Arun Kulkarni,Handling is very easy and superb to click the pic,fabulous camera beginners handling easy superb click pic,2017-09-29,5.0
105,customer_review-RMPWPO5KCK1TG,Hari kumar,Waste of money waste of money,mobile much better plz buy wast money,2019-10-09,1.0
106,customer_review-R1ONSIJHHBXBNU,Mahes,Good,good,2019-11-11,5.0
107,customer_review-RLSYGAVUXCR6,Mayur Budhawant,Four Stars,nicefor starting,2017-12-20,4.0
108,customer_review-RLPA0TQ3XHA7Q,S.Das,Good,nice photography daylight condition,2018-10-22,4.0
109,customer_review-RDIQMV9SIUU5T,rahul s.,Nice product worth to spend money,nice product nice quality features good also handy,2019-01-27,5.0
110,customer_review-R1J817VJ4SXRH1,Amazon Customer,Best,best excellent,2019-08-11,5.0
111,customer_review-R8SFXLMSJTI69,John Kakumani,Not beyond my expectations,expectations,2019-08-27,2.0
112,customer_review-R3NEL4B9K7WQO0,Alpha s.,Came shuts down again and again,camera rotate thing scn camera whole camera shuts defected,2019-04-26,2.0
113,customer_review-R15KWLGKKQ2YG6,PRAVEEN KUMAR M,Amazing,amazing product good cost,2018-10-16,5.0
114,customer_review-R1MRCMWC74BSV4,Yugesh babu,Accessories missing,actually product good accessories missing dont know took thats giving poor review,2019-07-11,1.0
115,customer_review-RYECZ4QKEPYLW,Naveen kumar B P,not worth money,bad,2019-10-18,2.0
116,customer_review-R2TAF2BDSN6JUO,TUSHAR,One Star,lens rukh ja raha hai aadha nikal k,2018-04-10,1.0
117,customer_review-R3QDIFA7SI5JWM,k b kaprekar,"Beginner camera for sos use, more than a mobile camera",good camera bad quality picture zoom lens,2018-10-12,4.0
118,customer_review-RC5DU4ML0CQ9Y,Rajesh,Photo quality is not so good.,photo quality good,2019-07-07,1.0
119,customer_review-RWCSBR105FEXX,Amazon Customer,Avg quality product,picture quality per 201 mega pixel beginners good,2019-02-26,4.0
120,customer_review-R355BC1LHFO47N,Harsh Gulhane,Good,good,2019-02-05,5.0
121,customer_review-RV1E5K0YYPO6N,Amazon Customer,Sure shot,nice product,2017-11-12,5.0
122,customer_review-R2STYO66DFQUIE,Chinneprakash,Good,good,2019-02-27,5.0
123,customer_review-R3DTEXU2UZZ2NP,VIJAYMAHANTESH KUBAKADDI,Best for beginners,super camera,2019-12-07,4.0
124,customer_review-R2WI8G7COZ0FDD,pradeep k yadav,Excellent,worth price,2017-09-03,5.0
125,customer_review-R1KW4TAO9CTS2I,neeraj saini,Accessories are missing with product.,accessories power charger camera case missing product,2018-10-16,1.0
126,customer_review-R2T63TXFSUNP2C,Go Cool Customer,Disappointed!!!,good thought would,2018-11-15,1.0
127,customer_review-R38HK3F9BLV23H,"GOVINDA GOSWAMI, AGE 72",An ok camera,easy use cant use right without memorizing manual,2019-04-30,3.0
128,customer_review-R2F75PCR5D7SF4,GUTTLU SRINU,Nice,good photos,2019-09-06,5.0
129,customer_review-R2OHMSU48FVQWA,ramakrishna,Good,nice camera,2018-11-08,4.0
130,customer_review-RSL0YEW6XCENI,RAKESH,Good for daily use,picture quality good takes several second focus object,2019-10-13,4.0
131,customer_review-R1R8ZYFV5CKI23,kamal,Seller didn't gave me charger and extra batteries,camera worthy price seller didnt gave extra aa batteries battery charger,2019-11-04,3.0
132,customer_review-R1O5NVYMQ30JQE,chandrashekhar mishra,Incomplete shipping,given rechargeable batteries mentioned ad rest ok,2018-09-17,3.0
133,customer_review-R2OMXRJ4WMV8CW,manoj kumar,Average,like realme x camera,2019-11-07,3.0
134,customer_review-RJXD8QV7D5X5X,M G,Good for the price,good price,2019-11-25,4.0
135,customer_review-R3O9WRRV026PQV,KRL TRADING COMPANY,Five Stars,good,2018-05-23,5.0
136,customer_review-R1T93SUGONBHZX,Amazon Customer,One Star,camera case missing box unable contact amazon call back service active,2018-05-16,1.0
137,customer_review-RXNTXH4QJZBNW,Vishal,It's better to take in cell phone,good,2018-11-05,1.0
138,customer_review-R16X3420WV3IL2,DINESH,very very nice,nice,2019-12-01,5.0
139,customer_review-R3UKOL8BCLPORU,Vishnu Vardhan K,Sony the best,picture quality superb easy use everyone,2019-02-21,5.0
140,customer_review-R19UTCTA0TDHNM,Rejo Kevin Paul,I really loved this camera,budget camera iam using tjis couple month till issues good beginner camera,2019-10-21,4.0
141,customer_review-R19VRVQJCAY744,Ravi Chauhan,Fast delivered with Good packaging,nice productenjoy lot photographyvery nice product,2019-01-22,5.0
142,customer_review-R3TI6P9BFV6HKG,Manonmani,Not happy with product,worst product stopped working 1st day,2018-07-11,1.0
143,customer_review-RIEKOZCGVMYRV,Mr_roy,Please replace this item...,delivery time good product good,2019-09-12,1.0
144,customer_review-RULYB8QSJQSJN,Jidhan lal karsh,Best,like,2019-02-23,5.0
145,customer_review-R2V8O5L5QUC57N,Shruti Sharma,Amazing,received order timely cybershot amazing sufficient accessories,2018-07-23,5.0
146,customer_review-R2OJJ9CCGD7YW2,Manoj wagh,Battery Charger not with package,product nice batterycharger package help please,2019-05-06,4.0
147,customer_review-R1MN0E483SLFQB,Dhanu,Best for begginers,best camera loves photography recommanded begginers,2019-08-27,4.0
148,customer_review-R1S1NTU3IRL7YU,dharmesh banjare,Rechargeable battery and charger not including,every thing well rechargeable battery including also charger,2019-11-08,5.0
149,customer_review-R398NN8ZGLGLTC,kausttav g.,About battery,charge battries remove batteris charge,2019-07-23,1.0
150,customer_review-R3JPPO073E8DFZ,rupesh kumar,Defective product,defective product,2019-05-13,1.0
151,customer_review-RAYUJY6PWT530,Kedi meska,I needed batteries and changer too,camera good didnt get batteries charger camera,2019-08-29,5.0
152,customer_review-RQV041YB7MA7Y,Amazon Customer,Not good for this price. Comper to other brend not good.,good product,2019-05-06,1.0
153,customer_review-R178DRHJ2S409G,Monu Narwal,image quality 👌👌,nice camerafor begginerseasy useeasy blur picturelike dslr,2018-08-18,5.0
154,customer_review-RGBTN0CQKW59U,Praveen Kumar,Good product,good,2019-05-24,5.0
155,customer_review-R1HI26HVTBOQ8F,Pragya,Defective Item,zoom feature doesnt work bought item started hanging within 10 days,2019-10-16,1.0
156,customer_review-R3UYJVLWKMRSGR,Angel78,Ok,good,2018-10-06,5.0
157,customer_review-R2QW7MCRLYG85O,Udit,Camera received but memory card and cell not received I want to refund,camera received memory card cell received want refund,2019-08-24,5.0
158,customer_review-R3JQP97HX8LYRV,Deepak,Not bed not good,dont know settings pictures quality pictures bed quality,2019-07-12,2.0
159,customer_review-R2MQXMK4VBUWIO,vinod,worth for money,good,2019-04-26,4.0
160,customer_review-RW9WYPDTIFH10,vipin,Nice camera......,sony awesome camera good price,2019-08-17,4.0
161,customer_review-R314SIOADI43S2,Iqbal Khan,Not working,working received charger though charger mentioned faq,2019-07-22,1.0
162,customer_review-RJLB67EKCJKUG,Arun mozhi,Best camera for beginners....,awesome camera,2018-08-23,5.0
163,customer_review-R1VNW31HQQTHI4,Sreedhar,Bad,bad camera work properly many problems faces waste money,2019-09-21,1.0
164,customer_review-RJ0BNXG4UBWL1,reddeppa tulasaku,averege,battary lock lose battary system old,2019-10-04,5.0
165,customer_review-R34M41VTHGNM4Y,Pradeep,One Star,never buy product,2018-04-05,1.0
166,customer_review-R1FB6QNASIG1OW,Ananth Neo,Battery performance average,quqlity,2019-07-20,4.0
167,customer_review-RH5VC5OLDZCS7,Venu,Product is good but Charges stopped working with in 10 day of purchase,good,2018-10-01,4.0
168,customer_review-R2EJI71LRKLCP,SANDEEP AGRAWAL,Cam,nise cap,2019-10-11,5.0
169,customer_review-RCCI6NLN9GD64,vijaykumar potturi,Sony,product awesome nice looking easy use beginners,2018-11-26,5.0
170,customer_review-R1PMIL7ZEBZTCS,Aishwarya,Please give the customers good quality products,didnt get rechargeable battery cells auto focus soo good,2019-08-24,2.0
171,customer_review-R3GTL7XXQQPXGH,giridharan,Five Stars,awesome camera setting like dslrand clarity photos area awesome,2018-05-29,5.0
172,customer_review-R3NHFGKJWDE9G1,Wagh R B,Features not good,bad quality expensive compare quality,2018-11-23,2.0
173,customer_review-RRN8VOC081PK0,Amazon Customer,Good for beginner,good beginner awesome zoom good outdoor photography settings complicated take little bit time,2016-11-20,4.0
