,customer_id,customer_name,review_head,review_body,review_date,ratings
0,customer_review-R3ADBVD2RD1K55,Rajneesh Jihan,Go for it...,loved much per expectations good looking value money go without fail,2018-08-19,5.0
1,customer_review-R3G5Q08N82BAHG,Anandhu M,Excellent watch. Satisfied,excellent watch worths money consists dual timing system timer also programmed calender sleek design fits wrist perfectly watch awesome satisfied product amazon proved quality,2018-11-15,5.0
2,customer_review-RHSS6XICAMEEQ,Visakh.V,Very good..,goodit little hard see time daylightbut still superb watch price range,2017-11-21,5.0
3,customer_review-R2HUBP1RQY9857,Shubham Rathi,Just go for it.,better expected rs 695 cant get better purchasing worried quality strap really ok little bit problem watching time sunlight managed overall decent watch cant purchase fossil,2018-10-16,5.0
4,customer_review-R1MVUGFNE67VAJ,Avinash Singh,Cheap & best,good product intelligent marketing digital watch seen since childhood design makes worthy buying option sturdy light compact isnt better option price point dont expect gshock,2019-02-01,5.0
5,customer_review-R3W25WHWZYXF8M,EV,Good product; Feels a little over priced though,great respect looks functionality view angle dial comparatively narrow making quick glance time difficult also free loopor free ring little loose make strap periodically move,2018-07-22,4.0
6,customer_review-R2LO5XI7VMM2D,Aman Mishra,Worth the price.,almost year since purchased watch rs 790 working fine ive used rain also kept working pros splash proof durable ruff tuff alarm light basic features like stopwatch timer cons sweat get deposited around back side watch creates wax also band watch,2018-08-27,5.0
7,customer_review-R3C2N7X3SZO647,Shaaz Shaikh,Do not buy this watch,bad quality strap joint simply broke pieces months use without external force applied request refund,2018-08-16,1.0
8,customer_review-R25XC7BNC44IR2,Rohit Ku. Dwivedi,nice looks and functionality,product value money wish digital watch wrist built quality good comfortable strap nice big inverse polarized display due screen black numbers text white watch contain features normal digital watch contain dual time timer along stop watch watch gives good sturdy look worn whole day wear watch 24x7 felt specific problem till problem may occur cover display made low strength plastic easily gets scratched try avoid damage screen careful screen looks get dull screen even little scratched,2018-09-22,5.0
9,customer_review-RIR2ARFTWCS1M,Ramamoorthi,Unsatisfactory,watch highly unsatisfactory dial clearly visible even daylight back light also powerful regret bought watch,2019-03-21,1.0
10,customer_review-R37JUOXZQM7K9C,Surya,Nothing special about this watch,found nothing special watch looks good thats todays life kinda simple digital watches also available roadside cheaper price,2019-01-17,3.0
11,customer_review-RJBSXH3OW31U6,Deepak T,Fit Perfectly for casual and formal look,look cool made good quality plastic band flexible clock international clock alarm daily particular date snooze every hour countdown timer timer light full dial get light datetime day dial big look ok,2018-12-28,5.0
12,customer_review-RYHVBNVKEGBL9,Shantanu Datar,Fabulous Watch,1 month im using watch went snow trekking temperatures ranging 1 10 degrees watch stood terrific conditions also swimming many times watch totally water resistant led light great little tedious set time beginning get gist super simple highly recommended,2019-05-10,5.0
13,customer_review-RUX2DPB2P6K6O,Dinar Popat,Fake Product,bought watch 2times time problemno doubt got refund times 1st time defective piece 2nd received fake one ordered 3rd time lets hope best,2019-10-12,1.0
14,customer_review-RD00G302AHETJ,Amazon Customer,Good product with decent quality,value money quality good rusting months good maintenance seems fine water proof 100working stylish good looking may asked whether smart watch,2018-08-26,4.0
15,customer_review-R3V2FGOPB0TLX9,krishna sharma,ITS SEEMS A HIGH QUALITY PRODUCT STRIP QUALITY AMAZING MAY BE IT IS A CHINIES PRODUCT BUT ITS ...,using watch 6 month using long writing review big dial lover professional look iconic watch price light weight stylish look friend want know sound hmmmmmmmm great material quality awsm seems high quality product strip quality amazing may chinies product feel like brand,2018-07-10,5.0
16,customer_review-R14GP67933C05V,Amazon Customer,Beautiful Product,writing watch year date purchase even year body like new one color remain although face constant rain monsoon ruff tuff kind watch highly recommend one rusty lifestyle like,2018-12-30,5.0
17,customer_review-R3LOUX7SCXZNLU,Pankaj tiger,Skmei poor quality watch.,watch shown lookimg premium got found made crude plastic look clumsy poor display colour also different wonder folks amazon care ur customers overall product poor,2019-05-24,1.0
18,customer_review-R1YFRASZ25V3IQ,chaitanya a v s g s,Best Low priced watch with timer,best watch good looking timer stopwatchalarm else ask low price,2019-02-04,5.0
19,customer_review-R3SDKF5I0ALUFN,Jayant shingar,"Killing it 🤩 , fully stylish 😎",wonderful amazing watch watch pure sport watch without dailer beautiful reality love one well get following features 1 operational manual 2 real time time date 3 daily alarm sound snooze 4 chronograph stopwatch split counting 5 dual time 12 24 hrs watch 6 timer mode amazing features well get watch 1 thing want mention watch looks better reality also 100 waterproof mentioned specifications product details u r wishing sport watch u go highly recommend side 1 thing remember watchs beltstrip fully wholes fitting adjustment better 18 boys due watch zise vs wrist size loved,2019-11-16,5.0
20,customer_review-R1K5O8H5R0MP42,Keshav chandran,Nice item at a great price,look inexpensive watch mainly motorcycling trips something didnt need take care could use rough weather watch came good option lightweight seems built touch one star less screen protector sticker hard take finally use pin yank long term review come months far satisfied 500 rs used 800 km motorcycle trip perfect absolutely worth money,2019-12-04,4.0
21,customer_review-RO3CK627WQSQW,Nikhil Soni,Great buy worth a try,another great one amazon great packaging watch came good condition stylish accurate vest price range worth try update review 6 months usage,2018-01-29,5.0
22,customer_review-RNUZK9E36LMBQ,Prabhas saxena,Very nice watch.,product review watch great shown pic pocket friendly dial neither big small perfect looks good daily office use also young boys seller review seller pathetic sent said rejected piece scratches glass screw place even box skemi warranty card user manual temporary lamination glass missing returned planning reorder suggest amazon check particular seller,2019-11-03,5.0
23,customer_review-R1ZJQWNSJ7WOJ4,Dishank R. Gharat,Amazing and stylish!,bought watch 600 rs worth value get features describe looks pretty cool hip issues digits dont look clear thers little lightthe belts seem weak im always worried pull little hard theyd breakbut overall watch worth price,2019-04-22,5.0
24,customer_review-R17C30DXFPFQ70,Amazon Customer,Wrongly products information showing display not visible,display good visible per value 650 good value amezon plz dispatch material per details given,2019-05-07,1.0
25,customer_review-R3R2RM3AEL9KE7,"S.Abishek ☺️Thoothukudi, Tamilan da💪",Should buy. Very Good Watch at low price,good skmei watch amazon low price useful us specifications available good strong built quality looking cool looks like smart watch fantastic watch original product looking great low price,2019-03-06,5.0
26,customer_review-R26LVS59FQWKHB,Prince K,Satisfied and a bit disappointed for delivery process,watch quality built good purchased 491 delivery day price watch dropped okay improve delivery process lot,2019-08-14,5.0
27,customer_review-R7VK1XITPNFIY,Amazon Customer,"Display very dim, Not worth buying",display dim even light cant see night forget day bad display light design manufacturer didnt test releasing worth buying waste money,2018-11-06,1.0
28,customer_review-R27Y6JJCJS50WM,saj,Good watch and decent price,795 price watch nicely built quality good fact would like see improvement visibility illumination actually weak weak daylights pitch dark would decent though functions good kid likes much,2018-11-15,5.0
29,customer_review-R2QRB7UX6PEOB4,Vikram,Economical Digital watch!,dial certainly looks good product seems like value money chime option bonus wouldnt expect watches range easy handle mode options big sized dial make product worthy purchase,2019-04-04,4.0
30,customer_review-R3U3WQ9S1SHBTJ,Kamal Deep,Awesome product with all features as mentioned,awesome product features mentioned kudos amazon delivery time received exactly product shown beautiful design features prices looks expensive,2018-09-04,5.0
31,customer_review-RC2FJJQPE2R3W,Yadaiah gundhada,Display,first good product considering price problem want see time tilting ur hand wont show u means u r able see time side angle view point view improved simply display dim,2019-05-19,3.0
32,customer_review-R2AR74KJLLIIBO,Vigneshraj,Awesome look,awesome product price range looks cool,2018-05-18,5.0
33,customer_review-RPQ94DN6FO2S6,Hrusikesh Mandal,No Buy,day time visibility low see time see watch straight carefully day useless cant read mon wed outward appearance good useless features didnt returned watch left summer vacation amazon allow return would great,2019-07-05,2.0
34,customer_review-R23T5LJ8G09VTW,Amazon Customer,"Product good but Seller packaging not good,product was in different box rather than company box",product good people would find hard adjust calender nowhere mentioned calender settings manualnext get watch normal white boxproduct company box plain boxwell box matter watch pretty awesome,2019-01-29,3.0
35,customer_review-R1H66OWL8H0QGW,Darshil Khatri,Unboxing of s-shock😁,bought rough purposes like running watch good although dial visible dark done unboxing,2019-08-20,4.0
36,customer_review-RDEWFRXN0IB3K,Mehul,Average Product.,watch looked exactly expected strap watch built quality good price size also adequate biggest con display brightness dim low thought battery weak even light function low brighter display would perfect watch price,2019-07-19,3.0
37,customer_review-RN6V100YHHTYM,Akashsingh P. Lodh,Just Buy it@Features in this watch.,watch actually good looking stylish along watch features like dual time counter chronograph backlight big dial water resistant etc certain advantages watch like watch shows time24 12 hour format hour minute seconds day date month year makes watch actually nice,2018-12-30,5.0
38,customer_review-R14C5BZCMN716H,Shubham a.,Mood off kr dia isne😫😫,product got stop working 2 months 6 month warranty service center also buying please use extreme return period sarisfied yr go sonata casio little expensive service good parts easily availaible,2019-07-20,2.0
39,customer_review-R2BHSN0G3DZ4,Narinder Singh,surprisingly good,got watch check dimensions could find proper details anywhere 50mm case diameter also watch surprisingly good sunnto replica negative display really liking wearing almost every day see die post review stop working working nicely without problem,2019-09-21,4.0
40,customer_review-RVLOKNR4TZ6I8,Siddhesh Athavale,Good purchase,normal digital wrist watch functions working major con visibility sunlight strap good quality wont wear soon,2019-07-19,4.0
41,customer_review-R1U135VOYSPKWG,shahzad shaikh,Watch is playing up already,display changed stopwatch alarm automatically randomly change even changes 24hrs mode 12hrs mode,2019-01-14,3.0
42,customer_review-R3IYGBM1BXOFQZ,naveen,best buy,one favorite cheap doesnt look cheap hand features really exciting hourly chime dignity look hand,2019-12-07,5.0
43,customer_review-R24VDQ1RI30MF1,Swami,Nice watch,pros nice watch budget great looking cons sunbright light much clear display okay needs improve,2019-08-12,4.0
44,customer_review-R2QWLVDQE6P481,Eshwar,Watch is good and stylish but not value for money,watch good stylish value money price shod rs300 rs350 bcoz watch made plastic display came exepected suggest u buy watch,2019-12-03,5.0
45,customer_review-RP7Z4ARCQ8HQM,akshay,nice and economic product to buy,nice looking watch im using quit long didt find issues material used also good value money looking something digital low budget go,2019-05-24,4.0
46,customer_review-R3MGHNDUY3A7W5,shan,Product is good but received rejected/damaged pieces...,product good received rejected piecesi booked 2 times received damaged pieceand returned selleryet refund initiated methe customer care saying take 10 working days refund returnthis 20th day return refund initiated yet,2019-11-21,2.0
47,customer_review-RNIRD6WGR2JQ0,Bhargav bhatt,quality down,4 months ago bought watch photo white bg today got different old one dial silver 2 strap holder dial light looks cheap old one way better dont know real one fake want old one,2019-04-16,5.0
48,customer_review-R1I558BPZKNFXR,"Bhuvan ,Goa",Basic but good looking watch.,looks good problem watch proper water resistance glass gets scratched easily otherwise good watch price,2019-11-04,3.0
49,customer_review-R22P0WBCX9RCFW,Anupam Chandra,Pros & Coms,pros look wise good plastic quality ok cons setting alarm tricky set alarm calendar date watch visibility poor scarcity light,2019-09-25,2.0
50,customer_review-R3KKKAQJTUYCUK,Amazon Customer,Go for it.,nice watch value money using since 5 months problem dial big looks fashionable led bright enough comfortable,2019-11-24,5.0
51,customer_review-R2VUTXNO5LRBYM,Sandeep Kumar,received different item.,product different one ordered dial colour shown black pictures item recieved silver colour,2019-09-02,1.0
52,customer_review-R1ARN1LV1LVKUJ,Amazon Customer,Cool product....,cool looking watch best product price negative reviews negative display like display looks good hand,2019-05-29,4.0
53,customer_review-R30C785U55EH1Y,Ranjan Paul,It looks nice and classy though I find the the light not ...,product arrived scheduled exactly described website looks nice classy though find light good,2018-02-24,5.0
54,customer_review-RWIXNMCGKAJNC,Amazon Customer,sporty and nice watch Good looks,real trendysporty nice watch good looks comfortable wearing nice display also worth money,2018-05-06,4.0
55,customer_review-R53KZEABMYCLT,Ady,Value for money 💰,cool wrist watchvalue moneyi using last 3 monthsdidnt check water resistance yetdesign really nice,2019-07-12,5.0
56,customer_review-R2TNXAZ4BLBQ42,Pratik Panchal,Very nice watch. A must buy. Value for money.,built quality good strap material hard tough fully loaded features one thing liked green light light weight looks classy full black colour,2019-11-29,4.0
57,customer_review-R1BXBVZC0K8KNZ,Vasanth,Good product,posting review 6months use really good saying working maintenance department dust muddy areas got dipped diesel etc also watch working good,2019-10-29,5.0
58,customer_review-RKB8B89FK05XT,Vanita,Loved the pattern of this watch.,battery low due back light bright thats reason im giving 3 stars,2019-10-22,3.0
59,customer_review-R2N7U8RYBESOL,SEENU,Totally worth your money!!,u hung whether buy thing would recommend totally go little brother kept refrigerator 2days approx mistake doesnt seem effect product amazing build quality,2019-09-14,5.0
60,customer_review-R12KLHVINMI1XD,Rishabh,Zero water resistance.,watch useless got filled water soon water touched says water resistance till 5 atm fake dont buy,2019-12-16,1.0
61,customer_review-R1BCQ1N6HJBX0T,Saneesh P F,Satisfactory,times difficult read time dark light also strap got damaged one year,2019-03-02,4.0
62,customer_review-R3DKWH44UA9UGN,John J.,Unsatisfied,backlight delivered watch completely different image shown amazon also guarantee card package replacing watch also things didnt changed dont buy product seeing image,2019-12-09,3.0
63,customer_review-R239NKYFTGD3KK,Ankush,Three Stars,decent watch price bit high,2018-06-05,3.0
64,customer_review-R2BOW7YP3NUUP,Amazon Customer,Overall good product,like style light weight drawback visibility dial dull unable see time brighter rest good,2019-08-19,4.0
65,customer_review-R195F6GIFEM4ZF,Vanshaj,Look nice but not useful,display low able see daylight,2019-08-18,1.0
66,customer_review-R213LKKNFE2BPW,Amazon Customer,Defective one,watch okay excepted glass inside dot mark available 3 places make return progress kindly check completely received,2019-10-12,4.0
67,customer_review-R24BFNSBOGJPG9,Debarghya,Nice watch for the money you spend,watch good robust appearance felt back light little low dark press light dial little lesser otherwise good product wrist strap good design,2019-04-23,4.0
68,customer_review-R331G8NUID0MEA,Dr. vijeth,Can't see time in daylight,cant see time without pressing backlight buttonits worst ideawe need see time quickly without pressing anythingback light also light makes u see time struggle like blind,2019-09-08,1.0
69,customer_review-RM8QGHBKEXUSK,hari,Not worthy,poor quality water resistant looks foggy inside rains low profile watch im disappointed,2019-10-23,1.0
70,customer_review-R9S2ZWJRXYE58,Amazon Customer,Feel the expensive look in a small penny,using last 2 months works really well actually im fan less priced watches thought trying believe really stylishmany colleagues thought one expensive watches,2019-07-01,5.0
71,customer_review-R2DD2AO7JKUXQF,Amazon Customer,Battery is not new,display visible dullseems assembled long back battery change others every thing fine,2019-11-24,2.0
72,customer_review-R1N0I76I3UQGIN,Talib,Dial are small,watch ek h bas muje umeed thi ke dial bada honga pr dial bhaut small h,2018-12-21,1.0
73,customer_review-RU8T37PMJTZ42,Shreyas Kamat,Best sports watch,nice sports watch skeimi loved easily shows time daylight especially sunlight timer function stopwatch function dual time function works well nice watch sports people,2019-10-28,5.0
74,customer_review-RKNXV29HHW83G,Shijil ganesh,Go for it,looking premium looking watch reasonable price search ends good looking good quality product realy worth,2017-10-09,5.0
75,customer_review-R15GHBWUOW8RXB,Anuj Sharan,Nice watch.,nice watch design also nice colour aslo nice good look nice hand wearing,2019-08-22,4.0
76,customer_review-R3BT7QHIW4XWZ,Vinay,Average Product,led display little brighter appears dimmer compared advertisement image improvisation day date setting needs done,2019-10-19,4.0
77,customer_review-R3605XRLU35H2M,TATIN BHOWMICK,Value For money Recommend for every student and engineers.,value money default light low function works good fittings efficient size hand looks professional one thing alarm decent good one thing concern light,2019-09-26,4.0
78,customer_review-RYK9PK348EVEN,sumit,Good under 300 rs,good 300 rupee giving 600 rs think twice still function work properly display good enough stap goodalso dont think water resistant,2019-11-01,3.0
79,customer_review-R2KJZFUR3ZGS93,TRINADH,Feeling awsome... 😘,guys really great purchase got rs 499 looks like premium watch worth every penny,2019-08-04,5.0
80,customer_review-R28PLWFQHWUZA,Emmanuel m.,Very much recommendable within this prize Segment,im satisfied watch ive using almost 45 months problem functionality,2018-11-20,5.0
81,customer_review-R317YGFJF5WAP3,Abhin kamal,Dont expect more.. !!,dont expect muchnot expected reviews photos bulky watch looks simple duplicate gshock watchesvisiblity display average,2019-10-06,3.0
82,customer_review-R2LFQ2MBAJMI8B,Joshua W.,My first and favorite Watch.,watch first order amazon really special want watch love buy love,2019-12-19,5.0
83,customer_review-ROJOIOYIQQHAT,Amazon Customer,Nice watch,watch nice build quality good strap also good overall give 8 10,2019-02-10,4.0
84,customer_review-R3JQQH5I0285JE,Manali Toshniwal,Good,nice best price n quality,2019-09-23,4.0
85,customer_review-R2OCPUSDTF6GQO,anoosh,awesome product,good product price working fine shipment reached time,2019-06-22,5.0
86,customer_review-R3QZSU6AF7HTA3,Nipun,Three Stars,watch looks cool strap doesnt stay place long time everything else fine,2018-08-14,3.0
87,customer_review-R3T72AL68YRFQZ,Krishnakanth tg,Good looking one in the budget,good looking one budget invert display key tone extra care needed strap,2019-08-21,4.0
88,customer_review-R3UODYSM2DF9Z4,Ritender singh,Water Resistance,water resistance mark watch ac compartment 24 hrs moisture come screen apart watch reliable good looking save pocket,2019-10-19,5.0
89,customer_review-RIG8NX3IB9A89,Parvinder Khosla,Nice watch,nice product would nice could set automatic repeated time alarm half hour,2019-09-08,4.0
90,customer_review-R31Z9ICYW7440A,rohit,Normal,display visible clearly,2018-09-12,2.0
91,customer_review-R1SFPIH8NSCUG3,amit,Looks premium as compared to traditional digital watches.,good product reasonable price backlight shown pictures 3 seconds difficult see time dark overall nice product,2019-08-10,4.0
92,customer_review-R1T6ZZ0LOF76TL,Sanuraj Pillai,Good buy,offers excellent watch less cost would recommend buying also check seller rating cheated one 2 months back time got right product,2019-07-19,4.0
93,customer_review-R8KHN2ZJPX2IW,Santhosh Rampay,Perfect,watch awesome working really good best part four buttons working perfectly guys go ahead buy,2019-10-07,5.0
94,customer_review-R1V3PMC0BLHXD9,Sanjay,only for simple uses,simple uses setting dificult,2019-10-13,4.0
95,customer_review-R1TJYD7T6IISUI,Prateek vasishta,Good product and value for money,truly value money matches expectations water resistant glow night bit dim thats dampner overall good product,2019-07-28,5.0
96,customer_review-R316PMKYAD02TA,Avi singh,Great,comes proper box bhild quality awesome bothbox watch,2019-10-11,5.0
97,customer_review-R2NKNZMHYLFORB,Sanchit,So coool,cool product dual time year format timer function also,2018-11-27,5.0
98,customer_review-R3PLYL7C6EHSIA,pranay kamde,Awesome watch,nice looking fits hand perfectly awesome watch loved,2019-07-30,4.0
99,customer_review-R28S6B62V0PDG7,Gaurav Thapa,Best watch in this price,dual time best option im 1 click see 24 hour 12 hour format time better watches price,2019-08-13,5.0
100,customer_review-R3VV055PWCAERD,#NISHANKRAI YOUTUBE,Nice and cheap.,nice price point,2019-09-06,5.0
101,customer_review-R16FWLLQ2V1S3X,Sahil M,Bang for your buck.,better expected smart sturdy reasonably priced every around asks brand watch smart watch samsung frontier s3,2018-05-04,5.0
102,customer_review-R13VCNIDYRTWOJ,Sujeesh John,Excellent experience and value for money purchase,cost brainergo ahead using quite happy,2019-05-26,4.0
103,customer_review-R3EB02BMNXV3F1,Himanshu Verma,Value for money,food watch durable nice looking water resistant problem delays 1 min day,2019-07-30,5.0
104,customer_review-R1CRZWA49ZLVKD,Amazon Customer,Good product,nice product really stands apart wrist watches got attention,2019-08-25,5.0
105,customer_review-R1SR0JGLPNJQ6T,Vinayak,Good Product,delivered end aug 19 watch looks good functioning confusing proper manual provided,2019-08-25,4.0
106,customer_review-R24S7BVG9N3V9E,Himanshu Meena,Excellent,good looking watch good price comfortable wear looks premium go,2019-10-29,5.0
107,customer_review-R2JOQ0ZYI8J0XY,athuljestinjoy,Classy watch at cheap cost,expectations labels like date week month chime etc show always present screen use,2018-10-31,4.0
108,customer_review-R85S1VPL92FT9,Aakash,Dial design fade after sometimes,watch functions r awesome problem design dial fade sometimes otherwise good watch rang,2019-06-09,4.0
109,customer_review-R8MUTZ1Z0LHX3,Amazon Customer,Suggest to buy this watch,awsm low price gud use daily life style watching one judge cheap product,2018-11-19,5.0
110,customer_review-R36USELODC6MXR,MOHANRAM,Good for casual wears,material 4stars alarm sound audible light okay feels good hand cool college folks causal wear gives rich look,2019-01-28,4.0
111,customer_review-R1772O1Q1ARROS,Bonnie D.,Day And Date Is Not Updating Automatically,day date updating automatically,2019-12-03,4.0
112,customer_review-R1EXOPGYALY2WR,Sagar Sen,Good one with a few knockdowns,looks sleek though issues cant see time daylight blurs screen protectors arent good enough light color green,2019-05-31,3.0
113,customer_review-R2EE04C4WQC5AX,AJAY PRINCE,Good guy I suggest u to buy.,good guy suggest u buy,2019-07-03,5.0
114,customer_review-R3HP0YMT3ZU5Q8,Kindle Customer,Good,liked price value nice soft strap screen visibility great may option keep screen illuminated,2018-06-13,3.0
115,customer_review-R1Z8T0AA5TJPYI,Anup Kumar Saikia,Value for money,product nice illumination dark shown picture manufacturer somehow acceptable,2019-08-22,5.0
116,customer_review-R2RJSUA4MALRM6,Raajan Anand,Cool watch.,worth buying cool watch,2018-01-24,4.0
117,customer_review-R1S0IPH4JGZAQJ,Amazon Customer,Value for money,watch excellentbut delivery late,2019-10-05,5.0
118,customer_review-R19O93X7YBGGDA,M.Arul,Five Stars,grand look im fully satisfied product,2017-10-11,5.0
119,customer_review-RBPIYP7Y1TGP1,Ashu,Quality was good,nice product quality good,2019-10-19,4.0
120,customer_review-R1XV99NKILZYHB,Srijon Mishra,Nice watch,great watch good display problem faced buttons tend go soft ie dont stay stiff allinall quite nice buy,2019-10-12,4.0
121,customer_review-RZED9K1DP494V,Rakesh,Best product...In Price,good digital watch working fine last 2 months best,2019-06-21,5.0
122,customer_review-R3GTYQ45CDF7OG,Shivam kaushal,"At this price, you cant go wrong with this watch.",value money product used 20 days review works good,2019-02-12,5.0
123,customer_review-R3PDPT3ZLWUHNO,Vijay,Wastes,cheap product dont waste money choosing watch horrible like anything even 100 kids watch better waste product,2019-09-24,1.0
124,customer_review-R3TUSPTVNQ30Y9,Amazon Customer,Great buy,product really worth money timer set seeing manual tube videos strap thin otherwise highly recommend,2019-09-15,4.0
