,customer_id,customer_name,review_head,review_body,review_date,ratings
521,customer_review-R3R5BSW5YRP4Q,Chennai sports,Not as expected.,dislike,2018-07-31,1.0
522,customer_review-RXPTANFVYPDPU,Nikesh,Pay problem,return pay,2018-08-11,1.0
523,customer_review-R2YGLR9UYH7ZMG,Satyakam,Not for kids or non-ultra wealthy adults,takes cartridge gives 20 photos fits palm thousand bucks depending upon kids obsession clicking picture might need least 510000 daily maintain use buying high quality digital camera printer photo paper combinely cost way less want lesser hassle always print online worth,2019-10-18,2.0
524,customer_review-R2SXOWG9FW0XAV,Vishal,Per photo cost around Rs 50 as Films are way too Costly for this camera,product good per photo cost around rs 50 films wayy costly films provided also spend lot films,2018-07-17,1.0
525,customer_review-R369ZKYCMXSX3M,Ramesh,Two Stars,give back cover place films inside camers,2017-09-26,2.0
526,customer_review-R14IOXQ8Y4U4YP,Hem Sadan,Detailed hands-on review after using Instax Mini 9,instax mini 8 one favourite fun camera instant photo lovers keeping popularity mind fujifilm launched new instax mini 9 minor upgrades unlike countries instax mini 8 indian market successful attempt due less popularity instant cameras turn tables fujifilm come updated version equipped selfie mirror minor upgrades let get details box 1 camera 2 two aa non rechargeable batteries 3 strap 4 closeup lens 5 manuals sticker warranty card design unique retro design attractive pastel shades one major reason people love camera instant camera fujifilm keeping retro look intact renewed colour range cool colours like cobalt blue lime green ice blue flamingo pink smokey white weighs around 350 grams battery measures 456 x 466 x 269 inch also built plastic thats make look like toy camera improvements design includes tiny selfie mirror front camera lure selfie lovers close lens attachment help capture macro shots precisely hardware camera features 60 mm lens f127 aperture flash always light whether indoor outdoor also houses light sensor helps automatically adjust exposure per lighting condition need turn dial per indicator dedicated high key mode addition model maximize brightness comes set two aa batteries instead would recommend use rechargeable batteries need buy separately save bucks also photo count analogue meter back counts number shots remaining,2017-10-13,4.0
527,customer_review-R1NBO8UCBZ3WHN,Nidhi,Retro Classic and Easy to handle. Basic tho,product basic model instant camera range might know good beginners trophy cam people wanting polaroids memories although basic features good enough get lovely pictures taking pictures need intellectual properly understand exposure focus cam,2018-06-03,4.0
528,customer_review-R2C09PJ54SNJ74,Puja Agrawal,Buy a printer instead.,product appeared good initially images stopped showing film weird investing may result disappointment buy printer instead,2019-08-17,1.0
529,customer_review-R2J8PGU0I2970V,Amazon Customer,Don't buy it because they don't have a customer care center,working,2017-10-27,1.0
530,customer_review-R3TF76ZW2TIC44,Mastergods,Best instant camera,dilevery super fastif instant camera cheap alsoand best also know use please search youtube made plastici love camera using camera form 3months loving easy start change lense thank,2018-03-07,5.0
531,customer_review-R2YOATSM7GGD47,Rohan Dhanashri,No rolls and very expensive,film rolls polaroid already expensive upon rolls makes worse person gifted font even chance taste quality gift dont even get chance return,2019-06-12,1.0
532,customer_review-R2XQ2OI0TSDZ3I,Yasmin Mitha,good,photo claraty good picture dark,2019-11-08,5.0
533,customer_review-R12AVRW0GC5JN0,Amazon Customer,good camera. liked it,good camera liked good people love instant photos memories slow delivery amazon okay afterall great experience amazon,2018-01-14,4.0
534,customer_review-R138V33LV5M7DR,Pritesh,Not working the camera,dear sir bought camera working click pic come blank film sorry said u bad thing given amazon,2019-10-10,1.0
535,customer_review-R2SWORYRFDV8HB,Rishabh,Value for money,easy use amazing styled product image quality decent works amazingly clicked outdoors didnt expect quality price,2018-12-14,5.0
536,customer_review-R2KME7Y3AT2HL4,Yugma,best gift ever,ultimate productbest gift ever product delivered described best way creat long lasting memories dont think much buy,2018-03-20,5.0
537,customer_review-RF65XK8P5FDOD,Sahil gupta,Don't buy it,dont buy bad product photos dark bad quality,2018-09-19,1.0
538,customer_review-R1RK16XPXFAUCT,Amrut Kadam,Cheap product,happy product still request want accept product return refund money,2019-09-11,2.0
539,customer_review-R365ARM0D81VRG,Dhanraj,Not worth it,product provided required accessories bought separatelynot even sufficient information product provided,2019-03-26,1.0
540,customer_review-RXRB9252CJOUO,Santosh Karki,Awesome,nice productand happy product get sticker strap lens also along say value money,2018-01-11,5.0
541,customer_review-R1JOF1GYB1A6R8,Gunjan,A great product,great camera additional selfie lens definitely better previous versions polaroid stop working middle due issue batteries film apart minor problem amazing product must buy,2017-12-28,4.0
542,customer_review-R8IFXVLADNWEH,Amazon Customer,Gives a bit of a old touch in this new modern world...,best product ever,2017-10-19,5.0
543,customer_review-R25KHB6NBWMRF2,Pruthvi,Not working,product working light getting able return product also,2019-10-15,1.0
544,customer_review-R2ADZQ3UWRFU7U,shalini,Initially it was great but suddenly after two pictures the lit circle has ...,initially great suddenly two pictures lit circle stopped working,2018-03-30,1.0
545,customer_review-R3M863SU5AIH0X,Amazon Customer,I love it,like lot really nice clicks cute pictures quality really nice weird dont like even little bit product,2019-06-17,5.0
546,customer_review-R3QIP6ASQP6P3V,Rustam s,good product,handy picture quality ok way camera film somewhat expensive overall nice product worth money,2018-11-29,4.0
547,customer_review-R3QSDQIER96MWP,gagans157,toy for teenagers,regular toy teenages refills expansive,2018-09-22,2.0
548,customer_review-R3M4H4HT13UI4G,Shweta Gusain,Amazing Camera,mini 9 amazing entry level instant camera loved pictures justice description although indoor pictures little whitewashed fine,2018-10-13,5.0
549,customer_review-R1258VP5E5WACR,Mohit,Great product,bought 60 shots saved money always better carry extra cartridges travelling packed individually stored easily,2019-05-15,5.0
550,customer_review-R1QGGNQSIIECDP,swapnil,Best for instant picture.,ive purchased great indian sale product value money far product good picture quality decent,2018-10-14,5.0
551,customer_review-RCP2DL3RXN3UY,Arnav,The camera makes you feel like you're in the 90s,brother gifted birthday happy camera makes feel like youre 90s great long youre expecting crystal clear see everyone types pore pictures great chill friends perfect scrapbooking think main reason people buy nostalgia instant gratification see picture without waiting developed somewhere nice color,2017-10-12,5.0
552,customer_review-R1BJC3D2GCT6RY,SurajShindhe,Defective product,bought product defective ordered replacementthe product defective againboth times product defective,2019-01-28,1.0
553,customer_review-R2EXI12T20VKXI,Amazon Customer,I,bad product,2019-10-04,1.0
554,customer_review-RHMCCZ6TWRZ5A,Amazon Customer,Waste product,dont buy product fake product used product received satisfied product waste product,2019-02-21,1.0
555,customer_review-RFGYP5L1B35G0,Sk,Small photos,really liked photos size small,2018-08-29,3.0
556,customer_review-R1RCBY1TAMHF4,Satish Kumar Thumu,One Star,recommendedthe films costlyits better purchase digital camera instead camera,2017-12-28,1.0
557,customer_review-RS65JFIQFMX0W,Gryf-therin,Bought it last week and works absolutely fine. The flash is amazing and the picture quality ...,bought last week works absolutely fine flash amazing picture quality muuaaaahhhhhh,2018-03-04,5.0
558,customer_review-R50RSAJ25KTYR,Akhilesh Pandey,Not fulfill requirement,received without gift wrap,2019-05-08,2.0
559,customer_review-R3ROSPWLGKMR1T,Aditya Arora,Encroaching product,quite amazing product request dealers send sample films camera gather audience,2018-03-14,5.0
560,customer_review-R4LLMNDRS2EBH,SAPNA SHAH,Non affordable,expensive,2019-10-26,4.0
561,customer_review-R1CPMP9E90YFW2,Amazon Customer,Horrible product,horrible product guarantee return product buy,2018-08-18,1.0
562,customer_review-RK2CRTEQM46P9,Kaydee,Nice,nice,2019-10-09,5.0
563,customer_review-RSTU5GPC2T0PL,RAVI KUMAR BISOI,Good for travel and decor,fancy thing,2019-06-24,4.0
564,customer_review-R1XF0WNXQRZAG,Neha Pednekar,Perfect surprise gift,louv,2018-07-12,4.0
565,customer_review-RM2AJQWLG3KNB,Arnav,The camera makes you feel like you're in the 90s,brother gifted birthday happy camera makes feel like youre 90s great long youre expecting crystal clear see everyone types pore pictures great chill friends perfect scrapbooking think main reason people buy nostalgia instant gratification see picture without waiting developed somewhere nice color,2017-10-12,5.0
566,customer_review-RLEKGRY0IAFA7,subham singh,Amazon the best,nice camera,2018-03-13,5.0
567,customer_review-R1YZCH7AQE8SYT,Vanshita,this is amazing,like,2019-08-01,5.0
568,customer_review-R2ZWF2K16ATIGB,Rosmith,Click pics instantly anywhere,real fun gift surprise click pics instantly,2018-10-20,4.0
569,customer_review-RG0K9XDW7MEDY,sanchita,Product viee,amazing product,2019-10-08,5.0
570,customer_review-RUVVXGMFTE3N3,Jithin Reddy Inreddy,Happy to buy this!!!,value money,2018-10-22,5.0
571,customer_review-R1VIS96OWG88PX,Abhinav Reddy,Good,good product,2019-07-30,4.0
572,customer_review-R2U9K10UTIWB5I,Pratibha,It's an excellent experience to shop with amazon,buy sister happy got polaroid,2018-05-15,5.0
573,customer_review-RU0SMDVEXHX09,Amazon Customer,One Star,absolutely rubbish,2018-05-09,1.0
574,customer_review-RUB9BVDFGRWNH,RMT technical,it gives you instantly photo also it takes selfie,dont much money dslr cameraso camera right choice youi like camera specifications directly give photo clickcamera light camera film goodit takes mini shotsits good camerai youtube channel called rmt technical get camera make one video unboxing instax cameraif like review helfull please vote,2018-06-05,5.0
575,customer_review-R2U4P4SMUI1ROP,Sarhon Bey,Very good product,good product must buy,2018-09-22,5.0
576,customer_review-R1ZJYYRS3UBD6D,iamraviroy,Five Stars,value money,2018-01-24,5.0
577,customer_review-R3AM7S6JODXIJ5,VIKAS JAIN,Five Stars,perfectmy daughter loving,2018-01-31,5.0
578,customer_review-R1PBI2SX2HJXPH,Arnav,The camera makes you feel like you're in the 90s,brother bought gift birthday really happy camera quality makes feel like youre 90s great long youre expecting crystal clear see everyone types pore pictures great chill friends perfect scrapbooking think main reason people buy nostalgia instant gratification see picture without waiting developed somewhere nice color,2017-10-12,5.0
579,customer_review-R23JWIYWU51B2L,Arnav,The camera makes you feel like you're in the 90s,camera makes feel like youre 90s great long youre expecting crystal clear see everyone types pore pictures great chill friends perfect scrapbooking think main reason people buy nostalgia instant gratification see picture without waiting developed somewhere nice color,2017-10-12,5.0
580,customer_review-R31HR4SU46E97Q,Rukmani Kadian,It reached me nicely packed. The color is also beautiful and I ...,cute camera reached nicely packed color also beautiful love,2017-10-18,5.0
581,customer_review-ROPXA3P715MDG,Nimit Thawrani,Wanna publish a lovely review on youtube,hello sir youtuber interested reviewing product price low price good request please give one sample product make video review peoples know buy promise disappoint,2017-12-12,5.0
582,customer_review-RXZ5MT1QNWPLH,Shail Pancholi,Five Stars,takes amazing pictures print quality great,2017-11-08,5.0
583,customer_review-R158IZZYPWCLD0,imran k.,Four Stars,get cartridge thisif run,2018-01-31,4.0
584,customer_review-REY2C8WDEUO1S,Vidhi Choudhury,Nice,good product loved,2018-02-03,4.0
586,customer_review-RX7Y39B49YCES,Karan Rajan,Awesome,bought little camera whim curious works dont regret decision one bit amazing camera price many good features like exposure close shots even light balancing even instant camera photo quality films quite good develop really fast added extras like strap close lens really good also get wide variety film types like ones stripes colored film comic film etc etc get perfect memory pic overall amazing product definetely worth even full price,2019-11-01,5.0
587,customer_review-R1HU5SXZOPWG0R,Abinash Behera,Very nice product,awesome,2019-08-18,5.0
588,customer_review-RK2OOIK1XVXW1,plnchowdary,Nice,excellent,2019-10-07,5.0
589,customer_review-R35MHDR4O2KDRL,Karma B.,Very good,good,2019-09-05,5.0
590,customer_review-R22ITMCJ3HHYAB,Masarat,Costly,good costly amazon 500 10,2019-06-10,5.0
591,customer_review-R2TI4RENO82JQ,Amazon Customer,Its messed up after some use,bought camera took 8 pics suddenly nxt pictures started come blank image printed clue happening anyone solution help solve good selfie click certain distance click okay,2019-12-23,2.0
592,customer_review-R2SLDMJ5Q3O1FW,Hariraj,Very good tech.,excellent product easy follow instructions would like inform get following 1 camera 2 instamix films 3 batteries operate tech make sure follow instructions,2019-12-16,5.0
593,customer_review-R1W7ITIZKIBVZK,Ramna,Loved it,loved good,2019-12-24,5.0
594,customer_review-R2EXM3LSSH3TE9,Nitin k.s,It's good,good camera beginners,2019-12-21,5.0
595,customer_review-R3NBSSIGF7TV6,Amazon Customer,Good one,worth money filmis much expensive,2019-12-25,3.0
596,customer_review-R24IEK88HS3Y9Y,Karthika,She loved it :),really happy got lil sister,2019-12-18,5.0
597,customer_review-R7YEM563GWQIE,Neeharika Lorimer,Not working,work,2019-12-16,1.0
598,customer_review-R1NCIL5Z4GD74F,jothydev kesavadev,Can’t take photo print outs,fake cartridgeprint paper camera battery came along camera get time return,2019-12-24,1.0
