first ever ipad loving heavy apple question quality pixels display read reviews says screen turns yellow think product changes warm mode depending natural light ensure harm done eyesight works wifi got wifi hotspot carry works super good using amazon prime videos enjoying max got cover well protect device stand feature product amazing battery back lasts 24 hours watching browsing movies videos games heating problem,,,,,
little heavy hand otherwise fantastic product dont see screen gap issue good one day delivery amazon,,,,,
firstly lovely piece technology needed something replace laptop browsing web creative use art apps think ipad lives name even though isnt pro think many ways make work buying third party stylus andor keyboard add think great device anyone use especially students portable sturdy likewise think anyone market ipad seriously consider device observations 1 lightweight rounded edges fit hand like small magazine 2 battery life brightness product awesome charge weekly twice week much gaming video playback 3 box contains charger cable starter card 4 fingerprint scanning home button makes easy unlocking ipad speakers bottom edge speakers offer strong fidelity leave wanting volume 5 8mp primary camera 12mp front facing camera 6 32gb internal memory 7 video 1080p hd video recording 30 fps slow motion 120 fps timelapse video stabilisation video image stabilisation face detection 3x video zoom video geotagging 8 works wifi got wifi hotspot carry works super good using amazon prime videos enjoying max 9 facetime calls much clearer skype whatsapp 10 apples appstore definitely gives severe competition play store still plenty apps try never get bored cons 1less connectivity devices files sent android applications using different application 2normal pendrives cannot connected device final thoughts 2017 ipad great things bigger tablets good reading watching browsing would recommend,,,,,
observed 20 days battery 1012 hours 1010 expected screen really good 910 wifi connects weak signal network even unable detect phones 1010 build quality best 1010 camera front mark idle vdo calling 710 value money ok 910 android user may experience problem first 7 days,,,,,
migrated ipad mini 1st gen apple 2017 edition plus points 1 faster 2 bigger screen 3 night shift mode 4 support least years 5 screen compared 1st gen mini slightly warmer good eyes minus points 1 nothing exciting thing wit slightly better screen bigger estate nothing major excite 2 found audio mini better ipad 2017there much treble sound 3 try access apps like garage band etc get prompted invalid address looks like need update payment address info address articles internet invalid address 4 handling ipad mini way easier ipad 2017 get heavy typing cumbersome,,,,,
ipad 97inch thicker marginally heavier ipad air 2 essentially replaces pricier ipad pro 97inch really unless three sidebyside going think anything new ipad 97inch light enough hold bingeing netflix barely noticeable chucked bag fact ipad common first ipad air terms weight thickness cases model fit 97inch ipad perfectlyaround sides got volume rocker orientation lock headphone jack opposite side powerbutton top bottom got single speaker lightning port charging course shiny apple logo smack bang centre touchid enabled homebutton sits 97inch display matches ipads terms speed reliability means unlock firm tap quite snappy one iphone7 ipad 97inch looks almost first ipad air display good bad news good great 97inch screen carries retina moniker packs dense 2048 x 1536 resolution actually matches pricier ipad pro hope helps,,,,,
battery lasts long smooth performance best price screen bit reflective increasing brightness counters get space gray hide black bars,,,,,
theres colour discolouration strip bottom screen similar issues iphone 5s apple starting lose credibility manufacturing products finesse,,,,,
first apple product exceeds expectations media consumption great device nonlaminated display issue buy,,,,,
ipad tablet 97 review specs 97inch 2464 centimeters led backlit display ips technology 2048 x 1536 pixels resolution 264 ppi pixel density 8mp primary camera 12mp front facing camera ios v10 operating system a9 chip 64bit architecture embedded m9 coprocessor processor 32gb internal memory 324watthour lithiumpolymer battery design used ipad air 2 familiar design new ipad new version touch thicker air 2 barely noticeable considering still 75mm thick makes easy hold hand weighs 469g plan carry device commute find light enough hold onto extended periods may want use two hands though 240 x 1695 x 75mm particularly easy grip one hand back ipad metal body feels smooth touch still easy enough grip denying ipad still bestlooking tablet buy rounded corners makes gorgeous device hold hand recent ipads screen home button featuring apples touch id scanner allows keep data securely stored away behind fingerprint lock particularly easy reach thumb though unless lying display ipad 97inch looks almost first ipad air display great 97inch screen carries retina moniker packs dense 2048 x 1536 resolution actually matches pricier ipad pro lcd panel quite saturation sheer colour pop amoled samsung galaxy tab s3 colours bright virtually impossible pick individual pixels blacks deep fantastic screen watching movies reading books lacks dualtone tech ipad pro 97inch whereby screen dynamically adapts environment still get night shift mode ridding panel pesky blue hues believed harm sleep often use tablet bed makes screen go soothing orange colour seemingly make genuine difference performance 64bit a9 chip latest greatest cpu apple arsenal still capable 2gb ram ipad pro 97 ipad air 2 job well 32gb internal storage usual microsd able play heavy games without problem camera rearfacing 8megapixel camera narrow f24 aperture would consider using document scanning anything else results noisy blurry plain good 12megapixel frontcamera equally weak bit disappointing see good facetime tool families videochats look blurry ghosting common battery even though ipad 97inch bigger 329w battery apple still states last 10 hours video watching per charge ipad air 2 ipad pro 97inch apple claims seem match results able kill battery shy 11 hours playing downloaded film reality though times spend 11 straight hours watching something ipad limited realistic daytoday use ipad 97inch go distance course week testing ipad lasted used hours day without issues lasted end week needed juice like previous ipads standby time particularly impressive important device use intermittently found dropped 12 day meaning come back days find dead side notes ipad runs ios 10 verdict price getting apple best features may used iphone 7 great 97 display capable performance good battery life great value want apple ipad apple ecosystem thank peace find helpful please hit helpful yes vote much appreciate,,,,,
10 days use heating issues started,,,,,
horrible product gets heated seller doesnt respond never buy,,,,,
hey guys ipad good product opinion worth money dont think costly bad worth lightning connector display retina 97inch diagonal ledbacklit multitouch display ips technology 2048x1536pixel resolution 264 ppi fingerprintresistant oleophobic coating chip a9 chip 64bit architecture embedded m9 coprocessor nanosim supports apple sim sensors touch id threeaxis gyro accelerometer barometer ambient light sensor touch id fingerprint identity sensor built home button camera 8megapixel camera autofocus panorama 43 megapixels hdr photos exposure control burst mode tap focus timer mode 24 aperture fiveelement lens hybrid ir lter backside illumination auto image stabilisation face detection photo geotagging video recording 1080p hd video recording 30 fps slow motion 120 fps timelapse video stabilisation video image stabilisation face detection 3x video zoom video geotagging facetime hd camera 12megapixel photos 22 aperture 720p hd video recording backside illumination hdr photos videos face detection burst mode exposure control timer mode dont hesitate buy good product,,,,,
perfect item original quick delivery rather call lightening delivery hadnt even thought would delivered much early havent used product much far good one happy shopping,,,,,
mark,,,,,
bought 24 aug 2017 today 4 oct 2017 problem charging buy ur risk,,,,,
good product delivery also good,,,,,
literally owned every single ipad ipad 2 ipad 3 ipad air ipad air 2 ipad pro spent enough time ipad warrant opinion going tell things want know things feel know lets begin describing ipad difference ipad air 2 difference faster clocked cpu graphics cpu new ipad thicker frame weighs roughly 50gram deal breaker new ipad antireflective ipad air 2 new ipad brighter ipad air 2 means visibility sun may ever slightly better noticed camera new ipad definitely better pros 1 value money never good think worth rs 25000 users hell yes 2 outstanding battery life tests found occassions great battery life even youre long day unlikely run battery wont need charge daily video watching doesnt really decrease battery 3 excellent media consumption travel lot buy one video watching great headphone jack 4 charges 1 100 roughly 3 hours 20 minutes bad ipad cons 1 anti reflective coating found ipad air 2 made display better resolution increased brightness brightness macbook airs also macbook pro retinas doesnt neccessarily transfer better display 2 could gone 64gb give users jump ship keeping entry level 32gb apple begging hated miserly attitude company might sink ship one day bottomline youve never tablet best chance get one compare ipad pro 97 find display ipad pro way better ipad pro also louder far daily tasks concerned speed tie really need spend go 97 ipad pro subjective would recommend people,,,,,
love surprised say value money apple product,,,,,
good product screen size also good heating problem use 2025min heat like blast,,,,,
purchased product store ipad amazing quality superb 2k videos awesome touch response great im loving great read books watch movies play games shortcomings 1 way big use lie bed using watching movies playing games becomes tough think buy 2 speakers low volume though quality good 3 screen anti glare poses problem reading watching movies 4 camera isnt good phones still love ipad recommend anyone wants buy ipad thats cheap smooth,,,,,
fantastic extremely smooth one cant imagine lag got 247000 form amazon,,,,,
bought product local apple store two weeks ago first apple product super excited overall ipad lives apples reputation uninterrupted performance device expected absolutely hanging issues device heat little bit charging simultaneously playing heavy graphics games like asphalt8 airborne otherwise heating problem light weight compared samsung tab 80 used father sports 97 inch display rear camera performance good daylight conditions though due lack flash underperforms low light condition front camera retina flash decent job cameras support live photos hdr modes ive using device browsing reading ebooks go photo editing gaming watching movies youtube videos surprise still 2530 battery left end day though takes 2 25 hours charge device 100 fast charging support interface smooth display real crisp various features like gestures app photo editing photos app split keyboard multi tasking impressive productive definitely must buy someone looking buy first tablet device worth money invest,,,,,
manufacturer match apple ipad though expensive brands worths money spent,,,,,
fast delivery n safe packinggenuine product worth buy interested ipad proa9 chip makes better,,,,,
cuts good quality average finger print magnet didnt provide wiping cloth alcohol swab cleaning happy grey ipad,,,,,
like ipad smell strange speaker holes replacement replaced item smells,,,,,
recently ordered 2017 ipad amazon begin product would say ipad excellent product using iphone 6s iphone se apple products surpassed expectations like iphones ipad also surpased expectations amazon done wonderful job delivering product next day cloud tail india done wonderful job packaging shipping correct product always premium product apple much fun use wont say heavy product actually feels light hands ios 10 compliments product wonderfully apps fast particular tablet actually feels fluid use tablet lot reviews particular tablet youtube screen reflective see air gap cover glass lcd trust guys hearsay tablet wonderful would recommend potential buyer wants use ipad go right ahead buy beautiful investment benefit long time unlike android tablet may slow within six months tablet give first day performance many many years come thank apple amazon cloud tail india delivering wonderful product,,,,,
using ipad 15 years pros cons pros 1 great battery backup 2 text ebook reading experience wonderful 3 presentation project easily prepared 4 speakers sound clean loud 5 camera 8 mp thats enough capture excellent pictures cons 1it bit difficult get os previously android user 2accessing wifi became next impossible updates due security reason issues,,,,,
review abt picture shown relation product ipad 2017 doesnt look like thin basseles camera bump picture shown belongs ipad pro 105,,,,,
performance could improved found slight lags multitasking fluid experience someone expects apple product,,,,,
good product,,,,,
ipad nice built quality good upcoming ios 12 going much faster new gesture control make work experience ipad much better display beautiful feels nice hands beneficial college students almost replace laptop,,,,,
great product lag alleven run four five apps time read negative reviews display laminated gotta tell display still amazing best product price range got 20900,,,,,
please check details product mentioned a10 chip later a9 chip per think 5th generation model a9 wanna know 5th gen also supports apple pencil,,,,,
good,,,,,
hopeless buy apple products flexibility using useless security provided every step u crores inside data rather buy samsungandroid tab best also save money,,,,,
misleading information,,,,,
freakin sweet deal tablet 2k displayfinger print scanner powerful processor unmatched price performance apple device,,,,,
mark dissatisfied,,,,,
firstly u ask single reason buy would surely dispay retina display 20481536 bet u get tab price ram chipset iphone 6s costs around 35k u get around 20k aluminium body gives royal look thin found anyother tab price tag last least great battery 8827 mah,,,,,
product good worlds largest store cant even get product picture topselling tablet correct put picture ipad pro 32 gb instead ipad 2017 32 gb misleading,,,,,
good wait ipad 2018 price updated internals pencil support,,,,,
worthy eats much data android least 4 times apple eco system really good enough appreciated like getting suffaction moving android even simple things lot difficult apple ipad worth buying enjoy freedom android,,,,,
excellent product exactly expected delivered expected would recommend whoever looking tablet,,,,,
excellent product variant 3 colors space grey silver gold available price however differently priced website silver approx 3000 space grey gold,,,,,
wrong product description charging beyond mrp,,,,,
really love ipad performance flawless play heavy games multitasking without lag also retina hd display excellent camera bit outdated otherwise awesome product,,,,,
truly fantastic ipad money skeptical comparing ipad pro model certain differences get passed aesthetics likely ipad lets address doesnt dohave fully laminated display slight airgap glass display also means display antiglare coating a9 vs a9x chip dual speakers bottom quad stereo speakers like pro also smart connector utilizing apples new smart cover keyboard compatible apple pencil dont think beat value upgrading ipad 3 like thing lightening quick even though slightly heavier ipad pro air models still light device coming 1 pound strain hold matter time screen bight crisp apps open close run flawlessly one thing noticed app requires internet blazing fast safari youtube netflix others much faster previous models ios10 using multiapp split screen feature great camera eh never intended taking pictures anyway graphic design smart keyboard get pro like easy touch interface web browsing youtube basic photo video editing playing music get new one ive hands pro appreciate better camera stereo speakers im going use dont need pay also inside home office ipads sound output plenty loud enjoy whatever listening purchased 128 gb model count happier great value definite buy looking upgrade budget,,,,,
new ipadit a9 chipbut new 97 inch a10 chip,,,,,
please reduce price bit,,,,,
think really good one brightness better modelcant get anything better edit best battery backup seen apple productit 2days still got 24 best standby yeti love,,,,,
received product yesterday fast delivery promised amazon first charging power charger heated expected normal,,,,,
amazon delivered product next day order great sellertab works fineno issue,,,,,
invoice serial number match one device requested clarification 3 days back still resolved,,,,,
description provided ipad 2018 product actually ipad 2017 silly,,,,,
purchase one star deceiving customers including description 2018 ipad selling 2017 ipad,,,,,
great 2017 model ipad old model,,,,,
amazing best product must say using 15 days make fall love apple use almost 5 6 hrs day loving,,,,,
ipad excellent everyway good audio quality best battery backup far bad rating service delivery amazon logistics screw prime member dont expect get ur items 45 days horrible,,,,,
good user friendly memory low regular os updates,,,,,
first apple product really liked bought paytm effective price 21319 mrp 25999 cashback 4680 thats good deal really great product find problem reading non laminated display may first ipad compared friends older ipads laminated display find much difference battery life awesome cant kill even using whole day thats even much better mobile phone dont think much go buy,,,,,
god one,,,,,
finger touch working,,,,,
best tablet pricescreen quality brightness amazing performance problemsmore functional ios 11 update,,,,,
got 19k amazon diwali sale never owned ipad apple product ever youll amazed product,,,,,
best tablet kids someone looking really good multimedia device,,,,,
product best quality well attractive colour love apple click good photos works like kindle,,,,,
mrp showing 28900 apple website showing 28000 difference,,,,,
youtube channel want product promote specific product,,,,,
always wanted sub 30k tablet read pdf tried many none matched retina display ipad however cost prohibitive student like buy new 2017 ipad competitively priced got additional discount bringing price rs 24900 steal price love brilliant display great read books video chat prompt next day delivery amazon satisfied,,,,,
purchased device birthday gift hubby absolutely loved,,,,,
simply best tab period,,,,,
great product affordable price go worth money,,,,,
great product works flawlessjust awesome go,,,,,
first apple product totally worthy big thank amazon,,,,,
fast delivery nice product buy,,,,,
poor slot memory card neither use usb pendrive,,,,,
product good bill credit showing,,,,,
great build quality great performance worth buying product apple rocks,,,,,
got todayit comes preloaded ios 10smooth experiencethanks amazon apple,,,,,
hangs many gamesgames doesnt work properly camera bad,,,,,
amazingworks wellpackaging superb received well estimte delivery cloudtail india,,,,,
great product,,,,,
ordered air 2 got new pad dont like,,,,,
best ipad regular use,,,,,
absolutely love ipad ipad mini 1 since couldnt upgraded anymore decided go apple products extremely satisfied,,,,,
good product,,,,,
great product must ios 11,,,,,
screen good,,,,,
best tab used features awesome loved siri,,,,,
awesome one,,,,,
happy,,,,,
cool,,,,,
excellent product excellent prime delivery much satisfied,,,,,
first fast deliver good job part amazon new ipad 2017 version perfect got product hand yesterday sync ipad iphone good guys good reasons ipad 2017 costs much ipad mini 4 operating system screen size bigger better apple continuing air models pro costly worth cost people need best laptop ever use ur tab watch movies play games check ur mailsdomestic use one best flaws e flaws life missing fully laminated display antireflective coating wide color display p3 true tone display want use tab place thats bright might lot glare issues cam true tone flash wide color photo capture flaws much big deal expect pro options present mini air etc note say little bit thicker basic air pro tablets dont think feel way ur hand,,,,,
nice,,,,,
gold color back led light,,,,,
good delivery ipad works well,,,,,
got deal offer rs 24900 basically ipad air 2013 version ipad air 2 processor camera display glued touch panel like 2013 version hence little fat heavier air 2 fantastic value money great strategic move apple reduce cost love original ipad air 2013 feel still king second addition go,,,,,
good product,,,,,
good delivery expected always,,,,,
build like apple devices build quality fantastic seems going back time innovation comes mind mutepotrait orientation switch like air 2 pro sim tray located position similar air 1 also thicker heavier air 2 pro exterior respects retread 2014s ipad air 2 two main exceptions heavy thick ipad air 1 devices unlaminated airgapped screen come brushedmetal chamfers ive found one point difference previous ipads terms physical design volume buttons apart screen ipad 2017 reasons known apple unlaminated screen air gap display youll find yields tiniest fraction press much means enough notice decent screen bright colorful sharp little less pro offering performance ipad 2017 higher battery capacity predecessors noteworthy area surpasses even ipad air 2 processor choice comes a9 chip paper ought slightly slower a9x pro models although 129inch models extra ram increase advantage significantly faster a8 mini 4 a8x air 2 let alone a7 ipad air 1 devices tested given complete reset updated ios 1031 tests first geekbench 4s cpu test see benchmark picture pro comes top expected trex onscreen manhattan onscreen manhattan 31 onscreen graphics benchmarks jst see benchmark pictures finally javascript browser test pictures well enough said performance battery apple claims new ipad 10hour battery life using wifi 9 hours browsing cellular connection standard figures company gives current tablets hopeful might prove conservative estimate devices battery impressive apple capacity 8827 mah compares 7340 mah air 2 7306 mah 97inch pro may explain device comparatively thick heavy look battery performance geekbench pictures verdict isnt ipad would go personally ipad 2017 lowend price tag mostly lowend spec list might good fit schools casual users reported success iphone se suggests market apple products behind times terms spec come appealing price point,,,,,
good,,,,,
ios 11are 10,,,,,
pictures shown black colored ipad ipad pro 97 evident rear camera bump flash speakers top end keyboard compatible access site side amazon verify pictures letting posted also title product similarly misleading new ipad 2017,,,,,
wasted money buy item efforts make item useful however could use item even single day switching device device automatically went extremely complicated process asked several passwords different stages process finally ready use switched started got stuck login page recognize password asked online recovery system apple webpage replied 24 hours useless reply however managed set new password next drama started whenever attempt switch device using new password shows product disabled spent 2 sleepless nights try make device work took help apple customer care chat even could help suggested download itunes software laptop connect device laptop complicated procedure fix problem even trying throughout whole night complicated procedure also work laptop could recognize device tried 3 different laptops spent huge money buy useless product could use even single day opinion device follows 1 device complicated procedure step feel product may useful buy listening songs watching movies etc people like less time spend want work find useless 2 even somebody lucky enough use item may good dont forget several passwords forces keep forget password whole data lost cannot even use item,,,,,
didnt buy know support apple pencil 2017 version unprofessional amazon,,,,,
waste money fair displayfile management system sucks file explorer,,,,,
apple products always brilliantly engineered blazing fast things like much ram etc present effect real world performance reason non laminated display pain used keeping brightness display settings ipad low levels read lot primarily avoid straining eyes cant new ipad turn brightness display settings like looking mirror see reflection background poses practical problem means keep brightness levels constantly 70 faster air2 benchmark tests apple used chasi air1 little bulkier air2 havent used air2 notice weight difference going return ipad air2 live great product competitive price pointsuperb delivery always amazon guys,,,,,
aweosme product bought rs 14000 apple store recently cashback 10000 valatentine day price dam worth,,,,,
left half side tablet yellowish better buying authorized retailers ipads ecommerce resellers different serial numbers thus buying offline better,,,,,
dont buy ipad price good features time price,,,,,
good compared expensive versions job looks good one two additional features pro negligible price damn good 128 gb,,,,,
want buy product year additional feature current ones looking sim card slot load jio idea vodafone airtel best data offer wifi also stay price band present one make wows,,,,,
dont buy seeing picture given given picture ipad pro bezzeles compared hope amazon publish real picture soon,,,,,
