reason keeps losing wifi connectivity reload webpage 56 times regains connectivity opens page fine issues router android phone windows tablet windows laptop range router room ipad even updating ios 114,,,,,
good product really worth money ive bought studying purpose im really happy quality sound charging capacity draining capacity suits per specification mentioned box also got product within specified time amazon promised im happy product seller also shipped without hassles,,,,,
entry level ipad good watching reading browsing casual games many cool ios features flip side transfer media pain need computer itunes installed offcourse pricey couldnt find better alternative android tablets 7 8 inch size small ram sizes outdated softwares,,,,,
bought ipad great indian sale 19k cash back cost emi using apple products since long time devices collection except one though companies boast higher configurations cheaper price devices hang often till date none apple device ever hung fret thinking ram 2gb believe faster 4 gb android device ios rocks love apple,,,,,
product delivered seller time packaging simply bubble wrap cover apple ipad box feel insufficient touchscreen electronic device rest apart apple products simply flawless go wrong lot better cheap android tabs,,,,,
great buy bought 199 k indian festival sale solid build quality amazing display absolutely lags hiccups use like games browsing etc sound also crisp overall best quality product used hdfc card got buy pay later offer,,,,,
awesome budget apple product careful first time u r using apple products android u face lots od problems irritations u cant use whatsapp instagram ipad check buying,,,,,
good came time perfect condition screen n sound quality good,,,,,
doesnt support apple pencil styluses available india shoddy cheap least job built gaming netflixing students werent kept mind rd product whole studies purpose fails without compatible stylus,,,,,
must say best decision made buying worried buying electronics online wrong packed care best reading books dont read textbooks anymore memory enough dont download many movies songs keep ebooks got rs 26000 8th month running since bought,,,,,
ultimate product apple review required best battery life extraordinary processing power enhanced 2gb ram helpful,,,,,
happy satisfied product amazing experience use macbook second apple priduct purchase every tab one one side ipad still go ipad,,,,,
durable tried water dust mud 2 meters drop battery bad iphones superior gave blow anger got little bend fully functional curved ipad pubg never lags gets heated okay brilliant,,,,,
fast useful reading note making purpose,,,,,
want use tablet definitely go ipads good every aspect compared android tabletsthis ipad a9 processor whose performance equivalent sd821 good full hd ips displaybattery backup also goodalmost 2 days moderate user metal bodymoreover apple support next 34 years providing ios updates unlike dont see android tablets,,,,,
kids using great ipad worth spending money,,,,,
used number android tablets switching ipad experience phenomenal onethe ipad buttery smooth unlike many android tablets constant landmarks lagginessyou quite secured constant ios updates make sure ipad always securei hadnt received even single software update android tabletoverall u give apple pencilu surely go ipadperfect bang buck rs22000,,,,,
first apple product delight use easy 14 hours sot charge interface breezy fast apps optimised well ios havent slowdowns performance issues must media consumption,,,,,
software issue 3 months use able update os giving 3 like apple products,,,,,
amazing product apple everything one person needs entertainment work related 5 stars side amazing features works best studying also travel long lasting battery good sound quality value money best buy heavy reading habits easy carry,,,,,
personal opinion coming guy techno wizard device compatible whatsapp instagramyoull get iphone version pure manure best browsing watching 1080p videos youtube reading ebooks kindle playing games best suited big screens motion sensors,,,,,
reasonably priced current hardware upgradable ios11 optimum tablet household,,,,,
apple ios best hardware class apart displaycant ask muchv happy customer though apple fan boy dont like costly products one alley hardearned money wont go vain go,,,,,
great product much better cheaper previous generations would definitely recommend ipad 2017 apple users,,,,,
apple devices something seldom needs reviews excellent device slightly thicker previous model ipad air 2 battery backup 10 hrs think device gives tat,,,,,
awesome loved though touchsensor bit hard delayed complaints,,,,,
great product packaged well screen beautiful bright watching shows movies secondary option great screen however smudges easily annoying charging takes time battery saver option either looks feels premium get case sure take care cable cause apple duh go wifi cellular option spend little,,,,,
believe cheap ipad pro lineup advantages normal use good choice got dad loves battery life better expected,,,,,
bought product 2 week back pretty happy new ipad 2017 edition slim stylish gives perfect fell want ipad go,,,,,
first apple productand terrific firstincredibly smoothno glitches till nowbattery life superblooks sleekreally sleekproud ownerhoping buy iphone next,,,,,
apple products read reviews get,,,,,
latest apple ipad really great deal considering steep prices apple range products amazon made deal sweeter,,,,,
first time user apple product really loved product usability better android thinking switch iphone,,,,,
best tablet market lags hangs crashes whatsoever runs everything perfectly battery life also great want tablet regular usage buy professionals ipad pro better,,,,,
first ipad 97 inch apple tablet awesome use time delivery pomised amazon excellent packing easy setup battery already charged thanks amazon apple giving wonderful product please purchase dont think twice,,,,,
value moneypurchased 20000good movie shows readerbrowsing 97 inch little big handling go pro affordable switching android windows little annoying,,,,,
packing delivery upto level ipad 2017 loaded features new apple user could dream lacks 3d touch id screen isnt non reflective minor issues price fits definitely worth buying,,,,,
ipad amazing comfortable work upto expectation apple,,,,,
apple products never disappointed truly stand reputation aspects ipad simply amazing sweet grab rs19900 amazon delivery fast time,,,,,
superb product simply extraordinary thing packed inside affordable price range got 21800 thanks amazon,,,,,
great devicemanaging transfering files headacheother makes life really easybattery life amazed u charge forget charging week u r light useri dont game much run youtube lot still getting 3 days backup charmfront cam worst ever rear nicenice sound quality,,,,,
sorry earlier review actually problem internet connection changed internet connection picture quality good ever,,,,,
quality one expects apple data connection need wifi range,,,,,
ipad really awesome whether want office use watching movie playing games editing music videos pictures great must invest one,,,,,
use read computer books browse net better samsung galaxy tab side miss back button android,,,,,
thanks amazon seller authentic product apple never disappoints last say nothing like apple added pencil support,,,,,
good one bought son likes much amazon delivery excellent delivered 3rd day even public holiday,,,,,
reading reviews made doubt little ordering worth risk good studying official purposes sound quality amazing power backup enthralling thing noticed till touch sensor bit slow thats completely fine,,,,,
using 2 months say love apple product u expect nothing less eveything wonderfull packaging nicely done delivery thing missing ipad retina display suggestion ho,,,,,
awesome battery backup awesome performance awesome sound wish offered apple earphone free cost,,,,,
brand speaks guys go got lighting deal amazon purchase like cake cherry top gr8 terms everything,,,,,
amazing product ideal reading screen size ideal display resolution extrodinary yes laminated display noticable unless want professionally edit media speaker quality good environment sleek smooth,,,,,
ipad never disappointed two things always apple one mac another one ipad satisfied product amazon,,,,,
pleasure product iconic apple product awesome working smoothly upto complete satisfaction thanks amazon providing beauty cost 20 000 k,,,,,
bought one year ago used sparingly handled lot care yesterday able power took service center said cannot serviced doesnt screws open attend worst experience product brand,,,,,
using daily best media consumption devise offers good screen descent speakers portability carry almost everywhere,,,,,
little thicker heavier old ipad air 2 see improvement performance speaker output,,,,,
superb first thinking screen comments finally went totally satisfied purchace,,,,,
wonderful time ipad butit taking lot time charging moreoverthe point regret receive ipad 250118 assured amazon finallyi received 7 days later lot follow ups,,,,,
know waited 2018 model regrets buying older one fast great browsing reading books handles tasks like boss,,,,,
android userthis first apple devicenicegood devicethe speaker sound little low otherwise okthanks amazon offers tempted buy think never gonna regret buying,,,,,
genuine item using year complaints far,,,,,
great product think bit sow open apps also os immediately upgraded ios 11,,,,,
good product price pay might lack features ipad pro still good one mention delivery extremely fast product described,,,,,
ipad visible yellow tint bottom whenever got heated went apple store stated screen glue issue manufacturing defect giving four star wasnt seller fault,,,,,
purchased product wife birthday gift got amazing offer amazon wonderful product one thing good charging get almost 4 5 hr full charging otherwise simply good buy,,,,,
amazingly quick delivery ipad fantastic previous ipad working solid last 5years still works solid,,,,,
product toy child play game compatible device play videos accept mp4 wastes memory buy,,,,,
good product 1st time buyers got awesome deal amazon 18k,,,,,
good product really worth money im really happy quality sound charging capacity suits per specification mentioned box im happy product,,,,,
super product apple affordable pricedisplay quality amazing,,,,,
great service amazon ipad great issues must buy value money apple,,,,,
useful many works able complete work outside without laptop,,,,,
new ipad good price point working flawlessly,,,,,
best ipad bought recent years fast easy use always cheap functionality provides,,,,,
great sturdy product worth money deal received,,,,,
liked product first ipad ever purchased best buy price range regrets purchase thanks amazon,,,,,
good fast service amamzon,,,,,
nice,,,,,
like ipad much thing like slightly heavy expected,,,,,
perfect tablet,,,,,
ipad great battery life ios learn android,,,,,
everything associated top class class productsellerdelivery superlative,,,,,
pros ipad superb extremely responsive light weight siri way better google assistant cons one packing cloudtail inadequate used single layer bubble wrap,,,,,
great product apple affordable prices,,,,,
guys dont even worry packing packed best way could awesome product love,,,,,
best price range may suit everyone features look might check specs,,,,,
apple fan quality interface awsome love itit screen interface clear without lag yiu go,,,,,
great product working well far afterall apple,,,,,
loved apple product amazing buy sure enjoy buy cover,,,,,
despite ipad inherent hw problem delivered would like product replaced want repair rectification service centre,,,,,
value money battery backup good upto 10 hrs playing games,,,,,
go ipad experience something unique,,,,,
best tablet price excellent multimedia web browsing reading ebooks good display screen reflective screen end setting brightness often better viewing,,,,,
tablet pc really helpful anyone ipad goes bit ahead amazing battery life clutter free user experience simple interface makes default option worth every rupee spend,,,,,
one retina display touch id works like dream amazing gave ipad economical price well done,,,,,
absolutely top class product huge tangible upgrade old ipad2 way ahead,,,,,
packaging 45 ipad value money 100 must buy tablet lovers,,,,,
complaints performance true brand reputation,,,,,
thanks amazon got amazon big sale awesome price awesome product good ipad like ipad pro air,,,,,
best tablet price,,,,,
2nd ipad amazing love new ios multitasking feature ps camera improved lot inbuilt speakers,,,,,
nothing dislike fast slim beautiful,,,,,
display awesomesound quality awesomebattery life outstandingnearly 10 hourspremium product affordable price range,,,,,
nice product one star less due delay delivery,,,,,
using since 1 year battery life dismaleven browsing 4 hours pad must fast charging takes hours recharge,,,,,
fantastic speed features responsive apple apple full marks,,,,,
everything good even fact review using device,,,,,
thanks amazon prompt delivery product absolutely fantastic one complaint initially touch got resolved software update,,,,,
wow great packaging prompt delivery apple experience going back windows laptops anymore bucket list checked,,,,,
expected great size bit big would preferred mini processor internals old bought awesome product,,,,,
doubt good product appleif u think go 4 without worry,,,,,
awesome ipad got 19900thanks amazon packing amazing,,,,,
bought mother simple use top notch reliability smoothness touch interface,,,,,
new ios 113 update started dropping fps games wont recommend buy ipad 5th gen 2018 nowyou go either ipad 6th gen ipad pro 2nd gen,,,,,
good display performance good value money,,,,,
far working well size appropriate screen sharpness good,,,,,
best tablet price discount period,,,,,
good item professionals download apps require smooth interface buy cover screen guard thats sufficient,,,,,
got offer price 20k nice product sharp display fast batter life also gud took timr get full charged,,,,,
product awesome entertainment purposes yet replacement laptop,,,,,
nice product battery longs almost 9hrs storage bit concern display bright overall gud product apple,,,,,
good quality good display apple best comes ipad definitly recommend,,,,,
value money,,,,,
need describe apple awesome performance,,,,,
delivery royal pain since guy delivered complete basket case product love buy getting less 22 k,,,,,
best apple ipad worth every penny spent fast iphone 6s great battery life cheapest apple product latest specs,,,,,
good tablet,,,,,
fast deliverygreat ipad ever apple lover buy must,,,,,
another efficient product apple screen quality touch sencecamera performance simply awesome,,,,,
cant go wrong one wish memory upgrades mouse access,,,,,
value money,,,,,
kids enjoying without hassle,,,,,
good performance compliments macbook pro laptop phone well,,,,,
thanks lot superb quality awesome product thanks tone already love tab,,,,,
happy ipad 97 bought amazon reasonable price sale time also increased happiness full satisfaction purchase one rely amazon,,,,,
good,,,,,
product found expected,,,,,
though apple products good default however im definitely happy one handy n battery lasts longer great product,,,,,
super value money,,,,,
one week use good battery backup bright display excellent sound quality touch id working perfect,,,,,
packing reach timeproduct really good worth takinggood basic useit gives premium feeling,,,,,
good display great battery speedy performance average camera overall good product worth money,,,,,
best one screen size bigger expected nice speed camera clearity higher expected flash last sayi love apple,,,,,
nice tablet little bit heavy bigger expected,,,,,
fron rear camera images worst,,,,,
original apple working fine like apple product,,,,,
love got 18400 post cash back,,,,,
far good helpful,,,,,
good original product prompt delivery per given time happy seller,,,,,
exlelant feel valu money 99 satisfying ipad,,,,,
nice product,,,,,
fully delivers promisedan apple product high quality experienceamazon delivered promptly,,,,,
awesome,,,,,
nice battery backup superb,,,,,
excellent,,,,,
good,,,,,
perfect apple ipad air 2 excellent,,,,,
awsome product,,,,,
another great apple product,,,,,
apple product best given price features cant ask super smooth ui,,,,,
go getting 22k outperforms available tabs 30k,,,,,
value money,,,,,
great product great price genuine seller need hesitate even minute purchase,,,,,
help full kids camera quality good,,,,,
great,,,,,
ya worth money often get heated back good type pad,,,,,
nice product,,,,,
lovely product amazing delivery always,,,,,
great product doubt,,,,,
light useful must upgrade previous version,,,,,
superb performance 1500 cash back credited battery 1010 audio 1010 camera 810 user friendly 1010 must buy,,,,,
really great working ipad,,,,,
awesome,,,,,
awesome product shipment good received original item bricks soap bars,,,,,
excellent,,,,,
excellent product well delivery packaging,,,,,
apple love,,,,,
nice product,,,,,
great buy reasonable price able purchased,,,,,
awesome never get freedom android quite disappointing interface also good,,,,,
apple ipad 97inch fantastic tpuch speed battery back every thing top notch,,,,,
support iphone pencil,,,,,
got 16k ipad needs intro,,,,,
arrived time good ipad performing well far,,,,,
bought dussehra sell working smooth problem slow net speed good reading watching movies,,,,,
superb,,,,,
need write review,,,,,
great device,,,,,
best tablet within price range,,,,,
nice product value money,,,,,
using tablet since past 6 months works flawlessly hang,,,,,
excellent,,,,,
using months performance good negative would camera picture clarity needs improved,,,,,
good working must buy least u phone,,,,,
good product used long time working great,,,,,
wanna big one low bugget buy good takes notes reading books,,,,,
worth buying amazon ipad working expected beautiful device apple,,,,,
touch screen resolution amazing,,,,,
really awesome,,,,,
great value money,,,,,
awesome display size large expect thanks quick delivery,,,,,
totally recommended fr one,,,,,
quick smooth four months say purchasing absolutely right decision,,,,,
best tablet reasonable price point,,,,,
stopped working 4013 error,,,,,
superb product smooth interface excellent performance value money,,,,,
great screen laminated,,,,,
match product,,,,,
superb product delivery time expectedhowever delivery late night 10pm overjoyed came mentioned,,,,,
battery draining quickly difficult trace old history deletion time consuming,,,,,
thanks amazon jaw dropping deal awesome ipad,,,,,
happy product delivered,,,,,
awesome amazing service amazon,,,,,
good product simple best tablet one value moneytimely delivery amazon proper packingworth buying,,,,,
must buythanku amazon,,,,,
pad good charging wire delivered genuine,,,,,
excellent tab price,,,,,
bought offer rupees 20900 worth,,,,,
ontime delivery product expected problem,,,,,
name enoughno complaints,,,,,
best nice ipad,,,,,
good product apple,,,,,
nothing tell perfect,,,,,
excellent quality time delivery thanks amazon cost benefit savings,,,,,
gifted niece feeling top world happy getting apple product nice product,,,,,
excellent product feather touch fast slim great battery service love,,,,,
nice one ipad,,,,,
great business seller product totally new,,,,,
superb waysclose eyes buy,,,,,
lovely,,,,,
apple apple finest quality,,,,,
got amazon sale rs 21000 worth,,,,,
get soft tip stylusbelieve meits great helpand cancels tapping sound,,,,,
apple means quality quality gives apple,,,,,
love,,,,,
5 stars early delivery amazon thanks apple decent product price range,,,,,
two weeks since delivery great far,,,,,
excellent,,,,,
well actual apple quality mark new apple user new smooth ride,,,,,
excellent ios 11 made better,,,,,
excellentsuperb afordable,,,,,
awsome,,,,,
love,,,,,
nice product,,,,,
good ipad,,,,,
awesome,,,,,
bought lightening deal 23k,,,,,
product delievered correct time osm everbattery good,,,,,
simply perfect,,,,,
excellent,,,,,
great product great deal,,,,,
excellent product recommended,,,,,
battery back good,,,,,
works smoothly issue even using 9 months,,,,,
recommended,,,,,
xcllent words say apple worth every penny,,,,,
amazing experience highly recommended first time ipad users,,,,,
excellent product mean price,,,,,
best class,,,,,
apple best,,,,,
apple product true standards,,,,,
super,,,,,
worth money lot cheaper apple store,,,,,
loved facing one problem able download apps smthing wrong,,,,,
nice sleek light weight smooth working got great deal exchange sbi cashbackhappy shop amazon,,,,,
solid,,,,,
nice,,,,,
excellent parameters complex connecting laptop supported sd card,,,,,
nice,,,,,
apple apple stand alone performer,,,,,
worth every penny good daily use also good service amazon,,,,,
excellent tablet price bracket far better tablet available market,,,,,
wow,,,,,
good quality product good battery backup,,,,,
everything running fine use one year pubg runs smooth,,,,,
value money,,,,,
great product,,,,,
awesome ipad im always apple fan,,,,,
best tablet,,,,,
using 3 months totally happy purchase almost flawless,,,,,
overall product good little bit slower touch response processing,,,,,
tablet segment one replace apple ipad fabulous amazing one,,,,,
nice products quick delivery,,,,,
nice,,,,,
best go without second thought,,,,,
great,,,,,
master piece apple,,,,,
awesome product great price happy prime 24 hours delivery,,,,,
good last one happy last one failed told couldnt repaired,,,,,
awesome,,,,,
cool one good price,,,,,
sound goes requires reboot enable,,,,,
anything user friendly android way,,,,,
cool,,,,,
great product,,,,,
amazing product great service,,,,,
good,,,,,
met expectations,,,,,
original product,,,,,
yes goodpackaging goodproduct okthey provide earphones ipad,,,,,
prod super complaints,,,,,
really good product cheap rate 48 5,,,,,
apple amazon ipad 2017 gold fast deliveryoriginal item good cloudtail selleralso great deal thanks,,,,,
excellent,,,,,
awesome product,,,,,
always excellent,,,,,
done job,,,,,
v good,,,,,
working great received good packing,,,,,
hats apple love much worth 25 k,,,,,
got delivery time apple never disappoint comes product,,,,,
good product expectations,,,,,
nice,,,,,
carry office ever,,,,,
best ipad suitable price,,,,,
lovely productits birthday gift love,,,,,
product per description arrived per schedule,,,,,
excellent value money,,,,,
awesome,,,,,
good ipaid economic,,,,,
apple apple,,,,,
good product delivered time,,,,,
apple product 25k 97inch awosome,,,,,
wow product without doubt worth every penny awesome next day delivery amazon,,,,,
reached hand excellent ios update,,,,,
mast,,,,,
osm,,,,,
awesome,,,,,
good,,,,,
without wasting money using another tablet go applejust awesome,,,,,
apple products separate classvery happy buying productwould definitely recommend,,,,,
good product deliverd wonderful way,,,,,
must buy ipad loved 97 screen amazing,,,,,
really good product amazon,,,,,
dont think go,,,,,
nice,,,,,
excellent price excellent product love delivered within day,,,,,
amazing resoulation screen,,,,,
good buyexcellent,,,,,
good product,,,,,
good,,,,,
ipad really awesome,,,,,
excellent response met expectations beyond disappointed thank god,,,,,
hi product good good faster delivery keep,,,,,
ipad choice product one gooddddd,,,,,
awesome productno doubtmust buy,,,,,
need compare even used nexus 7 best one,,,,,
value money best tablet price offered,,,,,
good,,,,,
excellent product,,,,,
great experience great price thanks,,,,,
happy product,,,,,
good enough,,,,,
good,,,,,
quality product apple,,,,,
good dont belive online product also wrong,,,,,
first apple product love already,,,,,
nothing say product simply awsome,,,,,
appledo need review,,,,,
overall paisa wasool,,,,,
nyc product specially screen size apt reading watching,,,,,
first apple product nice packaging lovely product,,,,,
great,,,,,
tottaly worth money,,,,,
nice product,,,,,
awesome nice battery confused androids tabs n apple,,,,,
value money,,,,,
good excellent,,,,,
absolute beauty really easy work,,,,,
awesome go,,,,,
excellent words,,,,,
nice apple low price ipad worth,,,,,
awesome,,,,,
nice one,,,,,
overall good experience,,,,,
good product,,,,,
good,,,,,
delivered time ipad working good,,,,,
great tab,,,,,
good services rate,,,,,
problems whatsoever,,,,,
good product,,,,,
superb awesome ipad,,,,,
good product happy onei need cash back urgently,,,,,
brand new product go,,,,,
good value money best display,,,,,
nice say least package perfectly delivered,,,,,
satisfied product,,,,,
superbipad best amoung android tablet,,,,,
ive using two months perfectly wellbuilt sturdy functional tablet practical purposes im college student uses reading taking notes necessary free apps like documents penultimate evernote handle two tasks pretty well even youre reading wanna search something say tutorial something youtube tutorial point multitask documents app swiping left right edge screen google apps chrome youtube function well multitasking jobs thanks powerful a9 chip charge weekly twice week much gaming video playback battery life brightness product awesome tablet weve looking one deserve thanks apple amazon delivering happiness,,,,,
overheating battery getting drained easily,,,,,
ver good,,,,,
best tab ever,,,,,
good buy,,,,,
ipad awesome,,,,,
good product,,,,,
excellent product doubt ipad good timely delivery,,,,,
good,,,,,
nice useful thing,,,,,
