got 19000 every thing fine,,,,,
life become hassle free organized due unique device gone 60paperless jotting extremely easy userfriendlyif student want stay organized going paperless suggest kitty drawback find lack unpaid apps fact wont able pay rupay app store,,,,,
got 21k sale period awesome product,,,,,
best playing pubg,,,,,
one students looking gadget watch lectures movies exactly need frustrated first coming android little customization ios lets transfering media takes hours learning curve fine specs top line considering get price android ecosystem amazed fluid machine manages handle everything throw never lag speakers quite good dealbreaker paying apple brand name assurance get constant updates long time something cant say android tabelts ips lcd display fine color beautiful want take notes also comes apple pencil support paper like digital device get battery life something worry battery optimization ios great easily last 2 days also play pubg fortnight without issues also plus point overall tablet fluid issues someone wants watch videos bit streaming internet along taking notes go save money instead breaking bank,,,,,
really need tablet committed get apple ecosystem cant interact windows android based devices ease ready spend good amount money accessoriesif yes go itit never replace computertransferring files hasslei bought strictly entertainment purpose occasional cloud based office work holding finekeep use mind buying,,,,,
ipad brand new considerably bigger previous ipad mini 2 functions buttery smooth main purpose gaming easily met installed asphalt 9 pubg playing without lag hours problem faced left corner screen shows yellow tint read internet glue sticks screen together fade away time mine started getting faded bought great indian festive sale effective price 18990 opinion best deal ipad specifications,,,,,
bought discount diwali festival offer first ios device still exploring thought 2 gb ram speed multitasking would issue amazed smoothness fluidity holding get feel premium product display amazing nothing compare android device came across sound battery life good complaints thing apple ecosystem costly android app cost rs 30 play store cost around rs 600 apple app store,,,,,
bought higher price 27k 23k bought portrait painting cause would cheapest ever display tablet considering price apple pencil besides screen looks good battery good times 8000mah btw heating whatsoever speakers good headphone jack bad thing worst camera apple product really good buy newbie digital great start,,,,,
awesome product must students even professionals job smoothly,,,,,
verdict ipad 6th generation 2018 nice tablet great hardware software us perhaps best choice tablet real competitor tablet ipad 105 better hardware much expensive following detailed review ipad 6th generation 2018 hardware surprises apple always makes great devices build quality good touchscreen excellent front back cameras good exceptional sound quality decent could better battery backup good touch id works fine improved cpu gpu enhance overall responsiceness apps especially games software ios simply outstanding software primary reason purchase apple devices device already ios 113 installed box things noticed ios 11 1 dock bottom screen looks similar dock macos 2 control center design improved 3 app store revamped personally liked simplicity old app store better 4 software keyboard design changed whats included box two accessories included box 10w charger lightening usb cable even provided earphones apple pencil included box want one need purchase separately cost inr 75k purchase apple pencil didnt want spend much money pencil dont think would used much even purchased one variant choose 32 gb wifi space grey 32 gb sufficient requirements store lots data consider 128gb variant wifi limited use case 4g model didnt want spend extra 10k 4g model space grey like black bezels find white bezels little bit distracting accessories purchased accessory purchased spigen tough armor case case good somewhat heavy shipping packaging purchased device seller appario retail private ltd ordered device morning received evening superfast packaging great alternatives ipad hardly choice want buy tablet think closest competitor particular model 105 ipad pro costly compared purchase already 4th generation ipad purchased 2013 experience ipad great apple provided software updates device till last year 2017 amazing purchase new one old ipad still works fine doesnt get software updates anymore opinion best move away device get security updates use ipad use ipad primarily content consumption conent creation example dont compose long emails edit videos ipad also dont use camera ipad much use ipad watching videos netflix hotstar youtube amazon prime videos web surfing use safari chrome like reader view mode safari games buy new ipad opinion already ipad getting software updates perhaps buy new one want one already one consider except much expensive ipad pro 105 best tablet currently available let know queries edit july 2019 wonderful device using everyday still recommend wholeheartedly,,,,,
apple products always worth bought ipad sale costs 20k real good deal im absolutely love ive always android user didnt took anytime getting use mainly use reading purpose making notes id suggest buy along pencil extra cash good jotting notes make go absolutely paper less ecofriendly right,,,,,
perfect new screen better pen use old one dont know certainly feels way 32gb plus cloud storage account wifi phones hotspot perfect save money,,,,,
week writing review placing order order within 24 hours got ipad amazon fast delivery one day delivery sim option even cant use whatsapp still numerous work tablet ipad provides every feature normal tablet provides features also computer provides tablet lover looking portable medium access edit files big screen,,,,,
safari browser browser save pdf generated websites properly firefox saves blank pdf chrome save pdf microsoft edge browser save pdf replaces pdf file original name website name poor 3rd party app support proper file manager apple gaming 3d graphics heavy games temp goes even 30 mins using augmented reality ar camera measurement 3d objects temp shoots immediately around 21gb free 32gb enough also 5gb icloud storage free,,,,,
seller good ipad felt like china replica device freezing frequently,,,,,
first apple product amazed build quality technology feel look etc except ipad support external mouse got suitable keyboard made mini laptop looks amazing solved purpose thanks amazon single day delivery amazing customer service tried accessories thru amazon chose suitable one thanks amazons patience got ipad 19k discounts festive offer real value money apple product,,,,,
got ipad 18999 rs,,,,,
device oozes classi fan ipads years owning one must say beast battery thing unbelievable usually charge every 23 days depending upon usage average get screentime 10hrs know people saying camera bad coz using 10 days say comparable iphone 6s plus camera ps charger get device 10w iphone bonus fast charge phone,,,,,
saved year buy ipad glad still expensive value money one week used observations charged arrival use reading kindle app liked could adjust brightness right eyes pleasure read books black background ipad much faster receiving mails faster phones spite wifi network siri helpful ways wanted interaction one sarcastic babe least dont play games think ipad would respond well user interface touch screen smooth lag things would like better keypad settings option mic keypad doesnt work well apps okay using wordpress app causes ipad become slightly warm overall loved ipad still feel price 15 20k,,,,,
second ipad purchased amazons upgrade ipad mini 2 ipad 2018 since support apple pencil got offer price 22000 amazon showroom price 28000 bought got afraid got larger screen consume battery nothing worry good better life use 7 8hr max daily still battery exhaust overall awsome product,,,,,
apple products hyped overpriced products ipad exception excellent battery life stand times best value money tablet 21k miles ahead android tablet used surfing gaming reading misc stuff,,,,,
never buy amazon even 50 discount 1st unit huge backlight bleeding issue replaced one dust particle display looks like dead pixels lcd never issue bought device bought apple store think apple selling defective products amazon huge discount nobody mind little defects worst experience ever amazon 2 friends device bought store without defects,,,,,
using device one half years never faced issue heavy gaming play pubg highest graphic quality without lag extreme fps dnt worry ram ram management good even 2 gb ram sufficient battery 8k mah super last,,,,,
looking android tablet replace ageing nexus 7 2013 running nougat 71 via lineageos tablet served well 5 years become little slow battery weak unfortunately hardly choice android tablets world leveno tab4 8 plus seemed good stuck android 71 clear update paths stable custom roms also hard find given lack interest android tablets samsungs tab s4 great expensive maybe two major updates tab 105 overpriced 30k sd450 based tablet standard tft screen even ips seems mi great tablets available india one need import via aliexpress gearbest given crazy pricing apples iphones products general pricing tablet pleasant surprise pros value money one best offerings price range much better samsung expect ios updates next 34 years least bright vibrant ips screen good battery life lag free good choice accessories like tempered glasses cases etc available online headphone jack present thank god cons uses older a10 chip though chugs along happily regular tasks like media consumption browsing etc single internal speaker nexus 7 2013 much better stereo speakers useful watching movies etc tied apple ecosystem wont matter many,,,,,
long discussion buying ipad tablet decided buy ipad instead brands tablets primary reason ipad touch screen responsiveness ipad good enough watch movies looks like small portable movie player watching movies used taking notes handwriting input comes handy taking notes also lightweight compared similar products market thin enough hold even one hand would say overall experience good far since already using iphone7 issues setting new ipad kept phones together wifi networkand automatically pulled apple account phone enter apple id password setting ipad overall good device ease use reading books,,,,,
let serious nobody needs ipad want need ideal causal internet browsing netflix movies got one dad 2017 laptop crashed resist getting one battery backup amazing tablet comes closer thing seemless data transfer iphone mac makes breeze use yes fancy ipad pro like gap screen glass know hype day usage never notice processor fast almost games enough browsing movies compared ipad pro sound camera definitely par 20k expect everything want decent computing power daily usage ideal speakers get bluetooth speaker give better immersive experience movie videos also feel bezels though large helps hold thing without covering parts screen seriously speaking using 2 months feel anything powerful overkill never felt thing slowed crashed also dad uses 2017 ipad still running smooth brand new sure good overall feel good buy looking something casual surfing light gaming also ideal parents case,,,,,
best tablet possible feel since people find android phones easier even cheaper use one wants work heavily mobile device best option would ipad puts less strain eyes also display touch ipad far superior android device,,,,,
must looking genuine issues like well got ipad appario great indian sale cost 20k happier grateful issues genuineness ipad display charging issue getting powerful device 20k nothing great opportunity nothing give kind performance battery life 20k sure even getting price recommend still go con hand coming ipad performance issues playing pubg graphic intensive games hours end got gaming writing purposes fulfilling wonderfully display large awesome plays hevc x265 formats well easily also recommend esr screen tempered glass moca covers go along great tablet using device pleasure speed everything else fyi upgraded ipad mini 1,,,,,
writing review 7 months usage engineering student preparing competitive exam bought study got pdfnotesbooks ipad light weightexcellent displaylasts upto 10hrs spend time home want utilise time study dont think helpful increasing productivity make sure dont play games happy learning,,,,,
charging time takes long otherways ipad good,,,,,
writing ipad bought bought ipad study purpose apple pencil using since 3 months never bad experience loved size display process powerful sign lag play high end games ultimate hd graphics like pubg fortnite battery back lasts 8 10 hours normal usage use productive machine paperless monk academics educational information one place use annotate take notes using apps like goodnotes notability well last worth every rupee want use moderate work basic use ipad like surfing watch streaming wide display really masterpiece,,,,,
nice product good battery life fast processor also supports apple pencil got updated ios 12 switching accounting cash back got 18990 rs price cant expect apple,,,,,
smooth ui ive come expect previous models battery life could better apples premium pricing base specs brings expectations average experience,,,,,
excellent battery life mistake storage size would better gone 128 gb,,,,,
apple proud ipad team even though latest greatest ipad deliver upto expectation wanted daily driver office reading capture notes writing thoughts online research perfectly fills requirement must say price 25000 including pencil cost way higher 32 gb space less charging much installed ram less thus lag happen 1 port like restriction china dont know freedom means apple parts costlynot quality deliberately made high parts cost even equal product price either reduce price components reduce initial price product support countries like india disasters problem happened would need throw ipad apples product like hp printers worst pricing models inherent flaws apple l product still shines return values time keep safer lungs,,,,,
good table according performance superior multitasking handle bit well screen quality good price point apple product mainly made studentsat respect rear camra good clicking pictures documnts good light condion rear camra click descent picture thanks image processing unit 12mgpixl front camra ok video calling battery backup good best reading books surfing web making notes best think supports apple pencil unhappy packing apppario retail private ltd 4 corner ipad box damaged send box plastic sealed package even packed cardboard box amazon fullfilled expectd,,,,,
6 months later review pros powerful a10 fusion quad core processer great battery life apple pencil support ram management another level never felt like im working 2 gigs ram cons camera 8mp 12mp f24 seriously 12mp camera 2018 1st gen touch id ios ipad nothing much done ipad model comes con since apple claims ipad laptop replacement restricted software many places hope ios 13 revolutionary,,,,,
battery life good use take notes annotate research papers creative work like pictures personal website moderate use lasts upto 2 days screen quality good reading video quality awesome distraction device,,,,,
used ipad 3 since 2013 switched ipad 6 feel difference though cant differentiate screen touch quality past present superb difference influenced weight ipad light pleasure hold one hand read long time,,,,,
first apple product absolutely love thoght going pro version later decided go one didnt needed extra features books sketching ang music works amazing superb response unlike android tabs 2 gb ram enough experienced lag even running 23 apps simuntaneously surely best tablet get 40k,,,,,
used almost month great product productive personal office use apple pencil writing experience brilliant feel writing paper book good ereading butter smooth 2gb like 4gb audio output less problem use bluetooth speakers headphone battery life good take cover buying also put tempered glass,,,,,
wish screen laminated display make things clear visible gap comes play apple pencil bother sometimes want make great arts tight budget go one along apple pencil bang bucks input lag pencil adobe sketch notebility procreate need worry looking game also good choice play pubg sometimes sometimes long time performance really good honest notice frame drops set everything max battery life really impressed didnt regret im sure also,,,,,
love ipad extremely fast super fluid product amazing every way screen processor build quality said ios mixed bag ui really good lacks customisation like android android make product adapt workflow ios rigid regard bought screen quality held department expectation,,,,,
good supports apple pencil dont feel problem till screen reflective pain artist would recommend apps artists yet useful touch screen go 12 inch ipad pro graphics uses,,,,,
use teaching learning purpose excellent useful love amazon sold offer lower price thanks amazon price writing apps high,,,,,
using product 9 months bought rs19k diwali offer great product apple everything fine fast easy quality ram highly rich camera excellent daylight low light good expected con low memory 29gb os important apps engulf 14gb make videos big size media like download movies buy atleast 64gb inbuilt highly recommended students writers bloggers vloggers artists please buy also unbreakable glass protector sling bag,,,,,
best price range even year launch apps run smoothly lag get latest ios upadtaes next 2 3 yearsandroid tablets hardly get updates 8 10 hr battery life continuous use screen vibrant sound quality excellent loudness could better headphone jack good camera inbuilt ios apps ppts spreadsheets word etc need buy microsoft office apps best office work students also apart browsing entertainment,,,,,
battery iife could much better gaming amazing pubg games runs buttery smooth build quality also great except laminated display price range a10cpu absolutely okk,,,,,
bought ipad study purpose apple pencil one go absolutely paper free notes organised clean smarter display great battery awesome reading room spent 11 hours form morning evening whole use ipad reading notes talking purpose means display around 10 hours even using much single charge battery go 6065 suggest students get ipad apple pencil productivity blow mind apple service centres great using 2 months found single minor dust particle inside ipad display apple care people replaced ipad gave brand new ipad 4 days mind blowing cases covers going make heavy would suggest use without covers going use extensively,,,,,
top mountain got pretty sure would netflix device buying apple pencil bluetooth keyboard really reduced need even open laptop use time take notes netflix chill sometimes create presentation school microsoft apps,,,,,
box ipad deffernt,,,,,
great product cannot say much issue screen gets scratched took 7 yr old child occassional viewing youtube games must cover enjoy experince get apple cloud connection pictures reat good,,,,,
called student edition though works completely par pro ipad size resolution smaller purpose reading writing one preferable larger one beautiful useful tablet though really shines along apple pencil,,,,,
best get price range use netflix video streaming apps works really well even tried installing high end games working fine hiccups would recommend daily usage planning installing high end softwares go ipad pro,,,,,
got 19k nothing say much,,,,,
well ipad got delivered surprisingly 2nd day guess quite quick packaging perfect item next level thing screen quality touch etc flawless battery backup till good total really impressed ipad 6th gen yeah used wifi though limitation house wifi connected need bother much 5 stars product delivery amazon,,,,,
looking budget tablet everyday needs everything need tablet powerful enough never lag supports apple pencil draw write whatever want lasts enough long go,,,,,
got budget tablet specifically drawingits blast love drawback 32gb way less space thats also cheaperi bought 1tb hard drive im good good buy youre looking tablet drawing performs like charm,,,,,
using since last 4 months happy really love pad b recomended every students either studies gaming,,,,,
works great general purposes youre gamer looking buy play graphic memory intensive games like pubg probably device want go switched oneplus 5t gaming let tell performance nowhere close 5t beats device longshot,,,,,
ipad gaming play game consume battery watch movies netflix 30 minutes gaming loose 10 10 bettery watch 1 hour movie 10,,,,,
camera working returned worst experience,,,,,
never go cost emi option amazonbanks charging interest even u purchased cost emi option,,,,,
excellent tablet apple ie ipad students great features,,,,,
usual ipad stands among tech products cool features security feel good investment serves many purposes educational entertainment,,,,,
u might thing oh old budget come get solely playing pubg yeah works fantastic hardwaregraphic lag whatsoever controls swift smooth btw supoorts ipad os got update week im writing review months trust works great,,,,,
battery drains fast playing pubg smooth setting besides heats lot even normal task making unable use long time,,,,,
dont want ipad pro handy option works advertised gets job done considering apple supports devices cant find better alternative price point,,,,,
loved ipad cost 20k would say best ipad awesome performance great screen good battery backup value money 20k,,,,,
ipad great battery life screen good retina display storage space major issue always go higher storage space base model fills 1520 apps ios fabulous always great binge watching go,,,,,
getting 10 hours battery life camera decent camera priority go upper models overall performance amazingly fast efficient lags frame rate drops,,,,,
except memory things great price wifi reception good screen clarity superb touch response apple product feel little lag speed get used,,,,,
battery doesnt last long given defective product sadly apple service centre manipur let know run diagnostics online,,,,,
adapter working 1 month brought 60918 nd 61018 adapter responding,,,,,
doubt price range best ipadtablet want use long term security go never compete tablet price range,,,,,
basically brought kids school work happens hooked plan fact due ease use apps come apple product simply amazing right build quality touch screen sound quality speed responds extremely happy choose item,,,,,
bought multiple tasks like playing games writing notes editing photos wonder good purchase using apple pencil works smoothly like ipad perform basic task much smoothly compared android tablets sucks days,,,,,
book lovers especially books kindle readers love device carry syuff ipad enough presentations study purpose bought one view glad thanks apple amazon,,,,,
got 23kawesome,,,,,
apple enough anyone still looking review quality build user experience definitely putting cupertino office steve jobs shame,,,,,
ipad one word ideal students whore determined type codes couple years get bluetooth keyboard mouse u never feel absence laptop also get case tempered glass converterslighting corn opinion speakers bottom firing weight little heavier expectation,,,,,
first apple purchase great experience using 5 daysi say battery life good screeen awesome screen clear tablet response excellent lag,,,,,
battery life something cannot complain aspects address average cost amazon sells worth honest options price point,,,,,
deliver time good attractive packing ipad light weight luxurious handling excellent screen display screen size big enough comfortable eyes big small short complaints take hand want keep aside buying best economical pad go ipad 97 2018,,,,,
good product,,,,,
ipad opinion isnthe best device apple made course ipad air best upgrade best tablet go,,,,,
awesome option want consume media use reading purposes moderate gaming want creativity work heavy usage like editing go ipad air pro since 32gb variant would suggest keep eye storage interested store media files ipad opt 128gb variant,,,,,
amazing product great price,,,,,
superb product superb battery life,,,,,
good buy regreat buy screen guard apple recommending using screen guard hampers use apple pencil,,,,,
ipad doubt good quality tablet would still rate high gaming see better specs like huwaei upper hand gaming aspects apple ipad great product,,,,,
possibly best tableti guess higher version ipads better thisit need intro,,,,,
professional like designer artist go must students screen quality great compared android tablets range touch smooth tried heavy gaming basically use reading watching online videos medical lectures like marrow prepladder app amazing battery life,,,,,
thinking buying tablet go premium design user experience superb wont regret buying ipad much better android tablet,,,,,
screen like mirror gets hot device snappy,,,,,
much dilemma whether buy android tab many options also less expensive ipad glad decided get ipad apple though expensive android tabs worth money,,,,,
earlier felt fear buying electronic stuff online confident buying products online product comes great value go,,,,,
simply awesomeit simplified multitasking,,,,,
liked fast delivery amazon packagaing little bit damaged harm ipadamazing use wifiregistred applecom warranty need fear fake productgot price 20499 thanks amazon beautiful product,,,,,
bought playing pubg justwork excellent played hdr mode also problem occurred even heating problembut one thing noticed ists price increasing day day,,,,,
value moneyi bought 19k worth although fingerprint sensor bit slow unresponsive rest find worth buy,,,,,
much expectations,,,,,
much improvement last gen good price stayed old gen,,,,,
