,customer_id,user_name,ratings,review_head,review_body
680,review-6acda29b-32b2-400b-a6b5-67995a076877,Sachin Kasar,1,Unsatisfactory,wrong hart reat moniter
681,review-b0df3420-1b85-4505-acdb-e4c0bfa11ddd,Abhay Pandey,5,Best in the market!,awesome product
682,review-8790dc64-d927-49a7-88fd-89707d25b593,Flipkart Customer,5,Wonderful,good model watch ultimate design referred friends price worth product rich look n ultimate colour
683,review-92372cec-6d20-49b7-9279-ee807d45f5db,Flipkart Customer,1,Don't waste your money,good
684,review-2b8e65f9-a83e-4317-828f-983c2d264faf,Flipkart Customer,5,Best in the market!,happy wid productfor awesome
685,review-c1957cae-cc6f-429f-a6cc-6bf26c58f6ed,Ashish Raj,5,Awesome,decent product sporty looking cool
686,review-8a7d75a6-6dbe-4378-a79b-4582030897e0,Ameen Pk,5,Simply awesome,super excited
687,review-b5b758f4-c2ae-43d4-987e-8f77594c6983,Flipkart Customer,5,Excellent,good watch also waterproofits better wrist band
688,review-be9692fd-082c-4414-9b7b-b787539d5259,Flipkart Customer,5,Classy product,good model watch ultimate design refers friends allprice worth product
689,review-a3ff2805-9a1c-4f82-9d54-fe04d0248143,Naresh Kumar,4,Nice product,bad
690,review-3ac8aa55-00f1-410f-82c7-2526a145d0e1,Govindarajan Srinivasan,3,Decent product,expectaion
691,review-bfde1756-1751-44e2-a19f-6b0d0dabd8b8,Flipkart Customer,1,Very poor,app interface horrible detect sync phone every time battery dead reach stuck wrong time level theres way reset without syncing phone super tedious process watch great love fact useless without right software sucks stupid chinese programmers
692,review-62290b90-0282-42d3-9453-b834a7a87d0e,Rohit Joshi,5,Great product,perfecr
693,review-0751710a-5ab3-4a16-af1c-01ac1abe0a04,Muin Javed,1,Horrible,bad
694,review-14ead065-fc58-45a1-8551-a4090a10a8fb,Flipkart Customer,1,Unsatisfactory,good
695,review-cb8fca9a-8f7d-428e-946d-92bf37d1466f,Yash Patil,4,Value-for-money,best smartwatch ever seen
696,review-1f9a6d7e-3d5f-4ceb-9183-533636e34321,SATHISH SRIRAMOJI,2,Moderate,looking good hand quality also lenovo mark
697,review-ce908417-18e8-420f-b646-c066e4e66733,Manish Thakre,5,Fabulous!,excellent
698,review-32352d6c-4b16-44b7-8435-71ebd36421b6,SOURABH KUMAR,1,Worthless,buttons working good use 10 days one button came
699,review-d6a13c07-4cf6-4a51-9e63-e788cbf77ee4,Parthiban Muthukumaraswamy,5,Perfect product!,value money handsome look slim watchamazing features got two phones one another friend overall review outstanding watch
700,review-33d68717-6d31-469a-b59c-c19c7525a00c,shakti Mani,5,Wonderful,good
701,review-93250db1-faa8-4e6c-99a8-4737c98efec8,Vinay Kumar,1,Horrible,replacement return policy product plz careful buying product
702,review-26baeaf8-b1c2-4657-b214-951c7aeb9a5c,Flipkart Customer,5,Super!,nice product value moneyits first smart watchi loved
703,review-8fcd8bd5-d108-4ab4-89d6-8418d07c9f6f,Venkatesh Venkat,1,Absolute rubbish!,waste
704,review-b66507c2-85ce-4bae-80b1-de645a195c2b,Sathish Peter Peter Ramsankar,4,Delightful,decent product
705,review-dda8b091-52cf-4b3f-8bc3-242583ec0745,Flipkart Customer,5,Best in the market!,great price
706,review-def92c66-fbb6-4448-95ad-c67d42fcc583,Flipkart Customer,1,Waste of money!,poor support
707,review-032df3d7-c7b9-408a-b1ff-bba5dd43dcd1,lijo George,4,Worth the money,lenovo ego good looking watch looks like casio g stock copy
708,review-6f333815-2637-49d1-a710-9724f63376bd,Srinivasan Amarnathan,1,Did not meet expectations,good looking look like kid watch
709,review-9f57d9e0-8891-4e31-81e8-251f323434d6,Flipkart Customer,1,Did not meet expectations,function easy use
710,review-63af5aa1-ec7d-46b1-b05f-0d0546e9fded,Flipkart Customer,5,Worth every penny,excellent worth money
711,review-0b3d1a2b-43e9-4344-9f99-2dba60b9ee41,Vinayak Khandekar,4,Delightful,best price best product
712,review-6a609961-1054-45d8-a269-58ebac635862,Flipkart Customer,5,Brilliant,complete watch smart features great looks fits wrist nicely
713,review-2f80efee-3bf8-4b89-afa8-188fc7a0311b,kamal raj,5,Perfect product!,good products excellent working lenovo ego smartwatch
714,review-9d1e38b3-f244-463b-badb-5c1f698076e6,Sumit Saha,5,Super!,difficult charging
715,review-257ef30a-12f1-4e04-a120-36db88da3595,Flipkart Customer,5,Simply awesome,good product
716,review-a7c1d95e-21a8-419b-af56-63c4b79bcf2e,abhi manyu,4,Good choice,almost good product sometimes heart rate calculation slow
717,review-d5d482ba-24e8-4632-881c-c38af1d78589,Flipkart Customer,2,Slightly disappointed,charging problem starts charging within 10sec charging symbol disappear
718,review-8ad53102-a9ab-420d-a01b-c4e6e6c284c2,Flipkart Customer,4,Nice product,nic charger good overall nic watch daily wear
719,review-35f71bea-8d44-433f-a5fb-c041ee8956ed,Ashish Sharma,1,Useless product,stationary battery sign keeps confused battery status dont think one go carelessly designed gadget
720,review-dea01994-f99c-4ca3-8b3e-7edf83e1f055,Kunal Singh,5,Mind-blowing purchase,watch get damage 1 week usage replaced new one completely satisfied
721,review-a415501b-83ba-4fa0-8ddd-52815d4d31bd,Rajrani Kumari,5,Best in the market!,best watch wanna give 7 star
722,review-d1d53403-b4ab-460c-a0a6-ffd43aa7313d,Flipkart Customer,5,Perfect product!,class
723,review-3f8a47f9-7695-4bb4-92f1-4abe1893a63c,Flipkart Customer,1,Waste of money!,worst watch dont buy total waste money
724,review-d4a36a78-5570-4d14-8e53-7e2a378cb8dd,Leela Venkata Krishna,3,Does the job,good looking watch great features feel difficultcumbersome accessing features
725,review-70a20738-ef88-43ab-86dc-678cf7df8d52,Flipkart Customer,4,Value-for-money,nice features
726,review-4d19af6a-37e1-4fd7-89b8-c2c4b5fadad6,Vikas Gupta,4,Wonderful,disconnects frequently unable serve basic functionality
727,review-e6bd1db4-1764-4ec2-947f-9937b73dce7f,Flipkart Customer,5,Great product,good product using price
728,review-45cd621e-30f9-4f3d-bc58-95f015e0f33b,Aniket Bagwe,1,Don't waste your money,worst watch stopped charging well bad product even listed lenovo site also support flipkart despite official seller guess big shame still 4 star product
729,review-68c7e32d-7dbf-450f-8425-489e30b61294,IMRAN ANSARI,5,Wonderful,awesome product
730,review-6161ff09-6b8b-4b6e-a3b3-a21bc04347bf,Victor Das,5,Terrific purchase,good product
731,review-256c0562-44b1-44ff-8825-045a546d0b94,Md Sahid Raza,5,Simply awesome,light weight super
732,review-27f98dea-c533-4b6a-86bc-204ec565806c,Flipkart Customer,1,Horrible,sleep monitor wrong didnt use sleep got checked showing 1007 sleep
733,review-7bc77190-e414-45a3-92a6-b7aa16c5fe6e,Flipkart Customer,3,Just okay,battery backup 5 days
734,review-07e3341d-633e-42a5-98af-6bae8ec00596,Shashi,1,Waste of money!,3rd class product
735,review-671e5482-a2e4-4a31-bbcc-828eeb49cb1f,Tanmoy Sarkar,3,Just okay,good
736,review-b22143c5-d47c-43ca-89c2-2e9d9bb06ffa,gaurav kanojia,3,Nice,nice smart watch less features
737,review-ea6229ad-38a3-453a-8290-9547889c022d,Vinod yadav,1,Useless product,im giving feedback using 3 monthswaste watch dont buy performance worst always shows late time daily set time
738,review-547febaf-a93d-4cb0-a6de-a0e757e1241b,Praveen Chahar,4,Pretty good,product good
739,review-9bd8ea3e-c6fe-4c7d-b941-b095bfda5b24,Anirban Bhattacharyya,5,Wonderful,till working fine initial installation ltl dizzy otherwise pretty good looking digital watch added featurethey make something girls also
740,review-846b62c1-f8b5-45dc-845c-512c67489657,Flipkart Customer,5,Fabulous!,stylish battery superbly amazingworth money
741,review-ec572ccb-55e1-4b83-9103-6570aafe1931,Susilo Prasetyo,4,Nice product,good
742,review-080de14c-88e3-45b1-a113-027056cc4a9e,Karthikeyan Mathivanan,5,Must buy!,quality product fr price looks lik sport watch suits well wit casuals entire watch matt black finish good buy fr price range things improved alarm beeps instead vibration reminder notification find watchmsg info call info displayed instead vibration
743,review-ec82fb6a-8de4-4d8f-825f-8ee14759ffb5,MOHIT BISHT,5,Must buy!,nice
744,review-9a538ee6-e690-45bc-a596-5a04af8bd0a8,Lijesh Kumar,4,Pretty good,nice steps heart beats accurate recommented
745,review-35872c11-0007-4f59-96bd-4898240a5ef3,Ravi Chandra PM,5,Just wow!,best smart watch price
746,review-23e7bc3e-3f9f-46e5-8f63-dd27afc4a242,Flipkart Customer,3,Nice,nice product
747,review-1c0940b8-a3ca-4080-8498-d98b48b2240d,nikhil govekar,2,Not good,watch light stopped working 20 daysbeing told waterproof still getting vapors watch
748,review-f95a732e-cab5-48e8-a179-87eb3b51ae7f,Jeet Singh,5,Simply awesome,excellent smart watch
749,review-4f639794-3a9c-4500-8438-d138eaa714a1,Senthil Kumar,4,Good quality product,ok
750,review-9bc3b015-c4d2-4d26-ad27-63f6d11a5534,Chanda Rani Sah,1,Hated it!,battery working
751,review-67cac73e-8022-4082-84b9-af2cdb265bc7,Vasu Verma,2,Expected a better product,bad watch
752,review-1f827ac7-d334-47f9-a603-cc890290cc8c,Yaswanth Naidu,1,Useless Watch,bought watch 15 days back took swimming water went swim proof waterproof mentioned wasted money
753,review-5a199ff3-6684-4339-b170-c1cd5b0d09dd,Gaurav,1,Did not meet expectations,heart sensor working waste money
754,review-fbec4206-1574-4ada-b50e-b2ce6bd6fb06,Flipkart Customer,1,Unsatisfactory,expected
755,review-dff253d2-24a8-4ad9-9518-14483ae3ccd4,Flipkart Customer,5,Classy product,good product price range good one
756,review-7947b075-a4e4-4a89-91c4-16a8266698b0,Flipkart Customer,2,Bad quality,worth cost
757,review-2b08b99f-9587-4f01-b4bd-0c71874b2873,Flipkart Customer,3,Nice,ok
758,review-14fbe8e8-54e5-4d52-9a72-c7ade6271c3c,Karthikeyan S,2,Could be way better,display working properly
759,review-dbd301d3-de78-40ca-b477-1b3c46279b37,Flipkart Customer,5,Brilliant,feel buttons tite
760,review-b5a483f4-6164-4d9d-be22-52f714bc392e,Gutta Vamsi Krishna,1,Utterly Disappointed,worst product worst company wellthey dont provide proper support fix problem respond properlywaste money
761,review-d0023417-6a44-4e7e-9422-31a3352c5596,Eksha Sharma,2,Slightly disappointed,whole battery hundred zero percent drained one day heart rate sensor working even sensors light flashing brought one month kindly something
762,review-fb08be8a-845a-46b2-bbee-28edf6e0de75,SRIHARI M,4,Really Nice,good battery backup others also fine
763,review-fcf54abb-4267-4623-9a2d-05e9f031dcbc,Sunil Kumar Dharmana,1,Very poor,bluetooth range tto low
764,review-329296c8-e44e-42da-9376-d2dac237977d,Kami reddy Mallikharjuna reddy,3,Fair,ook
765,review-b27f6cdf-5974-4237-9acd-b8ba6e7e464b,Amit Kumar,5,Worth every penny,smart watch product bateary good
766,review-5014061a-591b-457d-8de7-e65dfa60f60b,Hamza Badami,1,Horrible,worst product ever seennot worth battery problem
767,review-942b8b4f-0288-46ae-830d-d567c21d8b57,Satish Baghel,5,Fabulous!,nice
768,review-d85b3b89-ddb2-4120-96d2-31bd8af879ba,surendra kumar,5,Worth every penny,excellent
769,review-5909a32b-e878-4f0e-bede-5be3294ab102,Mahesh Kamada,5,Super!,nice productgreat nice smartwatch good displayaccurate measurement hrm nice battery back upworth buying
770,review-e12037d8-b729-48f7-ab40-ea3010a20e4e,Vikas C,5,Awesome,nothing say simply perfect
771,review-ca8ac8c7-f027-43fc-856f-cbd225cc362a,Flipkart Customer,5,Mind-blowing purchase,super
772,review-c928b5d1-ff0c-4049-bf23-607b29ca1871,Rohith Nani,2,Moderate,nesw direction bar separated span 10 days
773,review-ffe74913-3d03-46ed-aa01-df238241136a,Ravi Arora,4,Really Nice,good service features watches also good
774,review-60ccc68a-b35e-451d-8bfd-f1e6b349732c,Flipkart Customer,5,Worth every penny,lenovo ego antireflective monochrome display legible outdoorsits goodrubber strap watch decent qualityand best part battery
775,review-69e898c6-0949-4e36-b6f7-b0257438df8d,Madhavi Reddy,2,Moderate,waste watch
776,review-54757b29-9713-4dfd-b79b-0f21e9db4ecb,Flipkart Customer,5,Highly recommended,essential features available health conscious person happy performance smartwatchcant believe battery performance beyond expectations
777,review-ab4c291a-72a1-426a-9693-e71954db64c2,vishal yadav,5,Super!,fabulous productfull value money suffice needsgreat battery
778,review-216f4a32-82a4-4cbd-a467-2ebe81f6ff42,RKB,1,Unsatisfactory,dont buy bcz many issues like charging booting etc
779,review-1441b0e5-fc78-4cc5-a23c-9e08f6b1d9ba,Brijesh Jaiswal,5,Highly recommended,review look excellent compare bands price segment full charge means tension free 3 weeks product best students
780,review-2b6e4cd9-6f86-49c4-ba63-8749a3f13ce3,Flipkart Customer,5,Awesome,great product worth money
781,review-41f56edf-ae27-4ce6-af8b-27848f77b59f,abiaka khiangte,1,Absolute rubbish!,bought nephew wasnt super impressed gets job done 2 weeks ago charging cable broke theres replacement available dont buy product
782,review-2843a0b4-6269-4c13-bd6e-9903c04d6864,Flipkart Customer,5,Fabulous!,following factors makes product worth buy1 gud battery back up2 look gud3 heartbeat monitoring activities monitoring also gud4 keeps reminding daily activities
783,review-d18a8de5-38ee-425e-9f7e-da05e2980a2c,Flipkart Customer,5,Worth every penny,amazing product good battery life value money smart watch everything required fitness tracking
784,review-47bcdcde-bb70-4c8a-adf2-ad7cc8915321,Kunal Daswani,5,Excellent,looks stylish built pretty strong accurate health monitoring value price
785,review-0f47f3b6-b039-45c4-9c64-8a6670db9275,Mrinal Kumar Das,1,Not recommended at all,bad productworst product dont buy3day damaged
786,review-97c2706a-f443-4df5-8bbd-3b17df2a1ef0,Flipkart Customer,5,Terrific purchase,good sport smart watchthis one capable fulfill day day fitness needs tracking daily activities
787,review-39e1a399-b25c-4185-b38f-62d02601037f,Flipkart Customer,5,Highly recommended,bought count steps calories burnt daily battery backup also good overall good product
788,review-860648e4-eeac-424a-a697-e5061c223822,Flipkart Customer,5,Classy product,bought watch experiment daily fitness tracking tracks records foot steps accurately
789,review-668c5a30-8e8f-4c95-a8d2-a519394f0947,Flipkart Customer,5,Perfect product!,hrm works goodthe build quality seems good watch price segment
790,review-da8e7a52-ad57-41e6-9dfd-24c3dddd16e0,Flipkart Customer,5,Classy product,battery life impressed mostcharged lasted approx 10days
791,review-97ff8eaa-2b22-48f1-90a5-c411bec7ff26,Flipkart Customer,5,Simply awesome,amazing piece technology low price works perfectly
792,review-777980a9-6353-41bc-89bb-7d4cbb0aa112,Flipkart Customer,5,Excellent,amazing piece technology low price works perfectly
793,review-22801718-80dc-4029-9373-b6e8f582c6b6,Flipkart Customer,5,Mind-blowing purchase,watch accurate better mi fitness bands comes price point
794,review-899bdd31-8f01-4909-bf86-f35dcdddfeae,Flipkart Customer,5,Brilliant,sporty ergonomic fit excellent battery lifeperfect daily fitness activity
795,review-409e9524-a2f8-4f19-8b8b-042b49aef8b5,Flipkart Customer,5,Super!,light weight comfortable battery life good
796,review-500e4614-def1-498c-98b7-93d9137add5a,Flipkart Customer,5,Worth every penny,fantastic product lenovo easy operate sensors fast accurateloved
797,review-55d33531-f917-4bbc-a40f-c039dad6a6c7,Flipkart Customer,5,Awesome,absolutely value money product well built seamless functions pairing device easy
798,review-d0979cd0-4a89-4e5d-a705-9eb97c77a367,Flipkart Customer,5,Terrific,loved build quality watchthe fitness tracker works fine
799,review-56746091-6a67-40e5-9ade-f0b5c6b00c0a,Flipkart Customer,5,Excellent,good smart sport watch max facilities
800,review-01ef6359-191b-4ef5-a6f9-1bb6f5d2ed26,Aneezz Roshni,1,Waste of money!,buttons hard cannot charge completely drain charge recharge good battery life though changing modes resetting difficult
801,review-09cfcf0a-2122-4c3f-b2e3-8416297e5eb3,Flipkart Customer,1,Unsatisfactory,nc
802,review-263661f3-6d8c-4ed4-887f-47c560a9c232,Ishq Pathan,4,Value-for-money,best price range quite difficult set charging pin
803,review-3eea6207-8dbf-4c30-9722-8b0fc994a378,Anantuni ravi,2,Expected a better product,looking great like kids watch
804,review-82244a0e-d991-482a-ab70-04de110103a6,SUNEESH C S,5,Classy product,good product
805,review-1e7a8118-0f34-47d8-9b4a-02b609a05185,Flipkart Customer,5,Must buy!,product fabulous totally reliable totally worth buying
806,review-294989f2-214f-4d67-a1d4-fdae32e2ea2e,Munusamy T,5,Brilliant,good
807,review-f00d11fe-63ac-4701-b11e-d1c4387a6be8,Flipkart Customer,5,Super!,best smartwatch must buy
808,review-df88a129-6d8b-48f0-b203-8bd8cac710dd,Dinesh Babu,5,Just wow!,wait less worth money settings connecting mobile
809,review-938d212a-8b80-4567-a8c1-4d2dd7d6dd88,Flipkart Customer,1,Did not meet expectations,please buy watch accurate
810,review-60338b66-839b-49bb-bde0-0f5e6b19ef5d,Sagar Pandey,5,Wonderful,nice
811,review-965f1e37-efb3-4ee0-ae35-2df1313e7544,Kumar Gaikar,1,Hated it!,heart rate show 180 200
812,review-cb45f6de-d0bf-4744-92bc-6f68efac7493,Flipkart Customer,5,Worth every penny,good product watch suits young generation awesome price point battery life good
813,review-4e7f5081-da9a-4fa1-b76c-67633d4b7b61,Flipkart Customer,3,Does the job,good
814,review-c91da19a-ab86-4b4a-9c7b-585d3b658fec,Debdulal Singha,1,Absolute rubbish!,bettary quality poormaximum 2 days backupwithout heart rate showing
815,review-3a10b3bd-4fce-417f-86f7-fc568acb28c9,Ashwin k s Ashwin k s,4,Worth the money,writing review 1 month usage hxo7 ego watch smart main disadvantage buttons strong hard press make display disappear restart device functions quite accurate
816,review-785ffb65-4e5f-4d13-87b2-02f5c617c8a9,Flipkart Customer,1,Useless product,pedometer part step counting correct 1000 steps walked records 300 steps time taken part walk also remains inactive stops 717 consequently calories burnt also shows wrong figure problem go away getting replacement watch also replaced watch also recording accurately
817,review-a2f4967b-d9bb-4df4-acda-be70199cabc8,Kalpesh Bhavaniwala,4,Very Good,nice watch
818,review-f3b3df92-1a40-4711-b144-e55f6cbcd85e,Flipkart Customer,5,Mind-blowing purchase,lenovo ego
819,review-988929e3-ee57-41f1-9faf-54a57f914a0f,Amit Sharma,5,Terrific purchase,amazing product value money everything required fitness tracking smart watch excellent battery life
820,review-79edcec9-9827-486e-8983-cc4a51f56977,Flipkart Customer,2,Expected a better product,charging
821,review-bb461cfc-fffe-4437-a8f8-3b1b1b51219f,Anup Chasa,4,Nice product,nice solid built quality
822,review-99aee100-f65b-46cd-940e-32f29e462e28,Flipkart Customer,1,Horrible,working use less watch
823,review-d1b2b896-b513-4545-923e-05402cf801b1,Vijayalakshmi,1,Very poor,one button loose connecting mobile phone
824,review-fd1c785d-02a8-4de8-bf5c-9f36f4e0137a,Krishna kumar Swami,5,Mind-blowing purchase,wonderfull digital watch smart band features affordable price point amd yes battery life also gud
825,review-1dd9bccd-a4b9-4278-82e7-14291154c3f0,Flipkart Customer,1,Unsatisfactory,worth money
826,review-48b43e42-480e-4d50-874b-42da5a2c7429,Flipkart Customer,5,Worth every penny,good product
827,review-78e8d36e-22a3-4233-931a-852974f33f83,Kartik Sharma,5,Terrific,amazing product value money everything required fitness tracking smartwatchgood smart watch excellent battery life
828,review-e81aaf6e-7191-44a2-a5a7-f75eb3a622ce,Siddhartha varma T,4,Good choice,good watch never got stop watch working everything else fine step counter counts steps riding motorcycle sleep counter works well
829,review-b1364016-1a64-4d37-afe0-49c59ffed32f,abhishek thomas,1,Not recommended at all,avenger
830,review-a59d1f61-5d4a-4e25-a231-37f5dbaeac12,Raghav Pachori,1,Useless product,worst product lenovo watch stopped working 2 weeks dont go itelse buy chinese product instead
831,review-1a7421ed-34b5-41fb-8a99-8087cc938119,Flipkart Customer,5,Perfect product!,loved thanks cheap price
832,review-5b8a847e-200b-4883-8610-8537e35e4fc7,Abhishek Sharon,5,Super!,marvelous
833,review-c1c96b14-2297-4935-922b-b0c18e5ca2d7,Shashi Raghav,1,Very poor,worst product dont buyeven though taking photos phone mentioned feature doesnt workno idle alertno goal reach alertflipkart acts ignorant argues photo feature available
834,review-9bef75cf-535f-4a27-8ad5-a02130760d50,Flipkart Customer,5,Excellent,nice product lenovo
835,review-edc71d51-2631-49fd-a16d-e6a5285bae95,Jijos Joy,1,Did not meet expectations,like overpriced 1 generationcasio digital watch display doesnt look good step counter jokeit counts steps even riding bikeit low range bluetooth connectivity time connectivity watch leonvo app doesnt work lol good thing heartbeat sensor
836,review-69cdc36c-7972-4508-b3cb-9138ea1404b3,Vishwanath,1,Absolute rubbish!,worst
837,review-6f9ce465-8ff5-4a11-b5e1-eabf8c700cfe,Rithin Belliappa,1,Unsatisfactory,terrible product stopped working week refuses turn buy
838,review-7feda770-fd1b-4292-b8fc-4616a7335ce7,kuhu Bhattacharya,5,Terrific,wonderful experience son body weight heart beat calorie spent footsteps count everything perfect happy son thanx lenovo thanx flipkart
839,review-fc19c776-6b49-406f-986a-6776b463b174,mounika patnaik,1,Not recommended at all,watch working blank
840,review-3a4fcb40-5b32-459d-825e-93e80c589d32,Sayantan Mitra,5,Highly recommended,great product happy lenovo
841,review-2da54416-2e5f-4590-9e23-3a81a090edf9,Aishu Shetty,5,Perfect product!,nice watch
842,review-91ba4cbf-966c-4a0b-a4a8-71f4bc5311d3,Hitesh Jivani,4,Wonderful,good
843,review-0d3c2340-80a1-4158-bd78-298d3059008b,Flipkart Customer,1,Horrible,water resistant watch one month usage battry drain quick good product
844,review-ee00b2ec-01bc-4ef1-ad86-6061861de9ac,Mithlesh Kumar,5,Super!,sturdy nice features
845,review-dc5e6b42-5151-4d85-9549-17c9089897e9,samresh kumar,5,Fabulous!,love swimming wanted waterproof smartwatch 5atm waterproof love
846,review-476e3fc0-9e4d-458f-947b-d2de8822553d,Nishaan Sirotra,5,Wonderful,battery life always wanted loved remote camera well
847,review-e4d25617-068c-43b8-8d07-5e730eb8f535,Flipkart Customer,5,Simply awesome,good product exceeded expectations
848,review-29a8a0f3-5c78-457f-8545-9ab51d424f28,Flipkart Customer,5,Terrific,great features
849,review-a90337e9-3246-4c9a-8512-302d8cf26a23,Namrata Tayade,5,Perfect product!,great battery life
850,review-93e03d86-5bf3-4855-9c5c-c611b69bd9fe,Arpit Pruthi,5,Brilliant,5 atm waterproof night light mode best
851,review-d555d7c6-6ce0-487a-900d-91b5a14ab8e8,Flipkart Customer,5,Simply awesome,amazing battery life helps keep track fitness must buy product
852,review-23329bc1-857d-477d-83f8-6df8e76f4f6c,Aditya,1,Unsatisfactory,dont buy product service center would require courier lenovo accountability flipkart product sold product water resistant damage due water covered warranty
853,review-68378549-67b7-4b4c-8c5e-478caa16623c,Flipkart Customer,5,Worth every penny,must purchase
854,review-fe6849c0-d28d-4d13-b2b6-182c27aa526b,Flipkart Customer,5,Perfect product!,nice smartwatch
855,review-2a31c57c-af9e-4d73-bdd6-468277d96de8,Flipkart Customer,3,Fair,good watch
856,review-c3e865eb-a11f-4492-a513-6e506ecb0b6b,Bobby Vankadaru,1,Not recommended at all,getting charged properly
857,review-df16bd49-29b0-48ad-ab57-39e734d5b63a,Shibasis Basumallick,4,Really Nice,good sports glass quality watch poor
858,review-6e9c0590-40a4-43c1-a9e4-dfe3a8029d51,Tarun Diwakar,5,Worth every penny,lenovo ego black smartwatch good device steps heart rate accurate
859,review-0a000971-cd23-4f54-bae0-2e2091333bee,Diksha Sharma,5,Simply awesome,excellent product
860,review-d9628d24-9ba3-4417-a819-d1ff454dce40,sourav bhattacharyya,5,Must buy!,excellent watch excellent battery simple connectivity issue
861,review-c48cedd9-42b2-41f5-ace6-18d2c148815c,Sameer Sushil Umre,5,Awesome,good rategood productbattery awesometnx yu flipkart
862,review-57de3726-51df-48ea-aff0-6f5a053bc681,DEVANSH JUNEJA ZONE AND VINES,5,Brilliant,good day
863,review-f94449e3-0be8-47a6-b1af-e70e8e50b655,Saif Patil,5,Brilliant,watch good battery dosent last long compare mi band 3
864,review-a97ff3e6-2cc3-42cc-beba-c9cfbe6476cf,Subroto Chatterjee,5,Fabulous!,nice satisfactory aspect product service delivery etc etc issue
865,review-c69fad2a-579c-4504-8fd8-1c04df692eae,Salman Ashraf,1,Utterly Disappointed,pros1 light weight2 long battery lifecons1 looks like cheap 300rs watch2 remote camera option waste3 charging watch big challenge disturbed bit also simply charge
866,review-788ffae6-50ed-4452-a074-85f41ab2f20d,Flipkart Customer,1,Horrible,hopeless
867,review-bd4af04f-206d-4da2-b16f-6090d2e894ed,Sri Varoon,5,Just wow!,features awesome rate display small
868,review-0de61138-3570-4ad1-b25f-952c96c0f105,Yuvraj Chauhan,5,Worth every penny,bought count steps calories burnt dailythe bettery backup also good overall good product
869,review-f8c50d9b-60d7-4715-b90b-2af1066bd9d4,Hemant Khanna,4,Very Good,good connection techno phone issue permission phone ok
870,review-104969d3-dbc5-468e-a102-75658c70b3bf,goutam roy,5,Best in the market!,awsome product
871,review-4e465c98-9c39-484f-8dc4-eebad9e5cb58,Pratap Pednekar,3,Nice,qualitydial bit smaller compared gshock watchesno day name sunmontueno flashing reminders callmsgetconly seconds n vibration
872,review-a0a009a2-232b-423a-a0d3-b1f5aedc3ed1,Abhishek Kumar,5,Brilliant,must buy watch
873,review-cd7c634e-dc6c-4d71-bd5d-89132a4e5e59,Sarthak Bhatia,3,Good,product good mi band
874,review-3db2d5a7-f05b-4c23-814a-9088ca91c773,Flipkart Customer,5,Great product,looks really sporty activity tracker works good
875,review-d940f9a5-9240-420b-b293-be3a4968db70,Bhavin Mordhra,5,Excellent,watch really super good comfortable daily usage
876,review-312bcf4c-d713-4b0c-81bf-a459557eef25,rahul,5,Excellent,love watchvery comfortable wear
877,review-06b209b1-56bd-4c05-b086-82ec00a23392,aslam memon,5,Worth every penny,nice
878,review-8826bf86-6912-4abd-9df2-fb1fbbe972d4,Flipkart Customer,5,Wonderful,nice watchreally loved
879,review-0709f917-0c66-42b5-ae00-1fe6067b7d9e,sunny tomar,5,Brilliant,amazing watch
880,review-f6412f16-c824-40ae-9228-60cd01406c6e,Flipkart Customer,5,Awesome,loved dapper watch 3
