,customer_id,customer_name,review_head,review_body,review_date,ratings
242,customer_review-R3MBS6SLM8VK8Z,Dhananjay k.,Good,good beginners,2019-11-10,5.0
243,customer_review-R17HIY7TLW51G4,santhoshreddygangu,Good,nice worth value,2019-11-03,5.0
244,customer_review-R31JL1CFHQJFJ3,bimalkumar,Please buy this laptop,good laptop,2019-10-06,5.0
245,customer_review-R2UT7F682DCJG0,Hardik Airy,Acid green light,light awesome,2019-10-06,4.0
246,customer_review-R2M17AC0OU561M,Pushpdant,Not much good,good better,2019-10-07,3.0
247,customer_review-RPOYZQGIL4WFK,Kiran Narkhede,Value for money,speed great,2019-10-22,5.0
248,customer_review-R2O2CM4UUJ650Z,Mebin Joby,Perform,performance,2019-11-05,5.0
249,customer_review-R2GSOO3AEJXF6C,Nitant K.,Very nice product,nice,2019-08-03,5.0
250,customer_review-R3F8T6LHCVWXEV,Dinesh Gawde,Good one,good experience,2019-09-09,4.0
251,customer_review-R3MCDRA0DQG6AO,Deepak m,Performance problem,performance problem,,2.0
252,customer_review-R181U2XD73PK4J,Eshan save,Very nice,nice,2019-07-22,5.0
253,customer_review-R13M6TK6RU1KM9,Himmat Hadiya,Amaz,good,2019-10-06,4.0
254,customer_review-R1AVZPS453UACE,Asad khan,Working,slow,2019-10-15,3.0
255,customer_review-R278FCE6N1BX6Y,Mangalam K.,Nice product,excellent,2019-06-22,5.0
256,customer_review-R1PYEZ54NR5VZL,Hardik Rathod,Awesome,awesome,2019-09-03,5.0
257,customer_review-R2X9EZQ2XSK3EK,Shobhit Mukherjee,Awsome product,nice quality,2019-06-04,5.0
258,customer_review-RZ71HFZAT56KX,Gaming laptops,Super,nice,2019-10-04,4.0
259,customer_review-R3BVRLUI5394DB,Amazon Customer,Nice Laptop,good,2019-10-26,5.0
260,customer_review-R124RMD87R9J43,David,Can not use it with some OS other than Windows 10,good laptop gamers panning use laptop unix based operating systems hardware exactly compatible run issues installing os properly discover gpugtx 1050,2018-09-02,4.0
261,customer_review-R3B3IU0ERKY0K5,Rahul Jain,Good Gaming Laptop,good entry level gaming laptop hp laptop without ssd ie 15bc406tx model things absolutely details laptop new buyers pro 1 green light looks cool 2 i5 8th generation equivalent i7 7th generation compare i5 8300h vs i7 770hq google benchmarks i7 7700hq seventh generation gaming processor used high price gaming laptop 3 2 fans apart normal air vents fans tiny vents also bottom better airflow 4 keyboard nice buttons well spaced 5 screen much better dell laptops 6 graphic processor 4gb suitable play high end games high ultra settings depending upon games 7 future proof atleast 23 years cons 1 hdd 5400 rpm atleast 7200 2 ssd 128gb 3 battery backup less compared gaming laptops 4 battery sealed one remove whole backcover order access battery 5 bit costly comparison competitors,2018-08-03,4.0
262,customer_review-RN5PJCGNVJUYX,Udit,Its very good except the bezels. Better benchmark scores than asus and obviously more fps,beast machine,2019-06-20,5.0
263,customer_review-R3HLNVQV05QPES,Aditya P.,Gaming Benchmarks,tested couple games laptop worked fine fps benchmarks fortnite medium high quality 6080 fps plugged 3040 fps unplugged watch dogs 2 high ultra settings 4050 fps plugged 2030 fps unplugged csgo high settings 100150 fps plugged games coming soon,2018-09-21,5.0
264,customer_review-R280G908WH7HOU,Amazon Customer,Worst laptop,disappointing nd always gets discharge nd get hanged,2018-08-31,2.0
265,customer_review-RB3FLZCS590TN,Arun Joys,Poor delivery,product good took one month deliver product,2018-09-06,1.0
266,customer_review-ROSXDUR6KBM0J,Jinny,Go for Gtx 1650 with IPS display,hp pavilion gaming advantage decent battery life gaming laptops disadvantages display tn panel 220 nits 45 ntsc thick bezels bad screen body ratio resulting dull brightness poor colour accuracy screen build quality low grade plastic poor heat management resulting much flex performance 9th gen processor 1050 buy 1050 1650 gtx upto 12 times better 1050 far superior keyboard ok budget gaming laptop overall suggest buy laptop 1650 ips display narrow bezel,2019-07-28,1.0
267,customer_review-R1700EFPZNSYOT,Rahul Jain,Decent Gaming Laptop.,good entry level gaming laptop hp got around 55k prime sale along exchange old laptop details laptop new buyers pro 1 green light looks cool 2 i5 8th generation equivalent i7 7th generation compare i58300h vs i7 770hq google benchmarks i7 7700hq seventh generation gaming processor used high price gaming laptop 3 2 fans apart normal air vents fans tiny vents also bottom better airflow 4 keyboard nice buttons well spaced 5 screen much better dell laptops 6 graphic processor 4gb suitable play high end games high ultra settings depending upon games 7 future proof atleast 23 years cons 1 hdd 5400 rpm atleast 7200 ssd 2 battery backup less compared gaming laptops 3 battery sealed one remove whole backcover order access battery 4 bit costly comparison competitors,2018-08-02,4.0
268,customer_review-R1ECXWDEPUFFLX,JK,Blue screen and frequently hanging,laptop received started acting day got blue screen couple times got hanged wondering come new laptop kind issueswas manufacturer hp didnt test properlywas problem vendor side ever may reason customer suffering,2018-08-20,1.0
269,customer_review-R1XFDSN5NKBE4J,shridhar s. kapse,Fraud-Wrong infor-misguide,seems fraud select 9th gen model specs clearly mentioning 8th gen 8300h,2019-06-13,1.0
270,customer_review-RUZWUMIOZCC9X,Decoder,Nice one,cool featuresbut bad hear upto 16 gb ram upgradable,2019-06-21,3.0
271,customer_review-R3BJ58BBG0T7BT,Nikhil,BEST IN RANGE,product truly value money 1650 graphic card i5 9th gen 512 ssd starts 7 secs great display average speakers good need go bad review 1650 graphic ssd range awesome awesome specs antiglare display company giving specs range although hp better brand value company hp service far better asus acer thatswhy best 70000rs hit like agree comment know better laptop range,2019-07-27,5.0
272,customer_review-R26MIPRQG43090,Khader,in my watchlist,gonna wait till one buy write review purchasing,2019-05-02,5.0
273,customer_review-R1DA1Q5KQZXOOH,Roy,An Awesome laptop,looking laptop quite sometime shortlisted ce070tx cb054tx bc406bc407 bc 408 considering price ce070tx increased cb054tx older version actively looking buy bc series 4gb graphics card advantage price bc408 80k decided go 406 407 considering difference 128gb ssd finally bought hp bc407 67700 around 2k bc406 feel good green keyboard looks awesome watched movie amazon prime one half hour battery reduced 40 65 put charge half hour zoom past 70 looking good gaming entry level laptop look brand matter,2018-08-05,5.0
274,customer_review-R28HP4K33NUZEB,Ahad Ali,Awesome,got product safely performance awesome intel core i5 8300h powerfull even powerful i7 8550u gtx 1050 also awesome played witcher 3 assassin creed origin without lag,2018-08-16,5.0
275,customer_review-R2WCW6OYS46TBT,Ahsan ul haq,NICE PRODUCT AND SATISFACTORY SERVICE BY AMAZON.,nice product hp service pretty goodit decent look one plus point proffesional well gaming lookbuilt quality preety desentbattery life good gets full charged 50min pro 1nice look slim laptop meant professional gammers 2for price 74990 itz value money 3it i7 8th gen processor 8gb ram128ssd1tbnvidia geforce gtx 1050 4gb ddr5 graphics 4it fast less boot time 5acid green backlit key board 6it sva full hd 1080p resolution antiglare coating good contrast image depth decent colour reproduction cons 1the display good viewing angle poor satisfactory,2019-05-02,5.0
276,customer_review-R34CQSV36RSRQO,Chinmay Tiwari,No GTX 1650,june 2019 youve used i5 9300h dont also use gtx 1650 instead gtx 1050 shame,2019-06-16,3.0
277,customer_review-R3C84ECC8ZXO8Q,Sanower Alam,Very poor performance this product Hp Model bc504tx,amazon customer care third grade unsupported sellers bought product hp laptop i5 9th generation 8gb ram1 tb hhd4 gb intel graphics card bc504tx product poor performance work properly designing related software etabe maya safe etc suggest others dont buy electronic products amazon sellers buy product amazon sellers take support security behalf amazon sellers,2019-12-08,1.0
278,customer_review-RPVZZ7PKWHTO5,Amazon Customer,"Must go laptop for game lovers, who buy according to specification and not by brand name APPLE. ;)",ive using month far good laptop starts lightning fastwithin 1214 seconds shuts similar fashion apps open lightning speed thanks ssd harddisk games played flawlessly without heating issue plyaing game battery drains faster times battery lasts around 3 hours full charge packaging good hp registration successful correct warranty date delivery amazon super quicknext day illuminating keyboard looks fantastic dark keys soft pressed screen antiglare 15 inches awesome experience overall rating 55,2019-11-11,5.0
279,customer_review-R5ZS2RHVGRDSU,Aditya,Worst product,hp worst company provide limited support theit releases launch hp gaming laptop battery hard disk died year dedicated gpu drives got update 6 months release n also died 2 years time hp worst dont spend hard earned money,2019-07-31,1.0
280,customer_review-R4Q93KRPREEYI,Sanjay Somraj,Best-in-class laptop and value for money,purchased august 2019 hp bc504tx 1tb hdd 8gb got amazon sale 50k laptop works smoothly mostly work dataintensive applications faced issues far havent used serious gaming cant comment pros splendid performance bright screen clear audio smooth keyboard highly responsive touchpad zero noise cons startup time bit slow matte finish body leaves lots smudges recommend going 16gb 1tb hdd 256512 ssd option,2019-11-04,4.0
281,customer_review-R27O48V5XS4BKV,Kiran Kantanavar,Strongly NOT recommended as HP customer service & support is pathetic.,product good 6 months normal usage many problems keypad stopped functioning altogether raised complaint hp customer care 2months still customer care resolved problem inspite calling multiple times neither hp customer care service centre resolved issue another major issue buy online amazon warranty date 3months 6 months older actual purchase date submitted purchase invoice change actual date purchase next thing per database also date raised complaint within warranty period didnt resolve issue 2 months said warranty expired cant anything fight remind complaint raised prior warranty date stupid pathetic support hp would say dont buy hp products,2019-10-15,1.0
282,customer_review-R38GDSMRKHC0Q9,Oddharak,Terrible display and speakers.,buy although get decent fps aaa games display ruins speakers barely make squeak laptops half price better displays,2019-06-20,1.0
283,customer_review-RFAB66NDCQUU7,Mohd Shahzaib,Nice but too costly....,go nehru place new delhi youll know hp bc series one year olderyou get latest hpdk0045tx gaming beast rs 73500 hp gaming backpackcore i5 9th gen 1tbhdd256gb ssd gtx 1050 4gbbelieve lot offersfrom official hp exclusive store,2019-07-22,3.0
284,customer_review-RXTSAX416M7SC,asmit kumar,Takes half an hour to boot up,worst laptop takes half hour boot dont buy laptop watch ice age tooth asses,,1.0
285,customer_review-R1DZGZAVFXDD8G,Pratik Mirgane,Good laptop,battery life better otherwise good laptop extremely stylish though overall nice,2019-02-27,4.0
286,customer_review-RRGXXZC6MEX9H,Naushad Khan,Not recommended for gamming reason is display,built quality poor gamming recommend minimum 120hz refresh rate display provide lag free 4k gaming experience laptop cant,2019-09-02,3.0
287,customer_review-RZBUMGYSMPO9T,Pallavi Roy,Good for gaming,really good gaming play rainbow six siege runs smoothly backlit keyboard really cool pair good mouse youre set game,2019-01-15,5.0
288,customer_review-RG6B2ELMP5T22,Jatin,Hp pavilion 406tx,doesnt like lower version 406tx might better tha 1050 ti suggest buy navedia grafic ryzen processor,2019-05-04,4.0
289,customer_review-R2ZEF9IBOY6NCJ,Ankur S.,value for money,great specs bright feels litle dim sometimes battery ok portable youre college student laptop fine,2019-08-08,4.0
290,customer_review-RB65PJL0NRP3N,raj,Outstanding,outstanding product,2019-06-10,5.0
291,customer_review-R2KJ8NGFO1SISS,Rahul,Full performance,lappy awesome u buy one problem touchpadtouchpad smooth left right click badits big problem u r using external mouserest awesome,2018-09-23,5.0
292,customer_review-R2R16LEJHRDEFD,kush,Best budget gaming laptop,supreme viewing angle used laptop 3 hours moderate usage still 60 percent battery left one drawback bezel around screen gaming beast go ahead,2019-10-04,5.0
293,customer_review-R3NLAL3TX21ZQH,apoorv wadhwa,Only buy on sale,worth 64k make better desktop pc rate,2019-07-06,2.0
294,customer_review-RMQIJZI45NSP2,Balakrishna Munnangi,Not at all good,bad received laptop even one software openedalot errors customer care representatives care free wont even sort issues bad service,2019-10-31,2.0
295,customer_review-R31OIDK33HCE7P,Pritthiraj Mandal,Don't buy,go better option laptop mark display sucks,2019-06-24,2.0
296,customer_review-R1YNYZ2UQOFTO1,Thanzeel,Hp extremely failed on the display of this device.,average quality good battery life worst display,2019-10-15,3.0
297,customer_review-RKMVPIBEIG0SP,Pranay Bhatia,Awesome Laptop,gaming beast best laptop price range go,2019-07-28,5.0
298,customer_review-R25MSJZL0E3WJY,Frozenking,Worst laptop brand hp,worst laptop,2019-09-29,1.0
299,customer_review-R2Z5BMIS9SQ9WY,Shashikant Verma,"Heavy work, smooth work in laptop",thanks amazing gift pack amazon good laptop heavy work,2019-10-04,5.0
300,customer_review-R1M2VJTN0H7QY8,Abhishek Mohan,ABSOLUTELY FANTASTIC,absolutely fantastic laptop top notch performancerobust builtelegant designlovely backlit keyboard absolutely value money great gaming also casual stuff,2018-12-09,5.0
301,customer_review-RJW7TN5UDJI20,Monza,The best,good students gamers,2018-10-22,5.0
302,customer_review-R3OERKIGDDMMIR,Amazon Customer,Good laptop,good laptop available around 60k bought 57k viewing angel good,2019-10-26,5.0
303,customer_review-R2CA7022IWMJBG,Dev Kalra,Appario sells unactivated windows,unactivated windows despite charging appario retail,2019-07-30,1.0
304,customer_review-R71MR0RNPVNOC,Aman Patel,Performance,good,2019-08-01,4.0
305,customer_review-R2EYUSIN37RDCO,SANJAY TRIVEDI,Dont buy hp product worst quality.,buying found worst piece dead next day,2019-08-11,1.0
306,customer_review-R1QLNBLLPJCB2V,satish rathod,average,bettery life good expected works,2019-10-11,3.0
307,customer_review-R3EEMNM1JQDBIW,K.R. Sriram,Where's the GTX 1650 variant?,eagerly waiting gtx 1650 version,2019-06-18,4.0
308,customer_review-R7SVR8SI3UOS3,Rajib,Oohhhh,best laptop,2019-12-04,4.0
309,customer_review-R13VXVDC7D0NZ,shashi,Good product,satisfied performance,2019-11-07,3.0
310,customer_review-R3U1KTZO0UHY8X,pradeep singh dangi,Value for money,buy itt best,2019-07-25,5.0
311,customer_review-R3MUU36M4LBY4P,Amazon Customer,You will need to update OS at the earliest to remove all bugs,terrific laptop doubts problem battery lifewhich quite poor doesnt matter muchanother issue face bugs initial starts removed update os packing delivery excellent even new green backlight quite cooloverall brilliant laptop,2018-08-01,5.0
312,customer_review-RKDSCKXI9NXAD,Kindle Customer,"Best laptop under 60000 , good performance",great performance,2019-10-06,4.0
313,customer_review-R1LD2TXKP5WE5H,bhargav,Not good,ok,2019-10-25,4.0
314,customer_review-R27TNRHEGTH9F5,sriharsh,This is it,wanted,2019-06-28,5.0
315,customer_review-R9R33OO0G2VZE,Sumeet Samanta,Good Laptop,nice,2019-10-31,4.0
316,customer_review-R2SMMDBIDK6SIZ,Chandra,Super,good,2019-10-08,5.0
317,customer_review-R6KHCR05GYWZ2,TOWSIF,Thb,yhb,2019-09-23,5.0
318,customer_review-R2PBX1BBX6K1FY,DURGESH SINGH GOND,Very Very Good,,2019-05-12,5.0
319,customer_review-RODV403SKHCO4,Bhavik,"Price is too too much, only for 8th generation,not 7th gen.!!! Is it fair?",good laptop price specifically prefer buy price 60000 60000,2018-08-07,5.0
320,customer_review-RGT74VV5TL3VA,Amazon Customer,Value for money..!!,affordable gaming laptop great look better dell g3,2018-07-25,5.0
321,customer_review-RWJGCXSLWV59N,Hitesh Kulkarni,Premium Laptop with great features,feels premiumgreat features would require ssd fast better performance also priced,2019-07-21,4.0
322,customer_review-RAN21QRT2ZOW0,Atul Kumar Sinha,This best for hp fans under 65000,software controlling fans speed like msi dragon centre hp omen omen command centre asus rog aura sync etc,2019-10-05,5.0
323,customer_review-R164SMFD956RGC,Shiva Shankar,Good one,replacement product excellent writing review 3 months usagegood one go,2019-12-21,5.0
324,customer_review-RJVJIVDMSHL50,Nitin,"Battery Back up is not good and mosue click is really hard, do not buy this machine, I did mistake.",till experience product say anything comfortable use machine amazon giving option refund exchange replacement option goin solve purpose,2019-07-21,1.0
325,customer_review-R1YE41JV3MQTTJ,Dhruval,Just buy it,specifications price great may go,2019-10-14,5.0
326,customer_review-R15KNVG2LCYKXC,Jebin Vijumon,HP pavilion 15,graphics card crashing numerous complaints,2019-11-14,1.0
327,customer_review-R2LPGC1SRK14TH,Amazon Customer,best in this budget mark my words.,u looking get 100fps mostly games came 2018 go mean lappi best budget personally feel cooling could lil better ok,2019-10-04,5.0
328,customer_review-RAO8SC3FVDSKZ,Pradeep G.,Good,good onebit costly performance good,2019-12-27,3.0
329,customer_review-R6SRE3DGE5682,Abhijeet,"Durable, fast, games doesnt",best thing ever happened perfect laptop,2019-08-18,5.0
330,customer_review-R3RNRGH0QVXKYT,nasim haider,Honestly review,battery life 56 hours heating issue less becoz start heavy work fan fitted inside th laptop start working one thing dont like internal fan sound bought product 53k,2019-12-22,4.0
331,customer_review-R2ZZPIW1R5U9C,Akshat Sharma,Excellent product!!!!,great laptop got lot research good battery life gaming smooth processor also 9th general overall great laptop price range,2019-10-19,5.0
332,customer_review-R1KA8ZLXCO4NIP,SHIv kumar,No,,2019-10-10,1.0
333,customer_review-R1EUOOBIPA6PGH,Abhi,"Great Laptop at Rs.56,990!",great laptop bought rs56990 great display great keyboard gtx 1650 i5 9th gen fast quick response probably best laptop ever owned ms office pre built includes 30 days trail,2019-12-23,5.0
