,customer_id,customer_name,review_head,review_body,review_date,ratings
59,customer_review-R1OA8VAM7ENLUP,NITIRAJ D.,Probleme in graphics card,serious issue laptop game crashing minutes gameplaythe error message direct 3d error device removedthis single game play happens every game done everything updating drivers updating windows restoring windows factory reset nothing seems fix error laptop using powerful gtx 1650 i7 9th geneation still issuei feel betrayed,2019-09-19,3.0
60,customer_review-R373YBDBYDJ9FA,Amazon Customer,Got my 10 percent cash back,bestbut good gaming laptopits5400rpm 7200128gb ssd per budget around 75k satisfactory onei got 750002000instant disc1000got amazon pay550010 per cashback66500,2019-01-12,4.0
61,customer_review-R1YC2Z4RXRUCAE,Kk,Good,good,2019-06-27,4.0
62,customer_review-R1W674UKG60MDC,Amazon Customer,Value for money,great product delivered time fast booting,2019-10-22,5.0
63,customer_review-R31LVI7775T8I6,Gaurav j.,Worst laptop ever i have seen,1worse angle view sode even front view angle worst 2build quality worsta small pressure damage 3never buy amazon price fluctualtion 11000 generally shows price 70990 time 59990 4coming gaming never used laptop high processing ram burnt go brand laptop bcz feel cheated buying,2019-11-27,1.0
64,customer_review-R2I49T98EU249S,Mayur,Excellent for high perfomance computing but lacks in display quality,prefer performance anything else price surely go games played run smoothly without crashing gpu really good feel lacks bit user experience part expected price bear certain trade offs,2019-07-20,5.0
65,customer_review-R1JFIQYHX0DL6P,BYJU,Cheated by Amazon and HP - No return available,gaming laptop like toy screen look like 10 year old nokia phone zero resolution worst brightness amazon accepting return item friends dont gent trap get asus acer laptop cheap good quality,2019-10-25,1.0
66,customer_review-R1DC6VAOF2SWZ1,jerome,Duplicate product,sound speakers noisy even suspect duplicate product,2018-11-11,4.0
67,customer_review-R1FP9WI2IZF6UO,Abhishek Anand,Very disappointed with the display! No IPS display and bad viewing angle.,totally unsatisfied display bought 72900 sale display worst even redmi note 4 far better display laptop colour seems fade away ips display viewing angle ok cant edit single photo,2019-11-06,1.0
68,customer_review-R1A6LXZRTIQTN4,Dhaval Vaghani,Bakvas,worst product ever,,1.0
69,customer_review-R3A91YYZ4D97FV,Nirbhay Kumar,Good laptop for programming.,laptop good gets full charge 90120 mins though little heating problem touchpad expected hadnt run game yet ssd memory provides good speed laptop overall good laptops 60k,2019-08-12,5.0
70,customer_review-R1AF27DGZJRUSM,Radheesh M R,Descent configuration.,good choice fast like however mouse pad comfortable use need click multiple times right click,2018-11-01,5.0
71,customer_review-R1LKMSVY5TCM5R,Satnam singh,Poor performance,games stopped working everytime applications running slow like photoshop,,2.0
72,customer_review-RI0OQ60A7JT9R,Deepak John,Good buy,super value gaming nd work games ive thrown worked without issues,2018-10-18,5.0
73,customer_review-R1P9Y7C06G15RN,Madhivadhani.v,Worst product,buy cheating brand new laptop lot issues work purchase give replacement neither care issues,2019-09-10,1.0
74,customer_review-R23WB5SSLM6MER,MURUGESAN a,Awesome,bought 57000 festive offer really happy lap read description bought item designer fully satisfied good also comes one one updated clearly showed warranty info,2019-08-18,5.0
75,customer_review-R3JFMQCBD6B8KJ,John Thomas,Laptop running too slow,slow didnt expect 8 gb ram takes long turn files open long clicking icon sometimes stops responding,2019-08-25,1.0
76,customer_review-R3VQA7A32FQIV6,Jayanth,"Can do everything(gaming,video editing etc)",first thing first 1050ti 128ssd 65000 unbeatable laptop simply superb qualityspeed amazon amazing job delivering time,2019-06-03,5.0
77,customer_review-RFRX3P7LK3HXC,Chitra Bahadur,Very poor quality laptop not suitable for gaming at all,third class product wont find product hp website integrated old hardware processor game low configuration wont work start heating 10 minutes game requirement 650 graphic card work properly check hp official website bought i7 9th gen,2019-10-20,1.0
78,customer_review-RIAQ1N1216FCV,Amazon Customer,HP product quality is very bad.,bad product stopped working three months running pillar post get repaired also warranty one year cover whole product low quality chinese product dr alvin daud 502 tirath bakshi apartments new hyderabad lucknow mob number 9260976445,2019-10-26,1.0
79,customer_review-R2PI75F8849UVX,Amazon Customer,Worth for the price..,laptop slow bootup able handle intense work without glitches good amateur creative user multimedia purpose gamer average performance handle stuff medium graphic settings love laptop light weight,2019-09-19,4.0
80,customer_review-R1T2T4H7NFB9B5,Faizan,good product must buy...,nice laptop worth every single penny brightness good overall performance good packaging amazon good quality product delivered boxes without protection thats thing disappointed besides product really nice,2019-10-29,4.0
81,customer_review-R6P811L4SKBD8,Srajan Jain,Never buy this scum,slow laptop slower previous i3 laptop games able run downloading speed also slow recommend buy laptop store instead online also takes really lot time start shut,2019-11-17,1.0
82,customer_review-R2BCST7GMPDJ4F,Harshakiran kalavala,good lappy,better purchase one gaming vise normal usage good one battery life 6 hours minimum,2019-06-24,4.0
83,customer_review-R3BHQ0PF1U5O81,ATHARVA ENTERPRISES,Great performance laptop,product good aa far gaming concerned works great aspects expcept one takes much time booting processes takes one minute complete eg clicking right click staring laptop takes 2 min show menu battry life good,2019-11-16,4.0
84,customer_review-R2QVAB3YSJKGR3,Mujash,Price issues,price product bit higher 66k,2019-06-15,4.0
85,customer_review-R3SXVUIE194PFX,ANIKET BANERJEE,Not good,games like far cry 5 far cry new dawn assassins creed odyssey crashes laptop suggestion upgrade 16 gb ram play heavy games,2019-10-25,3.0
86,customer_review-R17YTBHLXFX8II,RAJEEV CHUGH,Product received without bill,received laptop without bill could big company costomer care solution problem instead help giving harrassment coutomer go cyber cafe downloading bill poor,2018-10-27,3.0
87,customer_review-R3BWJLFSKV15HO,Idrees,Product not same as written by Amazon configuration,amzone froud,2019-05-10,1.0
88,customer_review-R348Z3W3GZPP09,Ashish Goyal,Good purchase,laptop good chip fast keyboard buttons touchpad could better sometimes buttons miss register clicked takes points away overall premium feel,2019-08-25,4.0
89,customer_review-R1FG72K9OAUM58,Jai,Excellent Purchase !!!,speedy screen bit let everthing apart great good battery life decent speakers great performance,2018-08-29,4.0
90,customer_review-R1HPI2Z25WIXHZ,Manish Mehra,Good to go stuff,good gaming programming also display lacks tft display provide poor quality brightness also hard disk also average provides 1tb space speed slower bought 64k worth purchase,2019-08-22,4.0
91,customer_review-R20NAD17YLQAFY,Bhawani M.,"Great laptop, must buy!",bought laptop 55k prime day hdfc card discount im writing review 2 days use highly recommend laptop really fast good battery life acid green keyboard looks great price unbeatable,2019-07-20,5.0
92,customer_review-R1FXCVLA4JR5HZ,CUTE MK,mid range gaming laptop,good mid range gaming laptop good performance battery backup,2019-10-30,4.0
93,customer_review-R3SJLII5904PVL,Dharamveer,Better to purchase Acer Asus or predator in this range,poor battery charges 2hr 30 min lasts 1hr gaming keyboard good buttouchpad bad pubgm emulator lacks system hangs kill bit pubgm,2019-10-17,3.0
94,customer_review-R3SFQ56GIQ9SDU,Lokesh datta,Defective product,recive defect product complain mother board,2019-12-11,1.0
95,customer_review-R20Y06FSYSPH9F,JISHNU,Hp pavillion,build quality poor plastic body made poor materials display average performance system average considering specifications,2019-07-19,3.0
96,customer_review-R31ONWBCMA9644,Akash 510 Mehta,Ticks all the Boxes,product exactly needed fast sturdy ticks box requirement column graphics card drivers need updating office version included use perfect,2019-10-12,5.0
97,customer_review-RZFKEA3PJ48XH,Yagnavalkya Mukkamala,Excellent gaming PC,love new pc wider screen faster processser excellent games video processing also used routine word processing computing slightly expensive certainly worth,2019-12-01,5.0
98,customer_review-RPH1KYTH06MFY,Dipayan Mondal,Good laptop,good laptop charger got extremely hot charging,2018-09-28,4.0
99,customer_review-R3KNUTHVJT7ISK,Tushar Tembhare,Honest Reviews,got offer decent look mat black finishing got expectations green backlight awesome yet installed game good advice configuration go,2019-08-25,5.0
100,customer_review-RW6NHYEHH8NUR,Raider,A good deal from hp,product semi gaming professional laptopcpu speed touching 40no heat issuepowerful fans excellent temp sensorsgood gaming 4gb gddr5 gpugood dealdisplay also goodrun games smoothly without heat issue,2019-11-08,5.0
101,customer_review-R1XZM98OJ5U6VM,Amazon Customer,My experience after using it for a year,get product need good gpu screen average rest good never ever turn hp coolsense otherwise laptops gpu might get permanently damaged repetitive heating cooling loads happened,2019-11-07,4.0
102,customer_review-R25QALZJZOHIT0,Upamanyu Pattnaik,Great product!,runs smoothly fast boot time,2018-12-17,5.0
103,customer_review-R1ZEV44X89VS06,Manish,builtin laptop wifi is not good,company selling without tested products several time faced issue laptop automatically disconnecting wifi device time devices working fine,2019-08-09,2.0
104,customer_review-R1LVWAGO6K7M02,Yengkhom,okk,display flicker sudden change brightness gaming good battery last 4 hrs want replace replace option processor fast,2019-09-22,2.0
105,customer_review-R2O94SKK582M9L,Amazon Customer,Good product,product really good especially civil engineers interior designing need improvement display quality,2019-09-10,4.0
106,customer_review-R3Q3O5J2KMO5TH,Sidharth M B,Spectacular,absolutely worth pricegood battery backup keyboard feels goodunder normal use battery lasted 5 daysunder heavy gaming battery lasted 3 days,2019-10-09,5.0
107,customer_review-R2GZ7M44PD0VSV,R Suresh Kumar,Don't buy this if you are looking for a gaming laptop,really disappointed productit fulfil expectationsgaming performance upto marktends lag loteven much lower prizeyou could get laptops much better,2019-10-07,3.0
108,customer_review-R3UHVJ5E4B2ML,sagar,Not so great for the price,okayish laptop gaming hardcore gaming theres need add ssd careful buying laptop received one expired warranty,,1.0
109,customer_review-R1X73VQLCRH27C,Biswajit Mishra,👌 👌 👌,perfect laptop gaming n multitasking,2019-12-04,5.0
110,customer_review-R2397J3BQPS8GD,Anshu,Beast laptop,superb laptop great time fast processing also,2019-07-19,5.0
111,customer_review-R2VZCO6DZ0YZC8,VK the king,Very good,useful fast liked,2018-12-12,5.0
112,customer_review-RNKVCPMS0ESUV,Puru T,Great!,using month great laptop battery life seems smal adjusted give battery performance overall great buy awesome looks,2019-02-14,5.0
113,customer_review-R2V4362ABMM9PY,K k Gupta,Haven't got pkka bill,keyboard light working havent got pakka bill guarantee warranty card,2019-10-12,4.0
114,customer_review-R3L2BZOK1Q8XFA,satya sen,Not satisfied with the built quality.,using month specifications good works smoothly everything good concern built quality could better,2019-11-15,4.0
115,customer_review-R19HI854GYAZDS,Subharup Das,Bang for the buck😋,cool however win10 hdd sucks big time guy however problem might solved ssd though havent tried itcamera sucks big time,2019-08-27,4.0
116,customer_review-R7KT0Y2MNHOEG,Partha Prateem Bora,Love itt,good,2019-09-26,5.0
117,customer_review-R22E026D57PB7F,Asad Fahim Khan,One Of The Best Gaming Laptop,awesome laptop gaming,2018-08-29,5.0
118,customer_review-R1A9KRU6UAHW7D,PRAVEEN. R,Pure classy,worth buy awesome beast,2019-07-25,5.0
119,customer_review-R1UMXPBCT8SCPM,ABHIJIT PAUL,Good and as advertised,i5 8th gen good laptop best price,2019-06-23,5.0
120,customer_review-R4INHISGLXOR3,ABS Bhandari,Need a bill,bill laptop nothing mentioned warranty laptop laptop good products received received bill,2019-10-02,4.0
121,customer_review-RE9VLRJXDO4IO,Vedant,Best laptop,one month since bought laptop best piece range talking gaming experience worth battery also worth price,2019-09-02,5.0
122,customer_review-RB6WOC7UWS10Z,Anil TS,it’s super,like much,2019-06-12,5.0
123,customer_review-R29GY084XNGMVV,A,Just Amazing,amazing laptop good value money 128gb ssd 1050ti graphics 65k unbeatable nice cooling fans wonderful display good quality liked much,2019-07-17,5.0
124,customer_review-R42VYLNZDBPO2,M.Suresh,none,none,2019-09-20,5.0
125,customer_review-R27Z8HDXNOIPDR,Mukesh kumar goyal,Don't go for lenovo legion y540,must product buy,2019-10-31,5.0
126,customer_review-R18AN9LCVPUF8,Rt,Asus seems better than this,proper invoice given without would get warranty,2019-07-31,3.0
127,customer_review-RZAFEP8MZ2MV3,"Dhiraj gupta, New Delhi.",Excellent product,expect product delivered described website within time battery life laptop good backup time 4 hours,2019-05-11,5.0
128,customer_review-R1YDATHD48UATE,Venkateshwarlu,Wanted to give -ve or zero but no option to give zero rating.,one worst product bought ever life time open system takes 10 minutes load proparly installed software yet,2019-10-19,1.0
129,customer_review-RRQ22UG30KYJ2,Rupamm Bhowmick,Hopeless,msi lenovo laptops far better price range hopeless bought hurry hp laptop,2019-12-19,1.0
130,customer_review-R2U6FD7MRH7BW2,Subham sourav padhi,Good and light in use,good quality display fast charging reading speed little slow,2019-06-16,4.0
131,customer_review-R3DF74BJBGDC07,Abhilash,OK OK!,good laptop could better keeping mind price paidlol,2019-04-09,5.0
132,customer_review-R15LKXW3H85JW3,Soham Chakraborty,Laptop to depend upon,gaming stuff laptop beast longetivity anyday rely upon hp,2019-07-31,5.0
133,customer_review-RR8FO9ARTX5C7,Charudatt,Faulty laptop,laptop working booting issue replacement process taking approx 15 days frustrating experience ever,2019-11-25,1.0
134,customer_review-R2GXSK36XD4DNL,Rohan,Worth it,want budget laptop playing aaa titles low medium setting go happy product budget,2019-10-14,5.0
135,customer_review-R1FRTHT2AG2F6B,rajkumar sinha,Excellent,excellent product,2019-09-18,5.0
136,customer_review-R3BKNCPC5JJBWM,SUBHASIS P.,Value 4 money,good laptop 4 gaming loversseamless gaming experience,2019-11-20,4.0
137,customer_review-R2TOUEORWQH4JG,shaik,Performance,system performance poor much unresponsiveness without software installations cannot gaming laptop,2019-08-07,2.0
138,customer_review-R2F17KVVOK2NVV,Technip,Good one,good product,2019-09-14,5.0
139,customer_review-R2JPW2QS4CBU,indranil banerjee,Best buy,one best gaming laptop price range,2019-11-09,5.0
140,customer_review-R1087PVJ8P4VCC,Satish Kumar,"Good laptop for gaming, other purposes.",per expectation,2019-06-10,5.0
141,customer_review-R27LXEFJM7BUZ6,Vipul,Tx,best guy,2018-11-07,5.0
142,customer_review-RIZUZGWDLEU92,manoranjan nayak,Best laptop. Pleasure to use .. smooth and fast,best gaming laptop available market,2019-10-23,5.0
143,customer_review-R3X0X2KX9S5SC,Shashank,Battery problem,battery life gone 90 less within year purchase,,2.0
144,customer_review-R3LRVVQZ8UCFX5,Y R RAO,Good product,good product,2019-11-04,5.0
145,customer_review-R39SDXQO0OOEGM,Shubham Adaki,Good Performance,loved product super performance speed data loading thanks amazon hp product,2019-11-17,5.0
146,customer_review-R2X9C9W2F1777Z,Siddharth Pareek,Best!!,lot search found laptop happy searched best got best,2019-12-01,5.0
147,customer_review-R2B2Z282RDZNZQ,Amazon Customer,Incredible HP,ultimate performance fast charging great graphics quality lightning fast processor hp incredible go ahead hp,2019-11-02,5.0
148,customer_review-R11X0L9R6Y78VO,shyam krishna,Waste product,bad product speed bat graphics,,3.0
149,customer_review-R23HLQYV07939M,Ashish,Very sad,laptop slow start peopaly work,2019-08-11,1.0
150,customer_review-R2ESCKPH7UNR3L,Amazon Customer,Best,best gaming laptop budget,2018-09-18,5.0
151,customer_review-R2G5BGVOXPEAOZ,VISHNU VARDHAN BATCHU,Wrong product but great performance,got 13inch 15inch,2019-10-10,5.0
152,customer_review-RKDHJ88TVM9L0,Vittu chowdary,Doesn't suits for gaming,waste money never ever choice product go offline store get best price,2019-10-26,1.0
153,customer_review-R2DUYMP1JGL2FG,suresh,god level laptop,best,2019-10-28,4.0
154,customer_review-R102T117GBLMZO,Mandeep,Dont buy this model,faulty graphic card games freeze pc restarts technicians helpful,2019-08-27,1.0
155,customer_review-R34YQHK66R57K9,Omkar,Best,best laptop buy need handle carefully avoid removal mat colour back panel,2019-08-05,5.0
156,customer_review-R17DAW8QJTZS0N,Kamal,Non Functioning of HP Pavilion 15 bc 512 TX,set could done,2019-07-18,1.0
157,customer_review-R3QWJBBEDY1BP5,priyanshu,Wrond item shipeed,window10 activated yet ms word ms paint ms office working proprely angle view good,2019-10-25,1.0
158,customer_review-R6FZUFAVNX81C,Anu,Display against powered laptop,really powerful laptop less display quality overall really good deal go,2019-10-30,5.0
159,customer_review-R3Q1GHHRXWMM3I,Ghanshyam Verma,Nice,nice one,2019-10-07,4.0
160,customer_review-R2E1HC38WRLPOW,Subrahmanyam,Nice,nice,2019-10-12,5.0
161,customer_review-RG2UTSKGBRV2T,Rishikesh kadam,"For gamers only, average battery life, brightness already proper",camera clearity satisfied overall good performancenot fhd camera mentioned,2019-10-06,3.0
162,customer_review-R1QYLFJHIUJBCL,DHIMAN K.,Good product product,1st time slow performance lagging use problem fix poor 3d class delivery,2019-09-30,4.0
163,customer_review-R1U8P8HVZSC2A9,Vamsi krishna,Display quality,display quality good picture seeing clearly see laptop,2019-11-11,3.0
164,customer_review-R2JSYPF846HE64,Amazon Customer,Great,great overall need user manual know turn fansetc,2019-07-17,4.0
165,customer_review-R33UX28CRAX3LX,Deepak M.,Feedback,good one,2018-10-27,5.0
166,customer_review-R1UBLC6QYVBZ4L,G SREEKALA,OK. GOOD. TAKING MORE TIME AT START UP,ok good taking time start,,3.0
167,customer_review-R19FEY2T5YYQQN,Seiginthang,Pc went wrong,something went wrong whenever download application,2019-08-14,4.0
168,customer_review-R2AV9IHDKY553,ADITYA ARASHAR,"Value for money , but low battery life",good product low battery life rest good go,2019-10-12,5.0
169,customer_review-RQXQNT3M2NZE2,Brendon,Love it!,love,2019-08-12,5.0
170,customer_review-R1J1OT1W61Z8ZI,Somil thayani,Worst laptop,worst gaming laptop looks good performance nit gud alll,2019-11-01,3.0
172,customer_review-R3KW2AM98EYAN1,Surya P.,best laptop for students,good gamingexcelent workingawesome sound experiencegood movies,2019-09-09,5.0
173,customer_review-R36RE4AAMDY5CI,Deepak kushwaha,Make it good,look like awesome lagging much great choice,2019-09-16,2.0
174,customer_review-R78WPDPREMYAI,Atul,Highly priced and not useful,good task,2019-11-21,1.0
175,customer_review-RLEJN4GJ3JN7O,Amazon Customer,Excellent product,excellent laptop battery life expectation brightness good,2019-08-16,5.0
176,customer_review-R3U4FVPDYGKUYB,Mayank,Good buy,worth,2019-07-26,5.0
177,customer_review-R1GVVC443OUK0M,ACHAL A PANDE,Good product,worth good product shown per specifications,2019-10-18,5.0
178,customer_review-R2EAIXFP9RWZFO,Ayush goel,Laptop quality is not up to price,quality average gaming purpose,2019-08-24,4.0
179,customer_review-R3OM4OFI7GY60F,Aman Kumar,Awesome in this price,light gaming sufficient mouse touchpad improve otherwise beast,2019-10-10,5.0
180,customer_review-RDH805DROFKQJ,Aman Singh Chandel,Poor Display,poor laptop display even comparable 30k laptop dissapointed,2019-06-24,1.0
181,customer_review-R196GMS4HT8ZZ2,Herr Cross,Good,good,2019-11-04,5.0
182,customer_review-R3NZGSBRZQBMD4,Kollipaka prasanth,Good quality,good,2019-11-07,5.0
183,customer_review-R1KCEMX57XR3RY,Muthuraman Saisaktivel,Very good laptop for working and gaming,good gaming battery life good graphics great,2019-10-08,3.0
184,customer_review-R1MKGJEAJZF4RG,praveen,Waste,much faster even doesnt support inbuilt os windows,2019-08-19,1.0
185,customer_review-RNN9H0R3JD6BZ,BHUSHAN VAMANRAO PATIL,Best laptop,nice laptop rang hardwork,2019-10-11,5.0
186,customer_review-R1PKRPN79N6G40,suhas chopade,Don't buy,slow,2019-09-25,1.0
188,customer_review-R2CXDVWD5SK2PR,Ishaan,It's Battery Life Is Best compared to other Windows Laptops I have seen.,even played fifa 19 without using charger battery awesome,2019-11-29,5.0
189,customer_review-R3TSE5QW1RTGNY,Yogesh sarve,Excellent laptop,far gaming better battery life short brightness good,2019-11-06,5.0
190,customer_review-R3PG9FYD88W9PV,chetan kumar,Good,good,2019-10-06,5.0
191,customer_review-R145FX964O939A,Amazon Customer,Need ...Too improve their packaged style,package perfectnd product slice damaged touch screen,2019-07-18,4.0
192,customer_review-R3FVCMRYOT5QFE,Moinuddin sheikh,Nice,good gaming plus beginner developers,2019-08-24,5.0
193,customer_review-R18NY8A2VT2FN5,Amazon Customer,best workstation cum gaming laptop,good value money device,2019-10-27,5.0
194,customer_review-R2NDFHGKBK4JEI,Bhavani,good,good,2019-07-31,5.0
195,customer_review-R1AN571HJLCRA7,sunil,Good,product defibi6meets expectations,2019-08-07,4.0
196,customer_review-R9VC5CJLUW3XS,Bhavani Sankar Doddi,Awesome,nice,2019-07-25,5.0
197,customer_review-R3JOKAL98EGXAC,Manas,The seal was broken,get bill seal broken,2019-10-11,1.0
198,customer_review-RRTGMP0549WEJ,Anand,I recommend to purchase,good product,2019-10-11,4.0
199,customer_review-R26LOFTQDSSQVX,Athar H.,Not upto the mark,keeps restarting,2019-10-07,1.0
200,customer_review-R3MYON3TXWMWAD,IrshadAhmad255,How to activate window product,activate window product like excel,2019-08-25,4.0
201,customer_review-R138KC1QARW9GX,Vipul Vankudre,Multitasking Device,good features great battery life,2019-10-09,5.0
202,customer_review-R1MT7BMX4EWVUR,ranga n.,Good for gaming,nice product prefer gaming budget 55000,2019-11-16,4.0
203,customer_review-R2LB61PXD2KOBK,Purushottam,Best laptop,best buying gaming,2019-08-01,5.0
204,customer_review-RB5QO292D6PJ1,Kulasekhar,Review my laptop,super,2019-11-20,5.0
205,customer_review-R3O3JOVV3YHU35,Amazon Customer,Not best,costly,2019-08-05,2.0
206,customer_review-R8PPEP99FMVFV,Sarthak D.,Awesome,good buy,2019-07-25,4.0
207,customer_review-RI3V7VQ2AK0GH,Yogesh,Nice.,serve purpose,2019-05-25,4.0
208,customer_review-R31ECBZ6P992KG,Kashish,attractive and usefull laaptop,attractive laptop fast,2019-10-08,5.0
209,customer_review-R1L5EBE5VM6TNJ,sethu,Harddrive misssing,1tb 5400rpm harddrive present laptop,2019-11-09,1.0
210,customer_review-R2N2WOH34FDW8F,Shreyansh Sharma,Please improve battery life,everything good except battery life,2019-10-07,5.0
211,customer_review-R1E95LJJZOSC39,Bhojraj Singh chouhan,Unsatisfied,reaive damage laptop f5 key break,2019-10-16,2.0
212,customer_review-R2MUV62BKG0T3S,Suhas G,Hp pavillion,best buy 60k average display,2019-08-10,4.0
213,customer_review-R15H6JOHTCYY62,Amazon Customer,Awesome machine,impressed laptop,2019-10-04,5.0
214,customer_review-RRB7YPOBSDEB,Parveen Mathur,Go for it,nice laptop,2019-10-06,5.0
215,customer_review-R3JNBR49HLSYL2,Shalini wankhede,Nice laptop,everything good gamers affordable,2019-08-02,5.0
216,customer_review-R19MNZMQ0D0JVW,Ankit,Best gaming laptop,excellent graphic quality 60000,2019-10-28,5.0
217,customer_review-R3C3RN6N6JHUT1,venkatraman joshi,Very nice,good performance,2019-08-25,5.0
218,customer_review-R7VTWYRZGHM93,Prashant,Defective item sent,defective item sent even working,2019-08-26,1.0
219,customer_review-R337X9FGZR5P4Z,sivakarthik,Hi,besr display bezel size,2019-08-21,5.0
220,customer_review-R318VAHOZ5CMHY,Graphitos Support,hinges,laptop good hinges weak,2019-08-28,3.0
221,customer_review-R2NQPW63NJL4HG,ATUL RAMCHANDRA RAMTEKE,Best product !!!,best laptop nice cool,2019-09-11,5.0
222,customer_review-R3N8R66HNOLRTW,Uday Rajoria,Good laptop.Worth Money.,good laptopworth money,2019-11-25,4.0
223,customer_review-R287EELNBQ96MU,pravallika,Got different laptop,got altogether diffy laptop,2019-10-10,1.0
224,customer_review-R2Y84EHGR6EBPH,Amazon Customer,Good,good,2019-06-05,4.0
225,customer_review-R3B8ESO6X2V3X3,Rajareddy,Hp,good product,2019-10-07,5.0
226,customer_review-RE2RY6413HARF,Tushar maurya,Just awesome,awesome product amazon,2019-09-02,5.0
227,customer_review-R3SW4NNG4GGK6,Rudresh Samant,Value for money product ❤❤❤,value money product,2019-11-11,4.0
228,customer_review-R37UFCOEQOI7S0,Ajay,Outstanding,outstanding,2019-11-07,5.0
229,customer_review-RNYNFA2FXSWXO,Kiran Mokashi,Excellent laptop with better pricing,good laptop,2019-12-19,4.0
230,customer_review-R23ZVK0MURFKEL,Aman,Nice,good,2019-11-24,5.0
231,customer_review-RKGWLRVVHJBOI,MuraliandSumeet,Processer,value moneygood laptop,2019-11-07,5.0
233,customer_review-R202SPKBQG9JN0,Manohar rai,Worst experience.,good slow,2019-12-13,2.0
234,customer_review-R1PAUTPE0MPW0N,Amazon Customer,Excellent,superso good,2019-09-01,5.0
235,customer_review-R3I7L3ZVH0MP9P,Nihad Pattni,Awesome,really nice,2019-08-21,5.0
236,customer_review-R3DHH65VB4XLUS,Amazon_User@1234,Ok,good,2019-06-18,4.0
237,customer_review-R1QRF36TCJTFJ2,harsh raj,Worst laptop,worst laptop always,2019-10-01,1.0
238,customer_review-RH5F6AANQ1YS1,sandy,Good,good,2019-11-04,4.0
239,customer_review-R1VCV1G1ZANDK7,shaikh jilani badyodin,Good,good,2019-11-09,4.0
240,customer_review-R3VPBL062ZCND3,Bubai,Super,super,2019-10-05,5.0
241,customer_review-RC5XFJQOZ6IYZ,Priya Kumari,Good,gr8 product,2019-10-12,5.0
