,customer_id,customer_name,review_head,review_body,review_date,ratings
0,customer_review-R2ANVSB29LRHH1,Amazon Customer,Not the Laptop I was expecting,although laptop delivered time beware specs displayed hdd actually 5400 rpm official hp website whereas amazon displayed 7200 rpm charged 7200 rpm getting delivered 5400 wasnt expected still struggling actual laptop paid,2018-09-24,1.0
1,customer_review-R2DC2DBOOBTQ98,Yash Gupta,Though a bit costly but absolute worth.,researched lot get laptop almost 15 days didnt want buy gigantic gaming lappys still wanna game came across beauty notebook great powerpacked specs hp back got thumbs using three days impressions build quality absolutely excellent though made plastic great finish prone fingerprints display full hd 1920 1080 panel makes worth consume media stuff loved display viewing angle okaish battery device shines normal usage giving usage time 67 hrs gaming reduced half due heavy nvidia gtx 1050 operations keyboard much tactile solid buttons brilliant backlit coloured green mouse pad average due nonseperated buttons finally great ideal deal student works recommended buy,2018-09-05,5.0
2,customer_review-R1PCIYNZL98I93,priyansh nagar,Go for it..,good laptopdisplay viweing angle good buying thisi also buy m2 ssd installing ssd install os ssd laptop like flying speed,2018-10-17,5.0
3,customer_review-R3ET4UNYHYO10Z,Salil S.,True beast.,belive laptop true beast gtx1050 gives resonable fps aaa games laptop gives best bo sound experience sometimes even loud jbl go need perfect drivers let sound fly best thing battery life gave 5 hrs autocad 6 hrs movievlc time thats comes kind boost chargin takes approx 50 mins get fully charged zero aesthetics pretty neat acid green color stands bold beatiful like cheap red laptop body another plus point clean bold small touch hp logo makes elite basic features really nice keyboard one class really touch pad one dissapoints bad buut price range features worked little bit port select normal get 3 usb 30 hdmi ethernet port hdmi headphine jack atleat given usb type cbut charger recovers thing imortant thing quality screen lover screen good according price range expect taking ps premiere pro go options bcoz screen although bad yeah artists way 60hz fps counter games cause 4max 30fps shadow tomb raiderhigh3745 csgohigh 120s cod iwhigh 55s mortal comat xmax 60 batman arkam knightmax30 far cry 5max 3550 touch 60 medium settings nfs paybackmax30 maintained legacy,2019-01-24,4.0
4,customer_review-R2WFZYKFJCPZKA,J,Serious Issue with the Laptop,specifically bought laptop 1650 gtx playing cause 3 abruptly stopped threw error attached pic restarted laptop still soon game starts giving error still resolved first thought might error specification surprise recommended specifications game way less laptop config worst service ever going take replacement check doesnt work return product specifications game playingjust cause 3 operating system vista sp2 windows 71 sp1 windows 81 64bit operating system required cpuprocessor intel core i73770 34 ghz amd fx8350 40 ghz rammemory 8 gb ram gpugraphics nvidia geforce gtx 780 3gb amd r9 290 4gb storage 54 gb available space,2019-06-23,1.0
5,customer_review-R2T96BNSHKH9NN,Mohit Vaghela,worst service from HP,got new laptop damagedfaulty keyboard contacted hp service worst hp didnt contact issue even 6 months complaint,2018-12-11,1.0
6,customer_review-RF1WYYT7JZD71,Mihir Phatak,Abysmal service by Amazon,operating laptop week started getting battery charging issues hardware issue visible technical troubleshooting ticket closed due battery issues hdd crashed eventually force amazon make replacement request happen time told complaint would stay open till issue resolved issue started replacement model amazon told replacement window well lapsed cant give refund impression complaint window closed soon got refund thing told spent 64000 laptop still go service center even though amazon sold bad products times well within rights request refund laptop,2019-05-19,1.0
7,customer_review-R12L13J2RBX92H,Vaibhao,Item is defective please take return or replace order,im complaining defective piece issue since 1st day delivery action taken yet havent seen return replace order product amazon app charger product stops charging everytime 15 minutes automatically plug socket power done troubleshoot action told support team updated drivers please understand problem place return order product early possible lot work pending issue,,1.0
8,customer_review-R2SE38KRGAMM80,Yash Sharma,No Ips panel. Wrong description,worst display ever wrong info site laptop ips panel color contrast evn worse 7k redmi phone pathetic,2019-05-06,1.0
9,customer_review-R1PNAT3YZNJG7U,Jaidev,Amazing buy from Amazon,spec says fast powerful bliss work mesmarizing way handles challenges throw towards thing personally feel could improved battery back couple hours would better got 5 hours back normal usage would 7 would perfect 16 gb ram coz 40 percent ram already occupied start run anything like eclipse multiple instances chrome time memory usage jumps 60 65 percent guess current world live laptop needs 16gb ram 1tb ssd cope future requirements great buy p would even better wireless mouse laptop bag p ferrari thats much ask,2019-07-01,5.0
10,customer_review-R34PKBIQFTHUJL,Lagnesh Thakur,Cannot play any game on Nvidia GPU,laptop powerful fast bought laptop nvidia gtx 1650 4gb gpu able run game laptop game either freezes crashes get error dxgierrordeviceremoved tried upgradingdowngrading graphic drivers updating bios resetting system different games nothing seems fix want hp help write positive review stuck feeling betrayed gaming laptop,2019-07-11,1.0
11,customer_review-R1B0MXFGWR9UWQ,Amazon Customer,Good deal.,decent cpu gpu falls short screen ips colors look bit dull overall good laptop csgo 220fps dota 2 100 thermals good,2019-06-21,4.0
12,customer_review-R14YNP3KS7H629,SHIVANSH SINGH,Worth it,overall laptop awsome played batman arkham knight high settings witcher 3 high settings watch dogs 2 high settingslags little bit sometimes totally playable laptop little slow though due absence ssd slow descent want get 100 percent performance laptop install ssd laptop become gaming beast,2018-10-08,5.0
13,customer_review-RYHHG3YNDMG5V,Victorkhonglah,DO NOT BUY THIS!,buying laptop read reviews lucky people got good machine unlucky people got really bad ones got bad one never experienced sorry performance laptop owned thinkpad samsung laptop sony vaio last asus im really sorry say 9th gen core i5 8gb ddr4 ram pathetic 1 fan running non stop 2 slow cannot anything 3 click 2 3 times icon window etc 4 start takes 5 mins minimum 5 tried hitman absolution cod bo2 far cry 3 4 cod ghosts nothing works nothing 6 planning buy traktor full version thats bought pc think cannot run traktor kind sorry performance 7 connection tv big headache sometimes display lag times sound output external speaker connected tv various problems 8 wifi poor usb connection takes ages 9 stopped using returned old lenovo desktop i3 2 gb ram much faster 10 amazon promised replacement wait advice hp please dont sell kinds devices hp renowned brand kind un tested par performance accepted never buy hp product last least laptop replaced working one donate hp showroom spread good news social media people dont lose 58k piece crap,2019-07-22,1.0
14,customer_review-R2URMPTI4N4ION,sunilkumar sachdev,Do not buy,buy worst product hp,2018-11-01,1.0
15,customer_review-R3HHMQAT1925QW,simman,Best gaming and multitasking laptop,pros 1there flaws windows booting solid state disk 512gb 2gaming optimization well done 3keyboard backlit keys volume perfect audible cons 1storage small living generation,2019-07-03,5.0
16,customer_review-R2YGGGPBNPXADH,Jayesh Bhojwani,Great deal,overall good package deal decent price range performance great due gpu 9th gen i5 ssd display average problem gaming colors good thermals also good good battery life stuff beast whether gaming codingeditingetc,2019-06-29,5.0
17,customer_review-RW40A50T7T861,gaurav,Wrong desicription of display,pathetic display display bull side angle viewing pathetic,2019-05-08,1.0
18,customer_review-R1SN1NBXZT55B0,Onkar,Gaming Beast.,amazing budget performance hp done great job gpu cooling department overall great laptop daily usage high high gameplay experience,2018-08-21,5.0
19,customer_review-R32AXMXVRUQKPN,Amit Bansal,"Horrible brand, Horrible product",bought two machines hp month july july respectively one started giving problems month second one started giving problems 20 days calling customer care last 20 days technical support simply horrible wasted 100000 keeping faith brand hp recorded conversation technical support going put social media big product please guys aware brand hp,2019-09-05,1.0
20,customer_review-R27UU75WKZQKGR,Amazon Customer,Terrible hangs all the time - I wont recommend this to an enemy,terrible hangs time wont recommend enemy,,1.0
21,customer_review-R3KO6NDOZE2WC0,Prash,Better than any1,product delivered time laptop i7 8th gen heart super fast compared old i5 thanks ordered config dls 92k cancelled kept money 1 month way boon disguise,2018-08-13,5.0
22,customer_review-ROAFLMYKMOX2J,vaibhav,Awesome product!! I would recommend to buy,must buy laptop price range handle multiple tasks easily good laptop good features hope lasts long,2018-08-25,5.0
23,customer_review-R367JJZX0VP7KH,Mayaavi products,"If u are looking for a gaming laptop, u have come to the right place",laptop amazing buy one best best price range 1050ti ssd 65000 u crappy laptop like get extra discount via exchange great delivery delivered 2 days perfect condition laptop fast snappy boots 1015 secs 1050ti play game want medium high settings 1080p 60fps complaint screen great bad either price overall great gaming okay battery life good gaming laptop though love build quality design using week loving heart,2019-05-28,5.0
24,customer_review-RDZH5CY3GHC2S,Universal_critique,HP has a bad customer service (even within Warranty),purchased premium laptop hp assuming customer support postsales service would good firstly motherboard crashed within 6 months purchase laptop conked reason later complaining hp case handed local thirdparty service center keeps postponing postponing 10 days since laptop stopped working time find new reason postpone call hp blame service center say cant anything call service center noone picks hp expects followup service center daily basis even though bought laptop hp service center willing run around service center hp business suffers even warranty period buy hp honestly dont know dell brands better know never buying hp trust guys worth spending 80k laptop crashes within 6 months company doesnt believe customer support seriously disappointed product hp,,1.0
25,customer_review-R3E0WES2CMXNNJ,Pradeep Kumaresan,Hp does it!,good choice 70k price range 512gb ssd gets good start gaming boot time atmost 5 sec games run well need optimize nvidia game experience accordingly control heat reducing optimal level game experience software battery lasts 45 hours normal usage excel reports youtube movies songs etc combined charger small unlike behemoth brick charger get webcam also okay much talk display though sub par bad quite good sound also subpar adjust definately deal breaker design sleek weighs around 23kg carry much effort mcafee antivirus 1month matters people warranty 1year product contact service centre extend last least good choice midrange gaming pubg running ultra problem case want benchmark reference stats,2019-08-20,4.0
26,customer_review-R1DOZWYYVVNJJF,Vishwajit S.,Fully satisfied for students purposes 😍,good laptop gaming purposes students like btech cause latest thing excluding i7 processor dedicated ssd m2 slot make laptop worth buying cause increases speed,2018-12-01,5.0
27,customer_review-R15AO257BC4EH9,Amazon Customer,Should go for it..,build quality nicelooks classic ran games heresuch battlefield 5 devilmaycry5tekken7fifa18as reachable dmc5tekken5fifa18 ran ultra minor lags next would say battlefield suffered little reducing resolution work plug charging playing heavy games smooth performancesound nicedisplay os decent,2019-06-24,4.0
28,customer_review-RDLP5PFK7SDSU,Digvijay Jadhav,Awesome,nice product hp include ssd booting time quite high worries value money good sound quality awesome battery life average good gaming laptop,2018-12-01,4.0
29,customer_review-R3IWFWP4NWT7H6,Unknown,Poor quality,buy,2019-07-03,1.0
30,customer_review-R3G7AVVZSATIX6,Akash Soni,Bright specs dull display!,true specs awesome gtx 1650 better gtx 1050 ti paired i5 9th genand 512 gb ssd bonus windows boots less 5 seconds good everyone except ones looking good display psit tn display 60hz refresh ratedisplay bright viewing angles good comfortable,2019-07-14,4.0
31,customer_review-R1P8FLIXOLPDUG,Argon,Good First Impressions.,bought 156 inch fhd core i7 9th gen 4gb graphics 8gb ram 512gb ssd model startup quick battery lasts long laptop zippy silent cool full marks department green backlit keyboard gives interesting look screen full hd crisp clear viewing angle little disappointing adjust tilt per sitting height posture often ms office trial version buy subscription regular use always case hp lot bloatware uninstalled used gaming yet essentially bought processor probably cheapest i7 9th gen ssd combination offer amongst three top selling laptop brands lenovo hp dell amazon sale later update details month usage bottom line product recommended purchase,2019-10-06,4.0
32,customer_review-R2EHSWQEST6MLD,Kumari Sangita,ONLY LAPPY actually offering a 9th Gen i5 processor as of now,skeptical first official hp website info 9th gen i59300h equipped variant day got delivered hp updated website add support driver download links 9th gen variant website edit fixed itbeware though someone amazon messed big time option select variant amazon listed 8th gen variant 8th 9th gen variantand accidentally boughtand paid 8th gen cancelled bought 9th gen day refunded money back actually downloading latest windows 10 pro unactivated dont care legit window crack officialize office windows also removed intel nvidia sticker front repasted back sake clear uninterrupted ergonomics also suggest buying redhead emera something mouse match matte black finish laptop couldnt post specs windows coz formatted capture picture bios like help others name isnt mom ordered amazon account insurance purpose thinking buying thiswhen 8th gen variant asus fx705dy best laptop amd processer amd dedicated graphics card best 17 inch screen settle becoz family stuff trust intel hp nvidia mostly brothers dont trust asus amd processor graphics combo even though higher base clock better cooling better display nonetheless launched 9th gen variant day buy arrives leave college steal might first buy 9th gen variant amazon hadnt sick messed mistake amazon variant selecting option bad thing laptop shitty screen onits got worst viewing angles ever madelike 90 degrees total 45 normal wont suggest laptop casual family office use strictly heavy personal use gaming editing,2019-06-19,5.0
33,customer_review-R21IJ55WGWQB56,Amazon Customer,Decent laptop for work and gaming,speakers great nice backlight easy hotkeys issues running problems size trackpad battery device driver trackpad could easily inch longer theres enough space problem battery stops charging sometimes 70 80 percent far starting device manager plugging seems fix issue edit battery issue fixed windows update laptop works perfectly updating rating five stars,2019-04-04,5.0
34,customer_review-R1ULK80SOCRMCG,Shubhangi,Slow,laptop slow 1st day lot time lag even though fast processor takes quite time laptop switch also slow launching different softwares,,1.0
35,customer_review-R2JEGA0E7QFRTM,Rakhi,"Worth the Money, Amazing Performance",light weight doesnt heat much boot time fast due ssd got almost 63k prime deal feel satisfied thing wished space 512 gb bit less ill upgrade time,2019-07-19,5.0
36,customer_review-R2DFYPDWA02OI3,Er MANGESH GUJAR,GOOD ONE FROM HP,using laptop around 24 days played games yet used whole day 24 days 1good battery life daily uses around 8hrnote tested games charging also fast 2display ok 3 performance excellent compare u segment i5 8th gen laptop gr8 bye specifically comparing i58265u i58250u laptop give good enough performance comparable 8th gen i7 u segment daily needs well fulfilling gaming requirements performance desktop level realy good hp laptop 9th gen processor go price concern latest gen processor always advisable note much difference 8th gen i58300h 9th gen i59300h want silky smooth performance laptop go one even gamer interested actual specifications display full hd 1080p tn ips panel processor 8th gen i58300h24ghz 4 ghz ram2400mhz 8gb storage128ssd1tb hdd graphics cardnvidiagtx 1050ti 4gb gtx1050 speakersbo backlit keyboard acid green colour input 1 rj45 2usb 30 1 usb 20 1 hdmi 1 sd card reader slot 1 micheadphones combo jack license windows 10 wish luck gr8 deals purchase,2019-07-19,4.0
37,customer_review-RI4E8V38ZBLJX,Deepak,Don't buy it.,favor buy laptop read reviews please concentrate screen issue really badviewing angle terrible laptop price made mistake overlook comments screen theres also keyboard issue keys looseboot time considerable gtx 1050 ok,,1.0
38,customer_review-R1U631HKLNRHK3,Pranav P.,Very good gaming laptop with high performance,bought hp pavilion 15 bc 513tx model writing review using month first impression laptop perfect 1starting time boot time 6 8 second really amazing 2 display nice bright colours 3 speed laptop nice 4 i5 9th gen prosser get task smoothly fast 5 nvdia graphics 1650 good high graphics setting works fluent 6 cooling system nice centre cooling cooling system works effective manner use table horizontal surface doesnt heat part fans dont make much noise 7 sound also nice 8 good standard premium look makes different gaming laptop 9 good high graphics software 10 512 gb ssd totally awesome every thing run 10 times faster similar kind speed like i7 9th gen hdd nice laptop must buy try 512 gb ssd makes perfect,2019-11-14,5.0
39,customer_review-R8DSRS4LFJOR6,SHAURYA VARDHAN SINGH,Powerful processor,got really powerful processor laptop would excelled price range would gtx 1660 1650 graphics card 1050 pretty old graphics card,2019-06-17,4.0
40,customer_review-R10UIT89B8BWMI,raj,Good but still not the best,laptop good best part configuration laptop gaming really smooth normally use laptop highend number crunching terms data analysis stock market note windows 10 home edition laptop heavy batter lasts 1hr gaming rest would last alteast 2 hrs stuff plan get battery check warranty soon important read manual purchase,2019-07-30,3.0
41,customer_review-R336M8H8AG47JR,Tapasi Kundu,"Full worthless product, repenting now!",sure bad luck fully worthless product even replacement affecting sound contacted hp support n unwilling provide visit support existing clients complained whatever app used communication hangout skype meeting today loss one new client communication issue pavilion dv6 good second time went hp curse sure express,,1.0
42,customer_review-R2B5VU25TQQFS3,Nikhil,Good laptop at this price point.,everything good brightness battery life could overall good laptop handles heavy games quite well one enjoy long hours gaming sessions without worrying heating issue want typical heavy gaming laptops unorthodox designs still want gaming go,2018-09-11,4.0
43,customer_review-R30QWKWCU14XSL,Sush,If your looking for quality in budget go for it!,3 rd day laptop till impression good built quality feels premium even though made plastic dont know heavy gaming like aaa games coz dont one till played pubg runs medium settings also played asphalt 9 runs good graphics nice display great price point viewing angles good battery awesome gave 7 hours backup movies medium brightness,2019-07-14,4.0
44,customer_review-R16W3UP2B2MA80,Abhishek Kumar,Very very dull display,dull display feels cheap disappointed buying,2019-08-01,1.0
45,customer_review-RJ6G1LGCGGW80,Amazon Customer,That's Rockin',product absolutely fantastic performance really excellent lap functions high speed less booting time optimised cooling system less weight high graphic resolution,2018-11-02,5.0
46,customer_review-R2PO50OQF8DK6T,Kartikey,Nice product,super fast thanks ssd acid green keyboard flawless screen bit full know change intel graphics settings work b help deliver high quality sound battery backup also good worth buying available 57k,2019-08-21,4.0
47,customer_review-R18TQZHSQYAAZH,Aby Thomas,First week review - Pros and cons,got laptop 54k amazon prime sale great deal im satisfied overall specs laptop two things think could better would trackpad really average mat finish lcd screen secondly delivery really disappointing one paying amazon prime heshe could getting delivery two three days took literally 2 weeks almost thirdly sure expecting experience buying laptop store first time bought online really expecting hp bag atleast laptop cover protect laptop incase called amazon cs advised depends seller seller youre planning buying laptop choose seller wisely apart wanted use laptop atleast week two giving review fantastic machine bought primarily video editing gaming day day tasks everything runs smooth till,,3.0
48,customer_review-R3AA272NNZA0DL,Ishu Agarwal,WASTE OF MY MONEY! HORRIBLE DISPLAY,excited product graphic designer reading specifications amazon hp official site believed best laptop get range soon got product knew made wrong choice specifications okay screen horrible colors faded editing give results far different dont even know hp thought pathetic display enough gamers regret buying honestly waste money even put ssd speed display bad unbearable view anything everything looks dull really disappointment hp request everyone buy product many gaming laptops price range much better display quality,2019-10-29,1.0
49,customer_review-R30RKWVWMLG17F,Varun Vijay,Defective production error,worst product buy graphics card doesnt work perennial issue support gaming brought may behind support team fix support team confined cannot fixed think twice buying ended following support team almost 3 months yet issue persist buy product,2019-12-05,1.0
50,customer_review-RSA91CVLP04NO,Dheeraj Dhiman,Goods and bads,loved looks design acid green backlit keyboard slim andddd sound good expecting great lit display content creator every time edit picture video dont find similar colors smartphone colors good smartphone didnt match expectations even though great piece love,2019-08-28,5.0
51,customer_review-R2HLE90EW37JX5,Sonal A.,Best config to get at 55k @prime day,boot speed varies 5sec 10sec ssd job perfectly played pubg hd high frame rate buttery smooth best gaming range battery life major plus buffered youtube video continuously 2 half hour battery drained 90 71 liked loved almost everything except display bad see difference play video still value money get 60k update review using somedayupdated,2019-07-16,5.0
52,customer_review-R2OEU0ZV7FMX0S,Anand Swarup Nigam,Okay (performance not as good as expected),performance good specifications suggest hangs little sometimes battery life good maybe best price range,2019-06-03,4.0
53,customer_review-R2JH0GLNHBWLO5,Navin Yadav,It's a amazing product,im using laptop since 4 month feel works smoothly game play amazing never felt use daily simple work really amazed see battery life amazing works upto 8hours use heavy works like playing heavy game works upto 4 5 hours felt viewing angle might perfect still best product im happy searching best gaming laptop hope go product,2019-10-05,5.0
54,customer_review-R1J8B0ICOG0PZA,Logicule7398,Forget gillete.... This is the best a man can get under 60k,laptop excellent coding animation gaming want fast bootup u better go ssd install coz separate port windows updated 1809 edition march 2019 security patch download nvidia geforce experience site better experience battery charges quickly u get 2535 hrs watching videos surfing internet 70 brightness speakers gud problem display put gun point point problem laptop overall either go rog strix new 9th gen series,2019-07-23,5.0
55,customer_review-R1KO4MF20CIKL,Kshitiz,Laptop not working...started misbehaving just after replacement period was over,laptop working first bought working finebut days replacement period 10 days overit started abnormal faults like random showing blue error screensand got fixed paying amount working fine days malfunctioning workingthe laptop even powering press power button buying amazon literally worst decision ever,2019-12-01,1.0
56,customer_review-R3ACVQ009QQ3TJ,Vijay D.,"Good for gaming, performance",liked gaming performance keyboard backlight charging quite goodjust one problem u play without charger comes 0 within 1 1 half hourbut u want gaming best chargerbest product gaming performance heating issues,2019-05-27,5.0
57,customer_review-RJ2IMAHA5MHG5,SubhranshuNayak,"Don't buy this product from amazon, please buy from HP store",bought laptop 20th july 2019 230pm around started twice today started device dead poor products amazon never expected product,2019-07-22,1.0
58,customer_review-R1R377LWNNDP6T,RiddhiBose,Pretty Good!,product proved goodthis comes 8gb ram1 tb hdd5400rpmgtx 1050 i5 9th genthe 1st con hp offering ssd almost every laptops price range offering along hdd please dont ask good battery using gaming cant play without plugging charger battery would drain pretty fastand thus gets heated bitthis feel air vents placed sides bottom overall product nice looking gaming laptop also using softwares like solidworksansys feel one go also dont provide bagif buy offline would get bag surely,2019-11-11,4.0
