,customer_id,user_name,ratings,review_head,review_body
0,review-799d34d7-de94-4972-a397-4e2b13ffe6a4,SIVA SUTHAN,4,Really Nice,flipkart delivery amazing got within 18 hours orderthe first thing take pendrive download microsoft usb creater tool microsoft website create windows 10 bootable usb wipe os installed laptoppre installed version lot bloatware kill dreams owning gaming laptop depressed performance make clean install windows 10 dont worry warranty wont void bootablread
1,review-9cfd76f2-ea52-4321-8eca-1e1511e5918e,Elliyas Ali,5,Classy product,great look light weighted awesome glowing msi dragon logo good cooling system high level gaming performance improved upgrading ram replacing hdd ssd hard drive nice viewing angle cool backlit keyboard slowing installed os pain reinstall os install driversif use installed os thn may able separate hard drives desire overall good laptop ill adding depending experienceeditread
2,review-660412e6-c585-4323-9771-e62a502a8779,Vysakh M Nair,5,Simply awesome,best laptop ever laid eyes onhard plastic aluminium like finish really catches everyones eye laptop looking sleek thin mac book thin gaming laptop thin glowing msi logo lid adds another wow aesthetic wise would give laptop 55 update laptop finger print magnet annoying clean laptop everyday order make laptop look good newperfomance another area thread
3,review-c8fc23bd-356e-4dc1-8b93-30aab7f53d3b,Abhinav Bansal,5,Must buy!,awesome laptop great display good keyboard ok battery life awesome gaming experience sound quality nicethe build quality solid expected msi
4,review-02624818-aab3-44f8-bdae-deebdc33d85c,Hmangaihsanga Ralte,3,Good Product but..,receives product perfectly packed good perfect condition signs outer handling lappymy points view lappyprosbuild quality good material best choice since places handling seen cannot cleaned easily without help damped cloththe perfect laptop price range since latest components time along i5 8th gen processorhexacore gtx 1050 4gb 8gb ram read
5,review-723e7be9-9851-40e4-a737-e3c933133de4,Kriminal Kartik,5,Excellent,amazing laptop
6,review-bc429b31-6aab-4938-bebd-caacddc66a76,dhanu milmile,5,Awesome Product,good product value money best part sell flipkart flipkart service good face issue receiving product sound coming laptop shake means carrying sounds like screw inside flipkart giving replacement way following pros cons updated days1 performance good2 cooling extremecool quickly3 keyboard layout familiar buread
7,review-49d7fa12-9e6b-41e8-87a1-c17e183313eb,Tharun Shivdas,5,Excellent,beautiful laptop price flipkart really came delivery delivered day laptop advertised around solid build proud tag msi intel core i5 mistaken 8th gen processor better 7th gen i7 7700hq gaming smooth experience geforce 1050 handles aaa titles without issues pubg fortnite gta 5 assassins creed name id suggest getting lread
8,review-5863af21-80dd-442e-9a93-1cca613e5c58,Shriiyansh Pandey,5,Awesome,firstly laptop 60k buy blindly without hesitationpros1 performance good performance intel i5 8 gen processor lags works fineno doubt it2 cooling best class cooler booster 5 king laptop 2 fans 7 heat pipes thermal throttling3 keyboard steelseries keyboard make worth buyingvery sturdy good quality keyboardrgb lighting perfect4 sound going fell iread
9,review-114cfac4-5410-457c-8ca8-0982e349602a,Arindam Ghose,5,Terrific,writing review exactly one month purchase research buying product turned start writing would typically like tell prospective buyers general tendency within people biased product spent 70k towards laptop try unbiased1 display nice watching hd content clear crisp right edge2 performance superb still read
10,review-f47a6fb0-34c4-4991-a76c-b72d4f929417,Manoj kumar Meena,5,Terrific purchase,amazing laptopbest thermal system better acer predator
11,review-467776d0-0166-44ae-82d8-1a7766f35475,Flipkart Customer,2,Slightly disappointed,brought 75k im unhappy price decreased 54k 1 week purchase
12,review-4ee39954-7e01-43db-b74b-a528088086d9,prasanjeet jena,5,Perfect product!,excellent laptop absolute bang buck record i5 8th gen faster thani7 7th genso makes bad boy faster older generation laptop terms computing power dont believe said check msis official page detailed info comparison 7th gen 8th gen processorsvery little heating ofcourse laptop heating occur gets warm absolutely heating look moread
13,review-a4015158-e7cb-4447-90a9-d8863b434700,SUMEET GUPTA,5,Fabulous!,best get 60kpros1 i5 8th gen matches capabilities i7 7th gen cases2 8gb ddr4 2400mhz ram785gb usable3 gtx 1050 dedicated graphics 4gb handles aaa titles easeplayed far cry 4 ultra graphics average 4548 fps easily get 60 fps ultra gta54 cooling system great price segment got little warm playing 3 hrs thats ok gaming lappy5 steel series backlit gaming keyboard 4 brread
14,review-4739d8d5-c91a-45c5-8e20-a46d0c9a19a2,Nallusamy Raju,5,Highly recommended,good product bought 59k good gaming performance best cooling fans
15,review-84a7da31-f871-4b2e-99f8-75e80341819c,Azeez Azeem,5,Mind-blowing purchase,super gaming editing experience loved performance
16,review-a81ba68f-5eb4-42c7-a641-671e07adf3c7,AJITH,5,Wonderful,since old laptop dead wanted upgrade looked value money laptops shortlisted laptops finally ordered beast msi gl63 8rc 54990 onlyfirst impressions1 build quality never expected nice quality feels hard rigid2 steelseries keyboard awesome yes swap windows functionfn keys bios dragon center youre comfortable position it3 screen although vertical angles screen greatread
17,review-c4e34b62-7703-4cdb-8559-7f335a6670ae,Somnath Clare,5,Simply awesome,overall good laptop task satisfy batteryit run 3 hours normal usage like watching youtubebut gaming sucks run games 45 min 1 hour even normal gamingso generally play games plugging chargeri dont know play games charging good plz tell okto play charging
18,review-be88cfe0-4f13-489e-9ef9-47aaae164952,Navneethan GN,5,Brilliant,geniune review trust go click buy button totally beast machinemainly would diffrentiate review prosconsprosbuild quality solid matte finish machine built superior quality great rough usage whole machine fingerprint magnet except bottom laptop lol keyboard 04 brightness levels red backlit topnotch keyboard steel seriesdisplay tntwistedread
19,review-cfbf5ab3-0098-4a4d-8013-2a1b36276040,Flipkart Customer,3,Decent product,bit slow got laptop reinstalled windows remove bloatwares wonderful gaming experience professional focus purposes dont go product sound great laptop good colour accuracy red tintthat cant corrected
20,review-3cc5414f-9d9e-4632-a98b-e4016f85469f,Ayan Saha,4,Delightful,using laptop 10 months purchase one issue still present keyboard spacebar key sometimes dont work faulty manufacturing nothing else since used external keyboard dont nay issues apart another issue buggy windows 10 suggest everyone remove factory os fresh os installation
21,review-46fac4ce-0dab-4f75-9731-c1de6bb23d4a,Flipkart Customer,3,Just okay,provided warranty card
22,review-dc63154b-a2d3-4d42-9eb3-3942bf8a8c4e,Kamal Raj,5,Mind-blowing purchase,laptop good power plug indian style system became slow need reinstall os
23,review-75e74816-0dd4-4b14-b4b9-b3277598c369,Pramod Thapa,5,Worth For Money,laptop worth price tag system fast handel game nicelyhere experience using monthpros1 processor good2 nvidia 4gb 1050 graphics handel game nicely3you play game need speeddota fifa ultra setting4 keyboard nice typing give different experienceand red backlight5sound quality nice dont need sound box it6 cooling system thread
24,review-78abd971-1212-4d7f-8d34-d7cbc988c2fe,Soumya Subhra Sinha,4,Good quality product,got 61k nice design would loved 128gb ssd nevertheless played fifa 18 gta v worked solidworks 2016 autocad 2017 worked fine high settings cooler boost 5 works great nahimic 3 audio awesome vertical display angle could better tn panel screen ssd slot 1050 gpu works well dragon logo glows dark would loved rgb bacjlit red color backlit keyboard great cooling vents absence optical drive slot dont forget read
25,review-1277e777-212e-4138-9daf-583de1260a6b,Anil Prusty,4,Good quality product,purchased59990inr 24th dec flipkart delivered time 26th deccoming laptop one best looking gaming laptop within range buying register product msi website support warrantypros best cooling featurecooler boosterin segment awesome performance seamless system utilization toolmsi dragon center clocking steelseries keyboard optional slot ssd audio goodcons hdd conventional 5400 rpm thats whread
26,review-6a0cdabb-5aac-4e31-8192-099addb864a5,Flipkart Customer,5,Terrific purchase,beauty absolute beast sexy handle steelseries keybord one best budget gaming laptops great hours gaming playable fps max aaa games dota2 120 fps max settings csgo 120140 max settings pubg 100 max settings heating issues awesome cooling
27,review-6fa07d15-795d-41d6-ab50-9ce7f19213bb,Deep Raushan,1,Waste of money!,laptop work slow performance also good complain flipkart dont even respond
28,review-87ffe4ce-7796-4b51-bb4f-d6f79adeab75,Abhishek,4,Very Good,good entry level laptop gaming multitaskingperformance good tried aaa games giving 30 fps high settings 50fps medium settingslaptop cooling upto mark cpu temperature rarely exceeds beyond 75 degree better acer predator high end games cpu temperature reaches 94 degrees game starts freezeif used ips display laptops find display good ips display much better tn display lread
29,review-d920b0a8-7d25-48e7-9817-419caeee47e6,Ujjwal Mishra,5,Best laptop around 60k,beast best performance best sound 60k budget 60k want buy laptop gaming gpu related work dont give second thought go
30,review-83922d11-18a4-42d8-9599-ef58c9775e77,Sagnik Singha Roy,5,Classy product,awesomethey delivered day ordered itwithin 24 hrs cooler booster r pro problem update apps dont work properly
31,review-931259d3-8886-457b-b260-89c5bcd71493,Sharin Anchal,5,Perfect product!,good performance need ips display display clarity good side view good straight view perfect
32,review-ef14c427-4a9c-4a9f-856f-a7953b029633,vaibhav sharma,4,Delightful,dont buy casual gamer battery poor hardly last 15 hour power saver mode performance good keyboard awesome battery everything top notch programmer college dont buy unless wanna play high end games beacue gotta keep power chord always plugged
33,review-51f0b3d2-0907-42c2-a7ff-fc53425c468e,Omprakash,4,Worth the money,wow laptop switched gaming desktop moce frequently totally satisfied got guys already know features laptop tell users experience pros 1 light weight plastic body gaming laptop 2 great cooling system 3 nvidia run almost game play pubg pc rules survival apex legends cs go battlefield 34all runs good medium setting 4 board nahimic works great foread
34,review-4cd51417-4d7c-4783-a2c0-51b575e7c0af,Prince Kumar,5,Mind-blowing purchase,one best gaming laptop budget got 55k u want product budget thn wait sellonly thing hoped ssd onlybut dont worry extra slots given particular requirementsjust go without thinkingits awesome
35,review-fea9eef5-0034-4385-9bb3-7397be6e3b6b,Harsh Utsav,3,Just okay,laptop good windows update gave lot problems update boot time increased 3 minutes moreover lot bugs glitches driver related issues playing video youtube got lags stutter happens playing 4k 1080p60 videos offline next gaming performance good fps capped 60 due windows xbox dvr fullscreen optimisations struggled lot fix web cam drivers graphics driver finally solved 60fps cap issread
36,review-ce9d9583-6f09-4ed6-b582-8009e2e0b488,Manthan Poojary,5,Worth every penny,best configured product price range laptop currently produced features price range laptop except one
37,review-c2c0de77-9a44-43ee-8934-857d5c563e0b,Flipkart Customer,5,Classy product,great laptop anything u read slow booting upto 7 minutes booting windows updates nothing else cooling system awesome ssd right empty slot pci ssd graphics 1050 1050ti total 8 gb graphics 4gb 1050 4gb intel uhd graphics windows hello support light considering power packed lack ips display shows itread
38,review-8734cc56-2209-486a-9d21-dc756148a973,Shuvam Lal,5,Terrific purchase,terrific productjust beast needsgo
39,review-9bb232df-3b5d-48d6-95f9-4d42adbe65ba,chetan parkash,5,Great product,overall good product need check gaming performance
40,review-f5e73f04-2f76-4567-9991-277535f141d2,Habeeb Dashti,5,Just wow!,price slightly overpowered overwhelming laptop professional gaming point view dominant ij comparison laptops dota2 running around 200 fps ultra settings csgo running 230280 fps medium settings mouse control feels lot smoother accurate gaming stable ping playing online another add killer crystal clear display games would great laptop trying outread
41,review-07ca7ccc-4b8c-46c4-bb6a-cbc8831387ff,Pushpal Mondal,4,Good choice,item condition good saw uninstalled game dragon centre app dont know otherwise working fine normal usage battery lasts 3 4 hours onlyrecommend use battery saver eco mode camera quality low deal breaker first bootup takes huge time updates completed system work bit faster dont use norton windows defender better lightweight always recommend connect wifi first bootup system becread
42,review-e1a34856-1f53-4513-96b5-70725b0c631a,Abhijeet Desai,5,Super!,inr 61k good cost effective productlaptop comes without bloatware otherwise nortan antivirus preinstalled 60 days trialyoull need update drivers make run laptop efficientlygaming editing daily usage find laptop useful many categoriesbuilt quality best class youll need keyboard guard cooling pad let work efficientlyflipkart packaging nice fast
43,review-6ea85ba1-0582-40f4-aa68-c558ee1e50ea,Manu Bhat,3,Nice,tldr great gamers others look elsewherewindows button missing lhs keyboard alternative swapping fn key windows key bios come killer network card advertised mine intel chip support 2x2 connections spacebar actuate pressed edges volume brightness rockers integrated arrow keys making volume brightness adjustments two handed affair unless youve got absoread
44,review-fd857b28-890c-4475-95db-c2ab7fb2ae8f,chandoo Y,3,Nice,finally owned beast would like share following details regarding thia productpros1 design gets 552 heat sink design gives optimum performance gaming high usage3 backlight keyboard adjusted three settingscons1 much bloatware preinstalled os couldnt login second time startup blank screen display need carry service centre reinstalling fresh os2 better start performance beed add exread
45,review-32469d43-ba7d-4cd3-9c7e-4ce561524cb9,Utkarsh Rathore,5,Mind-blowing purchase,awsome deal got flipkartturbo mode amazingly working nvidea gtx 1050 smooth playing outstanding shadow effects gametotally loving
46,review-51a53de9-f887-421b-b294-6462e5617cad,Ayush Kumar,3,Nice,order delayed 1012 days cancel reorder product continuously follow order
47,review-d5c774ae-504b-49aa-a670-41275cf3b919,Naren K V,5,Best in the market!,good product satisfied super fast delivery good packaging flipkart
48,review-1ac1b7bb-8c7b-4aad-ba07-fe1fb78a8954,Cheriyan V A,3,Nice,item looks impressive installed windows hangs dont know takes 7 min boot
49,review-6ce45ffb-e274-4a4c-9e22-6785aad8b77d,Ramesh Chinni,4,Wonderful,comes lots bloatwareboot speed fast expected burn recovery software awesomeit dedicated button cooler booster 5 usefulalso far cry primal running smoothly average 45fpsneed speed payback also running fine medium settings
50,review-ef86914d-25c5-44cd-9a66-819d5a8fc640,SUMAN PATI,1,Useless product,dont buy laptop build quality poor 3 months hinge got hard cannot open lid properly plastic quality poor even handling carefully got damaged poor materials used
51,review-75b0319b-4a6f-4246-9c3f-985487ce08de,Flipkart Customer,4,Very Good,nice laptop mid budget range description given 1050ti gtx 1050 gtx software problems well minor like screen switched theres way turn restart laptophdd provided laptop slow need good performance replace ssd add pcie ssd
52,review-63ba5a80-5d0f-4777-bbc5-628bddb5bf7e,Bharath kumar,5,Just wow!,best laptop worth money got 60kthe performance good back laptop logo glows like pro making even better display viewing angle good red backlight super
53,review-09b213f2-726b-49cf-969f-21c1f5766451,PraTik PhaLke,4,Wonderful,everything perfect battery think coz gaming going fast
54,review-cc991eb9-ef0f-4114-940c-b531f870b613,Mohit Kumar,3,Nice,hinges open break time
55,review-b9ec9e51-94b0-40fe-9a60-4ff6b54b98ea,Gulshan Kumar Pal,4,Really Nice,performance good heats 80 c playing pubg mobile without cooler booster vertical viewing angles bad display tn panel ips one speakers mind blowing nahimic 3gives 5760 fps pubg mobile60 fps fortnite120 fps cs goall high graphics settings
56,review-0e657cef-8262-49dc-b5fb-26f9841a06dc,Flipkart Customer,5,Simply awesome,days ago like guys watching n surfing youtube get better n clear image product anxious um using say um happy battery bot slaggy give 3 hours time expect battery gaming laptop budget rest features man amazing might say perfect one going buy wont regretits beast
57,review-161fc446-1ed0-45e3-a598-2c7fa49292e8,Sayantan Das,5,Super!,nice product using one week found nice performing havent tried many games yet till satisfied though couldnt find numlock indicator yet dont know whether present
58,review-b12f904a-a27d-4dde-871f-40c1fc08f4fd,Vaskar Sarkar,4,Good quality product,laptop great price got 56k sale everything good except hingeshinges stiff might face problems beginning couple months believe notice hinge problem couple monthsonce get product might notice hinges stiff normally arethe problem hinge mechanism hinge stiffness closing see tha bak cover would come offi read
59,review-1bc1df4a-1bd2-48ee-ad04-5a56066eaafd,Rohan Mahakal,5,Worth every penny,best laptop price good things laptop ram upgradable upto 32 gig pcie sata interface ssd cooler booster 5 reduces temperature quickly 2 fansexhaust fan makes little noisesatisfied product
60,review-4dcb3374-dd8e-4e6c-943a-f903a51f6cb0,Hemanth Prajwal,5,Wonderful,good
61,review-d32ac3ee-4aee-4cf5-a360-e00161c71e86,Suraj Tawde,5,Brilliant,performance better i5 8th gen processor available battery drain 4 hrs office uses 2 hrs high end productive uses plus point charging rate fasterdisplay good ips panel average viewing angles refresh rate 60 hertz design good iconic back logo main highlight cooling system masterpiece available 60k laptop graphics performance better faster processor notread
62,review-4a841960-cdfc-4b0d-b54f-d0ca17770899,Harshith,5,Best in the market!,superb amazing laptopbut must include ssd necessary
63,review-5735b80e-ced8-4815-a90f-09b5b7ec6e25,Manoj,5,Fabulous!,online registration warranty unable register showing details wrong boxi dont showing like need clear explanation flipkart site delivered refurbished product contact
64,review-a54f3876-a4b4-43b8-b293-ee4146adc488,Aadhitya Logeshen,5,Super!,simplest way define product would call economical gaming laptop market today value money product price range offers features competitors would recommend one looking laptop casual gaming day day activities handled games ive installed till pretty well best product beginners gamingthe negatives would couldve beeread
65,review-6ed05288-83ac-4a4c-ad57-ed6200a96e32,vamsi krishna,5,Fabulous!,excellent productbuild quality high apart plastic bodykeyboard marvellous gamerscpu gpu highly greatdragon centre really usefuloverall lap great price
66,review-11b8a808-230e-46fd-81f0-6776f1daa3cc,Flipkart Customer,4,Wonderful,gaming beastif u wanna buy gaming go itit best gaming laptop pricei played fortnite pubg pc maximum 180 75 fps respectively custom graphics settings full resolution
67,review-15aad749-f777-47ce-ab51-9c22470ff522,Flipkart Customer,2,Bad quality,laptop good flipkart take care ekart packaging done properly seems someone try tempered packaging
68,review-b7747ba7-de0d-457e-8494-214a59e52897,Flipkart Customer,5,Terrific,awesome product go
69,review-f9087785-0edc-42df-a4a0-475653a5f641,shorab ansari,5,Brilliant,first would like give big thanks flipkart awsum service got parcel one day expected date best deal got online shopping initially scared book online heard many cases fraudulance wrong products flipkart proved wrong delivered exact product without defects damage delivery service ekart awsum delivery guy good got problm recieving parcel thank willread
70,review-8e3d7050-659d-4693-aada-130fa72c67b7,Robin Sihag,2,Not good,finger magnet mean considering features price range acceptedits hell slow first fresh start option windows 10 fix like 30mins beastspacebar dont work extreme right left guess supposed begot minute electric shock touched speakers one day never happened poor build quality considering price acceptablehinge broke 4 monthsread
71,review-f2d410ec-ebaf-4c49-978b-fa098e9cbd4e,maha marak,2,Could be way better,pros specification laptop excellent good looking design good keypad average build quality conspoor battery life heating issue playing games performance good color scheme also upto mark verdict average laptop per specification think twice buying laptop
72,review-dd08b5f3-e8fb-491e-8884-7c7bbfa4327f,Flipkart Customer,1,Terrible product,4 months since got laptop far great quite slow received package first didnt really notice screw missing underneath laptop contacted msi branch said ask flipkart went back forth thati actually used macbook prior much slower laptop compared could got one without ssdbut overall amread
73,review-74f08f56-e29e-4cd9-9296-278bcbabac6b,rishabh Sharma,4,Really Nice,great laptop pricethermals one best seen laptopdoesn heat even playing games battery life could better get around 45 hours normal use heavy workloads 60 90 minutes boots fast like 15 secondsdont even need use cooler boost heat speakers phenomenal best seen laptophavent problem speakerread
74,review-31617fd2-1976-4c00-bc46-003372af8f95,Saravana Bharathi,2,Moderate,laptop damn slow even booting slow try open documents taking 45secs respond open
75,review-7024adc7-c0af-431a-adf2-73b90efadba9,Pratik Banerjee,4,Wonderful,good laptop performance
76,review-24fd88a8-5248-4c64-8e36-b00b7c0428b1,Shubham Chaudhary,5,Highly recommended,best ever budget gaming laptop laptop greatest design speakers phenomenal performance really nice handle multitasking easily run games ultra hd happy flipkart delivery productpros high end performance speakers phenomenal great look antiglare display good cooling system awesome glowing msi dragon logo steel series keyboardcons preinstalled os loaded bloatwaresslowing booread
77,review-4d67690c-a444-44b3-9f1d-e02d1a9900ac,Tirthajit Das,5,Terrific,really good product price moreover cooler master 5 makes much better performance could included ssd cause booting time averagethe windows update version 1803 takes lot time complete overall experience quite good satisfying
78,review-5dbe2ae9-9a5f-4fae-81fd-1b013d1b8e86,soumit saswat,4,Good quality product,every thing great missed num lock indicator light key board key placing little bit weirdoverall best budget oriented gaming laptop
79,review-52b93744-f68a-4bbf-955c-eedcc7299d5f,Vijaykumar Govani,2,Not good,display horrible viewing angles compared ips display msi uses recieving marketing terms ips level isnt actually ips display also preinstalled os bundled software slow glitched gaming laptop even games like dota 2 cant get constant frame rate 40fps let alone actual gaming machine machine heats quickly underload even cooler boost active continuously think dell g serieread
80,review-c78aaec2-1fdc-47fc-b8fe-1188511df85c,harshvardhan singh,1,Utterly Disappointed,worst product updated new version windows 10 msi unable play video either online offline customer care help type irritating problem
81,review-e684bf1d-d6e4-4875-8dbc-e288a8b553cc,Bejoy NJ,1,Don't waste your money,battery stopped charging 3 rd day
82,review-fd808c3e-36e7-4e87-949d-f0206e26cede,Imran Mohammad,1,Horrible,laptop great price got 55 k noscost emi discount offer sale however rating negative ridiculously useless delivery service provided flipkart went collect product courier service provider could deliver time rating laptop would 4 stars 5
83,review-3b34d947-a6d3-404b-b109-51e3d82af3d2,Sharath Karanth,5,Just okay,camera working display horrible
84,review-f9fed27d-6312-4e7d-8836-621dd6e75027,Flipkart Customer,4,Really Nice,product good excellent gaming display played aw gta 5 lack battery back poor approximately 2 hours usage gaming
85,review-e1ebebb3-0d73-4df8-ab1f-4a9d434e100c,Ketan J,2,Expected a better product,great product price range company offering configurationinitially works slow due pending updates norton security dont forget delete norton use security since heavy windowsyou check youtube unboxing product write name model youll find itit heavy neither large handle worried weight dimensions
86,review-5e9a08e7-e693-4b4d-8776-01cd10af8eed,Shubham Bathla,1,Hated it!,porduct durable use 11 days screen issue come corner warranty issues registration service major cities hove go type worthygo indian base company service easly available
87,review-441b8dad-e938-4829-8c40-e2cafa20ec7f,Flipkart Ajitha Krishnakumar,3,Does the job,pros first performance top notch dedicated cooling system ensures overheatedthe nahimic sound system worth 5 stars build quality really poor like scale 1 10 10 worst build quality ever would say score 20the hinges get broken often back light keyboard goodbut keyboard build quality poor
88,review-f12710c2-c9d0-4142-8b7f-a5bed0068ece,Nandan Bandyopadhyay,5,Best in the market!,excellent purchase truely bang buck got 51k laptop bit slow though due window 10 home original installed lot blotware easily fixed installing m2 ssd formatting laptop running nfs payback high fhd setting smoothly assassins creed odyssey gears war running smoothly laptop high settings cod world war 2 infinity war black ops 3 also running smoothly shadows tomb raider frame dread
