,customer_id,user_name,ratings,review_head,review_body
89,review-f32c1d80-ea00-4eef-be22-a57147c2c917,Uttam Kumar,1,Terrible product,matter nvidia driver use crashes clean installed windows several times past 1 year used ddus clean install nvidia driver tried drivers msi windows update nvidia websites nothing works sure whats issue reached msi helpdesk get help either option disable nvidia graphics card device manager much gaming laptop
90,review-f9a0c8c1-7e22-4689-a4e8-be3777afcf13,Ashish Surti,5,Fabulous!,read carefullyit amazing product msi problem update need update intel graphics driver manually runs smooth battery life great make sure uninstall norton security increases load performance laptop amazing laptop go thinking twice compared asus tuf laptop series much better laptop dual cooling system cooling read
91,review-46b57ae3-b0f2-49cf-a1bd-3d9ff66a16b9,Flipkart Customer 21,5,Worth buying.,product top notch bought bbd sale 53k performancewise laptop beast used white letters keyboard red letters unusual first alrightcontrary popular belief laptop batteries battery initially lasted 2 hours tweaks disabling cortana running eco mode battery ran 6hrs totally worth money
92,review-3edd4da4-f172-49e1-9ce1-cbc11131d97c,Rajaram Mhatre,5,Best in the market!,excellent next day delivery unexpectedlaptop well packed well functioning good product
93,review-82170aaf-01c3-41f7-86ea-afc5256f0d57,Ravikumar C,5,Marvelous Product from MSI !,reviewing three months first laptop cared way much devicestarting build quality laptop much sturdy use premium plastic front sides keyboard best step taken msi make product look much elegant light though body fingerprint magnet get cleaner time would suggested msi use aluminum body would done saread
94,review-5d9af5a2-6269-462e-825d-8d550ef35eef,Pawan Kishor,5,Perfect Lappie,awesome gaming laptop budgetif done enough research buy please go research 2 years fixed lappie believe awesome value worth hard work behind itjust simple built quality average battery immense amount performance efficiency 100 reliable easy carry upgradable great extentplease purchase fully satisfied happybattery backup bit clunky gaming laptop duderead
95,review-3924248e-0389-4065-97d5-9f0622450cce,Chirantan Chatterjee,3,Just okay,things great apart build quality sell keeps breaking
96,review-feeb6729-6785-4e3f-99ea-777044b349e3,Ramesh Kumar,4,Good quality product,average good
97,review-a679419c-bb53-4378-9699-73f346efcc87,Mani gupta,5,Classy product,expected
98,review-df1e5805-a1ac-4f8e-8590-49d397be16f5,Flipkart Customer,4,Really Nice,finding great product may builtin windows nonsenses finding slowness booting well applications chance playing high end game yet hope also dissappoint
99,review-dd4cbd8a-e7f7-4300-9a95-efdccd8c41bd,Neeraj Kumar,3,Nice,harddisk veery slow purchase ssd want load computer good softwares games heats place bed undervolt heating significantly reduced hinges problem time become tight covering come strongly recommend using ssd dont want get frustrated regret choice without ssd booting time kind 1 min complete booting compread
100,review-ae090067-0008-48af-b194-9774531fae26,vinoth raja,5,Excellent,nice performancesmooth texture
101,review-c659572e-3a31-466b-8820-3127ea0661c4,Visakh V Nair,4,Delightful,good
102,review-e04b8f10-43f0-421b-9577-d33ec8213956,Kishan Bhakat,5,Brilliant,use ssd beast
103,review-c1dc630a-5bf1-4c34-ad8b-720657725e7f,Viswajith Vp,3,Fair,performance couldve better
104,review-8e4610e8-5f5b-4b43-ab28-6a3dbfc4d9a9,gaurav mehta,4,Good choice,every thing good bettery backup impressive thing
105,review-113baab6-cd67-4613-9473-00bc007af37d,Flipkart Customer,5,Awesome,beautiful product flipkart
106,review-00b24b03-6010-4e0b-b28c-d2d53aacf280,Flipkart Customer,5,Just wow!,nice product love gaming experience top notch best part sound havent ever experienced good quality sound laptop
107,review-e95d5777-d9db-4eaa-b6ac-80e6849ef02d,Supratim Dutta Chaliha,5,Great product,bought laptop video editing use premiere pro installed extra 16 gb ram inbuilt 8gb ram 24 gb ram icore 5 8th gen rendering super smooth went laptop repair shop amd got window reinstalled since original window pretty slow running faster happy purchase
108,review-fd02aa67-b540-404a-8ea7-cfbeb6bbffd3,Satyam,5,Terrific purchase,best laptop price rangei love thanks msi
109,review-21bae369-8b36-4697-a8ac-a66754904554,Flipkart Customer,1,Very poor,got defective product bluetooth working
110,review-4e978408-9aa4-4926-ab91-03779839fbe9,Anand Kumar,4,Value-for-money,everything perfect laptop wanted shortcomings west build quality good one display vaery bad veiwing angles
111,review-5c6728fc-2fbd-455c-a20b-c4f9c3f6cd70,Shubham Singh,3,Just okay,battery backup poor
112,review-c77dbe17-15f0-4b57-b7fe-c1dbaf013774,SUMIT KUMAR,5,Must buy!,best laptop gamingvery good sound qualitybetter graphics gtx nvidia 1050 gaming performancebetter coolingthish laptop better acer predatordisplay quality goodbest laptop gaming price
113,review-42498273-fe9f-480c-a1a6-69e8f3a16ad7,Priyanka Panda,5,Great product,delivery time product till working good update graphics driverpes2016 running smoothly need check pes 1819
114,review-6fd59b91-2db5-4dad-8d58-a456ef42238c,Reetom Bharadwaj,5,Must buy!,best purchase ever made almost triple games run high ultra settingsonly suggestion people thinking buying laptopis purchasing reinstall windows 10 stock windows 10 full bloat wares makes laptop really slowbut wouldnt affect gameplay experience
115,review-1f40fd21-e071-4950-9556-861e87b2eda7,RAJENDRA KUMAR MUDULI,5,Super!,price range laptop awesome think buy gaming laptop buy got around rs 51450
116,review-0b42acf5-efc1-4cd8-8284-f8e8265f5744,Ashik Ca,5,Terrific purchase,nice design good perfomence fast delivery got within 1daydragon suite useful
117,review-802fd83d-551c-4318-8ea7-07f7fee972d0,Lalit Kapoor,5,Perfect product!,searching laptop best features budget ended buying laptopi using 2 months say better thinkthanks i5 8th gen intel processor 24ghz 1tb hdd 8gb ram power pack 4gb nvidia 1050 ddr5 graphics card best part even high gaming heats cooler booster 5 technologybest class speakers first time ever seen powerful speaker loud yread
118,review-63be8bf1-806a-4661-8929-6c0d5adadbe7,Jatin Garg,4,Very Good,1 battery life poor last 50 min rormal usage heavy usage last 1520 min 2 laptop body material good oil hand stick body clean easily 3 rest things good gaming experience overall experience
119,review-0e71c6ec-33f2-4f91-a824-e79b2441f970,Bijoy Roy,4,Good quality product,want buy laptop mean gaming buy awesome college student like job want use laptop gaming work suggest better buy becomes slow less time im using laptop january may 7 upto wanna use
120,review-1730dfdf-a52b-4110-884e-7622f3f5de83,Gururaj Otageri,4,Worth the money,felt worst touch pad andend home keys page keys thats disappointingas others said finger print magnet added skins battery good used normalelse everything awesome till
121,review-d967bb39-b122-44c3-89d2-b41f1cf16575,Justin Mathew,3,Just okay,system pretty slow 1st week uselot bloatwares
122,review-588afdcb-4f65-494a-8916-a424cbc122b6,Flipkart Customer,4,Delightful,great product also fit budget boot time much faster compares laptops best gaming im facing lag issue game thing battery backup collerboaster runs battery backup reduced ok help maintain laptop heat every laptop get either battery backup collerboaster get features together
123,review-a1f0cf80-2034-45eb-947c-9e170ca6f4b5,jagadeesh reddy,3,Fair,performance processor good go 4 ghz claimed battery backup good barely lasts hour half normal work loads problem carry power brick around
124,review-34b6a703-b5e6-4673-960c-dee205ee8f59,Vaibhav Jadhav,4,Worth the money,great product battery backup average strongly recommd laptop gamers
125,review-51b38a9a-7314-4f55-b928-5a380e7c34a3,bhuvnesh sain,4,Worth the money,overall performance wow battery backup appreciable allif u hardcore gamer u go
126,review-7f82028a-566d-49aa-b8d8-55f0166bd61d,Flipkart Customer,4,Really Nice,really good price range heat exit really optimise play assassins creed odyssey high graphic avg frame rate 35
127,review-9d85c616-f017-4a48-92fe-62bc079d3370,Hari Krishna,5,Awsome (See Important info about processor in descp),overall great laptop heating issues performs well games like cs go etci noticed even though processor specs says i58300h quad core process 8 logical cores cpuztask manager showed 2 core4threadsit easy fixpress winr type msconfig prompt go boot advanced options amount cpusit untickedrestart pc 4 coresenjoy
128,review-f291fba1-4940-4089-9c62-cabc59b94887,mousam sarkar,4,Very Good,cons slow starting battery isnt long lasting 2hrs 30mins max pro nice looking speed use startup satisfactory
129,review-3436b829-84e9-4ac1-b7c5-78ec2d0ad5a3,Suwetha Sankar,5,MSI GL Series best of all,best ever laptop ever worth pricepros good design fast keyboard light hd displaycons battery standing 25 weights normal
130,review-47c5a08d-8899-45fa-bddd-9263f6094abe,Flipkart Customer,5,Best in the market!,brought product 12 th february good laptopbut battery power low last max 2 hours
131,review-a4f49b56-1f94-4ed4-9d67-3de4ef8ff6e8,Flipkart Customer,3,Does the job,expecting work fast lags alot crashed twice even though brand new complaining customer care asked install ssd
132,review-71fefddb-7627-4fe7-9e4b-cd9f068038c9,Akshay Shebe,4,Worth the money,using month laptop overall goodthe reason price low becoz fibre body avergae quality attracts lots dustthe thing build quality also average get feeling carrying laptop always feel like something get broke specially downsideother thing given cheap quality hardisk slow hellthe thing software takes lot problem adjusting diread
133,review-bc4b36e4-601a-4dc2-b424-905510525938,karan nair,4,Really Nice,awesome laptopgot 58k salethe con battery life 225 hr battery backup without gamingrest everything awesomedisplay cooling speaker everything
134,review-37c1db69-8b29-47a2-8bc3-0a647e8ac575,Diwakar Karwal,5,Must buy!,really great value money laptop playing games performace really great best part got 2 fans one cpu 2nd gpu msi gives u ful control run fans full power balanced mode
135,review-82d1f38c-43ef-4aa6-a5fb-0a07d3386daa,ASHUTOSH YADAV,4,Very Good,got 58k offer every thing good price range except battery backup though 6 cell battery
136,review-f4931690-47c7-4902-a31c-58273993ca17,Shibadatta Nayak,5,Best in the market!,good laptopbut feels bit laggy may ssd i7 version great add 10k
137,review-81c3a66f-f4a3-4558-b833-06effea22995,Flipkart Customer,4,Nice product,bought 62know rate nearly 58ki bought programming good programming experience made fan msi laptopits gaming performance lovingoverallit nice laptop price range
138,review-34840beb-e2c8-41bb-a0b1-2e1881305ca0,shabaz ali,4,Wonderful,os really slow system gud bought 54250 think worth buying lappy
139,review-11f6b43f-ab93-4adc-ada0-1bd9eb699012,Om Gupta,5,Best gaming laptop,overallusing laptop since 10 months nowbest gaming laptop price rangethe special applications provided like dragon center etc help bring lot laptopapart gaming applications like android studio run smoothlydesignthe finish laptop amazing fingerprints visible helps crime scenethe build quality amazing best part whenever start laptop dragon logo back glows looks ravisread
140,review-7bce05aa-f6f0-4326-aa8f-c9e56434783e,Abhijeet Adsod,5,Best in the market!,great laptop
141,review-a7035963-8da0-4e52-833f-14960b23bf4b,Flipkart Customer,5,Mind-blowing purchase,stealed deal 55k
142,review-d31540a2-8e35-42f6-8704-ab59e122c039,MITHUN DAS,4,Really Nice,battery performance bad satisfied msi improve battery capacity performanceother things good little lag felt booting time time gaming performance good build quality bad closing side flip get damage
143,review-e94577d4-9ab0-42bf-af13-39ae65061fc1,Pritam Kedare,5,Wonderful,laptop looks good backlit keyboard fantastic performance also good price specs also good msi no1 gaming company nvidias geforce 1050 works well handles heavy games easily value money laptop
144,review-e1e172be-3902-4620-8c4b-df9cf41dcb08,Probin Boro,5,Simply awesome,super awesome product price point good build quality
145,review-568d1861-a3d1-47d4-a87d-5fcc010bb187,Akash Sidhue,4,Nice product,10 months usage install ssd laptopas getting slowerssd must laptop
146,review-dd3ea1d7-7763-4fe3-99a9-7f02a1756f84,Flipkart Customer,5,Super!,amazing laptopjust press one button fan pc cool 40 ive never seen kinda feature laptopjust upgrafe ssd better speedyou clean laptop using oily handsyou play game gta v cod black ops 4 battlefield vbattery good cares play games
147,review-36b2cdf8-105e-44c6-85d1-72e54b50dae8,Mapuii Khenglawt,5,Beast,awesome
148,review-6a90d6b0-efa9-4ff0-bd5b-e5c49cd1b4c4,Flipkart Customer,4,Pretty good,best graphic card model
149,review-b1b56fb7-4965-4709-94fe-0d1a35d74fbc,vivek rathod,4,Value-for-money,booting speed slowmy laptop takes 3 min boot
150,review-6a880b23-ff13-4080-81c9-268e2bcb6333,Flipkart Customer,5,Worth every penny,reallyin range beastmean gaming lappibut weightdesign nd performance unbeatableyieah battery backup quite less although gaming laptop overall osmbrought 53khpy customer
151,review-61312e23-9ab2-4fab-aa00-e137ba86ecd8,Flipkart Customer,5,Terrific purchase,loved laptop amazing machine price playing cs go fifa 18
152,review-2d242b02-38fe-4a4f-a9b4-fb0ee927f5fe,Flipkart Customer,5,Worth every penny,product greatvery nice productspeakers powerful
153,review-997e3ee8-9485-446a-a1b4-3a8d4988c14d,Shamal Hattimare,5,Terrific purchase,battery issue due high graphics card otherwise superb laptop
154,review-01ef3368-faec-4664-b3e6-b14cd6337712,Flipkart Customer,4,Wonderful,okay battery backup nice design great performance good display nice key board overall nice laptop budget
155,review-f43355c9-c3da-4e90-8aae-d97815428e6d,Ashish K,4,Very Good,battery bad everything else good
156,review-0e59f640-14fc-4fd7-b3f9-565dd01eace7,Saurav Singh,5,Wonderful,perfect laptop gaming buying please reinstall windows system works smooth fine dragon center fantastic audio nahimic 3 awesome battery bit low fantastic product light weight good gaming use
157,review-e46100c4-8689-4679-9d05-edde69a70130,Tusharkanta Senapati,4,Good quality product,one best laptop price rangebut upgrade ssd hard disk able given better experience
158,review-0170f2ae-0aa2-4e4c-acb9-e584174d59bb,Venkatesh Babu,3,Nice,2months purchase laptop got hinges problem hard open close screen
159,review-60c2f9d6-538f-4017-88ea-f9d54bec8b4f,Munish Goel,5,Perfect product!,good product received delivery flipkart committed time good display voice quite loud clear battery backup first recharge 4 hrs hope increase bit 23 recharge cycle windows version preinstalled old takes long time update reinstall fresh windows overall value money bargain
160,review-8e7f89e8-bc2b-4011-8c5f-800f68c9096b,Ishan Dubey,5,Worth every penny,good value money cant dual boot linux stick windows os
161,review-7a50e4d3-2d44-4413-9fe7-d7e8a6a76c05,Manoj Singh Bora,5,Simply awesome,good laptopin price range 55k pcie ssd slot msi logo glowsbut wish ips wideview screen
162,review-68083678-326a-4176-bb9d-c289bacfa5b5,Gururajan Govindan,4,Value-for-money,got lap first week december upgraded ram 16gb added 256gb nvme gamer trader use triple display laptop screen inclusive msi support awesome battery could better get around 2 hrs paid 350 ram ssd upgradation along windows migration
163,review-947f7a1a-ecab-4d8c-bcd2-adc9ac8dd902,Sagar Hathwar,5,Super!,one best laptop price firstly thought buying acer predator series lags behind cooling thought laptop would trust gaming laptop 58k never thought would amazing games runs smotthly even ultra settings 3540 fps cpu temp never 72c cooler boost advanced cooling option able get around 6567c really impressivetotally satisfied 2 disappointment read
164,review-10fb315e-7fdb-43f3-aaad-f8395830e7f1,Budu Reddy,5,Terrific,well disappointed battery backup
165,review-961394b3-fe44-4ac4-937a-ac9c37c377cc,zainil waliyani,5,Simply awesome,great experience laptop flipkart
166,review-b5ff3294-3cf7-457c-88ae-1809e7f89bc6,Gpoushinglung 29julyssi55,5,Must buy!,product really cool superi really like u guys love
167,review-9f8337db-cfbf-435f-9091-5c7e2fb5d831,Arindam Bharati,4,Good quality product,laptop great 60k offerperformance great graphics playing games great loved totally battery kinda ok gaming laptop budget would recommend every one get ssd would definitely make performance better ever im disappointed build quality markunder budget cant get better gaming laptop one go youll love sure lasread
168,review-abb5ea35-af30-4829-b64e-aea1b9b58e22,Nishu Singh,5,Highly recommended!,ive using notebook 11 months still counting didnt find problem notebook allmy favorite aspect product performance improved experience ive using notebook gaming 3d modelingthis product completely fulfills needs delivers beyond expectations multitask without lag performance issues
169,review-2cd4afa2-692f-47c0-be51-89c6ab4a4c49,chandrasekhar reddy u,3,Nice,screen direction centre handle delicatebattery poor graphics performance good cooling excellent
170,review-a59a4e1e-c5fd-411b-b94d-c8be70047ab6,Flipkart Customer,4,Wonderful,quality amazing battery ok since gaming laptop acceptable graphics display point design amazing overall totally value money
171,review-95c19a38-5a4d-4c2d-ab7c-798d5624f4c2,kiran jaybhaye,4,Nice product,best laptop price category display good performance also best category anyone want purchase selling 10 months old laptop 14 months warranty remaining price 47 k nigo anyone interested please ping comment dm instagram kraigtheguy kiran jaybhaye
172,review-f743d0de-f2ab-40eb-8401-dea9070933d0,Flipkart Customer,5,Excellent,sexy hard drive
173,review-a6e0036f-3be6-4b67-afc7-f7fa4f9dca54,Eldho James,5,Fabulous!,good display nice thermal performance awesome service
174,review-666eda20-cf70-4561-b617-9b7d719cb253,Flipkart Customer,4,Delightful,theres smudges keyboard soo okayit says 1tb hdd get like 931display soo good say antiglare partialthe performance gooddisplay big problem cause gaming laptop given better displaygraphics good purpose
175,review-d85c941f-a6db-40b4-985b-376745e199b4,sachin shimpi,5,Must buy!,laptop good kinds daily usual work gaming struggles lot due absence ssd insufficient ram hope adding 2 parts gaming issue also solve dont expect higher performance even adding 2 parts entry level gaming laptop
176,review-842faba6-818e-4eb0-8a53-1cc2093f5e7c,Amitabha Pyne,5,Great product,first really worried external flipkart packaging large box inside laptop box could move around inside air packets would fixed problem laptop needs recommendation people create msi enough recommendation quality fortunate enough money buy know disappointed rather discover craftmanship dedication passioread
177,review-91fbea2a-0ac4-401e-8086-e5007664e81d,Prakash Tatipakala,5,Classy product,trust best laptop price rangeprocessor i5 8300h faster i7 7th gen processors laptop buttery smoothgames like gta v ultra setting fps always 75fps decreasing imagine smooth game wasu expand ram upto 32 gigs ssd many upgrades u future match latest models time cooler booster 5 wellaudio excellent word say u feel like 51 sound iread
178,review-a6306bbd-616f-4460-aea6-2609a45cd860,Flipkart Customer,4,Very Good,games work smoothly updated windows boot time became 56 minutes update 20 seconds dont update ur windowsi got 50k
179,review-cc2bbb6b-bcc8-493a-91a5-f1e2a5f1097c,Lingamuthukumaraswamy,3,Just okay,battery performance bad 1nly 2hrs standby
180,review-283fc99c-6460-4109-9946-200c91f60994,Tushar Bhowmick,5,Best in the market!,laptop beast
181,review-89498348-79c7-4129-8f92-1284990ee952,Flipkart Customer,4,Delightful,sometimes slow think hard disk maybe upgrade ssd
182,review-03654a3e-3f5d-4af1-85ca-419a9e3db4a3,Arpit Diwan,5,Fabulous!,laptop far better expectedthe prosessor powerful previous gen i5 25ghz base clock 4 cores 8 threads turbo boost 39ghz want performance shift turbo sports comfort settings enable charging laptop cpu frequency decrease base clock unplug tye power cord add m2 nvme ssd upgrade ram upto 32gb battery backup upto mark gamingread
183,review-fc390315-7784-4438-a407-776310eee1c9,Piyush Patil,5,Terrific purchase,laptop awesome preinstalled windows little bit slow download new windows good go battery performance good sufficient 3 hours maxgraphics great definitely recommend
184,review-9a6d23f6-2db6-4b5d-86ab-dc38165b728e,Sandesh Ghone,5,Mind blowing gaming laptop,awesome creation ive seen yet
185,review-a6633c6d-51d6-4735-8d26-de41e9211de4,Faiyaz Alam,5,Highly recommended,nahimic sound experience amazinglaptop performance smoothloving dont words expressmsi rockz
186,review-ab30ea02-a513-44ff-8aa5-376601fc90d4,Himanshu Shekhar,4,Wonderful,nic laptop delivery quick
187,review-1548deeb-71b5-456e-a0c0-b9cd2d75466e,Flipkart Customer,5,Wonderful,good
188,review-9929595d-a883-4b2f-9563-8e06d26b668a,Aditya Sharma,5,Worth every penny,best got till
189,review-340eacf6-6ece-46b7-8587-f9561dbb0563,Sreehari R,1,Did not meet expectations,delivery time gaming good faced many problems laptop camera laptop working wifi connections showing limited access always tried refresh pc issues really disappointed product
190,review-bc2300ce-06c6-4e6b-8fd9-0c875726416f,Darshan Rathod,3,Fair,times lags
191,review-b6e54fa6-c249-4bcf-b4fb-6bc299d24dfb,CHINMOY PAUL,5,Mind-blowing purchase,excellent gaming laptop within 60k budget u ignore battery backup everything else point u want pc u hardcore gaming without problems moreover u neednt worry thermals way good 67 heat pipes present audio good nahimic 3 sound technology display give 5 stars coming design outlook looks ravishing msi logo lits always proportional pcs brightness 8 gb ram nvidiread
192,review-d82f50b4-1179-4009-8850-f49099664e02,Sekhadri Ch,1,No good,buy laptop 8 days laptop keyboard working good
193,review-62108bbd-9dea-4fb2-8c63-1b54f614d207,Aditya kumar,1,Utterly Disappointed,worst product ever purchased flipkart replaced 1 time replacement issue exists example paid fortuner exactly got outdated maruti 800 disappointed time suggest buy msi products one buy mac approximately price
194,review-1961a057-0f8f-453a-9d8c-693e1812b9e6,Rishiraj Das,3,Nice,hdd every thing good hdd speed horrible booting takes 20 30 sec fully use pc take 1 2 min suggestion toh either replace hdd ssd slot external ssd pcie gen 3 taking base breaking factor seal sticker contact customer care msi games upto mark obviously gtx 1050 give 40 50fps enough power supply medium highest settingsread
195,review-ce2aa043-f0fd-443b-a6b7-85a94572b369,Sharad Verma,1,Horrible,good laptop battery life 4 hours web camera bad grainy display good viwing angle bad cooling system good drops temperature quickly without nvme ssd install wantafter using 10 days 1 dead pixel spotted screen
196,review-a997361e-d48f-4764-aea3-6e89f14b341d,11Mr. Dee,4,Value-for-money,good gaming play high graphic sometime slow cant play 10 minutes without charging poor battery performance cant play pes 17 sound cant install nfs sometime cant charge battery 93
197,review-769d93f9-b58d-4df8-bbea-7e1040317eb5,Deepak Mann,3,Nice,windows startup lags lot touchpad good creed unity nfs payback fortnite wo frame drop laggy ultra n high settings screen matte lcd looks fadded punchy good outdoor though heavy weight comes wo accessories8 gb ram shows 2667 mhz many cons many pros overall 3
198,review-50e55458-dab5-4713-ace6-5c2104e25712,Nayan Gwalani,1,Waste of money!,system boot slow performance justifiable according specs moreover month started facing lot problems like showing one external drive twice able copy 5gb file folder space around 60gband many dont buy personal advice
199,review-c0414fe6-c301-47ef-8d90-c1b5edae26f9,Flipkart Customer,2,Expected a better product,updating system latest windows 10 im able play videos online track pad wont respond sometimes clean windows install must
200,review-7c636ee1-f118-43d2-8404-74908eebb023,Gursewak Singh,4,Very Good,dont know people giving less stars battery bw battery capacity good per gaming laptop standardmy review 1 month usageaudio awesome loud clearwindows boot bit slow may due hdd gets fine startup tried gta5 works fantasticeven clean window installation boot slow may improved installing ssd m2 socketbody may plastic always fear breaking hinge sometime losse sometread
201,review-a587c19b-a220-4b59-a42e-2691c05d555a,Flipkart Customer,1,Terrible product,pls dont buy laptop plastic cheap much flex screen
202,review-28534a04-7960-45a9-bbcc-c573d8fa57cb,Deepak sharma,5,Just wow!,super
203,review-ff25c95e-ef5f-46cc-b62b-6d06c43df734,Flipkart Customer,3,Fair,good
204,review-13c73ddd-77d1-428e-bc94-e7021718d07a,Amit Kumar,2,Expected a better product,slowbattery back bad
205,review-915f5ddd-787f-4345-8270-64527f2959d8,Saurabh Mehta,5,Terrific purchase,first flipkart services superb got minor diffected product flipkart replaced 48hours without question come laptop good comes 2 years warranty increase three months registering product survey msi official site laptop comes charger third party company got chicony tyme affected product another company doesnt matter played gta5 runs smootread
206,review-b494ec56-2ece-4875-9701-205b4398479c,Flipkart Customer,3,Just okay,one month usage laptop extremely laggy takes 2 mins boot gaming performance excellent normal usage nightmare always lagging better go model ssd
207,review-4e1e59fb-e2a9-45f2-a3c0-dadb2e1f66c0,Navanath Magar,5,Best in the market!,monster literallymain thing laptop unique designperformancespeaker quality etc must recommend laptop designers works whole day need high resolution graphics software amazing man trust
208,review-f3a2b75f-ce2d-4b0d-98a4-4c607cd6cdbb,Naveen Sohal,5,Wonderful,awesome delivery got less 24 hrspackaging goodlaptop awesome af
