,customer_id,user_name,ratings,review_head,review_body
209,review-29278fc4-f8b1-46d7-9aac-a7d3f61428b5,Likhith Cv,5,Review after 45 days of usage,genuine reviewbest laptop ever pricei bought 59kdont compare laptops go itits highly durable u use roughlyspecs given get 4 gb extra shared graphics ie total 8 gb graphicsu dont need extra speakers superb loud woofersglowing dragon logo feels like proi compared gaming graphics laptops friendsi dont know getting best graphics friends get average graphicsread
210,review-162b02a7-7462-4654-bc9f-2f25a29ac809,Aman Verma,4,Very Good,touchpad good
211,review-6fadc5fd-c9ea-4550-a478-1fdf3427b6d9,Edgar Binan,5,Brilliant,awesome product installing make sure graphics activated
212,review-c971d74e-f33b-47c2-8294-0cac3d17ab78,Shuvam Baksi,5,Classy product,product really good faster boot time good look cooler boost 5 technology really helps hardcore gaming im getting 60fps vsync made vsync ingame nvidia control panel still helpful
213,review-6de69cfb-409f-4d60-a11d-57b5aac2e038,Mihir Yadav,5,Must buy!,awesome laptop played gta 5 60fps high settingfortnite high 60 fpspubg high 55 60 fpswatch dogs 2 50 55 highits awesomemy friend also buying price get low
214,review-7268cb54-3389-46a6-b80e-ef8383cbba12,Supratik Chaudhuri,2,Bad quality,gets fingerprint smudges easily even used clean dry handshas 60hz display means matter even get 120fps gaming experience suck
215,review-a87e5cb9-3661-4e53-ad46-38fc953aedae,NIRAJ MISTRY,5,Best Laptop in Category,using laptop last 1 year upgrade ssd easylaptop runs expectation run many software games laptop never lag hang run smoothlynest laptop price also well build future proof
216,review-da9044cc-b8b4-4a1a-89f0-66e51dc11e2d,Sagar Singh Shekhawat,5,Brilliant,almost 6 month using beast awesome performance used streaming gaming really give awesome performance every field
217,review-dfad76cb-9189-41f1-a6b7-4900b1e7c2d6,Anurag Choudhury,3,Good,bought june 2019 55k inexperienced first place buy paying 55k laptop ssd foolish gaming performance also average thought buying rare brand unique mistaken go asus rog lenovo guys best series
218,review-e5388d07-ffd0-405b-a1e4-faf1bbd219e4,Samir Choksi,5,Wonderful,battery drains fast drains 100 10 fast
219,review-96e0610d-200d-4f47-bd1d-594cae5f4fb6,Shantanu Srivastava,5,Awesome Product,pros performance good performance thanks intel i5 8 gen processor cooling best class cooler booster 5 king heating probs keyboard steelseries keyboard make worth buyingvery sturdy good quality keyboard sound going fell love quality sound build quality really nice looks nice sturdy nvidia gtx 1050 delivers everything expectcons trackpad trackpad good mouse buttons ofread
220,review-fda9c1dd-c8b5-4652-81e2-6f2f3d83eb97,Yashwant Singh,4,Pretty good,overall staus good build quality low full plastic structure proper support laptop handle load
221,review-65ae9070-d702-496f-a51f-87ba8cc341a2,Eshan Goyal,5,Terrific purchase,looks beautifulperformance ultimatei usually play destiny cs go dota itworks butter loved
222,review-33340c0a-d95c-4ca0-844b-1b6c5b687828,Flipkart Customer,5,MSI the new gaming era,support heavy gaming cooler booster help insane gaming help reducing heat laptop excellent battery backup even gaming laptop steel series keyboard awesome
223,review-ba55eb71-6cd0-4d19-bed2-a49a95971281,Flipkart Customer,3,Just okay,good one
224,review-d3ad37a3-3362-459c-a5e7-7b28d2a23cda,Shubhang Dixit,5,Super!,best gaming laptop get student budget lag free gaming experience play games want without hassles also give separate ssd slot upgrading gaming experience buy go msi service center fitting far best laptop got student going 1 year hasnt lagged yet msi
225,review-925fe137-826b-43d1-8e58-2cc470082529,Manas Saxena,5,Beast in this range,best laptop price range using laptop around year easy 250 fps games like csgo 150200 games like rainbow sixno heating issue two fans laptop operated using button externally keyboard triggered using dragon center greatutility software laptop keyboard leds great cen operated 3 modes laptop really fast heavy unlike laptops ranread
226,review-d5be967d-3f9e-4dac-8daa-c37fb78394c0,Devender Singh,1,Hated it!,laptops body worst cheap material used laptops lid lonk broken sides 6 months use
227,review-f545f3cc-f34b-4699-a5e9-6e535472d35f,Sooraj U.L.,5,Literally the best budget lap in the market!,first glance many doubts laptopwill enough powerwill good cooing systemwill able meet needsdoes enough juice work dayso many suggestions thinking finally bought laptopand proudly say laptop gone beyond expectationsthe gaming performance excellentthe cooling technology excellentit meets everyone daily needsit enough weight read
228,review-c1a34d52-1a81-4608-9de4-9e9e37d8abe9,Flipkart Customer,5,Excellent,wont good choice buy expensive laptop think brand like apple asus make compatible todays worlds demand use gaming studying business entertainment one experience feel high tech present around us budget laptop fit slot premium remaining economy
229,review-ebe4a00c-5425-4795-bac3-56135ace879d,Vaibhav Jagger,5,One of the best laptops I have ever owned.,wanted laptop college useprogramming aslo gaming laptop fulfilled without hickups laptop excellent speaker system excellent nahimic sound driver system also gave bang performance supported nvidia geforce gtx 1050 gpu also support pcie gen 3 ssd perfectly tuned keyboard like programmer would want laptops price range generally cut corners aspects like keyboard speread
230,review-0d25285b-666d-4727-b26f-213f13a00db9,Paras Bhadke,5,Great product,attractive
231,review-dfd87aca-e568-47f7-8db8-e19ce31287a3,Alokkumar Rao,5,Mind-blowing purchase,using laptop last one year couldnt happy satisfied gaming experience msi gl63 purchased laptop gain best gaming experience happy say msi didnt disappoint gaming mode dragon center optimizes game gives priority game battery backup around 4 hours good considering powerpack performance laptop delivers sound quality awesome nahread
232,review-cfd5c275-ac05-45ba-8c2d-0bda35a3e676,Rajesh Annam,5,Fabulous!,best laptop ever boughtbudget laptop gaming lv u msi flipkart delivering product safily
233,review-237bf69e-443e-4ad3-8a67-7f9a5265c493,Yug Choudhary,1,Not recommended at all,poor quality genuine product much display hard disk issues warranty period want refund
234,review-458f9149-4f52-4298-939f-3c38bd883d65,Ashish Rai,5,Great product,brand laptop really amazing performance superb looking also fabulous loved thanks msi
235,review-541f3758-4124-4b44-a2d3-d19f23346395,Asish Ravindran,5,Best in the market!,superb product uff gaming beast
236,review-30036f4d-8449-42ca-96a1-6f6740cb8167,Shreyansh,4,Worth the money,bright screen aboveaverage speakers dualdrive storage wellbehaved cooling system everything else good except build quality cant compromisedthe steel series keyboard works fine addon softwares like dragon center impressive works good daily gpu usages
237,review-c56afa50-50ff-4c8b-af4f-0f34fc0e444e,Harshith VP,5,Good mid-range hardware powerful laptop,pretty good tbh okayish battery dont expect lot gives around 25hrs battery saver running highend softwares whatever since body full plastic year side panels start slightly opening friend laptop also issue although doesnt hinder performance still scary cause laptop panelsdisplay panel slightly opens unfolding laptop performance really good dont complaints
238,review-adc0131d-1381-47eb-a6dd-fc5d610d40e5,Abin Varghese,5,Best Value For Money!,excellent gaming notebook price rangebuild quality much better expected feels rigid best class cooling making gaming experience much steadier enjoyablethe keyboard also good especially since keyboard steel series steady clicks nice travelthe screen good overall sound output system nicesupport nvme ssd hdd one feature attracted instalread
239,review-e11f3dfe-2c5e-438e-96f0-372540a0c249,Gaurav Ashish,4,Pretty good,good laptopbut battery backup bad 1 hour max without game
240,review-b0544906-f74d-4a6e-963e-01f2ce0226ff,Abhinav Kk,5,Great product,msi best gaming compared gaming laptops cooling systems prevent laptop heating gaming give cool atmosphere dont look choices go book msi
241,review-e44267b8-8fe7-4e01-96e0-ac8782e9e5c7,Ayush Yadav,2,Moderate,hinges got cracked 6 months normal usage
242,review-c2afcc32-3df4-4374-884c-163e5a642b8f,dhanunjaya nambi,5,Worth every penny,beautiful laptop price flipkart really came delivery delivered day laptop advertised around solid build proud tag msi intel core i5 mistaken 8th gen processor better 7th gen i7 7700hq gaming smooth experience geforce 1050 handles aaa titles without issues pubg fortnite gta 5 assassins creed name id suggest getting lread
243,review-1b9a126c-5009-4efa-b0a9-62f4eec7d662,Pappu Sah,1,Hated it!,better add little money go something better msiafter months usage started getting random problems slow hellthen clean original windows installation without bloatware worked well months getting sutdowns without warnings everytime play game around 5 mins problems faced 1 slow hell even basic tasks read
244,review-1706a944-9654-41d8-9f49-8a817b354a7d,Akshat Garg,5,Simply awesome,scouting laptops bit hesitant getting msi busted myths within hours arrival best thing msi dragon center writing emails watching movies switch eco mode want play games switch performance mode whosoever wants get laptop low budget gaming laptop laptop kudos msi
245,review-c2479c83-72c3-48f5-9157-b2ab851a3451,Rohit Anand,4,Pretty good,yeargreat design look awesome glowing msi dragon logoit good cooling system playing cause 4 1 hour advance turbo mode things laptop hotkeyboard awesome red backlitperformance improved upgrading ssdvery good sound system nahimic3 support speakers quite loudboot time long said improved installing ssdin price range suggest youread
246,review-4860c322-8253-4fd5-b135-ef14dd4a38aa,fahd hadi,5,Best in the market!,amazing laptop price best laptop msi best brand gaming laptops
247,review-8b8aab90-ad61-4337-baba-e94f50d44e91,Ashutosh kumar,5,Just wow!,really well delivered product love box classy good laptop good looking stud loved overall look laptopi ok performance liked overall thing wholethe screen good audio jack sometimes gives problem maybe due windows updateanyway overall good productjust buy alreadyits awesome budget steall go
248,review-7d470d02-7cf5-45e9-b570-549a2ff505cc,Ashish Saxena,5,Great Laptop,bought laptop gaming well using simulation software experience awesome performance great even extended usethe build quality great great finish doesnt scratch keyboard delight use even better expensive laptops manufacturers design also aesthetically pleasing doesnt top gaming look looks sleek beautiful course glowiread
249,review-cde9803f-198c-4397-b360-dd4f0962d1fe,Ranbir Chabungbam,4,Worth the money,performance good secondary storage somewhat slow hindge near casing monitor weak point curved display forced goes undivided try close open temperature control works like charm liked handles audio looks like mini home theater
250,review-c7c36297-1373-4b97-b481-4699cbc6f2af,Akash Jikadra,4,Worth the money,first laptop everthis msi laptop good battery backup also good performanceone play pubg pc games easily laptopi specifically bought laptop gaming found handyin short best gaming laptop price rangei love laptopone thing would like say company provide product ssd preinstalled bit slow hdd
251,review-e5168f95-1b8d-468a-ae45-5eb60775e4d9,Mohamed Nadeem,5,Terrific purchase,product works fine
252,review-eca0a4ee-22c6-44dd-801f-db942441f530,Sahil Sinha,5,Great product,laptop good working fine getting many features 60k range recommend
253,review-c725f3f9-b825-42b3-b710-835ccbf23afe,Sharad Dubey,5,Brilliant,looking gaming laptop budget definitely great choice gpu ideal gaming lag game core i5 8th gen gives great experience considering build quality may compromise build quality isnt great apart steelseries keyboard gives nice experience gaming well general typing nahimic great software sound assistant delivers decent sound read
254,review-d22e47b1-ce36-495d-a9cc-f4eb0ff82fd0,Bharath Kumar,5,Excellent,best gaming notebook buy price rangethis laptop clear 1080p uhd display great comes cooler booster dedicated button activate great option cool ur laptop amidst gameit runs 1050 4gb get pretty good fps around 60 almost every game settings tuned high gpu gamesit i5 8th gen cpu pretty powered enough gaming comes 8gb ddr4 raread
255,review-e88b4d31-a531-4a31-b630-fbfed60af9b5,Sai Ram,5,Fabulous!,one best laptop gamingpros1 excellent performance2 high performance cpu graphic card3 key board smooth use4 excellent look5 best gaming programmingcons1 battery upto mark drain fastly like gaming laptops
256,review-32962d02-0985-4121-9d12-735f053c63d0,Flipkart Customer,1,Did not meet expectations,bakwass laptop battery backup bakwass
257,review-4473118f-5a7b-4791-ad15-42249985e2e5,Biju Viswakarma,4,Nice product,good
258,review-7f5a69d2-7fb0-4d38-b6f4-00bd6750af62,Sajeev Thuppasseril,5,Simply awesome,best product price
259,review-a0028b59-b264-4c32-81e7-dcd1c8354644,Rajat Admane,1,Waste of money!,face issue help flipkart
260,review-9de852b5-a82c-48b2-b0ef-b4a98b2163a3,preeti bhanushali,4,Delightful,performance good
261,review-5c73749a-cbf9-4242-96a5-5f069a1951f4,Deevanshu Kumar,3,Does the job,purchased video editing workbut important software adobe premiere pro doesnt work properly laptop
262,review-53cf27ad-d8be-43fa-b622-9a30758db9ea,Prashanth G K,5,Classy product,best laptop 60kone drawback ssd ssd slot available ms officebuild quality bados need reinstalled get new one fix bloatwaresneed install essential drivers proper working beginning battery backup good
263,review-ebcf3d0c-f97c-43fc-945d-97ed58db4028,Shivam Verma,5,Must buy!,fall love itbetter battery life gaming laptopbut disadvantage pubg pc play pubg pc battery lifeu use laptop power u playing pubg pcor heavy gameon battery life give 1518fpsand power supply w see game running upto 60fps
264,review-6365dcfe-3f96-40e9-9e16-41804caac5a4,Gaurav Sharma,5,Must buy!,guyz seegpu 1050 powerful graphic card entry level gamingi run gta v smoothlyi run watch dogs 2goodi run nfs pay back smoothlyi run injustice 2mediumscreen sharp preetyi like laptop
265,review-c3ba7285-66c9-4707-92a9-44d381d11fd3,Manjunath Malakanavar,5,Awesome,laptop performance nice
266,review-7eac2b8c-e608-4b6b-bc08-ed632c08c1a3,vinay singh,5,Classy product,powerful performance price cooling vents 7 pipes helps playing heavy games default os boltwares un necessary formatted working buttery smooth add ssd totally awesome
267,review-7f6a238c-e317-40a7-81a0-e51eb484d1eb,Md.Ayaz hasmi khan,5,Fabulous!,good
268,review-c82a932b-ef48-4347-a686-fbf4678f31a1,Rahul Singh,5,Wonderful,value money
269,review-2c34b727-ac68-4373-ba85-4d62b273ca04,GOWRISHANKAR,3,Decent product,battery backup 2 hrs fully chargedother wise give 4 star
270,review-4e6ac6be-f26f-42f3-b937-3831db18e080,Siva Sai,5,Terrific purchase,cooling worldexpandable ramssd dragon centre jobsound fineno damages delivery good
271,review-5f24c99a-724e-4b11-a054-8ccdbd309666,Pratyush Piyush,5,Must buy!,upgraded samsung 870 evo bitterly smooth fast booting time games run really smooth love dragon centre nahimic softwares user friendly really good software
272,review-41e30d64-e109-4787-8d85-2fc7f6c7d9fa,Akash Handi,5,Great product,first bought 52k dam good amount price
273,review-90312924-4e2c-4de8-805c-dce89f0acbae,Flipkart Customer,5,Best in the market!,laptop best bang buck loved performance top notch easy multitasking heat issue
274,review-b62a46b3-4f56-47a2-ae56-659de891d1d7,Avinash Kale,4,Delightful,good product
275,review-d65ee02f-57c2-42e9-94f5-29694a575d69,Flipkart Customer,4,Really Nice,brought 3 months agoand point viewthis excellent laptop 60k much better acer nitro comes category budget laptops looking 1050ti budget bad wasnt laps like purchase acer predator 1050ti high end performance aaa games acer cons battery life throttling issues msi provides cooler booster 5 could drop cpuread
276,review-370fd55b-8252-4ecf-9067-14cd6c0bc298,Dr.G. Nixon samuel Vijayakumar,5,Fabulous!,excellent
277,review-1e802a46-13af-4169-9f98-582b14e6d951,Himanshu Sharma,4,Good quality product,booting hdd shows high level consumption became slow takes 5 10 mintues come normal stage
278,review-28f608cd-7012-4d92-a56f-7627d4bbe3fc,Midhun Raj,5,Classy product,good product
279,review-a58a68f9-d32a-437f-abf2-d3375d19d9e9,Flipkart Customer,5,Perfect product!,one best laptop price rangebut best one update pls add ssd
280,review-62712068-b98a-4292-a8c2-4a2dc5c87e46,Deepak Kumar,1,Horrible,worst battery life
281,review-5eb7109f-c1bf-4e83-9726-9837b40b031b,Sathish Kumar,5,Simply awesome,good laptop features medium rate
282,review-e6235d01-2933-4bba-9d2c-b477f24aa1c9,Mv. Babu,5,Perfect product!,super laptop price everything super
283,review-ba492bf1-d07d-4a3d-863b-34bc68556bc3,Samer Azzouz,5,Wonderful,amazing laptop
284,review-4ac27c44-ab51-4f4f-98a9-9d3b8b48c3e0,Colin Shahin,5,Brilliant,superb gaming laptop price
285,review-d6586d76-9817-4434-a964-8754814e4964,Arun Chandran,5,Awesome,everthing fantastic except battery backup flipkart delivery good received product 2 days prior actual delivery date
286,review-6753241b-7200-4d94-880b-4cc8cca2130d,Tushar Dangwal,5,Classy product,battery backup little lowno issues laptop
287,review-3833ce16-3bc3-48dc-89fa-be5d8afeba9e,Vijo varghese,5,Great product!!,looking laptop programming gaming video editing usual work related tasks really opt sturdy well equipped upgrades ssd upgrade slot available keyboards bliss power machine downsize dont expect battery performance great ultrabook surface
288,review-b2b00a1b-ad8e-4813-82ee-3bc84605bc04,Jayesh Mothla,5,Awesome,complete package price range overwhelmed speakers keyboard specially
289,review-59671340-fc2c-4b88-b3b5-72b5242cd77e,Akshay Ravikumar,5,Must buy!,best gaming laptop range
290,review-03b5a3cc-1614-4129-878d-106a0dba6056,Yash Rajmane,5,Just wow!,best gaming laptoppros design goodthe respons goodkeyboard good gamingtouch pad goodconsbattery back goodwhy u buy price u get good productsimething diff laptop glowing msi logo
291,review-5bb5ecf9-7df7-4141-adf7-b5dbae181bef,Prabhat Kumar,5,BEST BUDGET GAMING NOTEBOOK,laptop excellent mainly cooler booster badass take 20 sec reach 60 40 celsiussound much loud give feeling home theaterbody made low quality plastic betteroverall laptop awesome
292,review-9c5660bb-3ca3-415d-a129-fcc6eaa9bba9,Rishabh Sharma,5,Classy product,impressive proformanc good product paint pealing keyboard else good
293,review-a972f4d1-3224-4f5e-b5e7-e8186993ea44,Shiva Shankar,4,Nice product,great product battery life poorperformance greatbattery builtremember graphics enabled u plug charger
294,review-1aa9cc70-501f-45ae-bda4-0a593dc4a1d0,Rajmohan,5,Mind-blowing purchase,one best laptop cheap price amazing laight weight strong body makes lap amazing durability amazingthe draw back battery battery us soo weak stands fr 2 hours full charge otherwise really amazing well packed
295,review-bede6cc2-5ecc-4aad-a28d-ef5d55960dc4,Vincent,5,Super!,good speaker good performance worth
296,review-60328697-19d8-4680-8df7-4826c44c7846,MAKKHAN LAL RAIGER,5,Wonderful,running witcher 3 ultra games likes gta v fallout 4bf 1 ultrano lag slvery smoothgood hours gaming
297,review-ee22b427-363a-4beb-9481-b0cf58c44e07,Dhanush,5,Super!,charging faster discharging really overall great laptop still didnt like material used plastic fingerprint easily captured touchpad panel laptop performance great
298,review-de4e0944-247c-466e-b575-2d08d86c57a2,Flipkart Customer,5,Brilliant,good
299,review-f178520b-7457-4063-879d-1a981b7bf2f9,Sai Kishore,5,Mind-blowing purchase,beast gaming laptopin price rangemsi superb brand
300,review-df72ff19-46a1-4fc4-891d-a12a2c08be16,Sajahan Sk,1,Hated it!,worst experience everlaptop super slowafter 4 months display got dead pixel spotsnot buying msi products ever
301,review-f7aa94f5-ce03-46ad-a5dc-9fd66d6c5a5b,migam chayengia,5,Highly recommended,good performance
302,review-540cb9a2-ebb2-4fe0-84a4-a3420b2cd6e1,Himanshu kumar,5,Classy product,using laptop since august work superbly played gta 5 without stuck problem
303,review-d727e324-2fdc-4704-a8fa-8b5f41052e99,Sourav Sagar,5,Great product,nice laptop
304,review-135143fc-509c-46ad-8c41-8a154d06e3cb,Praneeth Kumar,5,Mind-blowing purchase,loved
305,review-80e1c5e3-12ff-4b94-9564-8c19de9fc0dd,Ravi Shriwastava,5,Terrific,fantastic
306,review-040b55d7-406b-4b68-99fb-d045d31ac6af,Jagdish Vaswani,5,Super!,awesome laptop bought 55k
307,review-705f2b7a-3577-49b5-ab90-fe94eabbaf78,Adhiraj Gupta,4,Delightful,good laptop gaming
308,review-f747fbe3-ae58-4ce9-98d3-c287682407df,vedant kolarkar,4,Pretty good,must buy
309,review-53613e26-b5a2-4b2e-aee4-cdb0e74d7c1b,Jaibir Singh,3,Fair,using 1 year faced lot performance issues slow laptop dont buy
310,review-3713d7e1-3c44-4204-ad67-751d0b99be83,Khushal Rawat,4,Pretty good,packaging nice things comes safeproduct nice need ssd upgrade
311,review-101174e0-ad04-470a-8232-b0bfb4d504a3,Flipkart Customer,5,Brilliant,good product
312,review-a30bfdff-cc79-42e6-a7c4-5054cc7cb00a,Neerav Kubavat,5,Best in the market!,windows takes 2 minutes startformat default os hope works fast
313,review-40f9cb7b-e912-4919-b27b-46a375aef6ef,Yadwinder Singh Jatana,4,Value-for-money,bang buck
314,review-ee16c7ff-011e-4b52-a6ad-7bb20e490d56,Abhinav Goyal,4,Value-for-money,nice
315,review-37590fd5-87d5-4dd1-9962-34a12f1155b1,Piyush Jain,4,Value-for-money,battery life good gaming good
316,review-00b20c7f-befc-4be1-8551-41f1dc5dd6f2,Uraj Patil,4,Very Good,awesome product thanks filpkart
317,review-723a895c-3d04-46e5-8c6d-57d45762d85d,vikram singh,5,Mind-blowing purchase,awesome
318,review-f6d2d000-9cce-48d8-8d0a-2ddf1165e7ae,Flipkart Customer,5,Simply awesome,amazing buy regret buying sale could saved tonalthough great buy rounder yet review month oldnow crucial part important came norton antivirus activated 60 days ever file containing tiney bits virus auto deleted normally would go disable anti virus option greyed poor thing get rid application hahabut machine iread
319,review-85a0d769-1953-4859-ad9c-0da66d9a6463,Flipkart Customer,4,Wonderful,nice displaycool design battery performance upto markit audio boost
320,review-cb199a37-3567-458e-bb06-376366c69865,Hari Haran,3,Does the job,worthy price
321,review-d00358a0-8000-409b-9993-fbd3777dbdf5,Prikshit Rana,5,Best in the market!,amazing laptop gr8 specs everything amazing got 1 day expected date flipkart rocks
322,review-6af24507-e9a7-4ec4-a3a7-43d418b1dad3,Sandeep Kumar Pawar,5,Wonderful,best gaming poor battery
323,review-94b80ba1-e15e-4e36-bad9-3b7b46b3e41f,Suresh Suravarpu,5,Terrific,amazing nice one
324,review-a0b1b6e6-ddb4-400a-b834-ebe276a80595,Rahul Kalambe,5,Highly recommended,good
325,review-aea2ee75-3c56-4a2a-8269-949ee07778a2,Amit Singh,5,Simply awesome,mind blowing
326,review-ae7fed8e-72a6-4969-9823-bc94bddd5698,Amarjeet Singh,1,Useless product,selling old models notebook lagging much
327,review-09469b44-484d-400b-8b51-2b0e03cf76a1,sumith shetty,5,Mind-blowing purchase,got 56000rsworth every penny spendproamazing designoperating speed gaming performance greatbattery life around 35 hoursamazing keyboardamazing graphics cooling systemconms office doesnt come pre activatedweb cam greatfinger smudge magnetictrack sensitive bit offnot extremely noticeable thou
328,review-e95caaba-bda9-4986-b794-6d13481c1271,Ashok Dubey,5,Worth every penny,classy product ultimate sound guality
329,review-56073009-f7ac-4ce0-937b-cb25a9a2d115,Flipkart Customer,5,Best in the market!,good product happy battery compromised brand gaming laptop battery worst
330,review-6cc89a14-9a3f-4441-acc5-58e0befead73,Ajinkya Rajhans,5,Brilliant,laptop screen good though good ips display bad tn display colors lools vivid
331,review-08848e81-93b1-4fc6-ae98-a18a2b5a7e22,Naresh Narula,5,Classy product,awesome
332,review-63983949-290e-4a48-82f8-25245c93a2c8,Vivek Singh Chauhan,5,Just wow!,beast performance well packed delivery kind noise fan dont know normal mistake
333,review-2fb53ec8-7db9-4edf-aa1d-ed8793c59bdf,Mohan Singh,4,Wonderful,worth price
334,review-0c3ec39a-6375-45a9-b6d0-695065476cdf,Nikhil Pawar,5,Excellent,plastic retaining fingerprints thats problembest laptop price range
335,review-8bf4d298-f512-4841-9aa1-dc09b2aabd59,Tripper Rajeev,5,Worth every penny,good laptop awesome performance
336,review-afbb2337-dd64-47e5-9f20-347ab0b6b30e,Abhijeet Kumar,5,Excellent,great look build quality isnt quite good screens back panel
337,review-84bafa15-9e7f-4c33-8726-1c98f77085df,purushothama nayak,5,Mind-blowing purchase,prompt replacement service product good performance best safe packaging overall service functioning product super thank people flipkart e kart helped get brand new one replacement feel proud customer thank
338,review-86a98ea1-250a-4005-a8ec-692e65fa8f1b,kalyan chinnu,3,Decent product,bad working
339,review-0f5e7c5b-3a57-422d-a344-7c93cfcfe2f6,venky annabathina,5,Terrific,nice lap good delivery flipkart thank u flipkart
340,review-e9a15a6f-c031-48bb-bcd8-2ec4a7f89fad,dhiraj Choudhary,5,Excellent,good laptop gaming
341,review-8cf166e0-ae17-4291-bcea-fa7371f6842d,Rishabh Hardaha,5,Excellent,missing 140hz display
342,review-0b9c38f8-5627-456a-9dd6-b072b24f7f59,Bholendra Singh,4,Nice product,good
343,review-e08cc9f2-5ff5-4452-85e2-29e9e23bcc29,Arpan Trivedi,5,Fabulous!,good product
344,review-3a7e13e3-4626-406c-9681-060f73d1c5d0,Anshul Verma,5,Wonderful,writing almost 2 monthswithout doubt awesomeness delivered flipkart msithank
345,review-588a45a4-6a99-44a1-af81-1b9f76637d1a,Shubham Chhipa,4,Wonderful,nice products
346,review-49071def-7d33-41e3-aaf5-3633c0c28964,Dilip Yadav,5,Super!,impressive
347,review-d14d6213-5b69-4c45-8203-35439a3d7ee0,Rishabh Shandil,4,Good quality product,battery life sucks rest awesome
348,review-7d1adb19-626a-4420-a7d7-65a76cf6d3f6,Prince Prakash,5,Brilliant,best among beasts
