,customer_id,user_name,ratings,review_head,review_body
349,review-757ad428-1661-42d7-9009-1edc1578930f,Parshav Mittal,5,Wonderful,amazing laptop played pubg mobile got max fps 60 best 60 k git 55 k big shopping daysthanksflipkart packing worst btw laptop safe
350,review-ba9e6f78-0308-4967-b5a2-79d30a019c4d,Flipkart Customer,4,Very Good,want laptop best
351,review-05e80351-9ec9-48c0-9614-401317705e0c,MANISH KUMAR,5,Just wow!,best laptop got 54k awesome sound nahimic3 sound board best configuration amount
352,review-8a5ce327-13a4-4e64-a0cf-cd11e7711821,Piush Kumar,5,Classy product,awesome cheap best
353,review-483ad087-bdae-4d13-91e3-c95647923825,Vijay Patil,5,Perfect product!,powerful compared pricenice build quality
354,review-8b52133d-82b5-4093-a19a-e53b7559b4f1,Snehashis Mohapatra,3,Nice,battery good
355,review-e78b024a-b602-42b2-9e22-92b2cbcdb9fc,Naveen Patidar,5,Awesome,good work
356,review-a85e1e56-4912-4a6e-9cd3-79776a5aec52,karan bedi,5,Mind-blowing purchase,great gamming laptop budget
357,review-17f4f0a1-6bce-41f6-87c3-14dea6b32a49,John Mili,2,Not good,good avg games normal work good keyboard issues etc etcupdating 10 months hinge cheap plastic hold long
358,review-4f0981f4-bc7f-46e9-9642-a875a97915e0,A.K Afsal,4,Good quality product,value money
359,review-493e765b-3800-443d-94b2-2f27f2c483cd,Navneet Tiwari,5,Mind-blowing purchase,enter deep learningonly laptop affordable
360,review-9823c755-8678-4ae0-9205-90b6ec88bd5b,Ayush Gupta,5,Brilliant,nice laptop nice price
361,review-1643ca53-e2bc-4f92-a539-5182bdeb4af4,Sagar Gupta,5,Terrific,amazing laptop logo scratched check properly added data soo cannot replace
362,review-a4d3c29e-cce0-45ed-9521-3e7753abc992,Gumtho Hage,5,Classy product,gave 5 star price range cant get better
363,review-098dc94b-ff46-474f-9851-ddc798e6ed7e,Vinay Rao,5,Fabulous!,great productbattery backup much good graphics features fantastic
364,review-7516603e-4259-49a4-b2b9-9d82d20880d8,Aniket Singh,4,Good quality product,battery poor quality otherwise product good
365,review-3ebb5882-1a53-4de0-9c3b-582fda4d7996,Sanjeev Kumar,5,Perfect product!,awesome laptop
366,review-36f5d88c-2130-43da-b2e5-4610f3e77792,Flipkart Customer,5,Very Good,product awesome price
367,review-3c5dafe5-6932-404e-bcd6-dec4263ea576,Veerraju Chowdary Vanka,5,Worth every penny,best deal 54k thanks flipkart
368,review-99bd58c8-a667-410e-a000-a073f044ed1b,Shaikh Danish Ahmed,5,Terrific purchase,awesome experience laptop
369,review-31c74802-d951-47ce-a5f0-298e9f619887,Subhash Kamath,4,Very Good,product excellent display tn panel hdd great expected suggested install ssd
370,review-48707cb0-d483-4424-9fa4-e0448c16e848,Ajay chaudhary,5,Just wow!,beast price lit
371,review-af64779b-9c0e-4344-b00a-71e49510748c,ADITYA RAJ SINGH,5,Mind-blowing purchase,thinking purchasing laptop budget definitely go feel excellent technology hand fast speed attractive design fast charging ips display beautiful build quality excellent sound quality really extraordinary sexy keyboard enhance gaming experience lot something best money buy go enjoy great experience
372,review-ef476f34-bb5d-420b-accb-28f39ffcacc7,Flipkart Customer,5,Brilliant,superb lappy
373,review-a1649645-4f27-4bd3-8eeb-fdd07666e0e3,Flipkart Customer,5,Wonderful,prefect
374,review-1bf9ef86-5765-4a34-93e0-535b06202c47,Arghya chakraborty,5,Highly recommended,extremely satisfied gaming performance thermal managementsound display battery backup short understandable gaming laptop
375,review-55ff3ff2-bf65-4cc9-9979-930eec610208,Flipkart Customer,5,Just wow!,awsome product worth price one word msi thats enough whole review awsome speakers sound output far par machine optimization proccessing best class gaming buy see urself personal favorite part backlit logo 3
376,review-b17fb5d2-9d1a-431d-8e83-d831f8a2ba6e,vignesh ramanathan,4,Worth the money,bought last sale request install fresh copy windows experience full performance laptop pre installed slow hv lot bugs keyboard speakers whole different level crystal clear display extreme graphic pubg emulator comes without lag ssd bought later good satisfied best deal came around 52k sale days good luck happy gaming
377,review-4b373c69-ef0b-4829-946b-7d9e14e4cab9,Kushal Gaur,5,Awesome,faulty battery zero support
378,review-13c4ebf3-0bdc-4dc6-849c-445718f7e668,Manish Gupta,4,Very Good,ausum product
379,review-bb3cdbb1-f1d7-4183-a128-1502f7c5f63d,Debaditya Chatterjee,4,Great gaming laptop for the price,solid build quality hardware delivers performance benchmarks games renders expected multiple issues regarding compatibility nvidia drivers basic apps like chrome os general especially boot time noticeably slower expected hardware possibly hardware compatibility issue ill able fix soongreat selection ports including 3x usb 31b 1x usb 31c upto 2 external displays mdp hdmi dedicated auxinout empty baread
380,review-30ca425c-efbd-48c8-b99a-bccba1bf1eb7,Logu Logu,4,Value-for-money,quick delivery nice
381,review-e697e120-864a-4b97-93b2-0ab77b0c6fc9,Soumyadeep Dey,4,Delightful,gaming experience excellentbut multitasking little bit slow good gaming laptop price
382,review-37bb94a9-b8d0-43a8-84a1-c8328de189f2,Simanta Baruah,5,Terrific,everything awesome speaker position worst ever seen till today msi machine bought otherwise speaker position would never buy
383,review-57bc4bb6-88ad-4d84-8f31-82087bfee401,Flipkart Customer,4,Nice product,probably best gaming notebook low price range thing battery performance use battery saver im using web development playing fifa find satisfactory
384,review-10546f8e-3fb7-4738-9a6d-f7160c7286e5,Tushar Upadhyaya,5,Mind-blowing purchase,laptop amazing flaw trackpad accurate uses synaptic drivers windows precision
385,review-15a148a7-9607-4752-960d-9da9f30f41e2,Akshay Garg,5,Highly recommended,amazing laptop always user msi problem i5 processor good multitasking given time resumes speed
386,review-0eedb6cd-6fb3-4ed5-83d3-42c5dfcc1d23,sanjay kulkarni,4,Very Good,product gud nice built quality doubt value money upgrade ssd must
387,review-3b0f1c9e-8306-412f-add2-0fdf853f774c,Dinesh Nayak,5,Awesome,best thermals go best gaming laptop fot 56k got offereven beautiful glowing logo
388,review-789a981d-e3b3-4731-a02f-27e06d67bf78,Jithin P,5,Perfect product!,good best performance
389,review-cc3c92dd-1f0a-4502-a99a-222d5d233b12,Kanishk Premi,5,Brilliant,nice laptop love nahimic
390,review-1ea6d3b7-4215-484e-97cf-25e6235cb6aa,Avinash Kumar,5,Mind-blowing purchase,awsome laptop worth buying 57k
391,review-0f5031af-7969-450e-982a-449ebbc913b3,Gajjar pavan,5,Classy product,laptop looking sexy n really superb love laptop
392,review-1836fa6e-fb7d-4ba2-be30-7648669a25da,Ishan Kaushal,5,Mind-blowing purchase,quite good product
393,review-0269a880-ec21-4a68-aac3-78facafac62f,Flipkart Customer,5,Terrific purchase,got 51k good value money great product
394,review-107e015c-9235-4b08-bd1b-2c0f0bdf053d,Navneet Goyal,4,Value-for-money,got 50k worth money
395,review-bc56f22b-d2ff-4d54-8a7c-af1d9ba84fb7,Rohan Mondal,4,Nice product,okay
396,review-366b9e80-9273-48b0-b5e2-2996e92e5b9f,Akshat Khandelwal,4,Nice product,got 50k best price range gta v smooth gameplay
397,review-07856118-5af0-4dc5-bb37-19daffda6fb0,Ankit Dey,4,Worth the money,laptop beast problem everyday proxy server gets activated shows interneti manually go internet optionsconnectionsproxy switch offwhen doesnt work uninstall lan driver install fresh
398,review-e845a232-ef03-4677-8619-2d3296fa114c,Flipkart Customer,4,Good quality product,try install ssd install rather easily maintaining hard disk laptop vacant slot ssd nvme performance exceptional price rangethe ssd additional 29k list price device really good deal ask
399,review-053b2ebc-e353-4571-97cb-669701d1826b,Rajaram Dalvi,4,Good choice,bright display performance pc msi gl63 8rc i5 8th gen gave great stunning performance gta 5 worked well high settings 60 fps gives big load gpugpuuseage 9899 average overall awesome gaming notebook
400,review-6bbcac09-726e-4ff9-8ed0-e036b38961a9,Avilash Jain,5,Super!,awesome boot time 4 secs add ssd
401,review-3e5d2290-6ece-4036-a7b7-e44e61adee72,Nihar Goyal,1,Hated it!,worst laptop really bad performance new gaming laptop
402,review-7ec4b4cf-1100-4bf6-8679-d663a3df1de3,sarath nair,5,Super!,great displaycool looksuperb perfomancethe problem encountered windows version installed bit slowover beast
403,review-e8c1e1c3-8f7b-4ab8-8aec-25d21c9e4eac,Sri Ragavendra S,4,Good choice,brought 60kafter 10 days usagepros 1games run smooth2 cooler boost 5 master3 speakers best4 keyboard perfect doesnt lhs window key 5 design perfect heavy carry6 touchpad perfect smoothcons1 stock os slow upgrade using media creation tool microsoft2 mechanical hdd slow3 battery backup dis gaming lap doesnt matter4 process run slow5 adobe effect somread
404,review-77115de1-277f-4fe7-b81d-eb8510b372ef,Divyam Singh,4,Delightful,nice laptop pathetic delivery flipkart usualbattery backup low good gamers affordable price
405,review-a48476bc-7af5-4bfe-b136-45f5e3ebac91,Khampa Narzary,5,Excellent,mast laga laptop ekdum zhakaas lightweight stylish premium looks design 4k video support battery lasts 45 hours thumps product go guys
406,review-39078c88-f47c-443f-89d3-addaa621a481,kunal mehta,5,Fabulous!,nice laptopbut cannot insert cddvdeverything else good
407,review-3dd9c543-9e55-4c7b-bd47-9e6e919c33a0,Flipkart Customer,5,Brilliant,believe guys u want smooth gaming go itit much capable u think
408,review-e33f8d11-51be-4542-951c-1878514a2c0f,Vinoth Kumar,5,Worth every penny,battery life poorotherwise good laptopgo
409,review-b612f70e-cacc-4285-a3c3-d1b11a07c8ee,HARSHAL BURDE,1,Waste of money!,nice laptop got 59990 dont look better option best go
410,review-3dc76c33-96bf-4781-9f74-87349ab54468,Binay Kumar Baitha,4,Really Nice,except build quality everythings good
411,review-002047dd-d9e3-4104-a0f5-978ac476cdd2,Flipkart Customer,5,Super!,awesome laptop price segment
412,review-dbdbd882-1e3d-4262-a987-4bb34a3e1a81,Abhishek Banginwar,5,Wonderful,laptop really goodand speakers really awesome
413,review-90e7014f-3a7a-42d9-b048-2d17b7c9143b,Vedprakash Singh,4,Good quality product,pros cost effective great build quality eyecatching design good transparent sales service future ready powerful machinecons stock mechanical hdd serious performance bottleneck consider upgrading ssd either sata lll m2 nvme go later gl63 8rd model comes additional ssd
414,review-4a2ac534-59cf-4fb0-8b45-9ae2a5c5bb74,Rohit Deoghare,5,Terrific,best laptop price awesome performance
415,review-75ed17ab-cbdb-4a5d-952a-d9bbd726cb6c,Idul Ahmed,5,Great product,wow single word
416,review-5f80817d-f68f-4961-81f7-97d9ef28b6a8,Flipkart Customer,5,Terrific purchase,everything ulta
417,review-ddd1ba01-f84a-41c8-8b21-8582378024e7,Tushar Rawat,5,Awesome,best price rangestop reading go
418,review-25d58dfb-2c4a-4fd4-85f3-5b6a981ff7f7,Rohan Das,3,Decent product,awsm laptop built quality good getting 60 fps games
419,review-8c1f6e8a-52a2-48d4-9cbb-7ea1dbcf4bee,Vaibhav Jain,3,Fair,hangs quite often
420,review-8ee8979a-59df-4574-92ff-721ac05bcc0f,AnandKumar,5,Must buy!,bought felt laggy solved updating driverspros good designgood performancebest specs pricecons big fingerprint magnet solved 1 minute clean every 1 week thoughshort batterylife exceptional coz gaming laptop
421,review-e5acebf2-39a5-43a0-91be-0ac0f20e3975,NITIN SHARMA,5,Must buy!,one best gaming laptopthe best performance nice backlight keyboard get 200 fps easily cs go fps r6 siege 150easyits body also nice light weight 2 fans never gets heated dragon center one best thing laptopthe gaming works nicely optimised laptop supports every hardware software keyboard steelseries says lot price range tread
422,review-3f059279-a34d-4146-a640-7c3e8211d8f9,Akshay Barhate,5,Wonderful,nice product get time
423,review-734353ea-8928-4221-88dd-bc48b4afb1bd,Flipkart Customer,4,Really Nice,booting little bit slower sysytem performance outstanding graphics used excellent cooling technology also perfect perfect gaming laptop
424,review-9feee288-81a4-4aea-aaee-5e9b0469b565,P Srihari,1,Not recommended at all,games like watchdogs 2 hangsnot expectation
425,review-87e989c5-bc7a-4198-8353-1e3897af117b,Anish Singh,5,Best in the market!,best gaming laptop flipkart packaging excellent
