,customer_id,customer_name,review_head,review_body,review_date,ratings
520,customer_review-R1W8SM624M9Z5I,Arun Sharma,Below Average product,many issues windows 10disk usage 100 slows system severely google ways fix screen go blank 10 mins key password used google solutiontime date updatedbought yesterday spent two full days fixing issues,2018-10-11,1.0
521,customer_review-R8LC5NT6EM3IX,Dinesh,Office only for 1month u provided.its not good,office 1month subscriptionits goodplease provide product key office,2018-10-13,3.0
522,customer_review-R3KSRWUMYIBSHY,Pranab,Good product for office works,light weight high performing laptop affordable price got laptop pricr 26990 great indian festival gaming laptop ideal browsing office works,2018-11-06,5.0
523,customer_review-RJ8JQQFOCI43E,Dheeraj Pandey,Everything is superb only performance is slow,sound quality good light weight easy carry hd displayyou love watching movies battery back good thing done get 4gb ram i3 processor wid genuine windows 10 laptop slow booting time slow researched found problem dealer amazon side think something hp company added extra say unnecessary software preloaded wid laptop anyone knows keep uninstall pls comment helpful others otherwise laptop good,2018-10-22,4.0
524,customer_review-R2WTBWQ9T7WBS1,Ankit Rathee,One of the best laptop in this price,30000 ki price one best laptop,2018-09-28,5.0
525,customer_review-R334CS2QCCCR3T,Amazon Customer,Slow...very slow in working,ok ok productworking slow mark,2018-10-18,2.0
526,customer_review-R32HGU7679DUVX,navdeep,5 star,got product 22k diwali offer price nothing beat machine recommend,2018-10-14,5.0
527,customer_review-R1LDE73X3E35B9,ashok,light laptop with easy office and internet handling,laptop light windows 10 smooth overall best laptop 30 k range better would provide office also play 1080 4k video go,2018-10-15,5.0
528,customer_review-R3200LO6VTELGM,Boduve Yhobu,Average product,product light weight size shape met expectations performance seems low slow,2018-10-18,3.0
529,customer_review-R1D557LTIMTDIQ,Syyed Fahim,Sound,useless product sound quality bad speakers damage cd driver point view good,2018-10-18,3.0
530,customer_review-R1VCN7MEZDGVEB,somegowda,Best laptop under 30k,got laptop 24000rs big billion day sale awesome laptop price range go,2018-10-11,5.0
531,customer_review-R3RYGKTOUWV1VG,pallab das,works fine,quality goodi love product,2018-10-08,5.0
532,customer_review-RE2MMBWTLH0W,Gr8gizmoguru,Its NOT a Slow machine,wrote review inform guys complained slow laggy freezing hanging etc simply add 48 gb ram windows 10 needs 4 gb run smoothly say 4gb enough windows 10 talking crap knows nothing extra ram slot added 8gb ram machine 12 gb ram 4 8 blazing fast sick donkey converted arabian stallion,2019-11-04,5.0
533,customer_review-RBSQ6JFSFZOOY,divya,Work@snail place,professional one worst laptop ever worked bought amazon reading reviews takes 23 minutes time chrome internet explorer even open doesnot microsoft office neither support multiple window work dont know sold also dell laptop bought 6 years ago work far faster new one bought planning buy new one complete waste overall experience pathetic scoring needs done negative,,1.0
534,customer_review-R2RRODDIT4WEUS,Amazon Customer,"Get rid of the hdd, You will have an awesome laptop.",laptop great choice portable general purpose usage get rid seagate hdd comes fresh install win 10 ssd seagate hdd coming laptop base model 5400 rpm 1tb model suitable running os display great even though ips panel wd green kingston 240 gb ssd enough make laptop look fast throw away extra pennies definitely samsung 860 evo way go,2019-10-15,4.0
535,customer_review-R12N0THXIP5D2D,Chirag,Pathetic Laptop. Slow as hell. HP Sells these fake Laptops in India via Amazon,bought laptop diwali sale replaced laptop adviced amazon money back buying another model possible trick get stuck onto fake machines second machine arrived slow hell tried everything upgrading windows updates microsoft installing fresh anti virus nothing works desktop 2000s faster machines last month frustration bought new laptop retail store lenovo never buy hp ever electronics amazonthe slow issue resolved dont b uy fake refurbished imported laptops hp amazon chiragsaxenaf1gmailcom 9871792443,2019-07-10,1.0
536,customer_review-R1YNHD3QSN9SAU,Sathish Kumar,Light weight.. value for money,expected hp quality light weight due preinstalled os performance slow uninstall bloated software useful install os top feel actual speed system,2018-11-03,5.0
537,customer_review-R588L1ZIADNXH,Arunkumar,White patch on screen,product screen defective small permanent white patch screen please note curser kindly requesting amazon replacement,2018-10-09,1.0
538,customer_review-R2523ORSJ42LEW,Parveen,Disasterous.,giving one star also appropriatejust believe nothing ideal way waste ur money purchasing plus amazon lots ideas fool customers dont stick words happiness guaranteed got replacement laptop new laptop model still working well issues faced 1st buylags performanceso much hanging issues issues facing first day use,2019-03-03,1.0
539,customer_review-R37IY4K24QY9BC,Music.in,Don't buy . Not long lasting will work only for 2 years,used less 3 years motherboard working replacement motherboard cost 13000 3 months warranty dont buy hp products suck,2019-08-06,1.0
540,customer_review-R1FVKL0TFXAT70,B L Meena,Product quality & it's durability,outdated configurations ms office unactivated hampered operation request buy costly products online,,2.0
541,customer_review-R1NHDXY9NKP9MS,Dipti,Best in this budget,nice laptop range pre installed softwares design sleek really amazing,2019-03-26,5.0
542,customer_review-R3OXWYT6HNRZRH,Chirag Soni,Absolutely Better Service,bought happy quality processor service provided seller must say buy laptops seller,2019-06-22,5.0
543,customer_review-RIZ92JKUTS69P,Tarun,Worst Laptop don't buy it.,lappy really awesome u buy around 25k bought 23990 wanna give 3 star coz seller mislead us didnt shows actual images laptop numeric keys disappeared laptop give 5 star coz lappy good,2018-10-11,1.0
544,customer_review-RXVYT45KBZ8QI,yogesh,Isee sasta aur Achha kaha,best laptop hp awesome body sound quality 3d great laptop please buy buy bag awesome buy,2018-12-13,5.0
545,customer_review-R11FOTVETUBV41,PRAMOD KUMAR,No word invitation most important vehicle right your real timee time most important,money thinking technology important self word say company company right people problems product,2019-03-29,1.0
546,customer_review-RQZT7AY0ZP015,Ramesh Khatri,Worth Its Price,value money got 25k diwali sale good basic needs laptop,2018-10-25,5.0
547,customer_review-R3G3CLSOT42U1R,Amazon Customer,Good,good product battery good price quite nice go heavy either,2018-12-04,4.0
548,customer_review-RB2DZNEKU7H8D,Sunil,Very slow working,dead slow productlight weighted simple handle processor working given except processor everything good,2018-11-05,3.0
549,customer_review-R2WXB4BZSIG7LD,Amazon Customer,HP laptop,charging battery coming max 3 hours warranty card provided,,3.0
550,customer_review-R19H5WPMOBE0Z8,PRAVEEN KUMAR,Good,awesome battery life good,2019-11-02,4.0
551,customer_review-R1BE4WAUBOE3IQ,sangeeta,good product,hp 14 core i3 7th gen 14inch thin light laptop good product loved amazing,2019-01-21,4.0
552,customer_review-R30PAKWEBCVUIS,Surjeet Singh,HP user guide,like light weight operating systems hp user guide,2018-10-17,5.0
553,customer_review-R3JN18U6H8925V,shubham mishra,Awesome but battery not good.,battery life average,2019-06-22,4.0
554,customer_review-R3HDYGL48UQRGH,saqeb khan,very bad,wrost products,,1.0
555,customer_review-R2FC8LH0HD0KFG,gyan,Fine good choice,good,2019-09-01,5.0
556,customer_review-R3GXBS3YAPNLU4,v uday,GOOd,nice,2019-07-22,5.0
557,customer_review-R178L07UL6QJSV,Amazon Customer,Ok,bad,,3.0
558,customer_review-R2XOXUCTJCR479,Dhiraj Kumar,Awesome,awesome,2018-10-19,5.0
559,customer_review-R3NCPQLD9ZB5DP,mal chand bhargava,OK,ok,2019-12-10,5.0
560,customer_review-R2EYF1X28C3D1V,Aman kadiyan,Perfect for basic home use and office work,honest review using 3 months digital marketer profession need machine easily handle heavy excel file data work found laptop good still level accessing file mails ppt etc concerned best laptop price range also issue mouse pad mouse coming model basic touchpad multi touch pad rest everything good thanks reading hope helps also get 10 cashback ordering vqr in13,2019-07-31,5.0
561,customer_review-R1OFT69EQAAY2I,kiran,PC has to be repared,everything fine couple months noticed device needs repared error code 0xc0000e9 disappointed product,2019-12-21,3.0
562,customer_review-R3BHXO45MURFEI,Aditya A Gupta,Worst product and service,please buy laptop purchased february september spots screen hp even replacing product warranty,,1.0
563,customer_review-R45WAM6D16BP5,Sameer Singh,Amazing laptop,laptop amazing light weight easy use,2019-11-06,5.0
564,customer_review-R14Z5LARRZSZFI,varaprasad,Good,good,2019-12-24,4.0
565,customer_review-RNH9I12C2E8L7,Abhishek anand,Not a good product to buy,slow functioning light weight,2019-12-23,2.0
566,customer_review-R2WWQOX1XBPR2,rajeev dewan,Slow,slow tortoise win race pathetic piece hp seen used hp 11 years frustrated know,,1.0
567,customer_review-R1I7MKIW1AMWF8,kumar vivek k,I purchased at very good price,nice product,2019-08-16,5.0
568,customer_review-R3EUZKC896M4IB,RAVINDER KUMAR,HP laptop,overall disappointment,2018-11-18,1.0
569,customer_review-RXAR5LJS2K9M2,HEMANT KUMAR JHA,Very slow system,much slow,2019-07-17,1.0
570,customer_review-R37CS84A6RLQ86,Ramesh Chandra,Good,good,2019-12-26,5.0
