,customer_id,customer_name,review_head,review_body,review_date,ratings
80,customer_review-R39IWDTEXXU4P1,Yogesh,Go fot it! Simply awesome,speaker placed top sound quality simply awesome matte finish makes laptop look first class lag heating problem battery stands upto 45 hrs handy 14 inch screen look compact best lap market 25k,2018-11-02,4.0
81,customer_review-R1ZRYUJ0IYIRX5,Viv,Best laptop,best laptop price got one wife happy bought another one though price changed nowm still happy deal,2019-03-01,5.0
82,customer_review-RHIKH28ZHZ1DH,Dilip K.,For for general office work.,looks good light weight also good general office work suggested running multimedia application become low,2019-08-04,4.0
83,customer_review-R1TQHAOFUG4NKB,Subha Ranjan Saha,Good Product,screen size slight small performance wise worth money,2019-04-17,5.0
84,customer_review-R146HEB7IA68L8,Rajeev Mittal,Hangs and/or does not start within 2-3 months of normal usage,dont buy product worth spend buy sturdy product major software issues,2019-07-14,1.0
85,customer_review-R16A3I50DDZX5B,omveer singh,Slow processor remaning all things is best .,sound quality standards battery life good minimum full charge light waight easy use issue slow processor starting windows time much,2019-02-25,3.0
86,customer_review-R2FGZ675OP78IC,Manjeet Singh,Worst product please do not buy,poor product worst ever seen slow share wastage money even sales service poor really genuine review,,1.0
87,customer_review-R2E3HA5Q7IHYDQ,Amazon Customer,Good Laptop,good product nice handle low weight graphic quality goodos updated good overall performance excellent,2019-07-21,5.0
88,customer_review-R1LJ6YRQLO00CS,ajaymihani,Slowest Laptop ever,laptop slow since received laptop feels like pentium version even opening folder takes ages start hangs lot tried every possible way solve hp assist still quite slow could return trust would obliged,,1.0
89,customer_review-R2X1PIEZ54F4YA,divay mangal,14 inch smoke grey hp laptop,delivery time effectivelight weight speed good think14 inch screen enough shows better look,2018-10-25,5.0
90,customer_review-R35C289BFM2SS3,sub,Value for money,value money comfortable,2019-09-20,4.0
91,customer_review-R3SHONZH8QTXXU,Rukmini Iyer,Terrible waste of money,slow machine despite nothing windows 10 ms office installed older laptop 2 gb ram whole lot software way faster conked within year im replace,,1.0
92,customer_review-R1XIKBAX8VYTE6,Arpan K Roy,HP14q cs0006TU,performance good little tune bring acceptable level mcafee also slows performance better avg basic windows defender firewall planning upgrade ram add ssd,,3.0
93,customer_review-R371FGAFREFHBU,Amazon Customer,Decent quality vfm,thing light weight laptop overall plasticky build needs extra care monitor hinges ugly oversized charger makes entire package heavy,2018-11-12,4.0
94,customer_review-R1VIXALW7SQ9UI,Kartik Kumar,An ideal Laptop for all types of use.,ideal laptop looking types uses battery life excellent screen quality also good smooth keyboard preinstalled windows charging takes little time,2019-08-07,5.0
95,customer_review-R3GA6T0A6P6ZAW,Chandrabhan yadav,Not recommend at all,key pad working 1month use windows software problem writing review using 10months might used one sure genuine,,3.0
96,customer_review-RYR1HBZJ6GGGC,Rohit Verma,Pathetic and Slow,laptop takes forever start applications hang without working purchase laptop day delivery complaint amazon forced keep laptop since customer service department told nothing done,,1.0
97,customer_review-R1K599UENI3E2J,DEEPAK SINGH,Light weight,really good laptop 29k using lenovo laptops rough tough usable lets see hp works,2019-07-21,4.0
98,customer_review-RWIGNBA2E50JD,Gautam Rishi,Worst product,worst laptop switch laptop fan running stop hang problem log take time speed good totally wastage money laptop u buy laptop recommend please buy product,,1.0
99,customer_review-RJ5BFATX73Y6,Nipun Kumar Navi Mumbai,Dissatisfaction with online Laptop purchase.,product per required standard feeling cheated takes lot time boot shutdown restart takes long time laptop configuration high speed really disappointed online laptop purchase,,1.0
100,customer_review-R3SYA76S227GH3,Amazon Customer,Potable and easy to move with,light weight expectations dimensions performance good students move presentations,2019-11-14,4.0
101,customer_review-R1ZUXKUSINDZFW,Chandrashekar,key board is not working properly,key board working properly laptop slow operating even though i3 processor 7th generation spend rs3000 extra buy internal solid state drive increase speed laptop,,1.0
102,customer_review-R3RORTOI96NM48,Ak,Do not buy !!!,slowest slow tortoise takes 3 seconds go one tab tab google chrome uninstalled unnecessary apps still added kind creaking noise laptop using,,1.0
103,customer_review-R2XFO37349A86S,Saran(HR),Worst product,worst product cheated worked 12 days afterwards got repair frequent money went waste please dont buy get cheated,,1.0
104,customer_review-RFH9SGANL5MRA,Amazon Customer,Excellent,value money,2018-10-11,4.0
105,customer_review-RJQ9DEBK8UXPD,bhatnagar,You wont get another one in Rs. 30899 range,using four month light weighted processing speed good display fantastic absolutely would feel 14 inch laptop go without doubt,2019-07-26,5.0
106,customer_review-R3D8Z83UL6LVQR,Bentick,Good product,worth budget 3538k go laptop like lenovo would provide features higher configurations,2018-11-19,4.0
107,customer_review-R1RAS9G4SIEMHR,Amazon Customer,Fantastic,wonderful product really good cheap brother give mark,2018-11-03,5.0
108,customer_review-R2T5463NX9ZKUK,Kailas Kisan Suryavanshi,System is very slow and Office365 is not pre installed.,system slow also office 365 working whereas product purchased licence version difficult reach customer support request contact discuss,,1.0
109,customer_review-RGKHWWWQ5EAPT,Amjad,Slow processing but nice sleek design,nice light weight laptop designed basic usage ment heavy tasks multitasking design lookwise good used bit lagged slow processing overall nice slow processing laptop basic use,,3.0
110,customer_review-R1EASMG7QYE8YO,RSM,Avoid windows 10 laptop. Very slow operating system for laptops below 40k,avoid windows 10 laptop slow operating system laptops 40k,2019-06-03,5.0
111,customer_review-R17NHP142R7F9Y,Shweta,SLOW,hi using model bought april programming slowing laptop add 256 gb ssd make faster please advise thanks shweta,2019-06-29,2.0
112,customer_review-R1HER8857AEVYB,Abhay Jain,ultimate in this price below 25k,bad display working gave laptop trivadrum hp care center servicing 21092019 still get today 1 month,2019-06-26,1.0
113,customer_review-R1AK73BKF10QFU,Amazon Customer,High battery consumption,product liked light wait smaller size besides working problem experienced low battery life heat generated working makes uncomfortable hold lap,2019-10-14,5.0
114,customer_review-R1AXWDZOH5UVTQ,Rajesh,Very good laptop for businee use,handy dail usage laptop performance decent,2019-05-02,5.0
115,customer_review-RM4HNSEBFGX0L,Kaushik Ghosh,Slow window start,window 10 slow taking abnormal start time office built accepted microsoft original please help,2019-07-29,3.0
116,customer_review-R1694RY3XP8DY1,madan,Highly dissapointed,worst product till date slow hangs opening website complete disappointed hp somewhat amazon keeping product inventory,,1.0
117,customer_review-RYAPUZYYIL2AD,Mathews AM,Wow for 24990,got best deal fantastic machine light users original windows light weight bit slow ok compare pricing,2018-11-18,5.0
118,customer_review-R3J7PC1CBZ4HUR,Basil Levi,Very bad performance,bad performance,,1.0
119,customer_review-R13NPT7LHLGGEK,Rishibha Gupta,Very slow.disappointing purchase,laptop slow operate 10 year old laptop works faster laptop heavy software stored big file laptop disappointed,,1.0
120,customer_review-R13ZXYQ8BPK574,Sachin T C,Product review,good product slow good normal use much load 4gb ram needs better processor,,1.0
121,customer_review-RR3FXYOI40H2Q,Anup Dubey,Value for money,nice purchase nominal price value money home amd official use appropriate battery life easy carry weight laptop,2019-07-22,5.0
122,customer_review-R203VB3TUJBEQ9,A. T. Singh,Beautiful and Lightweight machine.,beautiful light weight laptop everyday users fulfill needs sometime feel sluggish functions working fine,,3.0
123,customer_review-RMRWMTVEBZR6X,digisunil,Low Performance,overall laptop good except speed operating performance hangs many times even one application open many times wait minutes laptop react,2019-11-18,2.0
124,customer_review-R1EQRBBMD37LVG,sugumar,Not working after 11 months,bought october 10 2018 stops working within year dont know solve problem warranty status still active 5days please help someone,2019-10-04,2.0
125,customer_review-R1T7ZDHHTJ2Z01,Rajesh Kateja,Great product,great product wonderful price get see light weight indeed,2019-09-22,5.0
126,customer_review-RF5SUIPYSPQ3V,ankit,Fraud duplicate product.,highly disappointed sometimes doesnt start screen gets blue red seems like duplicate fake product im thinking filling suit seller,2019-05-16,1.0
127,customer_review-R87LBKOCN70D7,Amazon Customer,pathetic,getting message niw windows going expire wth paid wnd mentioned windows 10 lifetime,,1.0
128,customer_review-R2OVKKBQ5F6KLL,Rutu Joshi,Nice and light laptop,nice light laptop build could robust though overall excellent machine light usage,2018-12-22,4.0
129,customer_review-R15EQKFJPFX2Y2,Sumeet Bhowmick,Good quality product,good quality product,2019-09-11,5.0
130,customer_review-R144OG5FWEQWZJ,Tripti Singh,Worth it,steal deal 5k cheaper model priced hp world store rest every thing mentioned configurations,2019-06-15,5.0
131,customer_review-R2EBE5PCBW0ERS,S. K,"Though you have to buy MS office separately, its still value for money",value money best thing light weight yet comfortable screen size,2019-02-05,4.0
132,customer_review-RT3QYW43LB3UE,gnanakumar,Laptop,ok good price,2019-11-18,4.0
133,customer_review-R2IG933U4GOXNV,prakash,good laptop,laptop good use fast takes time boot got hang time even uploaded heavy software till battery life good fast,2018-11-28,4.0
134,customer_review-R1AM1SQMHWFGCL,Pratik,Fine product,computer good hangs sometimes speed slows,2019-10-14,4.0
135,customer_review-R2TZCEY3BF3WJ2,Abhishek,Bekar,dont buy slow processstarting mai hi blank dikhata hai purchased one week iska natk chalu eda banae ka dhanda hai bad bad bad,,2.0
136,customer_review-R1PZU5LJ5AYV72,Vibitha sujith,Operating system not loading,working properly started operating system loading,2018-10-26,1.0
137,customer_review-RPZX0DYLG8Z4A,Zing,Slow lappy,slow,2018-11-18,5.0
138,customer_review-R2T3TGWTYUAGVN,Vishal Gupta,Slow... Don't buy it,slow unhappy regretting buying,,3.0
139,customer_review-R2BFK01LF9I5OW,Amazon Customer,Better product,good laptop hp prices range got 24kbut feel material quality could little improved shoot pricesbut overall good,2019-02-25,4.0
140,customer_review-RNH9E5U9YNK1D,Siva,Nice handy light weight.,good performance light weight compact battery backup almost 4 hours sound quality adequate good choice day today activity drawback sometime lags reason otherwise awesome,2018-10-23,4.0
141,customer_review-R2BS3YRS28XFHQ,BADRINATH DAS,Very good,goodlight weight,2019-09-04,5.0
142,customer_review-R12FZP9W5PAGVG,Nayeem,Its Keyboard keys are loose and hardware quality is worst.y very very slow working,using two months writing review working slow time take 30 minutes startnot supporting latest technology software customer service worst,,1.0
143,customer_review-R2LSOTAE1D5D3C,Shesh Mani Tiwari,Performance issues in this laptop,laptop came windows 10 preinstalled sure problem processor ram laptop runs slow takes min open blank excel file,,2.0
144,customer_review-R1GTV0PLEYWPNF,HB,Poor Product,job allows work frequently laptops like using slow often hangs top office version trial version amazon dont tell clearly pathetic,,1.0
145,customer_review-R1WTEWMEUFDAD3,SAMUEL,Nice. Some times hungup,medium speed buy rs 22000 one year slow,2018-10-30,3.0
146,customer_review-R3N0OBWTHSI39N,Amazon Customer,Value for Money,value money bought stealing price,2018-10-19,5.0
147,customer_review-R1Q4ZD9JW2TZB0,Liju P Nandanan,Performance issue,facing much performance issue taking alot time reboot didnt try open excel files docs usual performance seems like disaster,2019-04-23,1.0
148,customer_review-R3ARH17LICRIHQ,Navneet,Bad n Slow PC from HP even a Local phone runs faster,bad slow pc even able download hp support assiatant screen becomes black every boot never recommend anybody dont buy crap,,1.0
149,customer_review-RGM4RGKN156IE,BIJENDRA SINGH,Do not purchase this item.,1processing time long 2frequently hangs 3camera hd web cam image poor ever seen 4ever start ever,,1.0
150,customer_review-R4BK8LSQ941LG,Jayandra Bose,Avoid purchasing this laptop from HP,slow perform something would never expect brand like hp far happy product,,3.0
151,customer_review-R25BB6M48P51MD,Rawikarn,It's ok,bought price 31k doesnt worth price better wait discount around 25k good,2018-11-25,3.0
152,customer_review-R3CKAJG5DL03VZ,Lalit Nayyar,Good product,good product,2019-08-16,5.0
153,customer_review-R2YJQDEHE41W25,Neha,Bad,bad slow keeps hanging option exchange return,,1.0
154,customer_review-R1SRV0QE02X403,Prasun Kumar,Good product,value money,2019-04-23,4.0
155,customer_review-RL8BH75HLSWOI,alok,Good product so far.,good product far,2019-11-05,5.0
156,customer_review-R1A869JO0U9A35,GAURAV PATIL,Overall good for daily office use.,good laptop hp using since 3 months problems easy use,2019-02-13,4.0
157,customer_review-RS8MQZTTQ1NBS,Amazon Customer,Good,good product,2019-11-06,4.0
158,customer_review-R3D2O1GOOE8NB6,Sanu,Too bad,takes lot time turn onits processing speed slow turn every time appears lines screen,,2.0
159,customer_review-R2BI0SPXCXVGSR,Amazon Customer,Overall all good product,facing hanging problem need improve,,3.0
160,customer_review-R2CEYXOGVDEC1Z,amit joshi,It's worth money,nice product heavy programming videos movies programming lightweight editors works well,2019-04-29,5.0
161,customer_review-R10HDQPTOAGWCP,Gulam Mustafa,For Basic home purpose,laptop slow cant multi task things laptop basic use like watching movies stuff cant install many programs slow,,2.0
162,customer_review-R1AWFNP87USR2S,HARIKRISHNA,Laptop has warranty issues,product warranty start date purchase warranty laptop received started 2 months earlier replacement laptop issue,2019-06-18,4.0
163,customer_review-R1NA9WCR5E3RS1,Manu,Could be better,issues windows first week reinstall running fine,,3.0
164,customer_review-R24UO0R4QBB6BJ,Arun,Could have added these features,missing backlit keyboard full hd display mouse buttons little hard,2018-11-22,3.0
165,customer_review-R37MKML762KOMV,Rohit Singh,Not good,poor response machinehard disk gone year time,,1.0
166,customer_review-R1DRIEZGP6D14I,pankaj panchal,Some reason of hardware issue,vear poor battery life screen quality,,1.0
167,customer_review-RRY5SE31AWZM2,SAMIK GHOSH,Excellent,excellent,2019-06-24,5.0
168,customer_review-R96RZFFKYID93,Amazon Customer,Light weight and stylish,stylish look wise sound good processor fast working awesome,2018-11-02,5.0
169,customer_review-R20JUG1C634FK6,MSB,WORST LAPTOP,worst laptop ever used last 20yrs,,2.0
170,customer_review-R3NPQKDIC70SYP,Mayanka Srivastava,Look like fake product i want to return this.,item totally pathetic yesterday collected product per expectation quality good want return product,2019-07-19,1.0
171,customer_review-R3VJEZUO22TKAF,Rajat Gupta,Will prefer dell over it,donot know slow,2019-07-02,3.0
172,customer_review-R1AFIXH175THLE,Mac,Windows software issues,windows software got corrupted month chasing hp service center big project,2019-08-23,4.0
173,customer_review-R3RRIU4WNZNN4B,Sujatha George,Not up to Mark !!!!,worth price cheap dated design hp expected like one design price,,1.0
174,customer_review-R1NL6ABCN76S39,Tanmoy,Worst product....huge slow,worst laptop ive ever usedits slower tortoisealso issue shutting process,,1.0
175,customer_review-RJOS8AB2QFWGR,shuchishman,Overall value for money,laptop tend hang lot dont know i3 unable handle win 10 give win7 much smoother,,3.0
176,customer_review-RA76RFR5YOWQS,Aryan,Handy lappy feather weight,light weight handy lappy,2019-10-31,5.0
177,customer_review-R14490L97RUAX,Anil,Slow one,slugish laptop windows 10 compatible 4 gb ram better buy 8 gb ram,,1.0
178,customer_review-R30IMUA82WVNOT,santhanakrishnan,Ok,good,2019-09-10,2.0
179,customer_review-R1N1FNAJB822QZ,Rosh Makal,Poor performance,slow hangs total disappointment return possible replacement careful purchasing one,,1.0
180,customer_review-R2MJHZC1SWY9Q2,Abhinav Dixit,Good,lightweight stylish laptop,2019-09-01,4.0
181,customer_review-RN74M8BNHZIGL,Nadeem,Excellent,excellent product value money,2018-10-29,5.0
182,customer_review-R5YAMC5W2559Q,Amazon Customer,HP laptop,hi laptop design sound good light weight performance slow,,1.0
183,customer_review-R37ZGUG5C8MOM,Shifa Sheikh,Love it,im happy product,2019-06-16,5.0
184,customer_review-RR8QFJ6K95Y1I,Rajesh Naik,Worst Computer,please buy computer loaded computer latest version windows apparently computer hangs thisam totally disappointed,,1.0
185,customer_review-RZD6UII459FO,Ayush,"Crashing within few weeks of use, Can’ return",within weeks use laptop crashing suddenly shutting since outside return window returned really disappointed,,1.0
186,customer_review-R3L0CIYDY6AROR,Arun,Nice,beteer,2019-08-01,5.0
187,customer_review-RTVO01JL3EBT4,Amazon Customer,nice,best quality range light increase ram speed thisss,2019-01-21,5.0
188,customer_review-R1EDQTLM62Y3WL,Dr Satish Reddy Pullalrevu,Horrible product to order,product horrible system repeatedly getting hanged feel ithat done mistake ordering amazon,2019-12-18,1.0
189,customer_review-R2CR8LETBUQ1N4,PARTHA DAS,Processing speed is very slow,good build quality ok processing speed slowwith price range big compromise,,3.0
190,customer_review-R4LM94JNI2NBI,Amazon Customer,Very Slow,slow,2019-05-06,4.0
191,customer_review-R3LYD2160YM9E1,Avinash sharma,its Process is very slow,i3 process even slow work related web onlyit take minutes load simple web window,,2.0
192,customer_review-R189A3BOCQ4T00,chetan Thakre,Good one,basic feature laptop,2019-04-29,4.0
193,customer_review-R1MUWXS8VWV4TT,Amazon Customer,Good,23k good laptop bought big billion days offer oct 18 works fine,2019-10-17,4.0
194,customer_review-RL17SNALYHI1Q,K C S GOWDA,Better quality,except battery system okay,2019-02-02,5.0
195,customer_review-R25WOC4AT1FE38,AJAY SHARMA,hang issue,satisfied,,2.0
196,customer_review-R20SZ7U3ZM8RER,"Palanichamy,K",Worthy,worth money,2018-12-04,4.0
197,customer_review-R2SF9BMW9Q45P1,jyoti,Waste of money,bad performancehangs almost time,,1.0
198,customer_review-R23V9OYTCVW396,nagmani kumar,Touch pad not sensitive,speed average touch pad sensitive,2019-07-23,3.0
199,customer_review-R3RYMPZ4AWGVKX,Reema M.,Good,good,2019-02-21,5.0
200,customer_review-R25NZAI7A69Z1V,CHANDAN HALDER,Good product,light weight good looking original windows 10 laptop running little slow,2018-11-01,5.0
201,customer_review-R1JFGDVT1RYF1E,Riya Tapadar,Price is low but system is too slow,processor slow,2019-10-05,3.0
202,customer_review-RFQVOEV1A9BS7,Amazon Customer,Searching for an answer,laptop quite slow doesnt look like i3 7th gen processor solve problm,,1.0
203,customer_review-R1T4CF1QVQO55D,Amazon Customer,Microsoft office,laptop fine microsoft office could given along package additional amount,2019-10-08,5.0
204,customer_review-RL6LR08LX2GJV,Rafeek P H,Priceless,good product affordable pricesomething bad,,3.0
205,customer_review-RCGL02D8UWU1L,Shaik Reshma Begum,Worst laptop,one worst laptop ever buy performance vry slow dont wasye ur moneyi wish could return back,,1.0
206,customer_review-R2ADRLO59R3ZSS,RatnaKumar,good,good,2019-07-24,5.0
207,customer_review-R15COK4H2IDP5C,anwar khan,processor speed,processor speed working like i3 7 generation system speed slow start window take long time,,1.0
208,customer_review-R3MOZDRL34A1Z9,hari,Good,good,2019-03-02,4.0
209,customer_review-R3V7G7Q0XX0CX7,Ganapathy T.,Super,good,2019-08-19,5.0
210,customer_review-R27V33ZV4M2AQK,pradeepta kumar mohanty,Good product,easy use easy carry,2019-02-09,3.0
211,customer_review-R1LRE1DMX2Q3YF,Debu,Good,compact light weight easy use problem doesnt cd drive except everything really good,2018-12-01,5.0
212,customer_review-R2X05N9RIGZE17,K. Vijay,Go For it,name says hp good quality got awesome deal amazon,2019-02-15,4.0
213,customer_review-R22THRFXE4F7RP,nagamallareddy,Good product,good product,2019-10-08,4.0
214,customer_review-RPTZAHYOIMJ4B,PGS,Looks,performance,2019-09-17,5.0
215,customer_review-R1RL01CGTMANJN,Abhay parekh,Very slow product,laptop slow hard disc useless worth price,,2.0
216,customer_review-R2AD4J2R53AJJY,George,Light weight but slow,system takes long time boot reason purchase light weight served,2019-07-10,3.0
217,customer_review-RLO27WSQ1O7N4,Amazon Customer,Good basic laptop,used hang frequently added 4gb ram working fine buy sales price goes 5000,2019-02-16,3.0
218,customer_review-R31BZ0JKZFV6N2,UJJAL CHAKRABORTY,Good performance,good performance,2019-03-12,5.0
219,customer_review-R1HRAW658VQHP4,Nandan,Awesome,display full hd okkkk,2018-12-09,5.0
220,customer_review-R2TH3KXF9SXI3D,Vijay singh,Very dissatisfied,slow sometime feel online products really bad except mobiles quality always bad,,1.0
221,customer_review-R1C0R751S76GKA,Ajeet Chaurasia,I'm satisfied with this deal,got 25978 windows 10 licence price range great deal,2019-08-13,5.0
222,customer_review-R260SQ9EAQZ81V,sree,Not good,6months problems occured,,3.0
223,customer_review-R336VIWHDHYX82,J Shetty,Not happy with this product,considerably slow sense processing speed old laptop exchanged new laptop better happy product,2019-02-18,1.0
224,customer_review-R1SCVMX1DBZ1DL,mithun,Good product,good product,2019-10-10,5.0
225,customer_review-R1IO4WI3NAOAG1,Amazon Customer,Poor Speed,laptop processing slow dead slow takes long time boot response keyboard mouse also slow,,1.0
226,customer_review-R138LOK5VAJ72D,sushma,Good,good,2019-03-06,5.0
227,customer_review-R3TKPO30WWMZL7,Neha Sharma,Hang Issue,new laptopbut hang issue light wait multitask hang lot,,3.0
228,customer_review-R172JRW6DKJESK,Dr.Rajesh Reddy,Nice deal,good product,2019-10-27,5.0
229,customer_review-R2A8DRFWHROMOP,Mahalakshmi,Superb,worth money looks good,2019-06-28,4.0
230,customer_review-RJVWHOR7DDX88,Sarthak,The Laptop is not worth at all.👎🏻,hangs every unhappy laptop poor quality,2019-07-13,1.0
231,customer_review-RFDM2J0SAQG5X,Guchi U2,dnt buy,fake laptop 2 months working waste money give back money,2019-07-06,1.0
232,customer_review-R2GXLKCBDISSIG,aijaz ahmad magray,Good,good product highly satisfied order battery backup lower side minor letdown,2018-12-25,5.0
233,customer_review-R2VZ543Z9XC9Q9,Govinda R.,Hp i3,display quality worst slow serious work,,2.0
234,customer_review-R37PO8YKTTX8ZR,Bhavesh S.,Unhappy with this purchase. Waste of money.,happy performance laptop slow please buy,2018-12-16,3.0
235,customer_review-R1A48RU8JHT0UP,Rishabh Sharma,Not so good,i3 core processor working found working dual core speed good,2019-11-02,2.0
236,customer_review-R2470W79O1YBTU,SUNNY KUMAR,All good,exlant,2018-12-05,5.0
237,customer_review-R38NEK8I86MAE,Amazon Customer,Don't buy this.,recommend laptop dead slow taking long time even get login screen,2019-02-26,2.0
238,customer_review-R1M4AT7BHA7094,Bipinlal,Complaint,registered complaint regarding warranty period proper response received yet,,2.0
239,customer_review-R38PK1BE5QRKJO,Amazon Customer,Good one,got 24k tis price satisfactory,2018-12-04,5.0
240,customer_review-R21HHQZCEGPMUR,rajan s.,good,good,2019-03-05,4.0
241,customer_review-R8JHKSY2W5ODZ,Amazon Customer,Nice product,nice product,2019-07-12,4.0
242,customer_review-R2AAI757GSTZ85,saroj,Very good,like product much,2019-07-19,5.0
243,customer_review-R1C410I66DDE1E,S Raja,Value for money,light weight issues faced related us ram,2019-03-05,5.0
244,customer_review-R3MT59MZG816N5,Satyendra,Worst product,worst product ever purchased slow even dual core better pls dont,2019-11-10,1.0
245,customer_review-R3QJBU3419EFZR,Rachit,Not a worth buy,using 1 day facing problem starting laptop video playing hang lot,,2.0
246,customer_review-R17VC33VKCLI64,Amazon Customer,It's not worthy,slow performance old laptop never expected amazon hp,,1.0
247,customer_review-ROMSN8JOV4BK5,Yashpal Mishra,ok,ok,2019-09-06,5.0
248,customer_review-R39NGYDJXJTPBA,Bhargav Raj,Out of warranty,hi bought laptop delivered 01102019 warranty showing warranty,2019-10-02,4.0
249,customer_review-R27XW9VGJ8O6GP,Nagesh Rajendra Thalpati,E,every time starting lpatop system take time,2019-07-03,1.0
250,customer_review-R2LUXJZ8PC1E4C,Mayank Srivastava,Average laptop,quite good speed upto mark expectations,,3.0
251,customer_review-RANTLU1NUB59J,Shadananan N.,looks OK,looks ok waiting see long term performance,2019-08-03,4.0
252,customer_review-R3UE7WNKSX0RT8,Amazon Customer,Slow and useless,takes ages boot even basic tasks wait around,,2.0
253,customer_review-R801GOF371TMS,srinivasreddy,Waste of money,much disappointed laptop speedvery slow,2019-07-31,1.0
254,customer_review-RBSH04TAVE6W7,Janardhan R.,A good laptop,suggest buy looking buy 14 inch core i3 laptop product good,2019-05-26,4.0
255,customer_review-R3IXCF9A9F1B1T,Anand B,Not good,good poor performance,,1.0
256,customer_review-R1LEYUPUZ646BU,Paul mf,Efficiency slow with windows 10,slow windows10,,3.0
257,customer_review-R34U113QPCG009,Nipu gogoi Amazon prime Customer,Very good product,good,2019-03-09,5.0
258,customer_review-R1742JGF4YGBCQ,RC,Very Slow,product looks good light weight however slow recommended,,2.0
259,customer_review-R165BTHQ7PGYMM,Dr h k misra,Good,goof,2019-08-22,5.0
