,customer_id,customer_name,review_head,review_body,review_date,ratings
0,customer_review-RKTU335Q59CT3,Sameer Patil,Detailed Review of Product itself !!!,note available online stores well check purchase model dont touchscreen note using device couple weeks following observations normal user point view first mentioning specs explain user experience following specifications intel core i37020u processor 1 tb storage 4gb ddr4 ram integrated intel 620 graphics 14 inch hd display resolution 1366768 3cell 41whr battery windows 10 os following user experience buildquality good build quality compared price top surface matte finish good grip speakers good output weighs around 15 kg moderate weight considering size finally looks good display hd led screen resolution 1366768 performs great colours punchy contrast well average display performs well upto expectations keyboard speakers keyboard doesnt backlit feedback keyboard good doesnt numpad placement pf speakers good enough sound output performance average battery performance average performing battery full charge used clock 3 hours battery backup charges 3 hours even medium brightness heavy multitasking used get 2 hours backup overall battery backup average system performance problems using laptop surfing browsing internet small medium games also runs smoothly doesnt fingerprint scanner 1x usb 2 2x usb 3 ports handy combination conclude average laptop verdict good device price would around 25k ups device 7th gen processor decent storage hp brand reliability apart theres hardly anything attract lacks fingerprint sensor backlit keyboard decent battery backup better graphics better display resolution theres deal available around 25k go else invest thousand go better device 30k worth buying,2018-10-09,3.0
1,customer_review-R27F7KDTS2X62C,Mohd abdullah,Beauty,best looks slim light weight display awesome performance per specifications good beauty bought much research confused lenovo 330s dell latitude 14 inch series much better would recommend,2018-09-16,4.0
2,customer_review-RIDOVAIT078KW,Asr,Good laptop if you buy under 25000....i pay 29000,overall pretty good package pros light weight decent battery backup good looking smoke grey colour good build quality cons inbuilt battery non removable glossy display mat display good glossy reflection display quality uptomark sound quality average system little laggy much,2018-11-29,4.0
3,customer_review-R2Y3WMNYX2EWFE,Prem Prakash Gond,Awrsome product,nice product range lappy really awesome u buy around 26k bought 22990 actual price 25990 instant discount applied sbi card 2000 received 1000 amazon pay balance 1000 final price 22990 great deal,2018-10-20,5.0
4,customer_review-R27YWXDDFFE08Z,Amazing Customer,"The laptop lags frequently for no reason, Not sure if this is a genuine laptop from HP",bought laptop month back amazon great indian festival using since product light weight sound good battery backup good important performance horrible ive exchanged 5 year old hp laptop 3rd gen i5 processor 7th gen i3 processor still even half good old one system lags always takes lot time process operations made fresh install windows 10 created recovery media bit better used realized faulty product late time last date return already completed 2 days im stuck super slow laptop go worst thing ram 1 slot 4gb cant upgrade,,1.0
5,customer_review-R1CLCUS1J2L8DR,Ashwani Yadav,HP is Crap,please buy product stuck wasted around 30k system hangs every second support,2018-12-29,1.0
6,customer_review-RFUQZLD2FZF2R,Abhishek,Pretty good under 25k,purchased lappy wife amazon sale 23k applying discounts would say pretty good price looks sleek slim light carry around screen display sound also good battery life pretty good around 6 hrs fast charging though stated others performance slight issue fast snappy take seconds launch apps get around added 4 gb crucial 2400 ram dual channel increased 8 gb though challenge remove back cover insert ram hp made end user friendly responds better please consider upgrading ram get around slowness issue overall good laptop basic tasks light office work,2018-11-07,4.0
7,customer_review-RHJPUWKE0L7B8,Manish Jaiswal,Go for it.....without a doubt,overall nice package provided get 28k 29k sound quality awesome win10 os 4gb ram lags sometime manageable looks good battery life acceptable complete value money buy given range competition fierce range choose according requirements mine portability area aces given dynamics thank u hp amazon,2018-10-26,5.0
8,customer_review-R2DDW6YWO3B06Q,puja gupta,This last is WORST THAN HELL in capital latters,laptop 7th generation i3 processor 4gb ram 1tb hdd still first usage found laptop 20 times slower 5 year old pentium lenovo laptop make payment payments also gets strucked amazon also policy customer friendly initiate refunds buy new different model u want settle model getting model today hope 31000 bucks go drain amazon confirmed 2nd product model working great said ensure hope dont go pain agony,,1.0
9,customer_review-RBO03PNN0NPSZ,Preeti,Used product delivered by amazon,bought brand new laptopn came locked user found laptop used someone amazon technician also visited approved nothing happened well,2018-11-09,1.0
10,customer_review-R2L1822Y56KQWC,Amazon Customer,Damaged product,pathetic expected online trustworthy,2019-02-20,1.0
11,customer_review-R32OCVLKPHMI5B,Rajesh,Processor speed,bought laptop 2 weeks back used twice yet speed pathetic sure original hp product unfortunately last date return yesterday even able return,2018-10-26,1.0
12,customer_review-R222Q5HVAR6L4I,SS,Lightweight and superb for basic needs,beautiful design lightweight comes core i3 good basic usage,2018-11-09,5.0
13,customer_review-RCMBVIYV78C76,Rohit,Best laptop under this range,laptop good office work recommended performing heavy work like playing games video editing work,2018-10-12,4.0
14,customer_review-R1I0KXSUEPH30S,Rupesh,Value for money ...And thank you Amazon for exchange ....,combination work 4gb ram pretty slow increased ram 8 gb bit fine place laptop decal sticker coz looks dull well happy purchase depends requirement increase ram max 25003000 service charge college office stuff smart wise,2019-01-17,4.0
15,customer_review-R19TOCO962F78G,subash baliga,Feel cheated by Amazon by showcasing a non functional product,product one worst functioning laptop product hanging i3 processors performance pathetic cant run basic functions clearly specification created hp sold thru amazon buyers stuck maze amazon support question answers sitting 2 laptops nonfunctional month tried return policy told cannot happen amazon products clearly con job amazon hp joint party,,1.0
16,customer_review-R3IUE9CPOJZ4FO,Burhan,Wins in looks and Value. Performance decent,laptop looks compact impressivebuild quality performance average complain ram 4gb default colors display looked washed dull however make vibrant increasing saturation levels 30 intel hd graphic settings display looks amazing vivid great buy given price point got 27500,2018-10-28,4.0
17,customer_review-R3Q2WE2MOGRLVK,Mahendra kamble,Faulty laptop,bad product 2 weeks started giving display problem speed super slow heating issues one cant tolerate speed operating anything within 2 months repaired almost 3 4 times worst part problem still solved one ready take responsibility please buy waste money waste energy call n,,1.0
18,customer_review-R10VYH3FWUYODB,C Vanalalhmangaiha,Perfect✌🏿,fast delivery item superb genuine,2018-10-02,5.0
19,customer_review-R3162KVLK3A68I,Ashwin,Below average,budget laptop absolute bare minimum pros light enough carry around decent battery life 34 hrs normal usage 1tb hdd allows lots storage cons slow booting 3 mins welcome screen spite win 10 slow running apps office applications take almost 20 secs initialize fully reflective screen hard see light source behind gets dirty easily average sound quality overpriced belongs 20k range,,3.0
20,customer_review-R1DWMA7ZY08MSA,ak,Fake .Not hp product.Never ever buy it.,worst product never buy itlooks like fake product hp support extremely poor never help see screen hardly month buying laptop throwing tantrums regretting decision badly,,1.0
21,customer_review-R1E7SURYB4OE5L,J M S Negi,REVIEW : HP 14 Core i3 7th gen,light weight definite plus however performance slow put extra 4 gb ram 250 gb ssd make bearable,,2.0
22,customer_review-R17G3J3GO9LXVY,Goutam Kumar Gope,It great. Just go for it,everything good laptop one slow although u fix uninstalling software start also purchased amazon great price 15500 including exchange cashback great indian festival also gotta great battery life lasts 7 hours easily also fast charger 90 percent 15 hours,2018-11-03,3.0
23,customer_review-RM8VZK9VTTVCD,Pooja Lahri,Faulty device. Not worth the price at all!,ordered product twice received faulty devices got replaced ordered second time product stopped working return date passed stuck,2018-12-10,1.0
24,customer_review-R8V0SGZNLYS5,neville,Thin and light weight but RAM upgrade is a must,sleek slim light weight laptop great dealif looking laptop carried around ease however performance abysmal get rid problem upgrading ram atleast 8 gb expandable upto 16gb per spec furthermore could add ssd improve boot speed purchased machine running matlab struggled default 4 gb ram added another 4gb crucial works fine next plan add ssd,2019-06-01,3.0
25,customer_review-R1IC1J1WPYPQQ3,Satyajit Roy,"Not good, performance is very bad!",low quality assemble 3 months ot started malfunctioning completely wipe reinstall complete os still good condition slow avoid buying low ram mostly compatible windows 10 would recommend buy product unless student,,1.0
26,customer_review-R14BJFIM6CFT4Q,Ramana,Display corrupt and very poor service quality from HP,laptop display corrupted within 2 days usage apparently one rubbers corner missing right time delivered hp engineer noted inspection despite best efforts convince laptop display wasnt fault hp squarely put blame upon sick bad experience dealing hp local service partner tvs electronics gurgaon folks never answer calls close cases without giving ear customer saying dealt dell service laptop purchased amazon service far far better professional,,1.0
27,customer_review-R2USPRE9BBVOB5,Anshul Shah,Slowest laptop I have ever seen. Worst customer service,laptop takes 2 minutes boot want run program like chrome even open folder laptop takes ages execute command software issue asked amazon help technician comes takes look laptop 5 minutes says software issue cant help approached hp customer care said ram needs upgraded would need upgrade ram new laptop without programs installed laptop lying like since past 67 months nobody use risk going depression,,1.0
28,customer_review-R19XI60E7DYS1N,YSMONYOG,It is slow,suggest spend funds buy laptop better processor,2018-10-11,3.0
29,customer_review-RW3BX2IY3WM28,Taresh khampa,Good for Students and Everyday use,chose one sister first impression opening box tiny light weight laptop easy hold convenient carry talking battert life decent would say would give juice around 3 4 hours normal usage excluding games screen quality also decent immersive higher end ones dont expect great camera quality average would say using laptop hearing issues sister till think laptop value money laptopno emi option great bank discounts would definitely recommend one looking decent looking fast laptop also add ssd card fasten processing booting speed,2019-05-29,5.0
30,customer_review-R1J3JVH6Y8GLEW,Vibha Gupta,There is a noise from Hard Disk of the laptop.,laptop received faulty following like crazy,,1.0
31,customer_review-RERBYK727KJZX,s.muralidhar,Light but slow.,laptop quite slow however quite light easily carried feel earlier 8 year old laptop better built review 5 months useless laptop freezes frequently slow please dear amazonians dont buy using old laptop sad money drain long term review giving tip speed updisable windows automatic updates install anti virus laptop works fine,,2.0
32,customer_review-R366H2IL7DVLSA,Vinayak Pathak,Sexy Product but very slow processing,slim light looks professional little bit slow processing average camera nice sounds quality slow poor processing plz dont buy,,2.0
33,customer_review-R37ICNCH7PJFJ5,-Amazon... ;Custome.r,"Dead after 2 Days, very disappointed!!!!",dead 2 days disappointed,2018-10-27,1.0
34,customer_review-R2DAJ9SEKJ3YBI,Amazon Customer,DO NOT BUY THIS LAPTOP,update laptop use touchpad working heating issues please please buy laptop received laptop amazed light compact boot laptop first time know truth laptop slow l mean slowif buying windows laptop get good laptop 3040k laptop lightweight cheap reason waste money amazon turned comments product know truth highly recommended buy product,,2.0
35,customer_review-R2T2AWL3KUPSK,Rahul G.,Okayish laptop. Don't expect much.,bought last week work working word documents browsing even laptop sluggish best windows 10 supported mere 4 gb ram unless option enhance ram laptop worth say hindi kaam chalau would rather spend thounds extra buy better version features like battery screen quality good track pad pretty tardy unworkable perhaps,2019-08-04,3.0
36,customer_review-R27DMRK4DYQ77H,Amazon Customer,A lightweight decent performer,product came good condition time gifted father laptop lightweight portable screen size perfet dad battery life decent performs tasks browsing running applications simultaneously quite decently perfect dads usage power users might want see somewhere else windows 10 experience good dad happy happy,2019-08-02,5.0
37,customer_review-R2OXAPHMMV2XQ9,Shailesh Dubey,For Light Usage Only (Student & Storage Purpose),best laptop light usagestudents recommend heavy gaming photoshops firstly got faulty laptop fan workingexchnged got new one processor good speed great works better windows 8 feels quite lag w10 ventilation fan vent provided laptop bad price point good,2019-10-19,4.0
38,customer_review-R2YFMPSE615R8B,Santosh,Bad service and bad built quality.,using laptop last 10 months screen quality worst color calibration disturbed poor built quality internal locks get detached try open lid keybord keybord cover comes registered call support 24 sept today 10 oct still complain resolved hp,2019-10-09,1.0
39,customer_review-R3BZ67VPMOIQ8Y,Suresh K,Good piece for the price.,light weight laptop comes windows 10 home os 1tb hdd decent storage 4gb ddr 4 memory gives smooth operation longer battery life claims 7 hours last 5 hours battery seems built dont know get replacement expired need take service center cannot change drawback overall satisfied laptop recommended,2019-10-30,5.0
40,customer_review-RYYLONSU66M34,shahbaz,Awesome,overall would say great deal price point bought 25990 great india festival sale awesome good office works justifies needs game freak bought carers office education related work,2019-01-17,5.0
41,customer_review-R15EI5YOKU64N9,Varun Markande,3.5 🌟,product rating 35 ok writing review using product month lot reviews product web even amazon high possibility creating lot confusion note points ok buy product without second thought 1 win 10 64 bit 4 gb ram i3 7th generation together wont provide great performance brand 2 still get decent performance browsing using softwares even playing mid range games 3if go upgrade ram things work pretty well 4 hp comes lot preloaded softwares create lag initial experience around 15 mins using laptop everything works fine 5 pretty light weight well built enables carry around ease,2019-11-10,3.0
42,customer_review-R1SUGLT3SBBF7X,PJ,Good for personal use only,remember ms office preinstalled upgraded ram 8gb still lagard suggest go i5 planning use official work,2018-11-15,3.0
43,customer_review-R3EO9MXXCBF78Q,Kumar a.,Not expected this quality from HP,bought office use general usage excel word mails even activity system dead slow switches quite often expect quality reputed manufacturer like hp disappointed submitting response 3rd july single response hp shows careless attitude defective model used always buy hp product personal use official use attitude change mind take hp face value disappointed,2019-07-03,1.0
44,customer_review-RX2K8ITRGD0DM,Magesh,Disappointed!,feel sorry amazon ensuring right product actually received might duplicate pre installed os working properly uninstalled also doesnt barcode nothing else made high subspecies genuiness trust 100 avoid buying,2018-12-03,2.0
45,customer_review-R2HKQ59NZPT702,Manish Sharma,Laptop not working from 1st day,sir mam kind information necessary action laptop still functioning properly days back people made second id mine still problem called back many times call centre nobody picked call went service station ahmedabad guided need call customer care ask pendrive take data pendrive reinstall data still problem unable understand replace laptop job work halt loosing 5000rs per day due laptop inefficiency pls suggest bear loss also want laptop pls take back need purchase laptop dont amount purchase laptop kindly expedite else go court solution life disturbed due nonsense product regards manish sharma,,1.0
46,customer_review-R33XQOFMSN1BRL,Ram Kishor Roy,Value for money,good budget laptop day day job light handy carry booting fast battery life also good quick charging optical drive generally required days,2019-05-13,5.0
47,customer_review-RN0FM1HSIGG5C,Manoj,Excellent Laptop from HP,well built fast durable laptop got 23k regrets best laptop category light weight thanks seller amazon deal,2018-11-13,5.0
48,customer_review-R12RCU2JGUX3M9,Amazon Customer,Don't buy.,dont buy seems hardware compatible software takes almost 15 able able start work basic excel powerpoint keeps hangingfreeze wish could return dont waste money,,1.0
49,customer_review-R1ZMO9I08J2TWU,Amazon Customer,System is very slow.,problem operating system slow day one hp customer care also unable repair system use issue resolved,,1.0
50,customer_review-R2D7MYKCBA5VOG,Amazon Customer,"Looking to Return after only couple months, Can't even find warranty",meeting expectations still 5year old lenovo performs better one keeps getting frozen everything major issues especially brand new laptop brand like hp havent even installed anything big major slow soo much months old im searching warranty information return get replaced im regretting choosing lenovo bcuz getting good deal thought,,2.0
51,customer_review-R1D39L0EY3YI80,Anshul singh chouhan,amazing laptop,one best deal made purchased laptop 24000 got 1000 cashback diwali sale 2018 amazing also lightweight initially afraid whether original one duplicte one using 3 months facing problem price i37th generation,2019-01-04,5.0
52,customer_review-R18R2P4BDCRO66,Paresh Biswal,Value for Money,paid decent amount money laptop compact light concern ram management feel like 4gb enough smooth performance offline mode ok 4gb ram however expanded 8gb ram pretty much smooth please wont recommend gammers,2019-07-07,4.0
53,customer_review-R33GP1E0MIVXJ7,Ajay chhabra,Worst ever laptop,writing new review 2 days use laptop heats lot doesnt cooling fans takes 20 min even start dosent office inside,,1.0
54,customer_review-R232SNR6AGGMRV,Ashwini S,"Pathetic, fell cheated by Amazon",amazon sold pathetic product think refurbished product lot hardware issues bought husband birthday gift march started using since last 2 months key board giving problems connector screen keyboard makes noises lock keeps opening please dont buy electronics amazon,2019-07-18,1.0
55,customer_review-RKP1Y66BT5ICT,Chandrani Mukherjee,Don't go for this laptop,laptop bogus dont fooled low price loaded windows laptop though lightweight highly bloated pre built softwares moment switch see disk space 100 consumed 80memory consumed bought laptop one week install bi tools boy super disappointed,,1.0
56,customer_review-R2V1KDCKFSQIW,Amazon Customer,Car with no tyre,laptop lags lotyou feel better remove pre installed app including antivirusotherwise gonna wall monday morning p,2018-12-30,4.0
57,customer_review-R3TE3GNTHDM3U3,Srivatsa Reddy,Don't go for this product ..,first laptop hardware issues got replacement new one key board spacebar workingspot screen seen one worst product hp im using hp devices since 2009 never kind experience,,1.0
58,customer_review-R1ECKOEPHJJE2D,An Architect,Value for Money,bought wife replacement 9 year old dell mac user use windows work build quality good got 27k price hp light weight laptop steal though miss back lit like mac except product good write another long term review later,2018-11-01,5.0
59,customer_review-R18L28J2ASHUFM,Manik Kandpal,Poor Extremely Poor,31k drain bloddy 1 month old laptop lags much even lags basic browsing let alone heavy usage restart pc take around 20 minutes one request every one please dont buy product,,1.0
60,customer_review-R26VL32Q1VRPY3,Debojit,patience will be tested,bought twenty six thousand got two thousand rupees back amazon pay happy enough get dirt cheap happiness doesnt lasted much time laptop really test patience using multi functions rest good using chrome use chrome nothing else,,2.0
61,customer_review-RLZPMQVYGO2RD,Hemant Kumar,Good value for money,home requirements fits bill battery life good laptop lightweight screen reasonably ok gaming therefore cannot comment processing speed overall good value money,2019-08-19,5.0
62,customer_review-R2OQLXOGXNCOYQ,Amazon Customer,DEAD SLOW LAPTOP,expected hp windows dead slow dead dont buy load start laptop takes 20mins open one tap browser system hang respond longer time waste money waste time,2019-05-04,1.0
63,customer_review-R10JZYDEWH2Z41,Shailendra,Online laptop Bad quility producat,bad producat sale online becous micro soft excel laptop one soft wear update suggest parches laptop online totally disopoited product last 3 m9nth use working time 8 hours update 5 house work promise dont parches electronic product online becosued benefits recived,,1.0
64,customer_review-R28EUFZPD8SSXO,Gokul GK,Very slow in performance,slow dont know whether delivered faulty product takes sometimes minutes open folder application cleaned temp files stuffs still help looks weight okay cant serves actual purpose use going take service center get checked anyway,2019-08-06,2.0
65,customer_review-R3GVWEH9PSZZC5,Anonymous01,Complete rubbish!,super slow laptop looks beautiful handy one need speed suggest never never buy product use read pdfs watch movies browsing even perform small works perfectly takes lot time open browser510 minutes hangs lot buy believe regret rest wish,,1.0
66,customer_review-R2AON48UIAHQOO,Amazon Customer,Worst laptop,using last 10 months though screen battery weight ok one star given software issue ver slow always hanging already checked hp service centre improvement better buy asus products,2019-07-15,1.0
67,customer_review-R2NPIAZRHV1J36,Abir,good in price,good price booting time muchnot gamer heavy user watching movies tube songsstill takes time load page performance average,2019-07-26,4.0
68,customer_review-R2SQ11KFSGI964,Ilora Saha,Great Stuff,time delivery device completely fits description easy use lightweight good builtin graphics speed also nice i3 processor battery life excellent better given description loved,2018-10-25,5.0
69,customer_review-R128D4T125Z1XV,Omkar,Best product ever...लेलो! कोई problem नही है।,best laptop office home use light weight small size laptop helpful carry anywhere sound quality battery life better ब नध स त purchase कर best product thanks amazon hp,2018-12-31,5.0
70,customer_review-R1U669PY599V6,Asim,Worst laptop from HP,slow get hang every 10 mins worst product,,1.0
71,customer_review-R36JW6YWTKOQKW,advsprasad,Won’t recommend at all..,worst laptop ever seen simple office works saving documents files even play game without hanging get fooled seeing price specs hp degrading brand value kind lappys,,1.0
72,customer_review-RN6VF7QFOT0SG,Reghu,Pathetic Performance,purchased product 5 months back already replaced due poor performance even replaced product able open powerpointyou dont believe i3 totally useless trying contact hp,2019-07-15,1.0
73,customer_review-RZM24H0WW6KIU,Nitin murali,"SLOW, SLOW AND SLOW",product received slow although decent built light weight good battery life good looks original windows slow thats deal breaker sold laptop 4 months use,2019-03-28,1.0
74,customer_review-R2Z4IRPHUOKC2Q,Prakash K M,"Average build, low memory",budget laptop average build quality 4gb insufficient win10 upgraded 8gb works smooth light weightgood browsing documenting etc medium heavy usage better invest another 10k go i5 8gb configuration minimum,2019-02-22,4.0
75,customer_review-R1SF0MQJB95HKQ,Reshma,Best Laptop,bought office use really great product good sound great battery life got great price cashback thank amazon quick delivery,2019-02-05,5.0
76,customer_review-R2047II4VE3VOW,Varun Kumar,Too slow..seems like it has 128 MB RAM,switch takes 10 mins boot open application takes 15 mins open upiam fed slow ness laptoppls prefer dell time hp customare care given laptop existits horrible,,1.0
77,customer_review-R20YCT7GWL8UAE,Amazon Customer,Poor laptop quality,adapter laptop poor quality 10days purchase started showing problem charging even unable charge batteryi know whether problem battery adapter simple wastage money,2019-07-30,3.0
78,customer_review-R3GA3RW6UR0XH7,Jagdish Agrawal,Good laptop in cheap price,good product purchased product 24000 good use office work really good work sound ok battery life also ok think good,2018-12-21,4.0
79,customer_review-R36JUV8IH8WH0M,Satyajeet,One of the Best,excellent sound equalizer surround sound etc makes even better battery also good weight 159kgs godd 14 laptop shift one hand kudos,2018-12-07,5.0
